,video_id,comment
1292,VpVvPNLY6hg,The people in the settlements will have to leave and the buildings turned over to Palestine.
1293,VpVvPNLY6hg,The Palestinian deserve to live like  a human being 😢😢😢😢😢😢😢😢May Allah shower his mercy upon you all my beloved Palestinian people ❤❤❤❤❤❤❤
1294,VpVvPNLY6hg,"Absolutely remove 800k ""illegal"" settlers, they are illegal as she said. Absolutely remove any israel control....I do appreciate that she says as an American jew, it is not for her to say, that should be the position of all Jewish Americans"
1295,VpVvPNLY6hg,"it's impossible as long as US, UK, and EU supports Israel"
1296,VpVvPNLY6hg,Once Natenyahu goes to the ICC to face his punishment then the new government should work on a two state resolution
1297,VpVvPNLY6hg,"Two (2) states solution should be FAIR in order to work
= there must be a UN contingent forces and guarantor of peace in the boundaries of Palestine territory and Israel. 
= Gaza should have a territorial sea, including exploration of any resources therein not to be  controlled by any states but the state of Palestine.
= Gaza access to the sea and air should be free from intrusion of Israeli forces or government."
1298,VpVvPNLY6hg,I personally would not welcome Isrealies near me. I don't expect the Palestinians to welcome living next to them after all they've done either.
1299,9wWer4c3htI,It is about time the world recognized the New York Times as a purveyor of misinformation.
1300,9wWer4c3htI,"''If you are not careful, the newspapers will have you hating the people who are being oppressed, and loving the people who are doing the oppressing.''  
A quote from Malcolm X"
1301,9wWer4c3htI,We are no longer falling for media propaganda!
1302,9wWer4c3htI,I’m a New Yorker and talking to my friends who still get all their news from the NYT is like talking to people in an alternate universe.  I hope they start to wake up.
1303,9wWer4c3htI,"My husband who wrote copiously for the NYT Sunday magazine and the Art and leisure section proudly for many years ago, would be turning in his grave seeing what the paper has stooped to . Shame on them ."
1304,9wWer4c3htI,"It's really very simple: Whatever Israel and the IDF accuses Hamas of doing, is what they have been doing!"
1305,9wWer4c3htI,The mainstream media has lost its credibility. I've unsubscribed from all of them. Kudos to Alhazeerah and these rising independent media coverages.
1306,9wWer4c3htI,"Look at the irony, these people were tortured like this once and the very people has given them shelter they're doing the exact thing to them. They've not learned from history."
1307,9wWer4c3htI,"As one father said, "" thanks, Israel and the western Media for showing the world who you are and what you do"
1308,9wWer4c3htI,The silver lining in this horror is that the world at large is experiencing in real time the very heart and hypocrisy of the Jewish state and its enablers...this will never be forgotten
1309,TrcebK_A2Ak,Two state solution or both live peacefully together if possible.
1310,TrcebK_A2Ak,First 🇷🇺 🇯🇴 🐩 🇷🇺 🇯🇴 🐩 🇷🇺 🇯🇴
1311,TrcebK_A2Ak,Israel was given to the Jewish people by the only God of Israel.
1312,TrcebK_A2Ak,"That edom, not Israel! They not Jews follow the history behind the word idumea. That’s Jacob twin not Jacob"
1313,TrcebK_A2Ak,There is some proof that Jesus Christ was buried in India in Kashmir. His tomb is there. He did not die on the cross. His sympathizers took him out of the cross and he traveled to India after he could walk.
1314,TrcebK_A2Ak,There is no such thing as Palestine
1315,sUE8N74opz0,"Check out my Mind Performance app: Level SuperMind
https://levelsupermind.onelink.me/CsSR/youtube

Join the Level Community Here:
https://linktr.ee/levelsupermindcommunity"
1316,sUE8N74opz0,The genocide of Bengali Hindus in East Bengal now Bangladesh is very much under stated and not discussed
1317,sUE8N74opz0,"I don’t have a problem with people being Muslim. But they have a problem that I’m not a Muslim and that’s the issue.
You can judge a religion by how it informs its followers to treat others especially those who believe differently."
1318,sUE8N74opz0,The irony is that those who are condemning the (extremely saddening) death of hundreds of children didn't even comment on the October 7 massacre.
1319,sUE8N74opz0,"This guy took the words out of my mouth. This is actually my stand out of this whole situation. It's sad, because other people won't understand this and will instead condemn you for standing in the middle."
1320,sUE8N74opz0,"Abhijit thanks for giving Indian such true picture of the Israel Palestine situation...I say it bcos half my life I have lived in middle East, Egypt.... complete clarity... always thanks to Ranveer without saying..."
1321,sUE8N74opz0,Explained impeccably! Every minute of the 52 minutes was worth it especially for someone who is here to genuinely understand the situation between Israel and Palestine.
1322,sUE8N74opz0,Cannot be more happy for bringing Abhijit back on the podcast 💝
1323,sUE8N74opz0,Every Indian needs to watch this. Awareness is the biggest strength!
1324,sUE8N74opz0,"We need to have such difficult conversations to provide clarity to everyone

thank you Ranveer and his team"
1325,NgVXIBj905w,Want to learn more about what Judaism has to say on things? Check out our other channel Big Jewish Ideas! https://www.youtube.com/channel/UCcAK9Kt7zg_FfDM3hTTearA
1326,NgVXIBj905w,"Wow, this waa one of the best videos I've seen on this channel and it's all because if the narrator. Professional and eloquent."
1327,NgVXIBj905w,"Concise and impartial, exactly what you needed in order to do the job as you did! Thank you."
1328,NgVXIBj905w,WOW! In a short few minutes you went through some major history. I salute you well done!
1329,NgVXIBj905w,"I love your videos. 
They are brief, oriented on facts and you tell everything withouth adhering to any side of this conflict or expresing your own opinions, interests or emotions like most arab medias/youtubers do."
1330,NgVXIBj905w,When one side of a fight is forced to destroy proofs to defend its narrative you know on which side to stand.
1331,NgVXIBj905w,"I live in Trinidad 🇹🇹, I'm accustomed to the multireligious traditions of Christian, Muslim, Hindu, Jewish, Sikh and Buddhist buildings, people and hearing the various prayers. All I can say, if my people can share an island, and your people can share a nation, perhaps Muslims and Jews can share the site. Is not the site large enough for a Mosque and a Temple as they are all Abraham's children. To share is better than fighting."
1332,NgVXIBj905w,I find it very strange that the Muslims holy book doesn't even mention the word city of Israel.
1333,NgVXIBj905w,I learned a lot here - specifically the role of that rock in Jewish tradition - and the excellence of your presenting skills (Mr. Narrator) is an honor to the Nations.
1334,NgVXIBj905w,Thank you for honoring us with these facts in such a concise way! Shabbat Shalom and be richly blessed.
1335,sPY92HDQwM0,"It doesn't matter what happened, its matter what will happen. We should all live in peace without wars."
1336,sPY92HDQwM0,Now that's communication skills ! 71 yrs it took to realization dawnin on the ancient heritage burdened carriers ones !!!
1337,sPY92HDQwM0,The content is very good. But a different font and colour could be used
1338,sPY92HDQwM0,Only The Hindu news Network provides unbiased  news .genuine quality content . keep watching it for more news updates . recently I ditched times of India because it supported cronny capitalist. Though The Hindu news paper is costly but has great content.
1339,sPY92HDQwM0,Nice Video 👍🏻. Thanks for information 🙏🏻
1340,sPY92HDQwM0,"As far as Documentaries go, the one made by “The Economist” on the same topic points at the Arabs who did not agree to the UN Resolution. The Jews were happy with Any Resolution as long as they were able to get some land they could call their own."
1341,sPY92HDQwM0,Thanks for making such a short informative video
1342,sPY92HDQwM0,Very helpful thank you
1343,sPY92HDQwM0,Selective news.
1344,sPY92HDQwM0,"""If I don't steal your house, somebody else will"" Jacob you friendly neighbour"
1345,6x1kiySrklU,"UPSC IAS LIVE New Foundation Prelims to Interview (P2I) Batch : https://bit.ly/46h11tt
Admissions Closing on 15th October 2023 | Daily Live Classes at 6:00 PM
Hurry Enrol Now : https://bit.ly/46h11tt"
1346,6x1kiySrklU,"Sir , Today I got to know your name yet I have attended your various lectures on your previous platform. Those sessions help me a lot. 
Thankyou so much for this great session ❤ sir"
1347,6x1kiySrklU,Wow!!!what a great lecture..ek dum CRYSTAL CLEAR..and sir you are a great orator
1348,6x1kiySrklU,Sir maza aagaya lecture....best analysis till now.
1349,6x1kiySrklU,"Sir please make vedio on train accidents especially the train coming out of track and please predict reasons and possible solutions, Did railway tracks need surveillance?"
1350,6x1kiySrklU,"Thank you so much sir ,for good explanation of world history and regional dispute."
1351,6x1kiySrklU,"Excellent explanation , very well researched . 
Good luck for more such videos"
1352,6x1kiySrklU,"Nice explanation, is context se yahi nikalta h ki Israel is foreigners who captured फिलिस्तीन but mujhe lgta ye adhuri history h. Inka 1400 sal wala history ko bhi dekha jaye to hume pta chalega yaha jews ka thikana tha. Isliye two nation theory is best solution to avoid further war between them."
1353,6x1kiySrklU,Great explanation sir ❤
1354,6x1kiySrklU,"History depends on how much year we go back,"
1355,I_o4NIF1ihQ,"""War is where the young and stupid are tricked by the old and bitter into killing eachother."" - Niko Belic"
1356,I_o4NIF1ihQ,"It’s so surreal watching the “other” videos of the Israeli settlers and raids on Palestinian towns in the West Bank over the week and not hearing a response from the news then, but now that hamas launches an attack it’s world news as if it was just a random occurrence. These events have been brewing for a minute, we’re just now seeing the flare up."
1357,I_o4NIF1ihQ,"What sucks is all the innocent lives that will be taken because of political [edit- and religious] powers that clash, that's the real injustice"
1358,I_o4NIF1ihQ,Israel usually takes revenge at a scale of like 100:1. I'm guessing this will be pretty brutal.
1359,I_o4NIF1ihQ,"History repeat itself again... And again... And again... And again... 

This will only truly end when one side is completely annihilated unfortunately...or when both side truly communicate with each other both politically and religiously..."
1360,I_o4NIF1ihQ,“Scrambling to respond”…the deceit in this manner of reporting is insane.
1361,I_o4NIF1ihQ,completely by surprise? With a photo-journalist filming it? Bravo Sierra
1362,I_o4NIF1ihQ,"The perished souls of the ordinary and common children, women and men must rest well on both sides."
1363,I_o4NIF1ihQ,What a nice place to live ever since 1948.
1364,I_o4NIF1ihQ,"The difference between Israel and Palestine is that Israel wants the worlds support, but Palestine needs the worlds support."
1365,EhFbVjntcvg,Since when does the man holding the weapon do the investigation? Thank goodness our courts don't allow that.
1366,EhFbVjntcvg,"We can never tell a lie! ""The Intercept showed how the Israeli operators of a Hermes 450 were responsible for killing four Palestinian children, cousins aged 10-11, playing on a beach during the 2014 Operation Protective Edge. They killed one child with the first missile fired, and then fired a second missile which killed the remaining three."""
1367,EhFbVjntcvg,"FOX NEWS, WHAT WAS CENSORED BETWEEN 1:45 and 1:58 ???

13 seconds of SILENCE"
1368,EhFbVjntcvg,There is no word to describe these people
1369,EhFbVjntcvg,Can we have  our 14 billion dollars back ?
1370,EhFbVjntcvg,Tbh we need an independent investigation
1371,EhFbVjntcvg,"If you said it, it’s 100% the truth🤣"
1372,EhFbVjntcvg,There's nothing humanitarian about what's happening... but I'm African..I stay in humanitarian crisis with No War...thank you Everybody
1373,EhFbVjntcvg,"It’s a new low, even on top of all the attrocities they have comitted. This is disgusting and depraved. To do this to starving human beings. If anybody else did it, make no mistake, it would not go unpunished."
1374,EhFbVjntcvg,"Every news. Israel said,israel said,israel said,israel said😅😅"
1375,vio53jUpJz0,I imagine 2000 years ago how they are treating Jesus Christ
1376,vio53jUpJz0,The Israelis ask them to leave and they forgot that they came naked to Palestine
1377,vio53jUpJz0,The true Face of Israel.
1378,vio53jUpJz0,"""We dont want you. Go!""
""But keep providing israel with billions of dollars in aid"""
1379,vio53jUpJz0,Stop giving them our money.
1380,vio53jUpJz0,We Americans helped them so much return our money back! We support Palestine ❤
1381,vio53jUpJz0,2000 years later and they’ve learned absolutely nothing
1382,vio53jUpJz0,Free free Palestine 🇵🇸 from evil 👿 amen
1383,vio53jUpJz0,Pure evil...the devil is farting from their mouth.
1384,vio53jUpJz0,We Americans want our money back
1385,O7ByJb7QQ9U,"Every single time I try to research and understand the history of conflicts in this region, I just get more and more confused...."
1386,O7ByJb7QQ9U,"Cant believe that this video is from 13 years ago, and tons of people still simply refuse to study history."
1387,O7ByJb7QQ9U,"A correction...It says ""in April 1920 Palestinians poured into the old city""...but these Arabs refused to be called ""Palestinians,"" in fact at the time and throughout the first half of the 20th century it was considered an insult to Arabs, like calling them ""dirty Jews"" since the Jews were the ones known as ""Palestinians."" They insisted on being called simply ""Arabs."" But yes, these are the people who perpetrated regular massacres of Jews in the 1920s and 1930s."
1388,O7ByJb7QQ9U,I am 17 years old girl with a learning disability. this is so hard for me to understand but I'm trying every day to be more informed......
1389,O7ByJb7QQ9U,"The fact that this was done 12 years ago, is amazing."
1390,O7ByJb7QQ9U,Starting wars @ losing them doesn't make you the victiim
1391,O7ByJb7QQ9U,I guess you can't have a 2-state solution when the Palestinians will only accept one state as the solution.
1392,O7ByJb7QQ9U,People will still be watching this video in a 100 years except the situation will be a little more confusing than now.
1393,O7ByJb7QQ9U,This is why i get triggerd of people that choose sides without knowing any history. The fact that this shows just how important history and knowledge is
1394,O7ByJb7QQ9U,Sad that 12 years later there's actually even more people deluded about the truth. Especially the truths of history and it seems this particular conflict. More young dingbats than there ever used to be. Teaching the next gen is so important!!!
1395,Fo77sTGpngQ,"Since this report, VICE has returned to the region multiple times. Check out our latest report from the deadliest day in Gaza since 2014 - http://bit.ly/2IEyc2J"
1396,Fo77sTGpngQ,"""Our religion says this is our land, respect our religion""
Native americans:
👁️👄👁️"
1397,Fo77sTGpngQ,"I’m a Christian and I’m so sick of these kind of people. They’re so focused on the end times that they neglect the people who they are supposed to serve. The poor, the outcast, the orphan, the widow, and the homeless."
1398,Fo77sTGpngQ,Jesus would cry out loud for the injustice happening in Palestine.
1399,Fo77sTGpngQ,"came back to this video and just struck by how insidiously evil it is for that pastor to tell palestinian christians to just ""stay out of this conflict,"" as if bombs aren't being dropped on palestinians of all religions. how exactly do you expect any palestinian to just ""stay out of"" the violent destruction of their land and families?"
1400,Fo77sTGpngQ,"There is a huge difference between allowing someone to practice their religion in peace, and allowing people to justify an ethnic cleansing with scripture."
1401,Fo77sTGpngQ,Wild how the bible apparently names countries that didn't even exist at the time.
1402,Fo77sTGpngQ,"Israelis: ""Why are you helping us?""
Evangelicals: ""So 2/3 of you can die at Armageddon"""
1403,Fo77sTGpngQ,"""I read the Bible, and I never saw the Bible say that God is a real estate agent"" had me geeking looool"
1404,Fo77sTGpngQ,"This angers me. You can be Christian and love Israeli people, but that doesn’t mean you have to agree with their government and condone their actions. Israel can do and has done the wrong thing. That should not be supported.

I love when the guy said “I read the Bible and I never saw the Bible says that God is a real estate agent.” Preach it!"
1405,wznD7uCEcLk,"While we applaud for Jon doing this interview and segment, let's also thank Comedy Central to let Jon use this platform to do what is right for the world."
1406,wznD7uCEcLk,"This is true journalism. Not a debate with opposite extremest, which sell a lot more, but a debate with rational critical thinkers."
1407,wznD7uCEcLk,"It is so weird that I click a comedy link to find the first real peace summit between Muslims and Jews ever. Murtaza's logic is unbelievably reasonable; Yair provides a very logical counterweight as well. I was in Damascus watching an israeli airstrike unfold before my eyes as the sky turned sunset-orange at 9 pm on a winter night. I was shaking and in tears a few hours ago, and now after this conversation I'm like yeah, the METO thing could actually work. Thank you all for making me feel like this is not an impossible case again. Thank you; you have no idea how much more comfortable with being at a warzone this makes me feel. Appreciation."
1408,wznD7uCEcLk,The incredible insight and humanity that Jon Stewart possesses is something to be cherished! Kudos to Murtaza Hussain and Yair Rosemberg for showing the world that there are no boundaries to friendship and goodwill. Also for showing that the only magic in great journalism is honesty and integrity.
1409,wznD7uCEcLk,There is something so comedic about the fact that the best news you will get about the nuance of Israel Palestine foreign policy is from a tv channel called Comedy Central.
1410,wznD7uCEcLk,"I'm so happy this video and the other one is getting millions of views... It's the most sane thing I've seen about the conflict.
I survived a terror attack in 2016 in Tel Aviv. My dream of peace will never die. They will never make me just another hater. Salam brothers"
1411,wznD7uCEcLk,"I would add that the reason the UN can’t pass a ceasefire resolution is that our country keeps vetoing it, regardless of the majority vote."
1412,wznD7uCEcLk,Wow.... It's amazing what hearing an actual conversation can do for your mental health. Thank you so much.
1413,wznD7uCEcLk,"I am grateful to the Comedy Central network for allowing this platform at all. Newscasters and reporters on major networks often face massive restrictions on their topics. Also, it must be said, few on camera reporters have the brilliance of Jon Stewart in breaking down complicated issues in ways that guide his audience into understanding them, while also offering them a choice to learn new and broader ways of thinking. I am so glad Jon is back at the helm of the Daily Show. Thank you to anyone and all who are responsible for that!"
1414,wznD7uCEcLk,"I love this dialogue.  As an Orthodox Jew who does a lot of Multi- Faith work, being open to listening to the stories of different people and give honor to their stories, and realize that we are all the products of those experiences will and does make a difference."
1415,Cj_Pr38vj8k,It blows my mind how some people can put so much stock in a specific geographic location. Crazy.
1416,Cj_Pr38vj8k,"I stopped watching news in 2019 because it was too negative and all lies. I almost lost my faith in journalism. I am really glad to find this channel. 
Happy that there are still people who are true journalist."
1417,Cj_Pr38vj8k,"Wion ,study iq, world affairs 

These 3 made me addicted to current affairs"
1418,Cj_Pr38vj8k,"I’m from Algeria 🇩🇿 and I find this channel very informing, I think she does an excellent job as true reporter with plenty knowledge of history and culture, highly recommended 💯"
1419,Cj_Pr38vj8k,"Palki you have a wonderful  voice , regards from 🇦🇱. Albania."
1420,Cj_Pr38vj8k,Mind blowing. I can only imagine how much work was put into this 10 min video. People of today desperately need this kind of information. Thanks for your work.
1421,Cj_Pr38vj8k,Namaste Palki❤️much love from USA .
1422,Cj_Pr38vj8k,Palki Sharma Upadhyay is the best journalist of our times. Greetings from the Philippines.
1423,Cj_Pr38vj8k,"I love plain speaking, straight forward reporting. I love this new channel i have found. Thank you Palki."
1424,Cj_Pr38vj8k,"""it's symbolism lost in reality"". Facts well said and understood.
Great woman."
1425,bW8efvOK2MY,"""If you see two fish fighting in water, you can be sure an Englishman passed by five minutes ago."""
1426,bW8efvOK2MY,Very nice coverage ❤
1427,bW8efvOK2MY,Why is this video offensive and censured by Youtube?
1428,bW8efvOK2MY,Very well produced especially post production and graphics. Nothing short of any international production by Indian channel. Kudos and wishing to see next production earliest
1429,bW8efvOK2MY,"I saved this video to watch later, but it's now private video and crux Re-uploaded it. What's the reason @crux??"
1430,bW8efvOK2MY,"hmm... this isnt exactly accurate but it is a very surface view, I mean telling the story in a linear fashion only to jump back all of a sudden on Yasser Arafat which was the one who signed the Oslo accords is kinda confusing time wise, not going into the split of the PLO at the death of Yasser Arafat is also kinda confusing since Hamas and Fatah which are 2 parts of the PLO fought for control ever since.
all around a confusing account I guess"
1431,bW8efvOK2MY,"Just imagine the UK feeling nostalgic for its imperial and colonial era and coming back, retaking the region and telling all its inhabitants: ""You know what? It's over, I'm taking this back from y'all and none of you are allowed to live here ""I'm gonna have a deal with the surrounding countries so they give citizenship to all of the arabs and I'm going to ask the US and other allies to give citizenship to all the jews. End of the conflict! AAAND NOW, I'm going to drink a cup of tea in front of the Wailing Wall while I sunbathe."""
1432,bW8efvOK2MY,Well that covered 10% of this conflict lol
1433,bW8efvOK2MY,For someone who really knows the entire story.  Is this video an unbias explanation?
1434,bW8efvOK2MY,1:27 is that Andy Sandburg??
1435,bU2wYxJSZBI,"▶Coding Invader's Job assistance batch :- https://bit.ly/46YuPLN
▶Use my code ""JG27"" for 27% Fee discount
▶Benefits is only for first 100 Application
▶Exclusive benefits of Dewali involved, Hurry up!"
1436,bU2wYxJSZBI,पहले पाकिस्तान कश्मीर मांगता था लेकिन आज भीख मांग रहा है 😂
1437,bU2wYxJSZBI,Respect button for🇮🇳 India🇮🇳❤
1438,bU2wYxJSZBI,Huge respect for you bhai. I hope our politicians will make an open statement like you.❤
1439,bU2wYxJSZBI,Thank you brother Aapko V Aapki  patrakarita ke liye  Jo  Sacchi kahi hai.
1440,bU2wYxJSZBI,Hats off to you Raunac ji....your analysis is great....my one like is equal to thousand likes for....keep it up....keep spreading truth...❤
1441,bU2wYxJSZBI,You are right ❤❤❤❤
1442,bU2wYxJSZBI,I am a kashmiri pandit... Bharat mata ki jai❤❤❤
1443,bU2wYxJSZBI,Respect Button For Rj Raunak Bahi❤❤❤
1444,bU2wYxJSZBI,Well done Raunak. So proud of views.
1445,To410lvuo30,"So glad we Astros live free in your head. Love it, love it, love it."
1446,To410lvuo30,"What's wrong with buying land? If I buy your property and you sell me your property, am I dispossesing you? When Baron Edmond de Rothchild bought land in Binyamina and Zichron Ya'akov or when Moses Montefiore bought land outside the old city walls of Jerusalem, were they disposessing or throwing out anyone? 
""Dispossess"" implies depriving - a negative connotation."
1447,To410lvuo30,"Very interesting, learned a lot and made ne think a lot as well, thank you"
1448,To410lvuo30,anyone know if there is a part three?
1449,To410lvuo30,"As a recipient of information, let's value the remarkable talent, time, and hard work infused into this project. I extend my gratitude to the Ford Country Squire rescue team for their exceptional service, emphasizing the profound meaning, friendship, and significance underpinning their commitment. Your professional and articulate approach is commendable, ensuring the best coverage with recent and relevant information shared by credible and intelligent journalists, leading to an impartial and comprehensive report."
1450,To410lvuo30,"_The illusion of glory in war is but a fleeting dream. It is those who have never experienced the horrors of battle, the anguished cries of the wounded, who clamor for more conflict, more retribution, further devastation. War is a profound abyss of suffering. Above all, it is the soldier who yearns most fervently for peace, for it is they who endure the gravest injuries and carry the enduring scars of conflict within their souls._

_""Mankind must put an end to war, or war will put an end to mankind.""_ - *JFK*"
