,video_id,comment
0,R0ftmf_Uv9A,No matter how many times these information gets thrown to our eyes. The ignorant will remain put a blind eye to the oppressed which is sad.
1,R0ftmf_Uv9A,"*To learn who RULES over you, simply find out who you are NOT allowed to CRITICIZE.*"
2,R0ftmf_Uv9A,"Say that part again: Jewish , Christian’s and Muslims were living peacefully till some Europeans came and then you make people refugees and take their land  also if you were trying to come live in someone’s house for any reason at least bring a plan that shares equally or give the owner 70 and take 30"
3,R0ftmf_Uv9A,Let peace prevail.
4,R0ftmf_Uv9A,Why start at 1946?
5,R0ftmf_Uv9A,"Thank's Ireland, for being consistent n vocal to supporting our Palestinian brothers🙏🙏, we from Indonesia really appreciate this🙏🙏"
6,R0ftmf_Uv9A,"This is not a  conflict, this is occupation."
7,R0ftmf_Uv9A,So sad. They were living in peace and now suffering for 7 decades 😢
8,R0ftmf_Uv9A,"What’s interesting and perhaps often missed is that Jews and Arabs were living peacefully together for many years in the Middle East before the State of Israel was created. 

Jews in the Middle East did not suffer problems with discrimination, however Jews in Europe did. It was the European Jews who agitated for the creation of the State of Israel, in which both Arabs as well as non-European Jews are considered inferior to the European Jews. We keep saying Israel is a Jewish state. It would be more accurate to say that it’s a “European Jewish” state, in which all who are not of European Jewish descent are discriminated against, in one way or another."
9,R0ftmf_Uv9A,What happened the video was removed and put again!!
10,Bno1m1zhIWs,Who else is here trying to understand what’s going on right now
11,Bno1m1zhIWs,Insane how the HISTORY channel of all places actually educated people about actual History and in a notably unbiased fashion.
12,Bno1m1zhIWs,"Finally. An objective concise summary with no religious,political,or racial agenda. Well done History channel."
13,Bno1m1zhIWs,Thank you for this excellent breakdown of the history. So many have never heard the total story. Your summation of the multigenerational conflict was well presented.
14,Bno1m1zhIWs,The best and most concise clip on explaining this conflict I have ever seen.  And in only six minutes.
15,Bno1m1zhIWs,This is the first video which has actually explained things thoroughly! Best way to understand a problem is go back to the original roots of the situation. Thank you for the insight.
16,Bno1m1zhIWs,Great Britain has caused so many problems through out history
17,Bno1m1zhIWs,"Here watching this in 2023... It's sad how it's just like a broken record at this point. So many innocent people dying just because of where they were born.... all over land, random religious beliefs and man made borders. I wish we could all just get along and share this gift of a planet together."
18,Bno1m1zhIWs,"I read a complete history once, like 800+ pages worth. But it’s such a complex and polarising history that relatively small/ brief events have had long lasting impact.
So absolutely I’m here for the refresh, like almost everyone."
19,Bno1m1zhIWs,WOW Insane how the HISTORY channel of all places actually educated people about actual History and in a notably unbiased fashion. Nice!
20,0anQIEeLonA,"Cool finally someone telling both sides of the story , the true history and in unbiased way. Nice video worth sharing"
21,0anQIEeLonA,An excellent presentation of how the Israel-Palestine conflict began. Very well written in a chronological order in simple English. Hope millions will watch this video. I expect more of this to come in the future. Good luck to you Priyanka.
22,0anQIEeLonA,"I've done some basic research on this subject over the years, but so much of what was presented in this video is new to me...I applaud the creators for giving such a concise and focused account, sharing each side's POV, giving us a much clearer view on the past and present situation 👏🏾👍🏾"
23,0anQIEeLonA,"As a Palestinian, I have always felt some bias from Indian media against us. But I have to be fair, you have done a good job summarizing the history of the conflict. Thanks"
24,0anQIEeLonA,"From someone who's a history buff, thank you for this unbiased reporting of history."
25,0anQIEeLonA,Thank you for explaining the reasons for this war from both sides so clearly and factual. I appreciate the history lesson.
26,0anQIEeLonA,Thanx so much WION for this comprehensive unbiased summary of the history of Israel and surrounding states. It must have take you hours of research. We appreciate. Keep on doing the good work.
27,0anQIEeLonA,"Fantastic narration which is both simple and comprehensive 👏🏽👌🏽
Hats off to Priyanka Sharma, a you are a fine narrator."
28,0anQIEeLonA,I like this episode because it's really a history that would understand to those who can't understand the history before. Good luck!
29,0anQIEeLonA,"Amazing synopsis, pertinent timelines, and balanced & unbiased presentation…all done in approx 14 minutes!😂❤ My decree:  This MUST be shared with the multiples!😂"
30,iRYZjOuUnlU,"If you found this video helpful as an introduction, the next one we recommend is this one, about the 1948 events at the center of the conflict: https://youtu.be/rGVgjS98OsU 

To learn more about the October 7 attacks, read our explainer: https://bit.ly/45oC4Ls 

You can read all of Vox’s continuing coverage of the October 7 attacks and their aftermath here: https://bit.ly/45seXzs 

And if you’re looking for more context on the conflict, there’s much more to dive into here: https://bit.ly/3LVOaoe"
31,iRYZjOuUnlU,"UK : Prepare for trouble
US : And make it double"
32,iRYZjOuUnlU,"""Unless something dramatic changes, whatever comes next will be much worse.""

That sent chills down my spine."
33,iRYZjOuUnlU,Would I be wrong in saying that England kind of botched this entire thing and kind of gets let off the hook for creating a lot of this conflict?
34,iRYZjOuUnlU,*”Unless something drastic happens - whatever comes next will be much worst”* famous last words and oh boy were you right 🥺🥺
35,iRYZjOuUnlU,What a great video. A lot of people my age blindly support one side or the other without actually knowing anything about the history at all
36,iRYZjOuUnlU,"""Unless something dramatic changes, whatever comes next will be much worse.""
it happened and it is worst"
37,iRYZjOuUnlU,"There is an Indian saying states that if two fish hate each other, it's most likely that a British caused that.


Edit: not sure where the saying is originally from, but I've heard from India."
38,iRYZjOuUnlU,"""If you're not careful, the newspapers will have you hating the people who are being oppressed, and loving the people who are doing the oppressing"". 
- Malcolm X



edit: In order to not ruin anyone's day, I want to clarify that both  the Israeli military and Hamas are in the wrong here. What I was trying to say with that quote was that Israel had no right to do what they did in Gaza and the West bank"
39,iRYZjOuUnlU,"My father was born in Haifa, which was then British Palestine, in 1944.  When he was 4 years old, my grandparents took him to England on holiday only to be refused back due to the 1948 Arab-Israeli war.  So they had to settle and set up their life in the UK.  My grandparents were once part of the aristocracy and they ended up living on a council estate in Portsmouth.  It's strange to think that I am a product of war; I would not exist if that war had not broken out."
40,E4iygQ--7dk,"Another thing, when britain received he mandate over the region, it divided palestina into two part, the eastern part was given to the Hashemite family from Saudi arabia in exchange for their support in the first world war. This is how the state of jordan was created, which is actually part of palestina. Most of the Jordanians are palastinian."
41,E4iygQ--7dk,"A Brief History of the name Palestine and its derivative Adjective Palestinian:

 1.	Palestine is Judea, the Roman name for ‘Land of the Jews’ when the Roman Emperor Hadrian re-named this land as Palestina in 135 CE. Since then, it was never an Islamic State. [‘In the 2nd century CE, the Romans crushed the Jewish revolt and Judea was renamed Syria Palestina’ – Jewish Virtual Libr.]

2.	The Pre-Islamic Arabs were in the Roman armies and witnessed both Jerusalem’s destruction and the name change of Judea. [Flavius Josephus Wars, Book V, Ch 13, 4]. As well, the Quran mentions Israel as the land of the Jews. Thereby, the Muslim people would be fully aware Palestine referred to the Jews for 2,000 years.

3.	The historical archives of the Persians, Greeks, Romans, British, French and Americans refer to Palestine as the ‘historical homeland of the Jews’, not of the Muslim peoples. America’s early Presidents initiated Israel’s return prior to Britain and Herzl: “Restoring the Jews to their national home in Palestine is a noble dream. My emancipated hope is the restoring of the Jews to their nation home in Palestine” - President Abraham Lincoln to Canadian Zionist Wentworth Monk; 1863. 

4.	The term Palestine was introduced in the Hebrew Bible from the term Plishtim [‘Invaders’]. The Muslims disdained the name Palestine, as they do the term ‘Zionists’ today. In 1947, the Arabs virtually begged of Britain not to use this name for the land. Thereby, the usurping of this name in the 1960’s is not credible as a mark of land ownership, because it was not one of historical usage by the Arabs. 

5.	 A host of Islamic scholars and historians decried and rejected Muslims as Palestinians.: “Allah Gave the Land of Israel to the Jews. The al-Aqsa Mosque was built on top of Solomon’s Temple.” - Eleventh century historian Muhammad Ibn Ahmad al-Maqdisi and fourteenth century Iranian religious scholar Hamdallah al-Mustawfi // “There is no such thing as ‘Palestine’ in history, absolutely not.” - Arab-American historian and Princeton University Professor, Philip Hitti, testifying before the Anglo-American Committee in 1946] 

6.	A host of Jewish organizations and Institutions were called by the prefix of Palestine or Palestinian in the 20th century, including ‘The Jewish Palestine Brigade’ in Britain’s WW2 Military Forces; The [Jewish] Palestine Symphony Orchestra; Today’s Jerusalem Post media was called “The Palestine Post”. 

7.	 There are no Arab Muslim Palestinians on record prior to the 20th century; the land was referred only as the homeland of the Jews. It is validated by a host of archives by many nations, and some one million Archaeological relics. Thereby, the nativity claim can only apply to Jews. In fact, there was never a time of no Jews in Palestine the past 2,000 years, as evidenced by the Crusaders, Islamic invasions and the previous Ottomans. 

8.	Generally, real natives do not usurp the name of other natives, especially one they disdained. [“There is a propaganda war going on now with regard to the term ‘Palestine.’ It is specifically employed to avoid the use of the name Israel, and must be considered an anti-Israel term.” - Dr. Thomas McCall, the Senior Theologian of Levitt Ministry, quoting Zola Levitt.] 

9.	 The previous Islamic Ottoman rulers of Arabia declared Palestine as the homeland of the Jews. - “Who can challenge the rights of the Jews in Palestine? Good Lord, historically it is really your country” - Ottoman Mayor and scholar Yusuf Diya al-Khalidi; Jerusalem, 1899. 

10.	 Judea’s original, previous name was Israel in 1002 BCE, established under King David; and again in 1947 when this country was re-established by the UN. ‘Israel’ is mentioned in the Quran as one belonging to the Jews. [Joshua J. Mark , Ancient History Encyl.) 

11.	 All Religious Scriptures acknowledge Palestine as the ‘Land of Israel’; ‘Land of Judea’; and ‘Land of the Jews’ – including the Hebrew Bible [1 Samuel 13:19]; The New Testaments [ ‘And he arose, and took the young child and his mother, and came into the land of Israel.’ - Matt. 2:21]; The Quran - [Surah Al-Ma'idah 5:20-21.]; and the Dead Sea Scrolls. 

12.	 The Original Philistines converted to the Hebrew Belief and became Israelites. The term Palestine is derived from the Philistines, a Greek Island people who invaded Canaan some 4,000 years ago. The Philistines converted to the Hebrew belief under a peace offer by King David, and held prominent positions in David’s army. [“They (the Philistines) met with a severe defeat, however, early in the reign of David (2 Samuel 5:20), he succeeded in reducing them to a state of vassalage (2 Samuel 8:1). In the year of the fall of Samaria (721 B.C.) they became vassals of Sargon. After the time of the Assyrians the Philistines cease to be mentioned by this name. In the ebb and flow of warring nations over this land it is more than probable that they were gradually absorbed and lost their identity. - [The Catholic Encyl.). / The Philistine cities lost their independence to Assyria, and revolts in following years were all crushed. [Myers 1997, p. 313.] / The theory of the “Lost Ten Tribes” calls for (1) all inhabitants of the Northern Kingdom of Hoshea to be deported by Shalmaneser and Sargon, 722-718 B.C [Hearyhim, Weebly, Armstrongism] / They (the Canaanites) were indeed assimilated into the Israelite nation. When the Assyrians overran the Kingdom of Israel, they did not leave any Canaanite aside, as they had all become Israelites by that time. Therefore, the only people that can trace back a lineage to the ancient Canaanites are the Jews. The Canaanites did not exist any longer after the 8th century b.c.e. and they were not annihilated but assimilated into the Jewish people. - [The True Identity of the So-called Palestinians, imninalu] / The Bible describes the Philistines as remaining “subdued” during David’s reign [Philistine; New World Enycl.]/ Josephus, Antiquities, Book 11, Ch.1] & [Esdras 13:39] Q. How then did the Muslims become Palestinians, an adjective of Palestine, in the 1960’s, and have been using this name as the antithesis of Judea and Israel¬¬¬? A. The Palestinian Name Deception: Those in the West who manoeuvred this name upon Muslims did so to mock, if not desecrate, the history, belief and culture of the Muslim people. Thereby it should be overturned by honourable Muslims."
42,E4iygQ--7dk,Your 1967 Map is wrong this was not occupied land.
43,E4iygQ--7dk,Well it seems that the creator of this video skipped a few HISTORY lessons.
44,E4iygQ--7dk,"🤣THAT IS NOT a map of Palestine In 1946 LOL ""Palestine"" the country or well ""the state of palestine"" didnt even exist yet. In fact in 46 Israel didnt even exist lol. It was founded in 2 years later, and the state of palestine over 40 years later. That ENTIRE area was British Mandate Palestine, which wasnt even a country first of all and then named it after the roman name of Syria Palestine, which the romans had renamed from ""Roman Province of Judea"", after beating the jewish revolt and expelling jews from their land, they renamed it after the jews historical enemies, The philistines (which have NOTHING to do with Palestine or modern day Palestenians) SO NO, that is NOT a map of ""Palestine in 46.. I mean if within the first 3 seconds you cant be unbiased, and historically accurate why even bother tackling this incredibly complex subject?"
45,E4iygQ--7dk,History starts from canaan period not 1946
46,E4iygQ--7dk,Very bias and unprofessional narrative. You should be ashamed of yourself.
47,E4iygQ--7dk,"* and the muslims and christians were living next to each other * Who were the first in  State of Isreal ? . The Christians ,The Ottarmans or Muslims"
48,E4iygQ--7dk,Looks like a rat nibbling cheese
49,E4iygQ--7dk,"A lot of lies. first of oll  during the ottoman rule, the entire area that is now syria, jordan and israel was called syria palestina, and there were no borders. Second thing the arabs who are now called palestinian, before the establishment of Israel was called themselves arab not palestinian they considered themselves part of big syria."
50,ZQUtT3pnw5Q,What do you think of the conflict going on right now?
51,ZQUtT3pnw5Q,the history of the two seem very different depending on who’s telling the story.
52,ZQUtT3pnw5Q,"So much hurt and pain. Both Arabs and Jews have been on that land. I remember when I was a grade school girl our graduation from 8th grade. We had watched the movie Exodus and selected a song from that to sing during our ceremony. I still remember the words “This land is mine God gave this land to me.”

Hearts and minds need to change toward each other. All believe in the God of Abraham, we are brothers. My prayers and the prayers of my spiritual group are holding that whole area in a bright golden light of gold bringing wisdom, intelligence, and love to the entire Middle East.

Now that I am almost 80 I pray I may see the peace I sang for so long ago."
53,ZQUtT3pnw5Q,As someone who has some Jewish ancestry my best friend living there and having cousins all throughout Israel and knowing some good honest Palestinian Americans it’s just sad
54,ZQUtT3pnw5Q,We want peace! No more war
55,ZQUtT3pnw5Q,"If you zoom out for a moment and just look at the two people you must state that whatever noble and/or religious goal they thought they had when they took up the fight as invader or occupant, it has surely long since outweighed any rational basis for building a future and/or living in peace by committing murder and genocide in the process. That is what happens when a seemingly righteous religious or national cause becomes fanatism, even terrorism, and bigotry of the worst kind."
56,ZQUtT3pnw5Q,"""When a foreigner resides with you in your land, you must not oppress him. You must treat the foreigner living among you as native-born and love him as yourself, for you were foreigners in the land of Egypt. I am the LORD your God."" Leviticus 19:34"
57,ZQUtT3pnw5Q,"Some reading for people interested in knowing more about the issue:

Enemies and Neighbours: Arabs and Jews in Palestine and Israel, 1917-2017 by Ian Black;
Anonymous Soldiers: The Struggle for Israel, 1917-1947 by Bruce Hoffman;
1948: A History of the First Arab–Israeli War by Benny Morris."
58,ZQUtT3pnw5Q,"I think ti is time to find a proper solution - understanding, peace, respect , and acception of each other"
59,ZQUtT3pnw5Q,Good conclusive video
60,6foH3Zc82ZQ,it's unbelievable that nobody mentions or blames the British for setting up the region for failure.
61,6foH3Zc82ZQ,"Watching a documentary that presents the formation of modern Israel in such a grim light is personally jarring for me. I had long held the view of Israel as a sanctuary for a people who had suffered immeasurable atrocities. To suddenly be confronted with the idea that its foundation is marred by acts of violence, terrorism, and potentially even genocide against Palestinians shakes the core of what I thought I knew. It's like experiencing a form of betrayal, where a narrative I held to be virtuous is revealed to have dark undertones. It's not just an intellectual exercise in reassessing history; it's a gut punch that makes me question the stories we're told and the stories we choose to believe. It's a painful reckoning with complexity in a world that's easier to navigate in black and white."
62,6foH3Zc82ZQ,"This is the reason us Irish 🇨🇮, proudly support the Palestinians and their cause but most people around the world fail to understand that or what this conflict is all about 😢."
63,6foH3Zc82ZQ,never let a british guy near a map and ask him to draw borders
64,6foH3Zc82ZQ,"This sounds similar to how British split India, Pakistan, and Bangladesh. Once they understood they couldn't trouble anymore actively,  they left a passive trouble as a separation gift. The entire Indian Subcontinent is still enjoying that gift!"
65,6foH3Zc82ZQ,"That first Israeli soldier laughing about how he didn't count how many Palestinians he killed and that he had a 250 bullet clip.... Imagine if a former Nazi soldier gave an interview like that about their conduct during WW2. 

They'd be hauled off to the World Court and hanged.

This guy.... Gets to hang out in polite society and live out his life in relative peace. 

Humans are insane.

EDIT: It's insane to me how many people out there give cover to a holocaust being perpetuated upon a people, by another group of people who should f++king know better after they suffered a holocaust. 

There are Israeli politicians literally calling for another Nakba."
66,6foH3Zc82ZQ,free palestine
67,6foH3Zc82ZQ,I'm blown away by the Jewish solder laughing when he was asked how many Palestinians he had killed. No loss of life should ever be met by laughter.  This has truly troubled me
68,6foH3Zc82ZQ,"As I say, you don't have to be a Muslim to feel the pain, you just have to be a human"
69,6foH3Zc82ZQ,"What blows my mind is that after experiencing all the atrocities and persecution in Europe, Jewish people went and did pretty much the same thing to Palestinians."
70,hdYZtRQ_eeo,"I can't believe YouTube is actually gonna come out and demonetize and/or age restrict what amounts to unbiased, fair and balanced reporting on a serious, real life situation? Unbelievable. Thanks so much again for your work, Simon and team."
71,hdYZtRQ_eeo,"You're doing a public service with these deep dives - well-researched, with strenuous efforts to represent fraught issues in ways the participants might recognize, and just enough humor (but no more) to make the medicine go down. Thank you."
72,hdYZtRQ_eeo,"I always enjoy Simon's videos across a number of his channels, but this video elevates the quality to a whole new level."
73,hdYZtRQ_eeo,As an educator Simon is invaluable! Hopefully this will help keep the messages of critical thinking and science  based decision making loud and clear.
74,hdYZtRQ_eeo,"Don't ever feel guilty about asking your community for support, you provide knowledge and perspective that cant be valued. Appreciate you."
75,hdYZtRQ_eeo,"I have done tremendous amounts of research on this subject, and I found your content to be incredibly accurate and unbiased. That is not an easy feat! I have recommended this to my friends who, like myself, are neither Jewish nor Muslim. Knowledge is POWER. Thank you for your hard work! Keep it up. ☮️"
76,hdYZtRQ_eeo,"2:55 - Chapter 1 - Ottomans & zionists
27:45 - Chapter 2 - During the war; after the war
36:20 - Chapter 3 - Civil war
43:35 - Chapter 4 - Suez & 6 day
54:35 - Chapter 5 - Interlude & consolidation
1:02:55 - Chapter 6 - The yom kippur war
1:07:25 - Chapter 7 - Normalization & palestinian isolation
1:13:20 - Chapter 8 - Intifada 
1:18:50 - Chapter 9 - The rise of hamas
1:27:00 - Chapter 10 - Intifada ; redux
1:34:45 - Chapter 11 - Elections & internal warfare
1:42:20 - Chapter 12 - 2 state solution ; 2 palestine situation  
1:47:55 - Chapter 13 - Recent developments"
77,hdYZtRQ_eeo,Thanks for taking about such a horrible and seemingly eternal conflict.  This was a tough watch for sure but I appreciate your effort to present facts as unbiased as possible.
78,hdYZtRQ_eeo,"Thank you for the hard work you and the whole Warographics Crew put into these reports. I have found them both informative and enlightening, and have been able to use them as reference in conversation with my family as well as with my non Jewish and non Palestinian friends. I wish I could do more to support your channel."
79,hdYZtRQ_eeo,"Thank you. Despite all my newpaper reading and all my history books, I have never seen such a comprehensive explanation of the events which have led to the current tragedy. Thank you in every way possible for your excellent journalism."
80,ZXfuqUhzESg,"""If you aren’t careful, the newspapers will have you hating the people who are being oppressed and loving the people who are doing the oppressing.”
― Malcom X"
81,ZXfuqUhzESg,I wish this could be part of school teaching so our children will learn.
82,ZXfuqUhzESg,"I appreciate the work that went into making this documentary. Whoever you are, thank you."
83,ZXfuqUhzESg,"It is very good to see a piece which gives such a clear history of the deals, both secret and open, which have led to the conflict which continues.  It is important for everybody to understand how this has come about."
84,ZXfuqUhzESg,For everyone genuinely seeking to understand & be educated on history thank you. Thank you to the documentary filmmakers of the excellent documentary. I’m thankful you made this free. This deserves an award.
85,ZXfuqUhzESg,"An incredibly important and well presented documentary.
This is a must watch for anyone who is interested in understanding how the stage was set so many years ago for the hugely significant events that are playing out right now in the present day."
86,ZXfuqUhzESg,"It's funny how we get the rawness of history through the windows of documentaries and such a like, but never taught in the educational system."
87,ZXfuqUhzESg,"I wish this had been taught when I was in school. It would have helped to explain a lot of what was to follow like our support of the Mujahideen's war against the Soviet Union, 9/11, the Gulf War, Operation Iraqi Freedom, the war in Afghanistan, and what's happening now with Hamas and Israel."
88,ZXfuqUhzESg,"By far this is the very best documentary on The Israeli-Palestinian Conflict that I have ever seen!
Beautifully created and laid out!"
89,ZXfuqUhzESg,"This is interesting, informative, and includes marvelous photos and film.  Worthwhile and well produced.  Thank you."
