,video_id,comment
458,rGVgjS98OsU,"Wow, the fact that some Palestinian families have kept the keys to their long lost/destroyed homes really struck a chord for me. That was so powerful, I literally burst into tears. Such a tragic catastrophe. 😭"
459,XNf40sBcvKk,"I love the fact that you are willing to be proven wrong but not with threats, or insults but with facts. We need more of this, less emotional dogmatic responses."
460,XNf40sBcvKk,"""nothing makes a place more holy than a competition with another religion"" - you have just provided the best line that was ever said about this conflict."
461,XNf40sBcvKk,SOOOO much information packed into this video. Thank you for sharing.
462,XNf40sBcvKk,This video should be mandatory for all high school and college students in the USA. Well done. Bravo!
463,XNf40sBcvKk,Great commentary! Thanks for setting the record straight
464,XNf40sBcvKk,"It's so good to be listening to this channel, the truth will set you free with facts there is no arguments. Shalom Brother"
465,XNf40sBcvKk,"As the child of Muslim parents, my dad was almost an historian. I knew this history from my dad. This should be required viewing."
466,XNf40sBcvKk,"Hi, I'm a viewer from a neutral country trying my best to soak up as much information from both sides as possible (as that is the best thing I can do right now as an individual) and I want to thank you for your perspective. The video was very in-depth and well-presented!"
467,XNf40sBcvKk,"Love the facts, the willingness to be proved wrong and the humility. As a British Christian - very educational run through history. Great post.."
468,XNf40sBcvKk,Fantastic overview of the history of this region.  Great work!
469,zmxJrMpIRh4,"“If two fish are fighting in a river, a long-legged Englishman has just passed by.”"
470,zmxJrMpIRh4,"The Israel-Palestine conflict is a deeply complex and sensitive issue that has spanned decades, causing immense suffering for both Israelis and Palestinians. Finding a resolution to this conflict is crucial for peace and stability in the region."
471,zmxJrMpIRh4,"Thank you for this unbiased summary on the Israel-Palestine war. There are no winners in war!
I was in Israel when the war started and the people were very helpful. This I did have anxious moments, did not ever feel unsafe. My prayers are with the civilians and soldiers on both sides who inevitably become the real pawns in the war😢"
472,zmxJrMpIRh4,"Don't tell me that they were not expecting this after attacking Israel. 
One Bad move and You pay a heavy price!"
473,zmxJrMpIRh4,Must be really horrible to live in countries that just keep going round in circles. This has been going on for decades and will just as likely still be ruining lives at the end of this century too.
474,zmxJrMpIRh4,"00:00 Conflict, Israel, Palestine
00:43 Militant, Territory, Struggle
01:13 Infiltration, Rockets, Border
01:38 Hostages, Casualties, History
02:13 Settlement, Alliances, Promises
02:43 Zionism, Partition, Resistance
03:14 Partition, Conflict, Statehood
03:49 Territorial Gains, Displacement, Tensions
04:23 Intifada, Occupation, Extremist
04:56 Blockade, Invasion, Escalation
05:30 Tensions, Separation, Incident
06:02 Provocation, Attack, Retaliation
06:33 Tragic Loss, Suffering, Humanity
07:05 Educate, Inform, Empower

Hi Aina Maya,

I found your video incredibly informative and engaging. To enhance the viewer experience and provide easy navigation through the content, I've created timestamps for various sections of the video (shown above). Feel free to copy and paste these timestamps into the video description. It's my small way of contributing to the community and making the content more accessible to your audience. If you have any specific format preferences for the timestamps or want to change the 3-word titles for each section, feel free to adjust them accordingly before adding them to the description.

Keep up the great work!"
475,zmxJrMpIRh4,"Brilliantly put. Such a concise, accurate and balanced portrayal of what is the conflict all about. Thanks for making this amazing video"
476,zmxJrMpIRh4,Avey is so underrated..... they explain it so interestingly hats off to the team
477,zmxJrMpIRh4,"Thank you for this video, pretty much the only unbiased source I’ve found. Clearly it’s a very complex issue"
478,zmxJrMpIRh4,Thank you! I love that you said stop taking sides. Both parties have innocent people and they are suffering and it’s a horrible nightmare for them. I can’t imagine what fear they go through every day! My heart goes out to all the beautiful children that never had a choice or a chance! These people are just trying to survive! I love you all! ❤My heart and soul cry’s for you every day and sends so much Love to you all! 🌸 🌼🌸🌼🌸🌼
479,xAs5EOBUDcs,"From a TRIP point of view, it is important to hear and listen to as many different perspectives as possible. Find some of our other videos on the matter here:

- A View From a Liberal Israeli: https://youtu.be/9qaxYQqmzIg?feature=shared
- The Palestinian Perspective: https://youtu.be/AtsTsCFxrNI?feature=shared"
480,xAs5EOBUDcs,"I’ve been meaning to catch your podcasts for literally months, but this is the 1st I’ve managed - helped for me by the YouTube format!
I think Alastair hit the nail on the head at the start when he says that the situation requires nuance that is lacking in mainstream media coverage. I was dimly aware that there was history, but Rory’s summary explains it very well, and I also love that he is at pains to say that other people will see things differently. It is very refreshing to have experts stating their understanding of a situation/ subject and simultaneously recognising that this is not the whole story. Thank you both."
481,xAs5EOBUDcs,This podcast is my favourite. I started with the rest is history years ago and I’m only now putting faces to voices. Thank you for all your amazing work.
482,xAs5EOBUDcs,"I’m glad Rory left frontline politics, he was too good for the swamp and this way he kept his hands clean. He’s of much greater service as a thinker, educator and advisor. That’s his real talent - to counsel and advise, using his considerable talents of being able to analyze the journey from A to B. He can see the journey both past and future, and therefore provide very useful predictions that can help to figure out the best actions to take."
483,xAs5EOBUDcs,Appreciate the nuanced and rational discussion of this difficult topic. Happy to see that 1.3 million people have listened and wish that several billion more would…
484,xAs5EOBUDcs,Thank you for this well formed and comprehensive discussion on what is a complex and bewildering topic. It’s best that more of us understand the context of this conflict and continue to learn as much as we can.
485,xAs5EOBUDcs,"I so wish we had serious, measured and professional people like Rory in government. Quite a few MP's could learn a lot from his morals and the way he presents himself. Keep up the good work Rory and Alastair. 💙❤"
486,xAs5EOBUDcs,From someone who is from Belfast and knowing what sectarianism can do to communities and how evil operates. I sympathise with all those innocent people. On both sides.
487,xAs5EOBUDcs,"The 'you're either for us or against us' attitude in the world today is frightening. There are so many shades of grey as opposed to being black or white, but many are unable to discuss something and see all sides. Great discussion with both of you. Enjoyed it in an informative way"
488,xAs5EOBUDcs,"Great explanation by Mr. Stewart. I'd been looking for a concise and clear explanation of this complicated issue, and I finally found it. Thanks."
489,GL-Rv2Zy8jQ,If two fishes are Fighting in the pond.. Must know that a Englishman must have passed by....
490,GL-Rv2Zy8jQ,Can clearly see the effort that you and your team have put into it. Very nicely explained. Thanks a lot..
491,GL-Rv2Zy8jQ,"Superbly explained...
Thanks a lot for your hard work to make the whole story understandable with ease."
492,GL-Rv2Zy8jQ,"प्रिया बेटा , इसराइल-पेलेस्टाइन विवाद पर बहुत सी वीडियो देखी हैं। पर आपके द्वारा जिस सरलता से विषय को समझाया जाता है उससे बहुत सी नई बातें जानने को मिलती हैं और ज्ञान भी बढ़ता है। आपको इसके लिये कोटि कोटि धन्यवाद।"
493,GL-Rv2Zy8jQ,This was very informative and elaborated video which gave us the full history in just 30mins. Great work Team Finology!❤️
494,GL-Rv2Zy8jQ,"An excellent compilation of information from several sources. Not an easy task at all. Thank you for the hard work that's gone behind this, and congratulations on a job well done. A humble suggestion if I may :  Please also seek opinions of well respected historians who have lived, and are living today perhaps, during the periods you have covered, just to make sure that everything,  as much as possible, is fact checked, and to make your presentation even more credible. Great effort. Thank you."
495,GL-Rv2Zy8jQ,BRILLIANT PRESENTATION. Lot of research and efforts has gone into preparation of this video for the benefit of community.
496,GL-Rv2Zy8jQ,I am not a law student but love your explaination style and content presentation and briefing skills so never miss any update of finology legal...actually Priya di's presence.❤
497,GL-Rv2Zy8jQ,"Without passing any judgment or drawing inference, I would like to express my sincere gratitude for compiling this information and I do appreciate the resources you've invested therein."
498,GL-Rv2Zy8jQ,"One thing i like about ur lectures is that... they are detailed well researched and presented in a crisp and clear manner.
🙌🙌🙌"
499,VA2tiAHmbm0,"I am Polish. When our neighboring countries attacked us and divided our land among them in the 18th century, we disappeared from the map for a 100 years. We lived under the occupation of three different countries at once. We fought back. And we are on the map again. They apologized. The wounds are still there but we live in relative peace. And I wish it for both Palestinians n Israelis."
500,VA2tiAHmbm0,Thanks for trying to present the topic without emotions or polarization. It's brave to leave the comments section open
501,VA2tiAHmbm0,"This is basically what happens when a blood feud reaches the national scale. Even if they've reached a ceasefire agreement, a splinter group that really hates the other party would emerge and strike the other one, regardless of collateral damage. The other party would strike back causing collateral damage as well, fanning the flames again, combine that with other factors, like who gets certain pieces of territories of interests to them and that cycle would continue."
502,VA2tiAHmbm0,Peace comes when both sides want it.
503,VA2tiAHmbm0,"Finally a more equilibrated video, thank you!"
504,VA2tiAHmbm0,Excellent work! Straight to the point and exposing the issues directly.
505,VA2tiAHmbm0,"""When man meets an obstacle he can't destroy, he destroys himself"" Ryszard Kapuscinski"
506,VA2tiAHmbm0,Equal rights  for all regardless of race religion or gender.
507,VA2tiAHmbm0,It’s difficult to resolve because too much blood has been spilt and all sides can’t accept defeat for one reason or the other.
508,VA2tiAHmbm0,We must look and understand Palestine Israel before WW2 to have the full truth.
509,0aM7RjXE1xo,This explains nothing to me. 260 people just died at a music festival. I need more context “reporters”
510,0aM7RjXE1xo,"Search ""How Israel Was Created"" and watch a video clip of how the Palestinian have their land stole from them, and ""Is Israel Guilty Of Apartheid Against Palestinians?"" to see how the Palestinian have been living under an apartheid system from the oppressive Israel system."
511,0aM7RjXE1xo,"History Lesson, you the media keep calling this the West Bank? Your Graphic Map is not correct.
It didn’t become the West Bank until 1948 when Jordan attacked the Jews.
For 4,000 years before that it was called Judea and Samaria, Israel was split in Two. That is the Holy Land of the indigenous people of Israel. Israel was destroyed by the Assyrians in 722 B.C.E.
Judah and Jerusalem fell to the Babylonian Empire and was destroyed in 586 B.C.E.

War and Empires determined Borders, over 4,000 years ago, so what is different today, the Jewish Nation has survived that long and is only defending what was their original Borders.
What do you think France under Napoleon, Germany under Hitler, and Britain did under various Kings and Queens did? Fought Wars to establish Borders. Today Wars are still fought to determine who owns what. Human history is that of Conflict, that is the one Constant that keeps Wars going.
My Ancestors were Vikings, who do you think shaped the various nations of Europe, why do you think War and Peace has survived for so long, it’s human pastime, a Game of Thrones.
The modern Borders were drawn by the West, without regard to the history of the various indigenous people, and you wonder why you still have Wars today?"
512,0aM7RjXE1xo,And she said the Palestinians were there before? Is this a joke??
513,0aM7RjXE1xo,"I didn't watch this.

  I think it's going to take a bit more than 170 seconds to explain it well enough for someone to fully understand. 

But hey...
if this scratches your itchy ears, so be it."
514,0aM7RjXE1xo,HAM????????????
515,0aM7RjXE1xo,UT arab professor she supports hamas
516,0aM7RjXE1xo,There were always Jews there!!
517,0aM7RjXE1xo,_the Gods know what Israel has done_
518,0aM7RjXE1xo,The Palestinians were the Jews before 1948. Why are you rewriting history!!!
519,WiNlxqlNZys,Praying for both sides Civilians.
520,WiNlxqlNZys,When i see things like this i realize how lucky i am to be living in the best country of the whole world ( The Netherlands)
521,WiNlxqlNZys,"The video title said ""Conflict Explained,"" but it looks like the channel is just trying to get views in the name of tragedy."
522,WiNlxqlNZys,"Proverbs 10:12
Hatred stirs up conflict, but love covers over all wrongs.✝️❤️‍🩹"
523,WiNlxqlNZys,Alhamdulillah ❤❤❤❤
524,WiNlxqlNZys,"Do not take weak as granted. When the weak stands up, table changes."
525,WiNlxqlNZys,These babys don't deserve this cruelty. Sad day on this planet 🧎🏽‍♀️🧎🏽‍♀️🙏🙏🙏
526,WiNlxqlNZys,Speak for peace for both Israel and  Palestine.
527,WiNlxqlNZys,My condolences and my prayers for both sides🙏🙏🙏🤞🤞🤞🫶🫶🫶❤️❤️❤️☮️☮️☮️
528,WiNlxqlNZys,Pray for Palestine 🇵🇸 and Dua 🤲🤲🤲🤲🤲🤲🤲for Palestine 🇵🇸
529,REWfM4gVtow,#Firstpost2Million: Thank you viewers for your trust! Leave a comment and let us know what more would you like to see on the channel.
530,REWfM4gVtow,This is more information than you will ever get from American news channels. Thank you
531,REWfM4gVtow,"So Qatar gives terror group Hamas $360 Million in unaccounted Aid each year. It is worthy of noting Qatar hosts no Palestinian Refugees though, in fact they expelled all Palestinians in 1993, even those working in the Qatari Government, and successful businessmen. They have an interesting way of supporting Palestine."
532,REWfM4gVtow,I'm pleasantly surprised by this YouTube channel i just discovered . You get like info that you won't hear in the Western Media and i absolutely love it . And i love how this Lady present the news . Good job Firstpost
533,REWfM4gVtow,"I lived for 35 years and I never understood the news. Until, I started following you and the first post. Please continue to be genuine and honest."
534,REWfM4gVtow,"What's happening between Israel and Palestine right now is absolutely disgusting and heartbreaking. No matter what there are innocent people caught in the middle and the more I see news reported on it, the more tears come to my eyes."
535,REWfM4gVtow,"She gives you the back story, this was how I started listening to WION because of how she presents news, she really does allow you inside knowledge, and give you indept information.
You listen to PS presenting news, and you take away so much, and you come back for more, because you know you will always be enlighted, and informed."
536,REWfM4gVtow,I miss American media being so unbiased and real with a news stories. Thank you for this information
537,REWfM4gVtow,"The best news channel in India. In fact she's the most unbiased anchor, (not perfectly as no one can be). States clearly, no unnecessary and dramatic bg music, Her well acquainted knowledge and efforts are more than enough to stand out. She's doing for us a national service."
538,REWfM4gVtow,"If i saw her reading the news, i will never scroll back or forth for other news.. Cause she's the only trusted news reader as for me... #Palki Sharma 🙏🏻"
539,53KolEoTyz0,Very well explained
540,53KolEoTyz0,So why are they fighting?
541,53KolEoTyz0,As soon as I heard his accent I was like ‘yeah this guy gets it’ lol
542,53KolEoTyz0,Too much hate in the world  especially fighting and killing over territory.  Isn't the earth all of our home?
543,53KolEoTyz0,Succinctly explained .
544,53KolEoTyz0,facts vs alternative facts lies obfuscation excuse making careful omission
545,53KolEoTyz0,Understandable english
546,53KolEoTyz0,Free Palestine
547,53KolEoTyz0,it is not conflict. it simply one of the worst occupation in the world
548,53KolEoTyz0,"Tidak perlu membantu Israel itu, dia telah tamak dengan harta dunia,bahkan dia telah mendustakan Tuhannya yang menjadikannya hujud."
549,r21iN7JYu2Y,WATCH NEXT: Inside the Hamas ‘Terror Tunnels’ Israel Has Been Bombing - https://youtu.be/W4gDfSNMRx4
550,r21iN7JYu2Y,"I don’t care what religion or side you’re on, watching a grieving mother talk to her deceased sons in a graveyard, while her surviving daughter stands nearby, is beyond heartbreaking."
551,r21iN7JYu2Y,I never almost cry but instantly started tearing up when that father was holding his child dead in his arms and screaming. Rest in Peace to those innocents and children who passed on both sides.
552,r21iN7JYu2Y,At first I felt like this video was gonna be pretty biased and one-sided. However at the end it really seems like she was very sided with the civilians who are the real people being hurt here. I appreciated that. She grilled leaders on both side. 10/10 great interviews and reporting.
553,r21iN7JYu2Y,That father screaming to the sky and asking why! The pain and grief in that moment is something I am going to pray for his well being and happiness.
554,r21iN7JYu2Y,"Thank you for continuing to make this information free and digestible. It's so important to understand what's going on in our world, and so few media outlets take the time to tell a whole story anymore. Just what's happening RIGHT NOW. I am praying for all sides, for the innocent people and families who never asked to live this way. It's truly heartbreaking 💔 🙏🏼 I can't imagine having to explain all of this to your babies and still attempt to sleep at night."
555,r21iN7JYu2Y,Always appreciate that Vice news asks tough questions to both sides and dives deeper than mainstream media
556,r21iN7JYu2Y,How does somebody go to both sides of a bitter conflict and ask tough questions on both sides? This is incredible journalism.
557,r21iN7JYu2Y,"The man who lost his children broke my heart. He was so shocked he couldn't even cry, just scream."
558,r21iN7JYu2Y,It doesn’t matter what side you’re on but seeing children who has nothing to do with this conflict die is heartbreaking
559,xTcP1R8BFBQ,"Download the PDF here-
https://cdn1.byjus.com/wp-content/uploads/2021/06/BYJUS-IAS-Explaned-_Israel-Palestine-Conflict.pdf"
560,xTcP1R8BFBQ,"This is the only man in Byjus that can take up any subject with ease in a very comprehensible manner ... The all rounder.... Kudos to Chetan sir, and thank u Byju's for the free service. And without biased to other teachers, each one of u are among the world class teachers. Keep up a good work for the most neediest one."
561,xTcP1R8BFBQ,"The way Chetan Sir simplifies the difficult and important topics is absolutely topnotch. I wouldn't be bored to listen to your classes continuously. 
Thank you Sir. Would love to see you more."
562,xTcP1R8BFBQ,The voice behind daily analysis... great to see him
563,xTcP1R8BFBQ,"Wow i am wondering ....1st time i saw the person  of voice behind the daily hindu analysis 🤗😊 
Thanks 😊 sir"
564,xTcP1R8BFBQ,"Lucid explanation. It cleared my doubts  .. The balancing act of Indian Government that sir explained is awesome along with other contents..
Thanks ByJus..."
565,xTcP1R8BFBQ,A magical voice behind news analysis curtain unveiled to screen finally for the explain session. Glad to see you sir❤️
566,xTcP1R8BFBQ,"Naa.. vanga na vanga na
Vandutan da yen thalaivan
Vara level thala ne"
567,xTcP1R8BFBQ,"So finally the man or voice behind the curtain now has come out and it's really good to see you sir because we often hear your voice during analysis videos and I must say that you really have powerful voice which is needless to say praiseworthy 🙏🙏🙏
Please sir come up with more such videos which are germane to our exam"
568,xTcP1R8BFBQ,This is the first video whr i am commenting regarding this topic.. this man deserve a like.
569,kUMYT6tozEg,That was so nice to see the Arab and Jewish children playing and learning together. May God bless them
570,kUMYT6tozEg,"""We don t have to agree,  but we have to listen"" . How beautiful is that ❣️"
571,kUMYT6tozEg,I don't agree with many things said by both sides but wow what a great job in keeping it neutral and truly hearing from both sides and not just cherry picking. This is what journalism should look like.
572,kUMYT6tozEg,"23:11 His music needs to be widely spread and promoted. There are plenty of talent agencies who could help get him as widely recognized as his tremendous talent and wisdom deserves. It’s inspiring, and a good message that I think we all need to hear. Beautiful ❤"
573,kUMYT6tozEg,"I can see that the artist is really hurt living in Israeli-Palestinian conflict. He seemed really tired and pained and i felt it.
I hope and pray that the peace will descend in the land, and the people will learn to share the present and future together."
574,kUMYT6tozEg,Thank you for mking this documentary. So neutral and fair on both the Palestinians and Israelis. 🙏 ❤ It is indeed a complex solution.
575,kUMYT6tozEg,The greatest deception in human history is the phrase “we can disagree and still live in peace” Human mind doesn’t work that way!
576,kUMYT6tozEg,"Praying for the Peace  of Jerusalem.  God bless Jerusalem and all who dwell within her. Let there be peace ,  love and tranquility.  Amen !"
577,kUMYT6tozEg,""" If two fish are fighting in a river an Englishman must have passed by ""
( Native Americans, Indians, Israel, Plaestines, Rohingyas in myanmar, Pakistan, Afghanistan, China  with India on mcMohan line, Malaysia, Philippine and  British North Borneo Company, Greece, Turkey)."
578,kUMYT6tozEg,"I enjoyed listening and learning about the people's journey together in this torn part of the world, especially the children and their shared academic experience; this is awesome as a new paradigm shift in understanding each other through the nuance of youth, education, and the future."
579,ECscKICzsJ0,The YouTube algorithm has an interesting sense of humor.
580,ECscKICzsJ0,I was two and a half minutes into this before I realised it was made eight years ago. It’s comforting to know some things in life are timeless.
581,ECscKICzsJ0,"I thought The Onion was supposed to make satire, this is just actual history"
582,ECscKICzsJ0,”Global leaders worked tirelessly to engineer a conflict so intractable that it could last indefinitely” I see no lies here
583,ECscKICzsJ0,Yet another example of when comedians do a better job of journalism than journalists.
584,ECscKICzsJ0,This is the calmest comment section about Israel/Palestine I've come across this week.
585,ECscKICzsJ0,This is where I get my up-to-date information on the Israeli Palestinian conflict
586,ECscKICzsJ0,We have reached peak absurdity when the Onion gives the only accurate fair and balanced synopsis of the Israeli- Palestinian conflict.
587,ECscKICzsJ0,Give it another 10 years and this video will still be just as accurate.
588,ECscKICzsJ0,"No matter what’s in the news, there’s a decade old onion video about it doing a better job at explaining it that any documentary."
589,W5hBL94EFMQ,Never ask the UN to ever draw borders again.
590,W5hBL94EFMQ,"If you give a mouse a cookie, it’s going to ask for a glass of milk."
591,W5hBL94EFMQ,And when Palestinians fight back they cry out in anger but when Israelis murder Palestinian civilians they say “It’s war what do you expect”
592,W5hBL94EFMQ,When the oppressed becomes the oppressor
593,W5hBL94EFMQ,Who needs history when you can make your own reality
594,W5hBL94EFMQ,Cant believe vox went into this narrative without presenting all the facts.
595,W5hBL94EFMQ,Cycles of violence & hatred are supposed to be broken not continued.
596,W5hBL94EFMQ,Free Palestine 🇵🇸
597,W5hBL94EFMQ,Left out the part where Israel said yes to the devision deal and the Palestinians said no because they wanted the whole country (this happens like 2 more times).
598,W5hBL94EFMQ,Y'all decided not to tell 99% of the story
599,qR5TCBBhihY,iran@iraq..she said like Almost same😶
600,qR5TCBBhihY,"Iran has motives, thats all you need to know."
