,video_id,comment
835,kbPnF8Hvj0I,I had no idea Israeli settlers were Americans. Says a lot about how they treat Palestinians there.
836,kbPnF8Hvj0I,The nerve of a foreign people flying half way across the world to kick out indigenous people from their homes for another foreign people. This is crazy
837,kbPnF8Hvj0I,"Is it just me or is watching those smug racists smiling while mistreating that family really, really frustrating? It makes the world seem so depressing. I've seen that type of smile before and every time that I do it's because someone is being bullied."
838,kbPnF8Hvj0I,"So sad, I’m so sorry for all the Palestinians who are suffering under Israel’s harsh regime. Everyone deserves peace dignity and respect."
839,kbPnF8Hvj0I,Thank you for exposing the utter arrogance of  American Jews and Israeli settlers to audiences like myself who once were ignorant to the plight of Palestinans. The Truth is knowledge and knowledge is power.  Keep up the good work.
840,kbPnF8Hvj0I,I am quickly losing respect for certain groups of people. Never thought I would feel like this 😢
841,kbPnF8Hvj0I,"Thank you for posting about what Palestinians go through, May Allah always protect them and ease their hardships! ❤️🇵🇸"
842,kbPnF8Hvj0I,"After years of being brainwashed, thank you Aj+ for showing me and most people like me in the rest of the world who is the real trouble makers and who we stand with and support moving forward."
843,kbPnF8Hvj0I,Imagine being an American Tourist and kicking people out of their homeland that you are just visiitng lol
844,kbPnF8Hvj0I,It’s time to revoke them as American citizens!!!!
845,O454c_qs5kI,"If you take the time to learn the history behind all this, in my opinion, the reason why there’s conflict between Israel & Palestine , it’s because of the British back during pre world war 1 to world war 2. The British made a lot of bad deals between the 2-nations which led to a big mess where it is today. Now England is just hiding in the shadow hoping no one brings up their old history presence in the Middle East."
846,O454c_qs5kI,"This is OK for a quick crash course, but it kind of conveniently left out a few things. Nothing on settlers? Nothing on the blockade of Gaza? It makes it seem like a two-sided territorial dispute without much characterization of what each territory is like other than ""densely populated."""
847,O454c_qs5kI,"I never thought Fox News would be the best source of information on a topic, but here I am"
848,O454c_qs5kI,Why are all these companies telling me to stand with Israel? No
849,O454c_qs5kI,"Good presentation and generally historically correct. What is missing in the conversation is the current apartheid mindset. For some 20 years Israel has segregated the Palestinians in two reservations (Gaza and the West Bank). In an effort to quell hatred of Israel and attacks - the Palestinians in these reservations face embargos and live in hopeless poverty.  Uprisings (intifada) happen regularly due the poor conditions in these reservations. These current acts of inexcusable terrorism by Hamas will bring even more oppression and misery to the Palestinians. That said, there will be no peace until both sides are willing to talk and compromise. As long as both sides see war as the only solution there will be only war."
850,O454c_qs5kI,So you focused on “Jewish being persecuted and fleeing Europe” but not “Palestinian forced out of their home en masse.” Let’s be objective here shall we?
851,O454c_qs5kI,"A nice attempt to explain what's going on ??
But some of the real important questions need to be answered?
Why did England want to create a State of Israel ??"
852,O454c_qs5kI,I am not a Fox fan but I see somewhat balanced news and comments. Great job gentleman
853,O454c_qs5kI,This might be the most comprehensive and intelligent explanation of anything I’ve ever seen on Fox News.
854,O454c_qs5kI,"The U.S. needs to stay out of it and fix our own issues. Then, we can (and should) help."
855,2CVoPLea5_Q,"As a Westerner, this is why in addition to western media outlets, it is important to tune in to non-western reporting like Al Jazeera to get an accurate summary of both sides of the story. That way, you will be best-informed when drawing your own conclusions."
856,2CVoPLea5_Q,"The families and children of Gaza bear the heavy burden of unrelenting pain as they endure the harsh realities of conflict. They suffer the anguish of losing loved ones to violence, their homes reduced to rubble, and their dreams shattered by the relentless cycle of strife. The echoes of explosions reverberate through their lives, leaving scars that run deeper than physical wounds. Amidst this turmoil, they grapple with fear, insecurity, and the trauma of an uncertain future. Their innocence is stolen by the harshness of the world they inhabit, and yet, they persevere with remarkable strength, seeking a glimmer of hope in the midst of the darkness that surrounds them"
857,2CVoPLea5_Q,"Hammas knew what they are doing, including consequences. Israel also knows what they are doing and consequences. Anyone else talking about this,possibly can’t influence their choices."
858,2CVoPLea5_Q,"Nothing is right with any of this... however- murder, rape and kidnapping is not the answer to any problem. You cant not kill people and say its justified."
859,2CVoPLea5_Q,"If you treat people like animals, you don't get to decide what kinda animals they become, lions or lambs."
860,2CVoPLea5_Q,They always seem to forget there's an Egyptians border for Gazan citizens too... but even Egypt blockades gaza because of hamas
861,2CVoPLea5_Q,Israel should remember history will repeat itself
862,2CVoPLea5_Q,"I try to be as neutral as possible on this issue, but only fools could not have predicted that after Hamas fighters entered Israel en masse and started kidnapping and murdering civilians living there. Israel will respond in a very harsh way. In addition, the attack by the Militants of a concert where young people were having fun will lead to public opinion in other countries turning away from Polestyn."
863,2CVoPLea5_Q,"Our prayers go out, and we pray for peace.🙌🙏🙌"
864,2CVoPLea5_Q,"On one hand, we have Hamas labeled as a terrorist group, while on the other, Israel is called a terrorist state. It's a peculiar kind of balance, don't you think?"
865,Y7a5Yww8mMc,"Correction - you said Palestinians ‘left’ their homes in 1948-
They were hunted down, killed, thrown out of their homes and  forcibly exiled.

Before 1946, Palestinians made up 96 % of the population.

Persecution, marginalisation, forced evictions, expulsions, - has lead to Palestinians being a minority in their own country."
866,Y7a5Yww8mMc,"Palestinians have a right to life🙏
Living in an open air prison for 16 years and being slowly suffocated to death slowly is evil. 
The religion that talks of being a mensch lives like the devil, I wouldn’t want that type in my country - maybe the world is waking up to what these people are really like…"
867,Y7a5Yww8mMc,I believe Buckingham palace is my home. . . Think I will move in.
868,Y7a5Yww8mMc,"From may 14 1948 to 2023 is over 5k year of history, you learn something new every day 🎉"
869,Y7a5Yww8mMc,"ITV clearly getting money from ""someone""... smh... You guys have barely covered the pain of Palestinians but quickly created all this propaganda in favour of Ees-ra-el with sad music and all..."
870,Y7a5Yww8mMc,I hope that the deceased will please restrain themselves 🙏
871,Y7a5Yww8mMc,Originated by British
872,Y7a5Yww8mMc,Such a biased report 😮
873,Y7a5Yww8mMc,Pls see Papal Bull of 1430 !
874,Y7a5Yww8mMc,Origin !? Don't you mean ORANGES ?
875,cGZE6Yh0X6M,This is the kind of stuff we need. Empowerment through knowledge
876,cGZE6Yh0X6M,Came across you on George Galloway's show (as I did with many other great people before). Thank you for everything you do Mohammed!
877,cGZE6Yh0X6M,"My grandfather (who was from a Jewish family told me most of this) 
I can't believe how many people don't know the basics of the ethnic history, politics, etc."
878,cGZE6Yh0X6M,I never realized how bad the Palestine people have it. This was a real eye opener
879,cGZE6Yh0X6M,"As a Jew I decided to force myself to listen to this historical conflict from a different perspective, thank you for this video 🙏🏽"
880,cGZE6Yh0X6M,This is by far the best youtube video content I have ever watched since the beginning of time! Thank you both for such a comprehensive accumulation of events in its true format with no toxic biases. May Allah reward both of you for the great work you bring the community and the world.
881,cGZE6Yh0X6M,As a Ugandan muslim I am greatfull that they didn't settle in Uganda . I am also sad to have  come to that realization after the the killings of many innocent Palestinians mostly children 😢😢😢😢
882,cGZE6Yh0X6M,This video is highly needed and welcomed. History is very important yet overlooked.
883,cGZE6Yh0X6M,Brother Hijab cooked hard with this one. Thank you bro 🔥🔥
884,cGZE6Yh0X6M,Much respect to Mohammed for using his platform to educate the audience about this complex issue. 👏👏 This is much needed.
885,wQmBsbt9blg,"As a Muslim, I want to request everyone on this platform to try to tell others around you that we need to respect human life and reject any ideology that supports the killing of innocent civilians. In this era of fake news, we need to be more careful because it is becoming increasingly dangerous everyday...  with rising polarisation around us, we need to reject hate and help people around us... 😢"
886,wQmBsbt9blg,"He's right about people becoming radicalised because of lack of peaceful economic opportunities, and how that's happening in the West, too. There's an old African proverb: """"The child who is not embraced by the village will burn it down to feel its warmth""."
887,wQmBsbt9blg,"Social media has done nothing but cause me stress, full of hate, extremely polarised and tonnes of misinformation that nobody questions. This is exactly what i needed to see a well balanced and insightful view. Thank you and keep up the good work."
888,wQmBsbt9blg,He is so well - read and balanced. Such a pleasure to listen to such people. Gives me so much clarity on the situation. Thanks.
889,wQmBsbt9blg,I have been seriously avoiding clicking on anything that advertises that it’s going to cause any emotion in me. All week. I was rewarded by being served this interview in my feed. So grateful. Will rewatch and recommend to thoughtful people. Thank you.
890,wQmBsbt9blg,"Honest clarity, competence and rationality make this conversation measured and constructive. Thank you"
891,wQmBsbt9blg,Nice to hear a level headed intelligent person discussing the topic.
892,wQmBsbt9blg,"I'm so glad I came across this brilliant, insightful man. I hope we hear more from him."
893,wQmBsbt9blg,Mr. Bremmer just opened our eyes to all that has and is going on. Before this I believe most of our eyes were closed  to what really was happening and how it had and is presently playing out. Please no more mistakes. THANK YOU.
894,wQmBsbt9blg,A lot more than 1.1 million people need to listen to this. Thank you for this interview
895,H7FML0wzJ6A,I admit i am not the most knowledgeable on the Palestine-Israel conflict but I found it very interesting that is actually illegal to acknowledge the “Nakba” in Israel while also letting Israelis have all there rights but Palestinians aren’t given those same rights and live under martial law most of the time. I’ve been doing research recently and another thing I noticed is how the media shows every atrocity committed by Hammas yet the atrocities committed by Israel’s IDF are not shown also the death of innocent Palestinians is barely shown yet a single Israeli death or casualty is shown everywhere.
896,H7FML0wzJ6A,"Imagine that you are living in your land in peace...and someone comes and takes your land, demolishes your house, and steals what your ancestors earned in the past just because his religion tells him that this is your land...which religion accepts this crime?"
897,H7FML0wzJ6A,The least the world can do is learn and understand the plight of the Palestinian people and their decades-long struggle for freedom.
898,H7FML0wzJ6A,Rewatching this as a reminder of todays event in the middle east... People please learn ur history!
899,H7FML0wzJ6A,A 2nd Nakba is happening in Gaza right now as we speak!!! May Allah protect the Palestinian people and give victory to them
900,H7FML0wzJ6A,Everything the British touch has turned into chaos until today.
901,H7FML0wzJ6A,I've watched this series a bunch of times. This video series needs to be shown and viewed now more than ever!
902,H7FML0wzJ6A,One of the best documentaries on the history of Palestine. Historical documents and photographs are worth thousands of words
903,H7FML0wzJ6A,What a tragic story of human suffering
904,H7FML0wzJ6A,Am 71 i was always thought that Palestinians were the bad guys ty for enlighten me
905,ffRfIfGgjmw,"Watch this video to understand the history: https://youtu.be/CISbbt1x2dc?si=QxeNDw1P9vhl7jxj

KukuFM Download Link - https://kukufm.sng.link/Apksi/1ocn/9n2s 
Coupon code – DHRUV50
Special offer - Get 50% off on KukuFM’s 1st month subscription at ₹49."
906,ffRfIfGgjmw,May all stand with humanity in this hour. Thanks for this clear message and reminder for all. 🙏🏻💐
907,ffRfIfGgjmw,"As a human i stand with humanity.
But things aren't that simple as you explained 😞"
908,ffRfIfGgjmw,"Dhruv, i watch each and every video of yours trusting that you and your team tries the best to get authentic and true information for us BUT this time i am really DISAPPOINTED that you have neglected what torture Israelis have been doing to Palestinians since a lot of years now. Gaza has just returned what they have been getting since a lot of years. I hope you see this message and know what the people of gaza have been through. People idealise you and trust you for authentic information, its your responsibility to please highlight the side of gaza too"
909,ffRfIfGgjmw,Those who are saying i stand with humanity i wanna ask them one question where did you go when kasmiri pandits were suffering from same situation
910,ffRfIfGgjmw,"We came across many videos where the Israeli forces targeted hospitals and refugee camps and many people  lost their lives especially children, this is not self defence it's clearly a genocide and infact innocent Palestinians are always tortured by the Israeli forces, it was heart breaking to watch how Israeli militants treated the elderly, women and children. I just wish for peace. May the almighty create ease for our brothers and sisters . I stand with humanity 🕊️🕊️"
911,ffRfIfGgjmw,Dhruv you should also talk about what is happening  right now in Gaza?
912,ffRfIfGgjmw,"*Jab tak majloom kamjor pr julm* *hota rha sab sakht dil chup dekhte rhe.*
*Jab jalim pe julm hua to sab ko* *insaniyat yaad a gayi* 🙂🙂"
913,ffRfIfGgjmw,"Many people are making videos and taking sides on the Israel-Palestine issue. They're reacting because Hamas attacked Israel, but there's concern that they didn't speak out when Israel conducted attacks. Good job, Dhruv. However, it's important to show the whole picture, including what happened before."
914,ffRfIfGgjmw,"To anybody reading this, I pray that whatever you constantly stressing about gets better. May the dark thoughts, the overthinking, and the doubt exit your mind may clarity replace peace. And calmness fill your life.🌼"
915,S_tTgryABBU,And she came from Poland 😂
916,S_tTgryABBU,As a german i stand with palestine🇵🇸❤️
917,S_tTgryABBU,As a English catholic I support Palestine 🇵🇸
918,S_tTgryABBU,As an Egyptian I stand for Palestine
919,S_tTgryABBU,She may not need Muslims but she definitely need a fitness trainer 😂
920,S_tTgryABBU,As a Maldivian I stand with palastine
921,S_tTgryABBU,This is exactly what Nazis might have told her grandparents.
922,S_tTgryABBU,As a German I also stand with Palestine 🇵🇸🫶
923,S_tTgryABBU,"As an American, I stand with Palestine. 🇵🇸"
924,S_tTgryABBU,"As a Chinese, I stand with Palestine"
925,7Jyc-LzXqk0,"This is the longest video I've ever published to YouTube, and I still feel like it's barely scratching the surface. The entire history behind this conflict is profoundly deep and complicated, so if you'd like to watch another 1-hour documentary covering all of the previous wars and conflicts between Israel and Hamas that led up to what's happening today, I encourage you to watch this video next on Nebula - https://nebula.tv/videos/reallifelore-modern-conflicts-israel-and-gaza-before-2023.
>Link to my Nebula page where you can get a discount ($2.50/month): https://go.nebula.tv/reallifelore
If you sign up using any of the above links, a big portion goes directly to support RealLifeLore and the journalism I do here.
Thanks - Joseph"
926,7Jyc-LzXqk0,"It would be really great to add subtitles in global languages like French, Chinese, Arabic, Russian, Spanish etc. for larger audiences to understand. My friends would watch this video but their English is not enough for this."
927,7Jyc-LzXqk0,Thank you for providing so much of the lost context that is plaguing media and social media. It's just a terrible situation nobody wants to properly deal with.
928,7Jyc-LzXqk0,Thank you for stitching together all these threads into a coherent narrative explaining this ongoing conflict and the geopolitical history and current policies behind it. I knew some of this from reading articles but you helped me understand how all of it fits together. Great job! Sadly you won’t learn much from American news.
929,7Jyc-LzXqk0,"As a Syrian citizen who is attempting really hard to stay objective and trying -again- really hard to tell the story in a non-biased way, I honestly think this is the most accurate video narrating the complexity of the middle-east as of now. I don't agree with the channel that this is barely scratching the surface. This is what I'm showing my friends when asked about the context. Foreign friends, Syrian friends, and whoever asks for context. You have no idea how easier this video made my life. I honestly, wholeheartedly, thank you."
930,7Jyc-LzXqk0,Really great video. I was scared to watch a heavily one-sided video but you mention a lot of topics and threads that keep it very interesting to watch.
931,7Jyc-LzXqk0,if you think i’m gonna watch a 1 hour long reallifelore video then you would be absolutely correct
932,7Jyc-LzXqk0,"This is the most comprehensive (though not the largest) and probably most balanced explaination of the Arab Israeli conflict that I have watched. This video should be getting WAY more views. As others have mentioned, it is hard to see why the algorithm is not pushing the video more."
933,7Jyc-LzXqk0,"I believe there's an important aspect you missed by not mentioning the Emirate of Transjordan, which is the part of Palestine occupied by Jordan. It's a topic that often goes unnoticed or undiscussed, and I find it puzzling"
934,7Jyc-LzXqk0,"This video was amazing, thanks for diving into the history, I'll go check out the nebula drop"
935,aBswCrpLSao,"This is complete human rights violation, totally disgusting, no one can stand this kind of oppression"
936,aBswCrpLSao,"This is insane, inhumane and terrifying. And what's even more insane is how the whole world slept on this all these years."
937,aBswCrpLSao,"How the hell can those soldiers invade the house of the Arab family, without being invited. Prisoners in their own home. Those settlers have to be removed!!!!! What happened to the rights of the Palestinians. They let the settlements grow and grow, they were supposed to be stopped from the beginning. This is so unjust!"
938,aBswCrpLSao,Wow.. I can’t imagine to loose your home and being humiliated. Thank you for replaying this. I hope more people will watch this to truly understand.
939,aBswCrpLSao,"I'm shocked how humans could treat each other this way....No matter what religion you are or where you live we should all be treated with respect and be able to live in peace..I live in California...I'm Mexican and born in the U.S...In the area I live I have friends that are Muslim, Jewish, African American, Philippino, Americans and Chinese..And we are all neighbors and help each other...I wish the whole world could live this way...We are all human beings and we all deserve freedom and peace"
940,aBswCrpLSao,"We express our gratitude to 60 Minute for organizing and presenting this program, which sheds light on the hardships endured by Palestinians. This platform provides an opportunity for people to gain insight into the challenges faced by this community. It is important to address the mistreatment they endure, as well as the complex issues surrounding terrorism."
941,aBswCrpLSao,Omg man asked to go to his city in his country 16times refused 16 times and he’s a powerful person imagine a normal poor family they have no chance
942,aBswCrpLSao,"Respect to the entire 60 minutes team for posting this video on this sensitive time, which sheds light on very important side of the conflict"
943,aBswCrpLSao,I hope more people clueless about what been going on for years watches this. This is the reality.
944,aBswCrpLSao,"Growing up in a diverse part of Houston TX, I never had any hate towards my Arab brothers, but I must admit that western Media had me thinking Israel was innocent. These recent atrocities are horrible, but I'm glad they have shed so much light on the truth and I have made it my mission to get the truth out and open other's eyes like mine were. Peace be upon my Palestinian people. Thank you for being strong, we won't stop fighting for you!"
945,K2zbN3AuHG8,If I'm a resident of Gaza I don't think I'll be waiting for the resolution  predicted by the spokesman for the Carpenter's Union!
946,K2zbN3AuHG8,Jon Stewart has always been a leading light for me since the 90’s. Delighted he is back
947,K2zbN3AuHG8,"John, I know there's a very small chance you will ever read this, but I want you to know that seeing you back in the commander seat has brought me a deep nostalgic primordial happiness that few other things in this world ever could. Please keep being the incredible honorable lovable individual you are. *I don't have words to describe how much of an impact you had on my life and to see you back. So happy it's indescribable!*"
948,K2zbN3AuHG8,"man, glad you're back ! feels like meeting an old friend after years"
949,K2zbN3AuHG8,6:22 - “why do you even have a f***ing building??!!” -jon stewart quoting the unedited view of john bolton about the u.n. 🤣🤣🤣🤣🤣
950,K2zbN3AuHG8,"The ""don't stay up all night"" line is incredible 😅"
951,K2zbN3AuHG8,Brilliant!! I love the idea of METO! ❤
952,K2zbN3AuHG8,wow. he's back. presenting the Daily Show. I'm not in the US; didn;t see this coming
953,K2zbN3AuHG8,"That pastor talking about an army of 200 million reminds me of ""what year did Fire Lord Sozin defeat the Airbender army?"""
954,K2zbN3AuHG8,Long live humanity!
955,a34zpFaoBoM,Doesn’t anyone find it strange that the most sophisticated intelligence agency in the world didn’t notice 100s of militants and 1000s of rockets being put in place just over the fence. This is either the biggest failure in military intelligence or it was allowed intentionally. Which is worse
956,a34zpFaoBoM,"On both sides, can we all agree this interviewer asked some terribly meaningless questions? “Do you think the enemy was bad? Do you think people helping the enemy should knock that off? Do you agree with people who agree with you?” 

Read the guys bio before you ask him book jacket questions. From that “interview” we learned nothing in depth. 

Most Predictable Interview of the Year Award winner here."
957,a34zpFaoBoM,"i laughed every time they say ""'Kremlin controlled media"""" as if our news arent the same XD"
958,a34zpFaoBoM,"The moment ,as an American, you’d rather hear from Putin instead of Biden 😂"
959,a34zpFaoBoM,I love how they really want us to believe they knew nothing about this 😂 I’m a stay at home mother and even I can see what’s going on here.
960,a34zpFaoBoM,I notice that alot of news stations are sending correspondents to israel but none to Gaza. If they belive what Israel is saying about their campaign in the Gaza strip the should go there and report the news. We know why theyre not.
961,a34zpFaoBoM,"Damn this reminds me of that Lenin quote ""There are decades where nothing happens; and there are weeks where decades happen""."
962,a34zpFaoBoM,"I think there's a very fine line between a terrorist and a freedom fighter. As the adage goes, one man's terrorist is another's freedom fighter. Case in point, the late Nelson Mandela who opposed the oppressive apartheid regime of South Africa. Now the apartheid regime, as oppressors often do, frequently labelled Nelson Mandela as a terrorist, but to the rest of the World, he was a freedom fighter, who by the way said that South Africa can never be truly free until Palestine is free. So I think that as long as Hamas and the Palestinians continue to view Israel as an occupier and oppressor, they will continue to engage in what they believe is freedom fighting. 

What can Israel do to change this perception? Perhaps they can start to show more humanity and compassion to the Palestinian people. They can give them equal rights etc. Understand one thing, Palestine is extremely popular in the World and continuing to defy and deny it's existence is making Israel, and by extension, Jewish people, hugely unpopular in the rest of the World."
