,video_id,comment
318,aoNQUUQno00,Magandang araw sa opisialis ng SSS sana madagdagan ang aming pension ng mga senior kawawa naman lalo na ang maliit ang pension 2200 lang ang bawat buwan
319,aoNQUUQno00,Bumulong nanaman ang mga negosyante ng mga Mask sa DOH Officials 😂😂😂
320,FJEMcVK0MWI,Great you put this together Erwan!  Stay healthy bro.
321,FJEMcVK0MWI,Brilliant video man. Super clear and concise. Hoping all the best!
322,FJEMcVK0MWI,"The way Erwan does his narrative is what sets him apart from all the rest here in YouTube. As always, A++ for effort ❤️"
323,FJEMcVK0MWI,It's good to see an influencer utilizing their platform the right way. Thank you for trying to educate your audience🥰❤
324,FJEMcVK0MWI,This is how vlogger should use their platform. A voice to educate and disseminate awareness...
325,FJEMcVK0MWI,I’m so glad that a lot of influencers put a lot of effort and make videos like this one to inform individuals on how we can help one another and stop this crisis. ❤️❤️❤️
326,FJEMcVK0MWI,Erwan is smart. Erwan is one of the real influencer. Thank you Erwan for this video! Keep safe with your family 👪
327,FJEMcVK0MWI,"Erwan, if I knew how to nominate a video for an award this would be my choice.  The amount of work you put into this video shows how much you care about the people of the Philippines.  And rightfully so; they are wonderful people.  Best of luck to you, your family, your friends and the people of the Philippines."
328,FJEMcVK0MWI,"This video that you have created was very informative. As a subscriber, I have admired your time and effort of producing this video. This alone will be of great help to those who have already watched. To all the subscribers and would be subscriber, please like and share this video to spread awareness. Kudos to you brother Erwan, Mabuhay ka!"
329,FJEMcVK0MWI,"It's nice to find English Philippine news. Please do more. I just subscribed. I live in rural Philippines and not speaking Filipino, I rarely know what's going on and have to pry information out of my neighbors. We were in lockdown for a week before anyone told me."
330,-n9Ks3VTub4,"I got $320 from social amelioration program of the government then 6x food packs from local government then Plus Cash. In Makati local government give 5000 pesos for every individual above 18 years old, if they have 5 adults in the one family they will received total of 25,000 pesos plus the Food Pack plus National Government Social Amelioration Program. In area that is ECQ they continue to provide AID from the government.
Then more AID or support coming from the citizen"
331,-n9Ks3VTub4,하루빨리 없어지길 기도합니다
332,-n9Ks3VTub4,Give a homelesspeople a shelter
333,-n9Ks3VTub4,"I got $320 from social amelioration program of the government then 6x food packs from local government then Plus Cash. In Makati local government give 5000 pesos for every individual above 18 years old, if they have 5 adults in the one family they will received total of 25,000 pesos plus the Food Pack plus National Government Social Amelioration Program. In area that is ECQ they continue to provide AID from the government.
Then more AID or support coming from the citizen"
334,MmyIvf7bEGc,Godbless Philippines 🇵🇭🇵🇭🙏
335,MmyIvf7bEGc,How do you find out whats the name of the reporter? I need to know for school thesis
336,MmyIvf7bEGc,Lockdown na
337,MmyIvf7bEGc,Gadon is the best for the position most qualified He knows best about Covid
338,MmyIvf7bEGc,tumaas nmn yan pisting yan kasi tapos na election maganda sana araw araw election para walang covid
339,MmyIvf7bEGc,Ayuda na naman ha ha ha
340,MmyIvf7bEGc,"Let's thank all these people for their involvement in the Covid-19 Pandemic with a Golden Star!

Rochelle Walenksy- CDC Director 🌟
Anne Schuchat- CDC Deputy Director 🌟
Sherri Berger- CDC Chief of Staff 🌟
Albert Bourla- Pfizer CEO 🌟
Tal Zaks- Moderna Chief Scientist 🌟
Mikael Dolstein- Pfizer Chief Scientist 🌟"
341,MmyIvf7bEGc,Duque again is the better among the rest prang wla ng ibang choices ang pangulo sana naman po paano po tayo uunlad nyan
342,MmyIvf7bEGc,Tumaas mga baliw sa covid
343,MmyIvf7bEGc,Red cup facemask n red t shirt n red n me white at me ksmang blue at Blue pants at shoes n blue Crimebuster po red vacsin po
344,xV1oR-RbOGU,"The Philipphines has been locked down strictly for quite some time, right? That's respectable and impressive by a country that still is relatively poor. Must be tough. Respect to those pulling through."
345,xV1oR-RbOGU,How are covid19 patients counted if hospitals are unwilling to accept suspected patients with covid? As my mother and I experienced where we toured the entire Gen. Trias until we get to the Manila Hospital where she is also not admitted without even passing the swab test.
346,xV1oR-RbOGU,Be strong Philippines
347,xV1oR-RbOGU,I feel super safe in the philippines when it comes to the whole pandemic situation.. The philippine handled this pandemic better than th most other countries. We atleast follow what is required and mandated by the government.
348,xV1oR-RbOGU,I don’t buy the “no budget “ idea.  It’s the availability and the priority countries. We are not that poor
349,xV1oR-RbOGU,"The Philippine government should be wise enough not to depend too much on China for COVID vaccines as the country does not have a good reputation for its clinical trials.  Even Brazil stopped the clinical trials of the CoronaVac produced by SinoVac Biotech on its people due to various serious side effects.  It would be better for the country to be talking to American, Australian, or European Pharmaceutical companies (e.g. Pfizer, BioNtech, Moderna, Astra-Zeneca) that follow strict regimen for clinical trials with emphasis on safety and effectiveness of COVID vaccines."
350,xV1oR-RbOGU,"Philippine government strategy giving second dose vaccine isn’t a wise decision! In other  countries like in Europe and USA giving second dose of vaccine even your a front liners or vulnerable there is a certain period of time or a gap of 3-4 months as there priorities at least majority of people have a chance to have a first job to be protected, while waiting for the volume of vaccine arrival! Meanwhile countries in Europe grapple with more infectious variants, a shortages of vaccine globally while the risk of dying in a road of pandemic! The important thing is the outweighs the risk..."
351,xV1oR-RbOGU,"They just admitted that since they were being used as test subjects, they hope they get some for free."
352,xV1oR-RbOGU,"The leaders in the Phillippines should consider the efficacy of the following vaccines before they roll them out into the public:  Pfizer-BioNTech 95%, AstraZeneca 90%, Moderna 89%, Sinopharm 79%, and Sinovac 50.38%.  The promotion on the type of vaccines should be based on effectiveness and safety to the Filipino people, instead of political considerations or preferences.  Just my suggestion."
353,xV1oR-RbOGU,every poor family in the Philippines are given cash aid from the government. what are you talking man? your local officials will be doomed if they did not gave it to you guys. report them to our direct hotline to the President.
354,ZLT6L3PHz78,"*Claim of fact:* The Philippines reported 3,561 new COVID-19 cases on Thursday, August 6, inching the total tally closer to 120,000 and causing the country to overtake Indonesia as the Southeast Asian nation with the most number of infections.

*Claim of Policy:* Prevailing quarantine restrictions will be implemented 'strictly and effectively'.

*Claim of Value:* The death toll has also increased, with the government reporting 28 new fatalities on Thursday.

Or 

Pooled testing initiative using the reverse-transciption polymerase chain reaction or RT-PCR test for the coronavirus on August 5.

*Evidence:*
• The country’s total coronavirus cases are now at 119,460. On the same day, Indonesia reported 1,882 new cases, bringing its total to 118,753, according to the Jakarta Post.

[the others are in google]
• Metro Manila was again the source of most of the Philippines’ new cases, reporting 2,041 on Thursday.

•Over 42% or 50,473 of the country’s total cases are still active cases."
355,ZLT6L3PHz78,"""I was here"" - Not your grade 10 classmate"
356,ZLT6L3PHz78,Parang meron din akong mga kasama dito ah?!
357,ZLT6L3PHz78,module😭😭😭😭😭HAHAHAHAHAHAHAHAHAHAHHAHAHAHAHAHAHAHAHAHAHAH
358,ZLT6L3PHz78,anong answer patulong HAHAHAHAHAHA
359,ZLT6L3PHz78,Module😌
360,-qFcO_onBdA,"Here in Armenia no signs of improvement for now and the number of coronavirus cases is increasing fast. And in some neighboring countries situation is even worth. Looks scary. But it's still much better than in EU countries. Why everyone starts to move only now? It was much easier to prevent the pandemic in early 2020 when it was just appearing, but by that time WHO saw no major risks of its spreading all over the world and mainstream media were focused on showing news from China."
361,-qFcO_onBdA,I wish we have a lockdown in AZ
362,-qFcO_onBdA,So a possible imported case from Singapore.... what to make of it...
363,-qFcO_onBdA,Wrong report.
364,-qFcO_onBdA,She said 15 million
365,-qFcO_onBdA,"so if its about phil 
fact research is off
report it right away!"
366,-qFcO_onBdA,Oh no a kid
367,-qFcO_onBdA,Manila doesnt have 50million or even 15m thats way too much. 50million people is the number of population for the whole Luzon island. Before the community quarantine people dispersed to their home villages. Population of Manila right now might be 5m - 10m.
368,-qFcO_onBdA,cna love  bad/ negative news about philippines
369,-qFcO_onBdA,Newscasters took turns to wear red and yellow
370,rS15PX2GVbE,"Everyone should have their vaccines in order for us to have protection, also for the people that surrounds us. Vaccines can  decrease the risk of getting infected. This vaccines  passed through clinical trials . Everyone must cooperate on how the government, us, can combat the spread of the virus."
371,rS15PX2GVbE,"These 600,000 donated Sinovac is just the first batch. PH govt. purchased 25 million doses of Sinovac and another million will arrive this March from China. PH govt also purchased 17 mln Aztrazeneca but the delivery is delayed,  but about half a million doses initial batch will arrive this week through the Covax facility. PH will receive about 40 mln vaccines from the Covax facility."
372,rS15PX2GVbE,God bless us all
373,rS15PX2GVbE,"I know everyone is looking for the next Bitcoin but that’s like looking for the next Wheel or the next internal combustion engine.

You can sit there on your porch and wait while we’re all buzzing by in our motor cars but even if you live to be a hundred you might not see another one...."
374,rS15PX2GVbE,"In this year, i trusted Sinovac of china."
375,rS15PX2GVbE,Pandemic situation once again turning grim in many countries
376,rS15PX2GVbE,SPLENDIDLY !!!
377,rS15PX2GVbE,How to get the China vaccine
378,rS15PX2GVbE,Vaccination certificate from china is it allowed in the Philippines?
379,rS15PX2GVbE,"meanwhile in Indonesia Started vaccination in early januari 2021.
and target in one day 1 Million of dozes."
380,2T3yZ6lNRDg,"Hayat vax is made in the United Arab Emirates... This is exactly identical to China Sinopharm vaccine... Both using the old and traditional style in making vaccine( inactivated virus)... If you done your research, using this METHOD in making vaccine, this far is the SAFEST Vac. Compared to other involving generically engineered."
381,2T3yZ6lNRDg,I dont understand how the line up work of there sitting… if someone move do they switch chair??? Are the chair sanitize?
382,2T3yZ6lNRDg,God bless us all
383,2T3yZ6lNRDg,So it's just Sinopharm but using another label.
384,2T3yZ6lNRDg,vaccine donations = free test subjects
385,2T3yZ6lNRDg,Thank you UAE.
386,2T3yZ6lNRDg,"Exactly the same in Canada, in gymnasium."
387,2T3yZ6lNRDg,0:23
388,2T3yZ6lNRDg,The people wants Ivermectin !!!
389,2T3yZ6lNRDg,People just have Faith in THE MOST HIGH YAH!  no need for a vaccine
390,jQusLZgOYac,"Thank you so much for the congratulatory greeting. More power to all of you, and my warmest regards."
391,jQusLZgOYac,"good morning  from mandaluyong NCR +  bubble... 
 thanks to this"
392,jQusLZgOYac,Good day to all of you.
393,jQusLZgOYac,We need to invest in Health to create more Wealth---Health is Wealth
394,jQusLZgOYac,May we kindly have a copy of the PPTs so we could educate more people?
395,jQusLZgOYac,"Lockdown was supposed to improve health care by increasing capacity and treatment protocols. So why are all these guys, who are all officials or prominent drs of hospitals, blaming others for the failure of the licksown strategy? While treatment have improved how about showing us how many covid beds and quarantine facility, icu facility have been added since March 2020?"
396,2T3yZ6lNRDg,"Hayat vax is made in the United Arab Emirates... This is exactly identical to China Sinopharm vaccine... Both using the old and traditional style in making vaccine( inactivated virus)... If you done your research, using this METHOD in making vaccine, this far is the SAFEST Vac. Compared to other involving generically engineered."
397,2T3yZ6lNRDg,I dont understand how the line up work of there sitting… if someone move do they switch chair??? Are the chair sanitize?
398,2T3yZ6lNRDg,God bless us all
399,2T3yZ6lNRDg,So it's just Sinopharm but using another label.
400,2T3yZ6lNRDg,vaccine donations = free test subjects
401,2T3yZ6lNRDg,Thank you UAE.
402,2T3yZ6lNRDg,"Exactly the same in Canada, in gymnasium."
403,2T3yZ6lNRDg,0:23
404,2T3yZ6lNRDg,The people wants Ivermectin !!!
405,2T3yZ6lNRDg,People just have Faith in THE MOST HIGH YAH!  no need for a vaccine
406,rS15PX2GVbE,"Everyone should have their vaccines in order for us to have protection, also for the people that surrounds us. Vaccines can  decrease the risk of getting infected. This vaccines  passed through clinical trials . Everyone must cooperate on how the government, us, can combat the spread of the virus."
407,rS15PX2GVbE,"These 600,000 donated Sinovac is just the first batch. PH govt. purchased 25 million doses of Sinovac and another million will arrive this March from China. PH govt also purchased 17 mln Aztrazeneca but the delivery is delayed,  but about half a million doses initial batch will arrive this week through the Covax facility. PH will receive about 40 mln vaccines from the Covax facility."
408,rS15PX2GVbE,God bless us all
409,rS15PX2GVbE,"I know everyone is looking for the next Bitcoin but that’s like looking for the next Wheel or the next internal combustion engine.

You can sit there on your porch and wait while we’re all buzzing by in our motor cars but even if you live to be a hundred you might not see another one...."
410,rS15PX2GVbE,"In this year, i trusted Sinovac of china."
411,rS15PX2GVbE,Pandemic situation once again turning grim in many countries
412,rS15PX2GVbE,SPLENDIDLY !!!
413,rS15PX2GVbE,How to get the China vaccine
414,rS15PX2GVbE,Vaccination certificate from china is it allowed in the Philippines?
415,rS15PX2GVbE,"meanwhile in Indonesia Started vaccination in early januari 2021.
and target in one day 1 Million of dozes."
416,xV1oR-RbOGU,"The Philipphines has been locked down strictly for quite some time, right? That's respectable and impressive by a country that still is relatively poor. Must be tough. Respect to those pulling through."
417,xV1oR-RbOGU,How are covid19 patients counted if hospitals are unwilling to accept suspected patients with covid? As my mother and I experienced where we toured the entire Gen. Trias until we get to the Manila Hospital where she is also not admitted without even passing the swab test.
418,xV1oR-RbOGU,Be strong Philippines
419,xV1oR-RbOGU,I feel super safe in the philippines when it comes to the whole pandemic situation.. The philippine handled this pandemic better than th most other countries. We atleast follow what is required and mandated by the government.
420,xV1oR-RbOGU,I don’t buy the “no budget “ idea.  It’s the availability and the priority countries. We are not that poor
421,xV1oR-RbOGU,"The Philippine government should be wise enough not to depend too much on China for COVID vaccines as the country does not have a good reputation for its clinical trials.  Even Brazil stopped the clinical trials of the CoronaVac produced by SinoVac Biotech on its people due to various serious side effects.  It would be better for the country to be talking to American, Australian, or European Pharmaceutical companies (e.g. Pfizer, BioNtech, Moderna, Astra-Zeneca) that follow strict regimen for clinical trials with emphasis on safety and effectiveness of COVID vaccines."
422,xV1oR-RbOGU,"Philippine government strategy giving second dose vaccine isn’t a wise decision! In other  countries like in Europe and USA giving second dose of vaccine even your a front liners or vulnerable there is a certain period of time or a gap of 3-4 months as there priorities at least majority of people have a chance to have a first job to be protected, while waiting for the volume of vaccine arrival! Meanwhile countries in Europe grapple with more infectious variants, a shortages of vaccine globally while the risk of dying in a road of pandemic! The important thing is the outweighs the risk..."
423,xV1oR-RbOGU,"They just admitted that since they were being used as test subjects, they hope they get some for free."
424,xV1oR-RbOGU,"The leaders in the Phillippines should consider the efficacy of the following vaccines before they roll them out into the public:  Pfizer-BioNTech 95%, AstraZeneca 90%, Moderna 89%, Sinopharm 79%, and Sinovac 50.38%.  The promotion on the type of vaccines should be based on effectiveness and safety to the Filipino people, instead of political considerations or preferences.  Just my suggestion."
425,xV1oR-RbOGU,every poor family in the Philippines are given cash aid from the government. what are you talking man? your local officials will be doomed if they did not gave it to you guys. report them to our direct hotline to the President.
426,fp9uRsmTWqg,"The unemployment rate is much higher if you consider the very low income people who are always ignored. Anyone who has friends, family or associates in the Philippines knows the truth."
427,fp9uRsmTWqg,Unemployment rate has never been under 20% in Philippines. Many Filipinos are under employed in temp jobs this is why so many Filipinos flee Philippines to work as OFW's. The best and brightest leave Philippines due to it's hopeless corrupt government.
428,fp9uRsmTWqg,In September the unemployment rate is really high because of 20k plus new cases a day but now the new cases is only 2k or 1k I think the unemployment rate will low because of lower restrictions in October or November.
429,fp9uRsmTWqg,That rate is muchhhhhh higher. Its getting worse
430,fp9uRsmTWqg,We should reduce the population from 113 million to just around 40 or 50 million
431,fp9uRsmTWqg,"Filipino everywhere in the world
[before c19]"
432,fp9uRsmTWqg,"And the vaccination rate in the Philippines is still low, when can they reopen their country. i feel bad for the people"
433,fp9uRsmTWqg,no child policy for those below poverty and one child policy for those below median income.
434,fp9uRsmTWqg,that's why I'm not resigning on my current Job despite wages is low its difficult to Find one.
435,fp9uRsmTWqg,Conformity always leads to extreme poverty. Revolt creates liberty. See: The French Revolution.
436,lbK7UjoLr8o,They are heroes .... they deserve more than that
437,lbK7UjoLr8o,Typical they want more money
438,e0fN7HxkIUc,"Singaporeans needs to realize that we have a very huge population, Democratic system of gov't, Free Press, limited budget, dogmatic belief, prone to natural disasters, ongoing communist/Islamic insurgencies, Drug problem, no mandatory conscription/military training for the young and high level of poverty rate. So connect the dots 😔"
439,e0fN7HxkIUc,the result of obsolete public transportation. Past 6 administrations are to be blamed but current situation is blamed on Duterte's government.
440,e0fN7HxkIUc,"Social distancing isn’t implemented well, this won’t be good."
441,e0fN7HxkIUc,Thank you for sharing 😷
442,e0fN7HxkIUc,Hopefully those horrible noisy polluting jeepneys will be replaced with better transport vehicles soon.
443,e0fN7HxkIUc,"I got $320 from social amelioration program of government then 6x food packs from local government then Plus Cash. In Makati local government give 5000 pesos for every individual above 18 years old, if they 5 adults they will received total of 25,000 pesos plus the Food Pack plus National Government Social Amelioration Program."
444,e0fN7HxkIUc,Where there's press freedom there's always going to be criticism... Unlike in SG...
445,e0fN7HxkIUc,You looks like vlogger not a reporter
446,e0fN7HxkIUc,Always annoyed with this reporter GOD cna please replace this ate!
447,e0fN7HxkIUc,This filipina reporter duh! 🤦🏻‍♀️ SMH.
448,JWA5mUrrr_A,lagyan ng cctv yung sasakyan para malaman nyo kung umalog ba o hindi 😂
449,JWA5mUrrr_A,"Bawal daw alugin e  sa himpapawid palang umaalog nayan e, ilang bisis na ako sumakay ng eroplano umaalog kaya din sa himpapawid,"
450,JWA5mUrrr_A,Paanu malaman kon naalog ba or hindi impossible yan na hindi naalog nung hindi pa naabot dto sa pinas
451,JWA5mUrrr_A,Maaalog at maalog yan. Sa eroplano pa lang may turbulence na sa daanan pa nya.
452,JWA5mUrrr_A,I'm so excited for the next step😆
453,JWA5mUrrr_A,dapat! sundalo! hindi opisyal! ng gobyerno! ano ba silbi nyo jan!
454,JWA5mUrrr_A,Security ang kaylangan dyan bka merun sumabutahe o kaya gawin nlng non working day.if ever na dadating na un mga bakuna para walang  ganun sasakyan at tao..
455,JWA5mUrrr_A,Di maiiwasan na maalog yan
456,JWA5mUrrr_A,Wiw
457,JWA5mUrrr_A,Sana mas madaming doses ang dumating mga 1 m na sana para atleast half million na ang mabakunahan.
458,57wz3HuIVLA,I'm from india and staying in phillipines from past 4 years  and I really appreciate them in all aspects and president who is doing much more than others to protect people 🙏🙏🙌🙌
459,57wz3HuIVLA,Stay strong Philippines. We feel your pain from India. We will pray for you.
460,57wz3HuIVLA,Stay strong Manila.   Prayers from India
461,57wz3HuIVLA,"Considering the population of the Philippines, i think its safer here than most of other nation hit by covid. And people here help each other."
462,57wz3HuIVLA,"The person you interviewed was not giving an accurate story as it pertained to the vaccination rollout. The slow rollout is due to vaccine scarcity in the global supply (note that the country does not have any vaccine production, so all its vaccine supply is imported), and not on the lack of manpower or resource to open new vaccination centers, as indicated by your resource person. The huge droves of people that gathered to get vaccinated was observed only in some areas of the country where the local governments allowed people to show up without pre-registering, and that resulted in chaos."
463,57wz3HuIVLA,It could have been better had they also interviewed someone from the other side of the story. What the journalist said were all true but the picture he is painting is not reflective of the general situation in the Philippines as a whole.
464,57wz3HuIVLA,"we pray for philipines, love from your cousin indonesia"
465,57wz3HuIVLA,God Bless the Philippines and its people! Stay strong kabayan.👍
466,57wz3HuIVLA,"JC PhP4000 is about USD80. And I think the vaccine rollout is quite efficient comparing it to other countries. 12M people have already been vaccinated, it's like jabbing a small country."
467,57wz3HuIVLA,You interviewed the wrong person. You shouldn't ask a journalist regarding covid data.
468,lczwrm68u6I,Thanks for watching everyone. Tell us what you think in the comments below.
469,lczwrm68u6I,The best nurses I’ve ever seen were all Filipinas. Absolutely lovely people.
470,lczwrm68u6I,I wish my Filipino brothers and sisters good health and the best of luck. As an international student I socialised with plenty of Filipinos and they are GREAT people. Genuine love from Pakistan. ❤🇵🇰🇵🇭👋🏼
471,lczwrm68u6I,Stay stronger our beloved Filipino brothers and sisters. We Indonesia people always stand by you. God bless you all. ❤️❤️❤️
472,lczwrm68u6I,"Just exactly who gets adequately paid in the Philippines??? Dynastic politicians perhaps.  And there is NO safety net for workers in this situation, in fact very little workers rights in general at all."
473,lczwrm68u6I,"Stay strong Philippines.
Support from Tunisia"
474,lczwrm68u6I,Philippines is archipelagic country meaning it consist of 7000plus island as compare to India where  people move around easily by land. For people to come from one island to another you need to travel by boat or plane. While in India the infection is all over but in the Philippines it’s just main city.
475,lczwrm68u6I,WE LOVE PEOPLE IN PHILIPPINES STAY AND STRONG
476,lczwrm68u6I,My favorite country Philipines...iam sure you will win this battle soon..i pray for it🙏🙏 from Nepal 🇳🇵
477,lczwrm68u6I,Stay strong Philippines from the USA.  We pray for the end of this horrible pandemic.  Keep your prayers and stay strong
478,-b0EuuMvvy8,Based off what purified isolate?
479,-b0EuuMvvy8,Ibalik na yung Module at online class para hindi lalo kumalat
480,-b0EuuMvvy8,My God!!! Please stop the covid issue
481,-b0EuuMvvy8,Does anyone know the reporter thanks 😌
482,-b0EuuMvvy8,Please USEC.. Ibigay n po yung benifits ng mga private hospitals.. OCA SRA HEA.. TIL now wala pa rin
483,-b0EuuMvvy8,"You should report how many people actually go to the doctor when their sick, probably 1%"
484,-b0EuuMvvy8,updated talaga ang pinas hahaha
