,video_id,comment
661,D9-CHldoZ74,Such a shame and why
662,D9-CHldoZ74,Now I understand the government arm twisting by restricting travel for those without a booster vax. That's going to hurt tourism though.
663,D9-CHldoZ74,Mga heneral ba naman ang iappoint na walang kamuwang muwang sa health issues.
664,D9-CHldoZ74,wala na kasi magpapavaccine dahil alam nila na lalo lang silang magkakasakit! panagutin ang doh dahil sa lake nang pera na nasasayang
665,254GdlKEz5I,How is their TB rate???
666,254GdlKEz5I,"But why Taiwanese are singled out, Double standard???"
667,254GdlKEz5I,This is some 1930' 1940's Papers please BS.
668,T2JkwAZ8KY8,"Take note, there's a difference between people who died OF Covid and people who died WITH Covid. But in some countries, they're all and the same. Might be the case here too. *cough*PhilHealth controversy*cough*"
669,T2JkwAZ8KY8,"In the end, we have no idea as to how many boosters will be forced on us because we understand that even  a 4th booster is not fully protective against Omicron."
670,T2JkwAZ8KY8,That's possible...since the 1st leading cause is governmental ignorance.
671,T2JkwAZ8KY8,"febrile seizure, aseptic meningitis, Kawasaki syndrome, arthritis, post-infectious arthritis, myocarditis, myocardial infarction, ARDS, stroke, hemorrhagic stroke, ischemic stroke, venous thromboembolism, kidney failure, pulmonary embolism, liver failure, `erythema multiforme, autoimmune thyroiditis, disseminated intravascular coagulation, and appendicitis."
672,T2JkwAZ8KY8,may pera din kasi mga hospital dyan pag declare na positive kinamatay ng mga pasyente well....di nakakapag taka
673,T2JkwAZ8KY8,"Tito Sotto... PAO chief Atty Acosta... Gov.  Gwen Garcia...Are destined to be GOOD leaders for the Filipinos... HONEST,  EMPATHETIC, CONSCIENCE GUIDED... most importantly GOD FEARING."
674,T2JkwAZ8KY8,We should be panicking about the 1st and 2nd cause of death not the 3rd😂
675,T2JkwAZ8KY8,eh pano naaksidente lng pgdating sa hospital covid na tsk!
676,T2JkwAZ8KY8,kaya dumadami ang positive dahil sa bakuna na yan ginagawa ninyong experiment ang mga tao
677,T2JkwAZ8KY8,Lies after lies after lies
678,I3mkImSqHA0,"*Blame the people, not the holidays.* 

These numbers were not increasing if only people put their health first before the Christmas and New Year traditions which call for more mobility, among other things."
679,I3mkImSqHA0,Please watch Dr John Campbell's videos to learn about omicron. It is mild and will help to bring an end to this pandemic. Downside is that governments will likely overreact.
680,I3mkImSqHA0,"Kayo kayo nalang mag lokohan
Ung media tapos ung mga tupa kayo kayo nalang mag usap wag nyo na kaming idamay"
681,I3mkImSqHA0,Nung christmas season mababa Ang cvid. Natapos lng holidays tumaas na. Namemera ba Kayo?
682,I3mkImSqHA0,Mas marami pang namamatay sa stress kaysa sa covid na Yan....
683,I3mkImSqHA0,"new deaths 133. kung sa estimate na 2% ang percentage ng deaths, dapat nasa 6thousand plus yung postive 2 weeks ago. di na ata na tetest lahat."
684,I3mkImSqHA0,Ang saya saya
685,I3mkImSqHA0,Always easier to control people when you put fear in them.
686,I3mkImSqHA0,Napakalaking kalokohan na nman yan mga data nyo hndi na nanininwala sa inyo ang mga tao sa mga datos nyo
687,I3mkImSqHA0,these pandemics last about 3 years just look at the history
688,sJ0xpruFAwQ,Im from malaysia which I worked in makati manila for more than 1 year.  Last time I leave the phil last march. And i really care about those people even im just a foreigner their country. It really makes me heart broken to see the cases spike in daily basis. Take care my dear brother and sister in philippines hope all is well. You guys can win it too. Mahal kita. Semoga dipermudahkan semua untuk anda
689,sJ0xpruFAwQ,Let's pray everything will be better soon for both countries mentioned
690,sJ0xpruFAwQ,"Indonesian and Filipino, We have so much in common..😅😎"
691,sJ0xpruFAwQ,"The interpreter doesn't know the language of our president, PRRD are the most caring president that I knew, since Marcos years has passed"
692,sJ0xpruFAwQ,1:24 such beautiful eyes.. ya and what a provocative statement by the country's own president
693,sJ0xpruFAwQ,"all world governments are not prepared for the corona virus outbreak, the world are down on it's knees...bleeding and suffering.... it's facts and reality...hopefully this pandemic outbreak is a lesson for all humans on this planet 🤘"
694,sJ0xpruFAwQ,Congrats Philippines for getting the silver play button
695,sJ0xpruFAwQ,"Seems like, he is captured by the soul of Duterte. The way he is delivering his message to government. It's pretty awkward."
696,sJ0xpruFAwQ,I hope 🇵🇭 will stop coronavirus
697,sJ0xpruFAwQ,Restrictions were not loosened in March! Maybe you meant May! Philippine total lockdown was March to May.
698,N9OQbW0YOLU,"Healthcare workers were undervalued and taken for granted until this pandemic. Even then, there’re not much changes except promises and short-term benefits"
699,N9OQbW0YOLU,"My brother works as a nurse here as well, many of his colleagues decided to resign because of severe workload for months. And with another surge of cases, many of them are bound to work in worse conditions, my brother is now considering resigning too.

Philippine system is so messed up, it's basically designed to churn out professionals expecting them to work abroad and send back remittances. While those who remain will just have to settle with low wages, establishments are happy with it."
700,N9OQbW0YOLU,medical course is literally the most expensive course but they be paid that low?
701,N9OQbW0YOLU,"President Duterte hoping Filipino professional nurses would have the ""spirit and the fervour to serve the Filipino people"" is one of his most insensitive and ""out of touch with reality"" statements.  It appeals to the conscience of these honorable people without recognizing the years of appeal this work force sector has been clamoring to uplift their dignity.

Excellent feature story by Channel News Asia, relevant for the times."
702,N9OQbW0YOLU,The head of department of health in the Phillipines only concerns about how much money he can make.
703,N9OQbW0YOLU,"I actually didn't know that Philippine's covid case are also worsening until I saw this. May the medical team who lost in battle rest in peace, and I hope that countries who also still in fight for this pandemic could find the way out sooner"
704,N9OQbW0YOLU,"I'm one of those ""lucky ones"" who got out of the Philippines to find better opportunities in nursing. But how I wished I could have stayed if medical professionals were rendered better pays/benefits in our own country. My heart still belongs to my country, but I have to survive too."
705,N9OQbW0YOLU,If the gov is going to put a ban on leave then increase their pay 💰!!
706,N9OQbW0YOLU,Bless those who work in healthcare. They deserve so much love and appreciation right now.
707,N9OQbW0YOLU,What a SHAME!!!! they should give this people the right amount of compensation
708,T48EuGS36Zk,I expect God willing Philippines to progress and advance from this fright 🙏
709,T48EuGS36Zk,"O admin.
Thanks for this small-hapiness!

We love you.

###
."
710,T48EuGS36Zk,Shoutout To The Philippines💘 it's going to be alright.
711,T48EuGS36Zk,"Yes, thank you admin.
for your respect one another!

We love you.

."
712,T48EuGS36Zk,""" May the knowledge that you are loved sharpen interest in your work and bring you rich reward at the end of the year ."" 

By. # NelsonMandela 

From a birthday card to Nandi Mandela, 
written in Pollsmoor Prison, South Africa, 
23 June 1988.



---
O my  President..
Welcome to- a new life in a better than Before 🌍🌏🌎- 2022!

O Excellency..
Thanks for your role to make the world 🌏 we seek.

HAPPY NEW YEAR- 2022!

Good health always!.

I thank you.
###

🌏
..."
713,T48EuGS36Zk,Nothing seems to be going well in there? From one disaster to another since one can remember.
714,T48EuGS36Zk,"Thank you for sharing.
Special thanks to admin.

We love you.

🌏
..."
715,T48EuGS36Zk,"Kamusta ka phillipians. I reside in the states. On my computer came information today that stated that president Rodrigo had ordered on site shootings of those not content to take the vaccine excluding the health care workers, those exercising, y those purchase life's essentials. I do not know if this order is still currently in effect. That a secondary pig shot/vaccine could be administered usually is given to swine. My prayers are with you. I am a burned patient In a nursing home. One of your very own is my CNA. I have nothing but tip top quality when she at work near me. She is a sweet, dear soul, y also a Christian. I have a deep admiration y respect for the Tagalog speaking community. A fine people. God bless you thru your many afflictions. Salamat."
716,T48EuGS36Zk,"As long as our overseas family keep sending us money, we can just relax at home."
717,T48EuGS36Zk,Filipinos is immune to omicron as long they celebrated long holidays and gather with their families and friends.
718,pK6y1h0YgSU,Thank you for featuring me on this
719,pK6y1h0YgSU,It's really amazing how people who have the least are the ones who share the most.
720,pK6y1h0YgSU,These people have less but still willing to share....and on other side people want more and more....
721,pK6y1h0YgSU,I was in the US Navy. I remember the raining season of. The Philippines. Beautiful country!
722,pK6y1h0YgSU,Lucky for him he wasn't stranded in USA because the Americans are not so generous and friendly as the Filipinos
723,pK6y1h0YgSU,These are some nice wholesome news for this difficult time
724,pK6y1h0YgSU,"Such amazing people letting him stay with his own room and everything! I applaud them, definitely deserve better houses too (it was very clean but it can help to have clean water sources and electricity)"
725,pK6y1h0YgSU,I heard a lot of people are stranded outside their country
726,pK6y1h0YgSU,Salute to this guy. He deserves much gratitude
727,pK6y1h0YgSU,"I have mny Philip  friends. Philip  guys so helpful  mind,and so friendly,they are  strong  minded,strong  hearts,, long live Filipino."
728,ZaTPlJ8nd9Q,"No need to hype on irrelevant data - always focus on daily reports on new cases, number of asymptomatic, number of recoveries and deaths since its more significant data for us."
729,ZaTPlJ8nd9Q,congrats for reaching 2million what a great milestone we had
730,ZaTPlJ8nd9Q,How many people died? How many people recovered? Those are the important numbers. Just giving a tally of total cases so far is just fear mongering for clicks and views.
731,ZaTPlJ8nd9Q,"ADVICE: If you have covid and is having a hard time breathing. Do a ""Belly Breathing"" - the most efficient way to breathe (you can search it up online). This is exactly what I did when I was slowly losing air to breathe. I was having a hard time inhaling through my nose so I used my mouth. Your belly should come outward as you take in air. As you exhale, your stomach will come back in. If it's hard to breathe through your nose then use your mouth. If this makes your mouth dry then try to have a glass of water and maybe a little bucket beside you where you can rinse your mouth from time to time. If it's hard to breathe when you lay down then just sit. You need to practice until your body gets use to it. Put your hand in your stomach so you can monitor your breathing. ( I tried the one where you hold your breath for a couple of times and cough at the last try but it didn't work for me. It made it even more hard for me to breathe.)"
732,ZaTPlJ8nd9Q,"Pls Note: 1,840,294 ""Recovered"" of 2 Million Cases. Thanks. ... Stay clean & healthy 24/7 :)"
733,ZaTPlJ8nd9Q,Keep safe everyone. Sumunod sa mga patakaran na ipinatutupad.
734,ZaTPlJ8nd9Q,This is good news! That means many are acquiring natural immunity without dying.
735,ZaTPlJ8nd9Q,Woooh go on! Record Holder! Go Philippines!
736,ZaTPlJ8nd9Q,Given that covid-19 especially the delta variant is highly contagious as per CDC's. 2M is 2% of our population and thankfully I lot have recovered. I remember Germany's Merkel mentioned in her speech last year that they'd expect 70% of their population being infected as per expert's data. We are nowhere as rich as Germany but 2% is considered low basing on experts data.
737,ZaTPlJ8nd9Q,Dapat Kung magbalita kau hwag nyo na isama ung nakarecovered na ung active case s na lng ung severe at mild cases
738,81Fj00CFmJM,"The leaders in the Phillippines should consider the efficacy of the following vaccines before they roll them out into the public:  Pfizer-BioNTech 95%, AstraZeneca 90%, Moderna 89%, Sinopharm 79%, and Sinovac 50.38%.  The promotion on the type of vaccines should be based on effectiveness and safety to the Filipino people, instead of political considerations or preferences.  Just my suggestion."
739,81Fj00CFmJM,"💯💯💯💯💯
Ano pa ang silbi na turukan ka pa niyan kung mahahawaan ka pa rin  niyan pagakaturok..? Di po ba ang kahulugan ng na-""immunized"" ay hindi ka na tinatablan....?

Libre nga..pero pera ng bayan pa rin ang ipinambili. na BILYONES pa naman ang halaga..?

KATANUNGAN  NG LAHAT o ng BAWAT PINOY....
""Ano ang tiyak (o kahit maaari lang...) na  mangyari sa akin/amin/sa mga anak at sa mga magulang namin... kapag  nagpaturok kami ""NIYAN"" (kahit ano pang uri ng pinakasikat na brandyan..)?

Dapat sagutin ""nila"" YAN at sabihin na nila kaagad sa mga tao kung ano talaga ang mangyari sa kanila pagkaraan ng ilang araw, buwan o taon pagkaturok niyan ..para naman makapaghanda sila ng kanilang mga ataol  kung sakali lang na bigla sila na humimlay... o ng wheelchair o saklay kung sakali na sila ay habambuhay na malumpo .....at hindi basta lang ninyo pinapaasa.....

At tsaka, mayroon ka bang masisingil kapag sakali na sumablay sa iyo ang ekspermento na yan?"
740,81Fj00CFmJM,It’s their job to facilitate it faster what are they evaluating while other country is inoculating it are they crazy that they administer  it to their own people the answer no for sure
741,81Fj00CFmJM,Amen...
742,81Fj00CFmJM,Yan ang pag kakaiba sa Gobyerno natin. Sabi nga nya nag aantay ang gobyerno na itong mga drug companies mag apply sa kanila. Samantala yung ibang bansa ang gobyerno mismo ang nag apply noon pa man July para maka secure. Bakit kaya
743,81Fj00CFmJM,"Dpat government na nag initiate ng EUA wag na antayin ung pharmaceutical companies kaya pala mabagal eh, dpat nun October or November pa yan ginawa"
744,81Fj00CFmJM,sa davao nyo ipagamit chinavac
745,81Fj00CFmJM,"madalas tinatamaan nyan mga mayayaman, yung madaming pera na madamot sa kapwa. kaya kayo jan na may mga pera mamigay kayo."
746,81Fj00CFmJM,Sus matagal na paikot ikot sa usapan yang pag apruba nyan
747,81Fj00CFmJM,this is the trusted vaccine guys here in Germany i already used this vaccine i maybe feel some side effect but my side effect gone in 2 weeks still observe kong anong mangyari sa akin nag vollunter ako dito sa germany isa sa mga human trial for vaccine hoping this will the answer for this pandemic Stay safe everyone!!
748,NY6eXjIQr-Y,What the
749,UUYQ9F9hGZo,"These beautiful couple has done a lot for free in promoting Palawan as a tourist haven, let's reward them with our subscription guys and not skipping ads."
750,UUYQ9F9hGZo,"No need to go, you can stay as long as you want. You're already one of us 😍 We love Cris and Carol and your beautiful videos"
751,UUYQ9F9hGZo,"If ya comfortable with where you are now,and not struggling financially, stay, lot safer 👍❤️🇦🇺🇵🇭"
752,UUYQ9F9hGZo,"Why can't tourists be more like these guys: happy, positive, respectful and lowkey."
753,UUYQ9F9hGZo,"There is an old saying: ""Don't look a gift horse in the mouth"".  Stay put. You guys are in a good spot."
754,UUYQ9F9hGZo,"Really enjoy seeing your video's i'm a retired ex-pat living here.  Love your laid back demeanor,  also love to see the places you have gone. wife and i have never been there but we need make a trip over there when travel becomes more routine.  Enjoy the Philippines,  stay happy and upbeat,  we're all in this together."
755,UUYQ9F9hGZo,"You're in an isolated island, you can stay for a while and when things get better, you can go. You just need to find a repair shops for your laptop, cellphone and do more videos. It'll help you financially."
756,UUYQ9F9hGZo,"Stay in El Nido...it’s  safe from covid, friendly people, beautiful scenery, and not that expensive...😊"
757,UUYQ9F9hGZo,"be patient and just enjoy where you are... hoping that everything will come back to normal situation , and let us keep praying that this pandemic will end now . keep safe always, and God bless."
758,UUYQ9F9hGZo,"Ask the Family “Eight Miles from Home” they might know the situation, they are from England and move to Portugal, they got stock  in SIARGAO ."
759,Yb4Ja62zJrY,Paabutin nyo na hangga 100m .
760,rFDK10oplxA,"Revelation 22:12-13(KJV) And, behold, I come quickly; and my reward is with me, to give every man according as his work shall be.
I am Alpha and Omega, the beginning and the end, the first and the last."
761,rFDK10oplxA,"Good Job! Duque & Vergerie! Sana magresign na kayo, pero makapal yata pagmumukha nyo!"
762,rFDK10oplxA,Road to 1 million n tayo guys🤣
763,rFDK10oplxA,"Sorry but if the people in philippines don't work as one,then how can it recover from such!!!!??
If everyone just thinking of itself then all the more more people will die of this pandemic!!!!!"
764,rFDK10oplxA,Oh man😡😡😡😡😡😡
765,rFDK10oplxA,"sana po mtapos na ang problems ng bansa natin,,, cing grats sa 24,,oras"
766,rFDK10oplxA,Bakit kaya ganon parin kadami ang new cases?ano ba talaga ang ginagawa ng karamihan?wala paring social distancing?
767,rFDK10oplxA,"1 million cases here we go 😂😂😂.
Neighbors like Indonesia today recorded just 5K. While Malaysia recorded 1,8K."
768,rFDK10oplxA,*I love the view but “the” is silent.*
769,rFDK10oplxA,Bukas ang active cases nasa 187k or 190k
770,-LFGaCkPzzY,nostradamus
771,-LFGaCkPzzY,Punta ka sa palengke coviď free na😂😂😂
772,-LFGaCkPzzY,"Gawin nyo nang millions of cases, boring na tong kalokohan nyo e."
773,D9-CHldoZ74,CDC changed the definition of VETSIN just prior to the mass vetsination.
774,D9-CHldoZ74,Ayaw nga magpavaccine eh...nasa kanila na yan...malaki kita ng previous admin!
775,D9-CHldoZ74,Great news.
776,D9-CHldoZ74,"parang tinapon sa basur ang 10.2 Billion, imagine how many people and  roads can help in this amount or pambayad utang"
777,D9-CHldoZ74,Good
778,D9-CHldoZ74,"Baliwala lang sa kanila yung ganyan kalaking pera, samantalang yung karamihan sa mamamayan kakarampot lang ang nahahawakang sahod"
779,D9-CHldoZ74,Such a shame and why
780,D9-CHldoZ74,Now I understand the government arm twisting by restricting travel for those without a booster vax. That's going to hurt tourism though.
781,D9-CHldoZ74,Mga heneral ba naman ang iappoint na walang kamuwang muwang sa health issues.
782,D9-CHldoZ74,wala na kasi magpapavaccine dahil alam nila na lalo lang silang magkakasakit! panagutin ang doh dahil sa lake nang pera na nasasayang
783,xqz1KueuzAM,Kalokohan na yan
784,xqz1KueuzAM,we are stay home po
785,xqz1KueuzAM,Mababa na pla yan
786,xqz1KueuzAM,Naks
787,xqz1KueuzAM,uh oh
788,xqz1KueuzAM,gutom nmn ang mga tao kya yun iba di maiiwasan magawa ng di mabuti para lang malagyan ang kumakalang na sikmura
789,xqz1KueuzAM,Paano hnd tataas eto MCU hospital dto s caloocan lahat ng nmamatay idedeclare nla suspected covid kht negative ang swab test. Sana maimbstighan
790,xqz1KueuzAM,NATURAL TALAGA MAY NAMAMATAY ARAW ARAW
791,xqz1KueuzAM,Ako maniniwala sa ng ganyan
792,xqz1KueuzAM,"Pilipinas Lang ang nakafacemask at faceshield at napakahigpit pero Yong numbers unbelievable.
SA ibang Bansa facemask Lang Sapat na .At ang weather natin mamatay talaga ang germs."
793,C-iuGrZR2pQ,Kayo nalang magpaturuk
794,C-iuGrZR2pQ,I'm terrified for my friends and family that took the triple you know what.
795,C-iuGrZR2pQ,Hay naku.mababaliw na ang manga tao sa dami ng vaccine2x na yan.ang emportante.kumain ng maraming gulay at plprutas. at tamang tulog.para dika mag kasakit ng basta2x.
796,C-iuGrZR2pQ,Ginawang negosyo mga vaccines
797,C-iuGrZR2pQ,"Nakakatakot ang ginawa ng mga tao,parang wala ng maniniwala sa panginoon.."
798,C-iuGrZR2pQ,"Common sickness nuon obu sipon trangkaso, ginawang plandemic covid ngayon with protokills GOD SAVE US FROM THIS PLANDEMIC"
799,C-iuGrZR2pQ,Usec may bagong health project nanaman.... Mga taong bayan tutukan yang budget na yan! Alam na!
800,C-iuGrZR2pQ,Dapat yong mga health care muna ang magpa vaccine.. Para matiyak po natin ang vaccine ay safe.. Kahit 10 times po kayong magpa vaccine kayo.. Wag yong mga senior.. Kayong mga health care muna
801,C-iuGrZR2pQ,"Buot buot epamugos anang vaccine wa man gani  ka pavaccine  plandemic covid disease,, huwag pilitin ang ayaw , its a choice madam"
802,C-iuGrZR2pQ,Ako nga naka 6 na dito sa uk late diyan sa pinas
803,T2JkwAZ8KY8,"Take note, there's a difference between people who died OF Covid and people who died WITH Covid. But in some countries, they're all and the same. Might be the case here too. *cough*PhilHealth controversy*cough*"
804,T2JkwAZ8KY8,"In the end, we have no idea as to how many boosters will be forced on us because we understand that even  a 4th booster is not fully protective against Omicron."
805,T2JkwAZ8KY8,That's possible...since the 1st leading cause is governmental ignorance.
806,T2JkwAZ8KY8,"febrile seizure, aseptic meningitis, Kawasaki syndrome, arthritis, post-infectious arthritis, myocarditis, myocardial infarction, ARDS, stroke, hemorrhagic stroke, ischemic stroke, venous thromboembolism, kidney failure, pulmonary embolism, liver failure, `erythema multiforme, autoimmune thyroiditis, disseminated intravascular coagulation, and appendicitis."
807,T2JkwAZ8KY8,may pera din kasi mga hospital dyan pag declare na positive kinamatay ng mga pasyente well....di nakakapag taka
808,T2JkwAZ8KY8,"Tito Sotto... PAO chief Atty Acosta... Gov.  Gwen Garcia...Are destined to be GOOD leaders for the Filipinos... HONEST,  EMPATHETIC, CONSCIENCE GUIDED... most importantly GOD FEARING."
809,T2JkwAZ8KY8,We should be panicking about the 1st and 2nd cause of death not the 3rd😂
810,T2JkwAZ8KY8,eh pano naaksidente lng pgdating sa hospital covid na tsk!
811,T2JkwAZ8KY8,kaya dumadami ang positive dahil sa bakuna na yan ginagawa ninyong experiment ang mga tao
812,T2JkwAZ8KY8,Lies after lies after lies
813,TQ0QJ4Si7A4,Don't let Chinese  travel to Philippines or impose total restriction for Chinese..
814,TQ0QJ4Si7A4,"Gling  n tyo  sa lockdown
Sana wag  n ma ulit muli 
Naranasan  na ntin  ang hirap 
Kya  Sana  maging  MA ingat  n tyo  pati  mga  pag papapasok  ng mga 
My  symptom..."
815,TQ0QJ4Si7A4,Wag nyo Kasi papasukin Yung lahat ng may travel history galing china
816,TQ0QJ4Si7A4,buhay pa yang dengvaxia queen na yan?  she is still not in jail?
817,81Fj00CFmJM,"The leaders in the Phillippines should consider the efficacy of the following vaccines before they roll them out into the public:  Pfizer-BioNTech 95%, AstraZeneca 90%, Moderna 89%, Sinopharm 79%, and Sinovac 50.38%.  The promotion on the type of vaccines should be based on effectiveness and safety to the Filipino people, instead of political considerations or preferences.  Just my suggestion."
818,81Fj00CFmJM,"💯💯💯💯💯
Ano pa ang silbi na turukan ka pa niyan kung mahahawaan ka pa rin  niyan pagakaturok..? Di po ba ang kahulugan ng na-""immunized"" ay hindi ka na tinatablan....?

Libre nga..pero pera ng bayan pa rin ang ipinambili. na BILYONES pa naman ang halaga..?

KATANUNGAN  NG LAHAT o ng BAWAT PINOY....
""Ano ang tiyak (o kahit maaari lang...) na  mangyari sa akin/amin/sa mga anak at sa mga magulang namin... kapag  nagpaturok kami ""NIYAN"" (kahit ano pang uri ng pinakasikat na brandyan..)?

Dapat sagutin ""nila"" YAN at sabihin na nila kaagad sa mga tao kung ano talaga ang mangyari sa kanila pagkaraan ng ilang araw, buwan o taon pagkaturok niyan ..para naman makapaghanda sila ng kanilang mga ataol  kung sakali lang na bigla sila na humimlay... o ng wheelchair o saklay kung sakali na sila ay habambuhay na malumpo .....at hindi basta lang ninyo pinapaasa.....

At tsaka, mayroon ka bang masisingil kapag sakali na sumablay sa iyo ang ekspermento na yan?"
819,81Fj00CFmJM,It’s their job to facilitate it faster what are they evaluating while other country is inoculating it are they crazy that they administer  it to their own people the answer no for sure
820,81Fj00CFmJM,Amen...
821,81Fj00CFmJM,Yan ang pag kakaiba sa Gobyerno natin. Sabi nga nya nag aantay ang gobyerno na itong mga drug companies mag apply sa kanila. Samantala yung ibang bansa ang gobyerno mismo ang nag apply noon pa man July para maka secure. Bakit kaya
822,81Fj00CFmJM,"Dpat government na nag initiate ng EUA wag na antayin ung pharmaceutical companies kaya pala mabagal eh, dpat nun October or November pa yan ginawa"
823,81Fj00CFmJM,sa davao nyo ipagamit chinavac
824,81Fj00CFmJM,"madalas tinatamaan nyan mga mayayaman, yung madaming pera na madamot sa kapwa. kaya kayo jan na may mga pera mamigay kayo."
825,81Fj00CFmJM,Sus matagal na paikot ikot sa usapan yang pag apruba nyan
826,81Fj00CFmJM,this is the trusted vaccine guys here in Germany i already used this vaccine i maybe feel some side effect but my side effect gone in 2 weeks still observe kong anong mangyari sa akin nag vollunter ako dito sa germany isa sa mga human trial for vaccine hoping this will the answer for this pandemic Stay safe everyone!!
827,JWA5mUrrr_A,lagyan ng cctv yung sasakyan para malaman nyo kung umalog ba o hindi 😂
828,JWA5mUrrr_A,"Bawal daw alugin e  sa himpapawid palang umaalog nayan e, ilang bisis na ako sumakay ng eroplano umaalog kaya din sa himpapawid,"
829,JWA5mUrrr_A,Paanu malaman kon naalog ba or hindi impossible yan na hindi naalog nung hindi pa naabot dto sa pinas
