,video_id,comment
1024,sJ0xpruFAwQ,"Seems like, he is captured by the soul of Duterte. The way he is delivering his message to government. It's pretty awkward."
1025,sJ0xpruFAwQ,I hope 🇵🇭 will stop coronavirus
1026,sJ0xpruFAwQ,Restrictions were not loosened in March! Maybe you meant May! Philippine total lockdown was March to May.
1027,29LXKUT0eMY,To flaten the curve just means to decline the number of new cases up to zero. When new cases become stable to 0 then the curve is flat.
1028,29LXKUT0eMY,wew di naman updated yung site na ncovdotph
1029,29LXKUT0eMY,Philippines is not thinking about student that's r not capable to enroll or pay feed of University shame on the them their loosing hope to their future
1030,OB0qJwk5yA8,"For the past 5 days we recorded the highest confirmed cases daily, and we will start GCQ today. Goodluck po sa lahat!"
1031,OB0qJwk5yA8,what a decesion to resume the classes on august 24? Ang galing talaga ni doque at secretary ng deped hayp na yan.
1032,OB0qJwk5yA8,dto sa taiwan zero napo. back to normal npo dto.
1033,OB0qJwk5yA8,"Ganda ng laro nila kahit namatay sa high blood ,  positive agad sa covid"
1034,OB0qJwk5yA8,"Umabot na sa puntong hindi na natin pwedeng panghawakan ang datos na inilalabas at ang desisyon ng mga namumuno. 

Good luck.."
1035,OB0qJwk5yA8,"God , please heal the Philippines, in Jesus' NAME ! AMEN"
1036,OB0qJwk5yA8,"HAHAH kung ako presidente ng pinas ilolockdown (HARD LOCKDOWN) ko na buong luzon(kahit walang virus sa lugar basta buong luzon). PAG sinuway mo 1st offense huhulihin ka kaagad kulong 1week.
2nd offense:... 

Ikaw na bahala kung saan mo gusto mamatay. Sa virus or sa kulungan🙄.

Then syempre 1month lockdown yon tapos ako na bahala sa needs ng mga tao. Kase may pondo. Wala akong paki kung bumagsak ekonomiya ng pilipinas kasi ubos pondo dahil sa pagbibigay ng ayuda.

Deds ang magiging cprrupt sa pera.




Basta para sakin:
Wala akong paki sa pagbagsak ng ekonomiya sa pilipinas. Basta buhay mga kababayan ko. 😉"
1037,OB0qJwk5yA8,"Maniwala kayong backlogs yan. Malamang yan yung result ng mga nagpopositive sa testings ng mandaluyong, kino-cover up lang para di mahinto GCQ."
1038,OB0qJwk5yA8,Dalangin ko na sana maging milyon yung may Covid sa ating bansa nang matauhan tayong mga Pilipino . Lalo na yung mga nagmamarunong na di man lang mag face mask pag lumalabas.
1039,OB0qJwk5yA8,"sana lang di pinauwi ng DOH ang mga nagpa test. habang hinihintay nila ang result f + or - cla.

f pinauwi. tapos pagala gala. cgurado tatamaan ng napakalaking lintik ang pinas."
1040,ENk_QRA2XsY,Permission to use this for our Documentary Thesis Thank you so much <3
1041,ENk_QRA2XsY,Arigato and have to watch this for my module from highschool
1042,ENk_QRA2XsY,NANDITO KABA DAHIL NANGGALING KA SA ILOILO NHS?LIKE MOTO DAHIL SCHOOLMATES TAYO
1043,ENk_QRA2XsY,"Who should get tested for COVID-19?
Get tested:

If you have symptoms of COVID-19.
If you have been within six feet of someone for 15 minutes or more who has tested positive for Covid-19. (Note: some testing sites don’t offer testing if you’ve been exposed but don’t have symptoms.)"
1044,ENk_QRA2XsY,Permission to use this for a english project thank you >_< (from iloilo nhs)
1045,ENk_QRA2XsY,"Cases rising: lockdown
Cases going down: lift lockdown (Party, No distancing, Can travel, etc)

Cases rising again: lockdown
Cases going down(Now happening): nearly lift lockdown"
1046,ENk_QRA2XsY,2022:its ok i think when is my first new year is no corona 🤔
1047,ENk_QRA2XsY,"0:20 ""Manila is the most densely populated region of the Philippines""... *shows footage on the main street in the small Dumaguete City (Visayas)* (@9.3078663,123.3076264)"
1048,ENk_QRA2XsY,I was supposed to be in Manila this April....but my flight got canceled.....now I need to wait another year to go back
1049,ENk_QRA2XsY,permission to use this for a project :)) thank you
1050,LWIgEf_TMVU,stay safe ❤from việt nam
1051,LWIgEf_TMVU,"The boy was saying about protecting yourselves
But he's not even wearing mask and the lady was angry about the lock down she's not even protecting herself so the lock down will be over I know it's a low infection rate but still"
1052,LWIgEf_TMVU,Everyone is trying to survive through this even the government. We are responsible too. Cooperate. Dont crowd. Wear your masks and handwash with soap!
1053,LWIgEf_TMVU,I'm scared😷
1054,LWIgEf_TMVU,If the urban areas are heavily affected. What about the rural areas?
1055,LWIgEf_TMVU,And now a storm is coming in the Philippines
1056,LWIgEf_TMVU,Wow
1057,LWIgEf_TMVU,"Someone wish me luck 
I live in red zone!!"
1058,LWIgEf_TMVU,I pray for all the pinas and pinos.....
1059,LWIgEf_TMVU,Better safe than sorry
1060,Bo24jIb7GA8,It seems people were suspicious of the daily tally of new cases.  An irrovacable resignation of Duque will bring back the trust to the health dept and system
1061,Bo24jIb7GA8,Please be complete in your reporting.  Include if these patients are vaccinated or not.
1062,Bo24jIb7GA8,Paano hindi mag highest mga hospital kahit hindi covid positive patients ginagawang covid positive para wala daw babayaran sa hospital. Pls Phil. Gov't intervene.
1063,Bo24jIb7GA8,"Maging realistic na tayo. Hindi na kaya ma contain ang covid dito sa pilipinas. Ibahin nyo na ang taktika DOH at IATF. Imbis na puro community quarantine ang puro ginagawa nyo tapos mamimigay ng milyong milyong ayuda. Yung mga  ayuda na binibigay bakit hindi nyo idagdag na lang gamitin ang pera sa pagpapalakas ng health care system dito sa pinas, magtayo ng facilties na kaya ang hundreds to thousands na covid patient. Ibigay sa mga health care workers ang pangangailangan nila. Dagdagan ang pagbili ng bakuna. Hindi yung pinapataba nyo lang ang bulsa nyo samantalang milyon na tao ang nagdudusa."
1064,Bo24jIb7GA8,in contrary pala dapat pag tumataas ang   covid cases luwagan ang quarantine!
1065,Bo24jIb7GA8,"Nothing new! DOH, OCTA and mainstream media are so much excited and seemed happy and amazed to tell the nation that covid cases are getting higher! Is this news really helping the economy! Is this giving helpful information to the people or more fear, anxiety, confusion , hardship, and hopelessness ??!"
1066,Bo24jIb7GA8,"Huwag kayo masyado padala ng emosyon dahil sa datus, bumilis ang testing capacity natin kaya ganyan.  Malay natin last year pa yan ang 20k per day, hindi nga lang natest.  What i mean, the data does not tell everything.  Kailagan lang natin mag-ingat, follow the protocols, be healthy, galaw2x din minsan.  Expose sa sunlight.  You see, ang mga media outlet na kagaya nito nananakot lang ito upang makuha ang atensyon natin at views para kikita sila ng malaki.  So just relax, be optimistic. huwag padala sa stress."
1067,Bo24jIb7GA8,All expected!
1068,Bo24jIb7GA8,"always reporting the numbers ,maybe should report places in each province where one can receive vaccines and testing -then the numbers might go down"
1069,Bo24jIb7GA8,WHAT ABOUT HOME SERVICE. CLEANING ?
1070,UUYQ9F9hGZo,"These beautiful couple has done a lot for free in promoting Palawan as a tourist haven, let's reward them with our subscription guys and not skipping ads."
1071,UUYQ9F9hGZo,"No need to go, you can stay as long as you want. You're already one of us 😍 We love Cris and Carol and your beautiful videos"
1072,UUYQ9F9hGZo,"If ya comfortable with where you are now,and not struggling financially, stay, lot safer 👍❤️🇦🇺🇵🇭"
1073,UUYQ9F9hGZo,"Why can't tourists be more like these guys: happy, positive, respectful and lowkey."
1074,UUYQ9F9hGZo,"There is an old saying: ""Don't look a gift horse in the mouth"".  Stay put. You guys are in a good spot."
1075,UUYQ9F9hGZo,"Really enjoy seeing your video's i'm a retired ex-pat living here.  Love your laid back demeanor,  also love to see the places you have gone. wife and i have never been there but we need make a trip over there when travel becomes more routine.  Enjoy the Philippines,  stay happy and upbeat,  we're all in this together."
1076,UUYQ9F9hGZo,"You're in an isolated island, you can stay for a while and when things get better, you can go. You just need to find a repair shops for your laptop, cellphone and do more videos. It'll help you financially."
1077,UUYQ9F9hGZo,"Stay in El Nido...it’s  safe from covid, friendly people, beautiful scenery, and not that expensive...😊"
1078,UUYQ9F9hGZo,"be patient and just enjoy where you are... hoping that everything will come back to normal situation , and let us keep praying that this pandemic will end now . keep safe always, and God bless."
1079,UUYQ9F9hGZo,"Ask the Family “Eight Miles from Home” they might know the situation, they are from England and move to Portugal, they got stock  in SIARGAO ."
1080,Y-xQtgvNuvA,I'm Filipino and I hope we flatten the curve of covid 19 soon. Let's keep safe Indonesian cousins.
1081,Y-xQtgvNuvA,"I love both countries; they've been my home intermittently. Let's continue to pray and be hopeful that things will eventually go well if not soon then later.This virus isn't here to stay. This, too, shall pass. Fighting."
1082,Y-xQtgvNuvA,"In Indonesia, no body talks about covid anymore. No one even remember how much the number now."
1083,Y-xQtgvNuvA,"I’m scared, I’m living in Indonesia

Edit: Thank you all for wishing us to be safe! Stay safe and healthy from the 🇮🇩"
1084,Y-xQtgvNuvA,But they all deny it. They just don't care.
1085,Y-xQtgvNuvA,"Huh? We already forgot having such high cases, we pretend to live like there's no covid-19. It's completely normal"
1086,Y-xQtgvNuvA,This is so sad😔 lets pray for the both countries.🙏🙏🙏
1087,Y-xQtgvNuvA,"Considering how there was no proper testing in Indonesia, it should always have been the first, not the Phils. Just look at the death rates."
1088,Y-xQtgvNuvA,Stay safe Indonesians💖
1089,Y-xQtgvNuvA,Philippines and indonesia are brothers. Let's help each others
1090,Yb4Ja62zJrY,Paabutin nyo na hangga 100m .
1091,19hkLN7KEqc,Do doctors recommend vitamin D3 for everyone?  What results have doctors had with HCQ + zinc or ivermectin + zinc ?
1092,19hkLN7KEqc,Nako national lockdown na naman iyo.  Ayuda galore na naman si Barangay Kapitan.  Sobrang yaman na ng LGU ang mga tao naman sobrang hirap na.
1093,19hkLN7KEqc,HINDI NA YAN UUBRA NA KUWENTI NIO DOH... BAKA SA GALIT NG TAO SA INYO SUMABOG NA LANG KAYO DYAN.
1094,19hkLN7KEqc,Iyon pala senior citizen ang namatay sa covid..bakit ang GSIS requires senior citizen to make an appearance sa GSIS office for the new ecard...di ba bawal senior lumabas? Hindi ata nakiki pag coordinate ang GSIS sa IATF at DOH.
1095,19hkLN7KEqc,"84 years old dies. Extraordinary. Wait, did she say 84 years old?"
1096,19hkLN7KEqc,Something fishy talaga.. Napaka layo ng Buntoc Province... At bakit binuksan agad ang tourism industry or  siguro may ore existing health problome na yang namatay. 😏
1097,19hkLN7KEqc,"Hindi na nakakagulat to, syempre namamanhid na mga tao sa covid so kelangan takutin ng bago. Marami na nagigising na Pinoy. Galing galingan nyo naman ang pag ""Gas Lighting"" o drama nyo.
Kayo na humusga, check this video na na baban sa youtube: https://www.bitchute.com/video/E5HTy1ascajJ/"
1098,19hkLN7KEqc,Yes
1099,19hkLN7KEqc,[X] Doubt
1100,19hkLN7KEqc,Evil leaders of the nation!
1101,W7Y_YKON-uU,Naku ang 31 M nasayang ang mga vaccine sad.😢😢😢🇭🇰
1102,W7Y_YKON-uU,😷😷😷
1103,W7Y_YKON-uU,Palpak as usual.
1104,LnLA__UFi6c,Dios ko kailan paba to matapos gusto konang makatrabaho🙏🙏🙏
1105,LnLA__UFi6c,Hi
1106,LnLA__UFi6c,Sana mawala na ang COVID
1107,LnLA__UFi6c,Ang galing ng pinas laging nangunguna!
1108,LnLA__UFi6c,Isagad nyo pa hnggang top 1. Congrats Pinas.👏👏👏
1109,LnLA__UFi6c,Ini expect natin na sa Holidays lolobo mga kaso ng Covid19 pero ngayong summer pala
1110,LnLA__UFi6c,ecq na nga pero dami parin. ang naulat na nagka covid. anu ba yan. malamang extend nanaman nyan ang ecq.
1111,LnLA__UFi6c,"Sabi bawal i swab ang baby covid is pinagkakaitaan na talaga dapat pupunta kami ng province with my little couisin tapos nung nag swab kami negative tapos yung 5 months kong cousin positive sabi bayaran nlng ulitin baka mistake lng, sabi bawal i swab ang baby so pati ito negosyo pera pera lng.... nako..."
1112,LnLA__UFi6c,Kawala ng moral..
1113,LnLA__UFi6c,gawin nyo agad ng i million ang active cases para ezkyo for another one yah
1114,u9Jtlhv1IX8,I am really really excited about large Church Gatherings around the world again. We need more of these massive religious gatherings. I think all religious people should faithfully be gathering in mass. Please.
1115,u9Jtlhv1IX8,"Faith doesn't mean you have to go to church and show youself present . Even without the church , your faith is there wherever you are . Because God is present within you,  and your body is the TEMPLE OF GOD."
1116,u9Jtlhv1IX8,"""Asia's only predominantly Christian country""
Cries in East Timor"
1117,u9Jtlhv1IX8,"In our cong(not catholic), a letter was read to all...necessary precautions, no touching, if you feel sick talk to your doctor or health admin. If you are sick in any way, please refrain from coming, dial in and connect to cong. Obey local authorities direction. Scriptural reference was 'the shrewd one  precedes to conceal himself from Calamity'. Read to all our congs...120000 of them."
1118,u9Jtlhv1IX8,AMEN...AMEN 2 THAT!!!! I soooooo AGREE with THIS.
1119,u9Jtlhv1IX8,"25 But because of the sin and because of the churches, know that the world will go from suffering to suffering. And it shall come to pass that a man will not be able to shake hands with his brother or his best friend for fear of being contaminated with the disease. People shall walk without touching one another. Schools will be closed and you will hear people say: ""I'm afraid of taking the underground or the bus, I am afraid of being contaminated.” You see? The righteous one will say to the wicked one: ""Go and show off your nudity on the beach!"" and the wicked one will tell him: ""I won’t!"". You see?"
1120,u9Jtlhv1IX8,"5 With the map, I can go wrong but with the guide, it is impossible that I go wrong. And I do not even want a guide who knows how to read maps but a guide who knows Geneva! [Ed: The congregation says:  ""Amen!""]."
1121,u9Jtlhv1IX8,Wasting time  untruth.
1122,u9Jtlhv1IX8,"11 You who are alive today, know that the Message of a living prophet is the pure and sacred water from heaven for the purification of the living of his time before this water becomes old water. I was born and grew up in Africa and I have not seen a witch doctor or a shaman use old water for the ritual baths of his patients. And the old water is the holy books, booklets and Messages of dead prophets."
1123,u9Jtlhv1IX8,"I really don't like this term: Churchgoers.


Bravo to my Christian brother: ""Faith without work is Dead"" James 2:26"
1124,_quGokF8G0o,Kaya hindi na kapag submit ng data 8 laboratory kase hinaharang ni duque variant DOH
1125,_quGokF8G0o,Kanina umaga 22 amp ngayun 13 nanaman niloloko nyu mga tao yawa kayu
1126,_quGokF8G0o,"Kung maganda ang madudulot ng mga bakuna na ito, bakit kaya may mga doktor na kontra dito? Mas excited ako sa kalalabasan nito…Lawsuit filed by American Frontline Doctors in Alabama against these experimental vaccines. Source: American Frontline Doctors"
1127,_quGokF8G0o,Di na ako mniniwala sa covid na yan. Bkit s  ibang bansa nag free covid na sla tayo di PA tpos.... Hanggang kailan PA to mtatapos covid nato....
1128,_quGokF8G0o,Nawalan ng saysay ang bakuna
1129,_quGokF8G0o,"*Ang hindi pag skip ng ads lang matulong namin sa inyo. Kami po ay small YT na mahirap lang,  nangungupahan lang kami. Asawa ko maliit lang sahod. Gusto namin makapag bigay inspirasyon sa katulad nmin mahihirap. Na kahit mahirap lang ang buhay dapat masaya at patuloy lng sa pangarap walang imposible sa Dios. Dahil po sa inyo naging inspirasyon namin kayo mga blogger. God bless sa atin lahat wag susuko laban lang tayo sa hamon ng buhay 💚*"
1130,_quGokF8G0o,Abs cbn lng malakas
1131,M7qPgEDk2JY,Scary... let's hope it does not mutate into a more virulent and fatal strain :-(
1132,M7qPgEDk2JY,How come it's 4 month ago?? While the Philippines confirmed it just this January??
1133,M7qPgEDk2JY,G virus ? RE game?
1134,M7qPgEDk2JY,So it’s here and in Denmark? Someone needs to stop this madness.
1135,M7qPgEDk2JY,We're all dooooooooomed.
1136,M7qPgEDk2JY,There was a positive case in India
1137,M7qPgEDk2JY,alien super virus
1138,M7qPgEDk2JY,*Laughs in cooties*
1139,M7qPgEDk2JY,duh ?! pag aaralan pa yang mabuti ng mga experto kung mutation nga . binalita nato sa 24oras
1140,M7qPgEDk2JY,"Lord help the Filipinos 🤲😔 they are good culture ,"
1141,-PqXVcMtygc,Great job PRRD!❤️
1142,-PqXVcMtygc,Donating poison is what it should be called
1143,-PqXVcMtygc,Donating poison is What it should be called
1144,5DvMPgoKZmM,"Church turn into a hospital?
What a good collaboration"
1145,5DvMPgoKZmM,"It's been almost 2 years of this, and how many people do you honestly know of that really died of covid without the presence of an unrelated terminal illness?

How is it that the homeless are fine (ask any cop)?

And how many athletes/celebs/elites can you name right now that really died of covid?

Exactly"
1146,5DvMPgoKZmM,"please lang, if may option kayo to get vaccinated,  do it. possible pa rin magkacovid, but hindi sya ganoon ka grabe. Huwag nyong hintaying maging huli ang lahat."
1147,5DvMPgoKZmM,"""Cases"" mean absolutely nothing whatsoever, in reality.

Especially since it's well understood that the PCR testing still in use is highly inaccurate and often displays false positives in the presence of influenza and often for no apparent reason at all."
1148,5DvMPgoKZmM,The man that should resign from his office is nonetheless than the present head of state of the philippines for his gross malfeasance and misfeasance
1149,5DvMPgoKZmM,"Honestly, I just hope things can at the very least get slightly better here in PH. Obviously debatable, but still."
1150,5DvMPgoKZmM,A new variant is inevitable.
1151,5DvMPgoKZmM,"Is that the people who got been vaccinated.,"
1152,5DvMPgoKZmM,This covid will be a never-ending fuckery as long as the media will keep on talking about these magically-made numbers.
1153,5DvMPgoKZmM,We don't care anymore😡
1154,_quGokF8G0o,Kaya hindi na kapag submit ng data 8 laboratory kase hinaharang ni duque variant DOH
1155,_quGokF8G0o,Kanina umaga 22 amp ngayun 13 nanaman niloloko nyu mga tao yawa kayu
1156,_quGokF8G0o,"Kung maganda ang madudulot ng mga bakuna na ito, bakit kaya may mga doktor na kontra dito? Mas excited ako sa kalalabasan nito…Lawsuit filed by American Frontline Doctors in Alabama against these experimental vaccines. Source: American Frontline Doctors"
1157,_quGokF8G0o,Di na ako mniniwala sa covid na yan. Bkit s  ibang bansa nag free covid na sla tayo di PA tpos.... Hanggang kailan PA to mtatapos covid nato....
1158,_quGokF8G0o,Nawalan ng saysay ang bakuna
1159,_quGokF8G0o,"*Ang hindi pag skip ng ads lang matulong namin sa inyo. Kami po ay small YT na mahirap lang,  nangungupahan lang kami. Asawa ko maliit lang sahod. Gusto namin makapag bigay inspirasyon sa katulad nmin mahihirap. Na kahit mahirap lang ang buhay dapat masaya at patuloy lng sa pangarap walang imposible sa Dios. Dahil po sa inyo naging inspirasyon namin kayo mga blogger. God bless sa atin lahat wag susuko laban lang tayo sa hamon ng buhay 💚*"
1160,_quGokF8G0o,Abs cbn lng malakas
1161,M7qPgEDk2JY,Scary... let's hope it does not mutate into a more virulent and fatal strain :-(
1162,M7qPgEDk2JY,How come it's 4 month ago?? While the Philippines confirmed it just this January??
1163,M7qPgEDk2JY,G virus ? RE game?
1164,M7qPgEDk2JY,So it’s here and in Denmark? Someone needs to stop this madness.
1165,M7qPgEDk2JY,We're all dooooooooomed.
1166,M7qPgEDk2JY,There was a positive case in India
1167,M7qPgEDk2JY,alien super virus
1168,M7qPgEDk2JY,*Laughs in cooties*
1169,M7qPgEDk2JY,duh ?! pag aaralan pa yang mabuti ng mga experto kung mutation nga . binalita nato sa 24oras
1170,M7qPgEDk2JY,"Lord help the Filipinos 🤲😔 they are good culture ,"
1171,rxfbTVjIGa0,Yan na yung preparation nila for Omicron. We all know the cases will skyrocket once it spread throughout the community.
1172,rxfbTVjIGa0,"The people have the right to know and to be informed about the trends of such significantly timely issues such as this pandemic.  For in one way or another such information is key as to how individuals and institutions will move and decide on things that will matter to their health, either individual health or general health.  Moreover is it not that this, the people's right to be informed about the things happening around them, does this hinge on the Constitutional Right to Information Access and Media? 

To not release daily social media updates about the pandemic is to keep the people in the dark. You will do them a huge disservice."
1173,rxfbTVjIGa0,How hard could it be to take a screenshot of the website every 4pm and have it posted on your social media pages for public information? Kahit ojt kaya naman gawin yan.
1174,rxfbTVjIGa0,This doesn't make ANY sense.
1175,rxfbTVjIGa0,tapos yung dashboard hindi upto standards for mobile web... ang liliit ng texts
1176,rxfbTVjIGa0,"Tama ba ang desisyon na Ito?!?!? In crises, there is no such thing as communication overload or over communication. Ewan ko sa inyo kung anong umiiral sa utak nyo..."
1177,rxfbTVjIGa0,Walang update tas biglang mang gugulat ng hundred thousand cases lol
1178,rxfbTVjIGa0,"the phil govt is so sick for this, like, anong plano niyo? bakit, tinamad na ba?"
1179,rxfbTVjIGa0,Conspiracy on whole humanity
1180,rxfbTVjIGa0,"Mas maganda parin sana sa Social Media kasi mas maraming mararating yung balita, hindi naman kasi lahat ng tao nag effort na pumunta pa sa Website ng DOH. Hindi rin naman lahat ng tao may time na manood sa TV"
1181,_S_9JRwFmcA,Good job!
1182,AO_LPOVLOPU,"It's sad that again it is returning. 
 In India,  we still didn't overcome the problem missing school a lot."
1183,AO_LPOVLOPU,It’s quite sad to see that they used to have 3 recovered cases and now cases soared above 100k.
1184,AO_LPOVLOPU,"I believe Philippines will win the battle against Corona
Support from India"
1185,AO_LPOVLOPU,"Philippines'people are very understanding . i'm rooting for you Philippines, you can weather this storm."
1186,AO_LPOVLOPU,"Please be safe. Stay strong. Discipline is the most important factor.

 Pray from Malaysia."
1187,AO_LPOVLOPU,Keep fighting and stay safe philippines! if us malaysia can do it you absolutely can too <3
1188,AO_LPOVLOPU,"They just do a lot of tests. No need to return to lockdown. ""As of August 4, 2020, according to DOH data, the country has a total of 99 licensed testing laboratories and conducted a total of 1,643,539 tests, testing an average of 28,938 tests per day within the last 7 days. This is significantly higher than Indonesia which has tested a total of around 908,000 as of August 4, and testing an average of 14,291 per day within the last 7 days according to Our World in Data.  """
1189,AO_LPOVLOPU,"To everyone out there, stay safe and have a great day!"
1190,AO_LPOVLOPU,Stay Strong Philippines.. love from Sabah Malaysia ❤️
1191,AO_LPOVLOPU,not all the parts of the Philippines but some parts that are affected
1192,aw59h2FNMIQ,"how come the, the avigan from japan until now not start the clinical trial,,"
1193,aw59h2FNMIQ,Why is Russia going to conduct the clinical trial of its vaccine in the Philippines first? Why don't they do it first to their Russian citizens? And why the Philippine government is going to allow it here first?
1194,aw59h2FNMIQ,Oh no pls no
1195,aw59h2FNMIQ,may 2021
1196,aw59h2FNMIQ,"Ahh Jezz , Isn't the virus bad enough ? Now we have to worry about the cure 
Which red pill will you take , Russia's ""Sputnik"" or Americas ""Dragon Slayer"""
1197,aw59h2FNMIQ,Good
1198,aw59h2FNMIQ,Sputnik five... Hmm interesting
1199,aw59h2FNMIQ,FDA of the Philippines how do you think about this?
1200,aw59h2FNMIQ,not a wise decision considering how silent Russia has been through the vaccine development process! Duterte's opportunistic approach may prove fatal
1201,aw59h2FNMIQ,Philippines authority should consider Russian vaccine carefully. I watched a video clip of an American doctor and he says he doesn't question Russian vaccine validity but he questions why Russia refuses to provide scientific data of the third stage test to international organization to confirm.
1202,GUVKWAEO_hY,"here in PH, they are fast in administering vaccines but only while supply last. especially in the provinces, it takes weeks before a new batch of vaccines arrive. How can they administer vaccines if there is no supply."
1203,GUVKWAEO_hY,You will get vaccinated here in the Philippines when you get registered on local government sites. Some places in the Philippines allow people to walk in and get vaccinated as long as they have registered online. It also depends on your local government or City.
1204,GUVKWAEO_hY,"28:39 where the deck did you get that information from?? In Indonesia health workers and elderly are first and second priority to get vaccine hence why my dad  could get one in early March.
39:19 did you say fifty or fifteen?"
1205,GUVKWAEO_hY,"The Filipina interviewee’s fear on general public being left behind is not true. The vaccines of the private companies have not come in yet (not that we know of), and the poor sector are being vaccinated now through the government’s procurement and donations. They’re not last to be vaccinated. Admittedly last to be vaccinated are those from far-flung provinces but they are not in immediate danger of the pandemic."
