,video_id,comment,polarity,sentiment
247,Lb3v8M8dzic,"Very informative, well put together and unbiased. Great job, thank you!",0.6,positive
248,JZIIOp38KYU,Very informative... Love from BD🇧🇩🇧🇩🇭🇳🇭🇳🇮🇳🇮🇳,0.35,positive
249,JZIIOp38KYU,"Because of the tragic events going on in Israel,I decided to come back to my teacher for revision. Thank you Sir.",-0.375,negative
250,JZIIOp38KYU,"Incredible video thanks a lot! No western media was covering this properly, but at least an Indian did! This needs way more views!",0.2333333333333333,positive
251,JZIIOp38KYU,"Sir, I am from Israel. This is amazing! You explained this much better than our media. Hat off",0.625,positive
252,JZIIOp38KYU,"Now, this is called as an example of  great degree of research & analysis; powered by authenticity and driven by Passion!",1.0,positive
253,JZIIOp38KYU,"Amit never disappoints.. this is called proper journalism, research,  information passing and genuine reporting.. amazing Amit, amazing..  you are a delight to listen. Carry on brother.",0.4,positive
254,JZIIOp38KYU,"You should have also mentioned that even the Opposition party supports their PM in the fight against Palestine. This kind of mindset of putting nationalism above politics is why Israel has achieved its stature today. If that same sense prevails in India, then it can even become one of the veto powers in future.",0.15,positive
255,JZIIOp38KYU,Man you have guts to speak up the truth! Hats off to you Sir!,0.0,neutral
256,JZIIOp38KYU,"Sir, you never fail to simplify complex things in such a lucid manner ! This was beyond brilliant !",0.2375,positive
257,zdq3NVtT6Nc,"The British played a key role in the creation of Israel too, when they were occupying Palestine they made a promise to hand it over to the Jewish people in order to win support from them during ww1. They made good on their promise (after ww2) with the help of the UN, leaving alot of Palestinians displaced and causing a huge amount of resentment in the middle east",0.27142857142857146,positive
258,zdq3NVtT6Nc,You left out the sykes picot agreement during WW1. That one is extremely relevant to where we are today.,0.2,positive
259,zdq3NVtT6Nc,"Ironically British created most of the world’s biggest conflicts like Kashmir, Gaza, Tibet etc.",0.25,positive
260,zdq3NVtT6Nc,CNN telling history is the funniest thing I have seen today,0.0,neutral
261,zdq3NVtT6Nc,So basically they settled on land without any conciliation from the people who were living there.... and they wonder why they have problems  :/,-0.25,negative
262,zdq3NVtT6Nc,Why did you leave out the 1948 conflict?,0.0,neutral
263,zdq3NVtT6Nc,"You mentioned the proclamation of the establishment of Isreal but you forgot to mention the ethnic cleansing of Palistineans that followed in 48. So I'll point it out instead of you by quoting the Isreali historian Ilan Pappé. 
""Once the decision was taken, it took six months to complete the mission. When it was over, more than half of Palestine's native population, close to 800,000 people, had been uprooted, 531 villages had been destroyed, and eleven urban neighbourhoods emptied of their inhabitants. The plan decided upon on 10 March 1948, and above all its systematic implementation in the following months, was a clear-cut case of an ethnic cleansing operation, regarded under international law today as a crime against humanity.""

- THE ETHNIC CLEANSING OF PALESTINE BY ILLAN PAPPE.",0.06190476190476191,positive
264,zdq3NVtT6Nc,A moment of silence to the many who will watch this video and become experts on the history of Gaza.,0.5,positive
265,NeZ4yXyzUG0,"What impresses me most, honestly, is the fact that whoever runs this channel did not disable comments. Now that's bravery.",0.55,positive
266,NeZ4yXyzUG0,Crazy this is 2 years old and still so very relevant after this week. Trevor is eloquent and thought provoking.,0.006666666666666672,positive
267,NeZ4yXyzUG0,"So amazingly thoughtful and timeless! “When you have this much power, what is your responsibility?”",0.35,positive
268,NeZ4yXyzUG0,I wish he was still sharing his thoughts and insights with us through news. I wish he was talking about this right now and opening people's minds with his points of view. I miss him,0.2857142857142857,positive
269,NeZ4yXyzUG0,"""Whose right and who's wrong depends on when you start measuring time."" Perfectly said. A thought ALL need to think about. This is 2 years old; here in November 2023",0.22142857142857142,positive
270,NeZ4yXyzUG0,“Who is right and who is wrong depended on where you start measuring time” - wisest words in understanding history,-0.10714285714285715,negative
271,NeZ4yXyzUG0,"That was beautifully and compassionately said. Thank you, Trevor, for having the courage to state your opinion and to express this question.",0.85,positive
272,cfkUE5Q0K04,"Odd that this documentary makes no mention of the 1917 Balfour Declaration.  Wasn’t that a critical milestone that set so much of this in motion?  Otherwise, an informative documentary.",0.0066666666666666706,positive
273,cfkUE5Q0K04,"For people who only have surface level tiktok knowledge of this conflict, even those of us who have forgotten the nuances that subject matter scholars can bring to the forefront, this historical account is an important part to understanding the issues surrounding the conflict.",0.05833333333333334,positive
274,cfkUE5Q0K04,It's super refreshing to get an older perspective on these issues,0.3333333333333333,positive
275,cfkUE5Q0K04,"""In former days the struggle for existence was chiefly a struggle against nature, today it is primarily a struggle against other human beings."" - Kirby Page",0.06875,positive
276,cfkUE5Q0K04,"I’ve watched your film archives for a while and I had to do a double take at the view count! It’s good that you maintained this informative and well made content for young viewers today that want to be informed, instead of just seeing a headline.",0.26666666666666666,positive
277,cfkUE5Q0K04,It’s ironic that such supposedly holy lands are filled with so much hatred.,0.2,positive
278,cfkUE5Q0K04,I am appalled and saddened that 40 years after this documentary the conflict still continues and innocent lives are ended in the most horrific ways.,-0.16,negative
279,cfkUE5Q0K04,"I'm Aramaic.
 Why doesn't anyone talk about the Aramaeans who have lived there for thousands of years? They were tortured and sometimes slaughtered by Jews and later by Ottomans. Things weren't going well for them among the Europeans either. Nevertheless, thousands of Aramaeans still live in Jerusalem, Bethlehem and the surrounding area today. They were not left alone among any of these peoples. Today I spoke to my relative there. They are never mentioned!",0.03409090909090909,positive
280,FH9uVw-d35c,I love how the occupier is asking the people they’ve occupied for 50 years to surrender 🤦‍♂️,0.5,positive
281,FH9uVw-d35c,Why not tell Israel to stop the occupation and stealing Palestinians land.,0.0,neutral
282,FH9uVw-d35c,"Matthew Miller: ""If only the Palestinians would unconditionally accept Apartheid without resistance then they could have peace.""

If Apartheid, inequality and militarized brutality is what Miller means by ""peace"", then it's no wonder it's unsustainable.",0.0,neutral
283,FH9uVw-d35c,Israel doesn’t need spokespersons when it has these.,0.0,neutral
284,FH9uVw-d35c,"“Every record has been destroyed or falsified, every book rewritten, every picture has been repainted, every statue and street building has been renamed, every date has been altered. And the process is continuing day by day and minute by minute. History has stopped. Nothing exists except an endless present in which the Party is always right.”
― George Orwell, 1984",0.05357142857142857,positive
285,FH9uVw-d35c,Always blaming Hamas when Israel is doing the killing.,0.0,neutral
286,FH9uVw-d35c,Matt Miller always looks and sounds like he is giving a book report for a book he has not read,0.0,neutral
287,FH9uVw-d35c,So he wants Palestinians to surrender to the occupation? Why doesn't he say the same for Ukraine?,0.1,positive
288,K5tcwIicICg,This was great. We need long-form content from experts with intelligent questions asked sensitively.,0.5666666666666668,positive
289,K5tcwIicICg,One of the most nuanced explanation I have seen in mainstream media. Wow.,0.3,positive
290,K5tcwIicICg,"Do people understand that this is what political science and historical studies actually do all the time, as best they can? Rational argument, differentiated, detached analysis, correction of viewpoints based on new data and new relevant interpretations? There are far too few people like Ian Bremmer who transport this knowledge into the public sphere, which instead is being swamped by the social media toxicity he refers to. Thanks, Big Think!",0.1389277389277389,positive
291,K5tcwIicICg,This was the most pragmatic and responsible examination of the situation I can recently remember.,0.2333333333333333,positive
292,K5tcwIicICg,"Thank you Big Think for continuing to be a great source for honest and intellectual information on the Internet, where information is usually the opposite of honest and intellectual.",0.29374999999999996,positive
293,K5tcwIicICg,What a great  interview. Asking a question and then actually let your guest talk! Love it!,0.47500000000000003,positive
294,K5tcwIicICg,What an excellent interview!!! Thank you to Mr. Bremmer for so articulately explaining the geopolitics here!! His ability to articulate such complex topics is absolutely brilliant!!,0.425,positive
295,K5tcwIicICg,"""Algorithms are not humanity. Algorithms are programmed by business models that are productizing people for profit"" perfectly put.",1.0,positive
296,K5tcwIicICg,"Brilliant review! We need more of that nuanced perspective on these sensitive and complex topics by people who understand what's really going on. Plus, really good production value.",0.3666666666666667,positive
297,CISbbt1x2dc,"I almost clicked way when I found out the video was in Hindi not English. But I watched with English subs, and I have to say, you are an awesome history teacher bro! Very well explained video.",0.3,positive
298,CISbbt1x2dc,"""If you ever see two fishes fighting, you can be almost sure an Englishman just passed by. """,0.5,positive
299,CISbbt1x2dc,"It's like you invite someone into home, and few days later he started to claiming it is his home and kicked out you.",-0.1,negative
300,CISbbt1x2dc,"Very informative and easily explained. I liked how the story of both the sides have been explained. but honestly i still feel deep pain about the condition of these two countries. In my opinion, extremism in any religion in any aspect can never spread peace and equality. Its the radicalism of a few whose price is being paid by the innocents who are in millions.",0.27222222222222225,positive
301,CISbbt1x2dc,Everytime I want to understand any conflict this person never disappoint me,0.0,neutral
302,CISbbt1x2dc,So basically British are responsible for every border and land conflict in this world 😂😂,0.1,positive
303,CISbbt1x2dc,"For a long time, I was trying to figure out why this conflict is  going between two countries, you cleared my doubts in Just 17 min Video, outstanding presentation skill, Keep it up Dhruv",0.225,positive
304,CISbbt1x2dc,"“We know too well that our freedom is incomplete without the freedom of the Palestinians.”
― Nelson Mandela",0.0,neutral
305,Il-Vz6X2ygg,"“If two fishes are fighting in a pond, a britisher must have passed by”",0.0,neutral
306,Il-Vz6X2ygg,"I pray for the innocents, those are the ones who suffer the most",0.5,positive
307,Il-Vz6X2ygg,"Hats off to you brother. 
You have predicted it's gonna happen 2 years later correctly.",0.0,neutral
308,Il-Vz6X2ygg,Great work Dhruv. Simple explanation of the most complicated global conflict,0.16,positive
309,Il-Vz6X2ygg,“There is no such thing as real peace! It’s impossible as long as we live in this accursed world!”,-0.05924242424242423,negative
310,Il-Vz6X2ygg,"History is interesting when you don't have to study for an exam.
Someone",0.5,positive
311,Il-Vz6X2ygg,"Vengeance brings justice but that justice breeds more vengeance 
         - pain",0.5,positive
312,Il-Vz6X2ygg,"Gandhi never said ""An eye for an eye makes the world blind"" This was a dialogue in the movie ""GANDHI"" and BEN KINGSLEY said this.",-0.5,negative
313,Il-Vz6X2ygg,"you are best neutral speaker on this matter Dhruv, lots of respect♥",1.0,positive
314,iiUIWnU-Ofk,Imagine how much hard work need to prepare this type of content. No word to describe sir's effort.,-0.2916666666666667,negative
315,iiUIWnU-Ofk,"I wish i could imprint all the information all at once in my brain and never forget them again.. As a Christian and as a student, I am really thankful for your work. Things have become clearer than before, not only for the ongoing debate on Israel-Palestine conflict, but also for my academics and my Bible knowledge. Thank you Sir.",0.06666666666666667,positive
316,iiUIWnU-Ofk,"I have watched countless of videos and documentaries from various sources but nothing like yours. This is clearly by far the best narration ever , very clear, crisp, succinct and straight to the point ! Thank you. I'm a huge fan of yours. I  really appreciate your hard work. God bless you and keep doing what you're doing.    🙏",0.2038333333333334,positive
317,iiUIWnU-Ofk,"Amazing video sir , those who say India was never a nation before their doubt will be cleared , I think my present generation takes our culture for granted and mocks it often  without knowing the fact that thundred of thousands of lives are sacrificed to keep this culture alive .
Proud to be part of this oldest civilization.
Jai Hind",0.375,positive
318,iiUIWnU-Ofk,"Geography, history, politics, religions, civics...this video is a 5-in-1educational bonanza. <3",1.0,positive
319,iiUIWnU-Ofk,This young man’s knowledge of history is unbelievable. I am beyond wow 🤩,-0.016666666666666663,negative
320,x_isZHaZjcU,"Lots of new things I had never known on the conflict…great documentary, thanks you!",0.12878787878787878,positive
321,x_isZHaZjcU,I had my eyes and mind opened more watching this documentary Thank you,0.25,positive
322,x_isZHaZjcU,"This documentary left out the Egypt border, saying Gazans were stuck due to Israel borders on all sides. Egypt has an equally solid border because despite being Muslim they don’t like Palestinians. They allowed them to live in Egypt for a time but the Palestinians decided to attempt to overthrow the Egyptian government. Not a smart move.",-0.015963203463203464,negative
323,x_isZHaZjcU,This documentary leaves out the Balfour declaration and the Haavara agreement.,0.0,neutral
324,x_isZHaZjcU,"My dear Humans, why can't we just live in peace. I'm a former lost boy of Sudan and the pain srill haunts me. If it wasn't for the UNHCR, WFP and JRS, I would not be alive today. Human kindness is not only a  virtue but also the means to survive peacefully, as Humans. My father's head was chopped because he wa just a farmer, growing millets, sorghum, maize, groundnuts, beens and even okra and more. 
_Do we have to hurt each other to this extent, Benjamin Netanyahu? No, Humans will always be Humans. The worst of us are like pests that just keeps bugging. Kakuma was my refugee Camp and I know the pain.",-0.015404040404040408,negative
325,x_isZHaZjcU,"although this is an old documentary (2008) it does a good job at trying to be impartial and balanced, unlike anything made now, which is either pro this side or pro that side.",0.26666666666666666,positive
326,x_isZHaZjcU,"Hello 
 Thank you for your attention and add Farsi in the automatic translation section.",0.0,neutral
327,x_isZHaZjcU,History just keeps repeating itself over there.,0.0,neutral
328,nufBpHmWhtQ,"UK created most of the territorial disputes around world in history, but incapable to solve any of them nowadays.",0.5,positive
329,nufBpHmWhtQ,When you divide a nation like it's an incomplete jigsaw puzzle this is what happens. I think much of the blame falls on the U.N. and the British empire. You can't promise a nation to a people where people are already building lives.,0.1,positive
330,nufBpHmWhtQ,"If there are two fish fighting, a Brit swam through",0.0,neutral
331,nufBpHmWhtQ,"The map after 6 days war that you used was inaccurate, Israel also took the Sinai and Golan Heights.",0.0,neutral
332,nufBpHmWhtQ,"I mean, they could at least have divided it in half, with both sides getting sea access... but no, they divided it by what seems like drunk people throwing darts at a map.",-0.3197916666666667,negative
333,nufBpHmWhtQ,Me in 2023 trying to understand the conflict,0.0,neutral
334,nufBpHmWhtQ,Why is America involved in everything?,0.0,neutral
335,nufBpHmWhtQ,Only the blind cannot see the cruel injustice,-0.5,negative
336,nufBpHmWhtQ,"Sykes-Picot Agreement, also called Asia Minor Agreement, (May 1916), secret convention made during World War I between Great Britain and France, with the assent of imperial Russia, for the dismemberment of the Ottoman Empire. The agreement led to the division of Turkish-held Syria, Iraq, Lebanon, and Palestine into various French- and British-administered areas. Negotiations were begun in November 1915, and the final agreement took its name from the chief negotiators from Britain and France, Sir Mark Sykes and François Georges-Picot. Sergey Dimitriyevich Sazonov was also present to represent Russia, the third member of the Triple Entente.",0.043750000000000004,positive
337,nufBpHmWhtQ,"The PLO was founded in 1964, before the 6-day war, not after it.",0.0,neutral
338,W5hBL94EFMQ,Never ask the UN to ever draw borders again.,0.0,neutral
339,W5hBL94EFMQ,And when Palestinians fight back they cry out in anger but when Israelis murder Palestinian civilians they say “It’s war what do you expect”,-0.35,negative
340,W5hBL94EFMQ,When the oppressed becomes the oppressor,0.0,neutral
341,W5hBL94EFMQ,Who needs history when you can make your own reality,0.6,positive
342,W5hBL94EFMQ,Cant believe vox went into this narrative without presenting all the facts.,0.0,neutral
343,W5hBL94EFMQ,Y'all decided not to tell 99% of the story,0.0,neutral
344,W5hBL94EFMQ,Tell me half the story without telling me you're telling half the story.,-0.16666666666666666,negative
345,W5hBL94EFMQ,Free Palestine 🇵🇸,0.4,positive
346,W5hBL94EFMQ,Cycles of violence & hatred are supposed to be broken not continued.,-0.4,negative
347,rGVgjS98OsU,"Thank you Vox for showing the raw facts, very simple history that the whole world is turning a blind eye to",-0.1326923076923077,negative
348,rGVgjS98OsU,Thank you for sharing this. Many people ignore history and talk about the future.,0.25,positive
349,rGVgjS98OsU,Isn’t it funny how the British avoid all responsibility and culpability? When the majority of geopolitical issues are Britains fault.,0.125,positive
350,rGVgjS98OsU,"if you had released this AFTER october 7th, they’d have said you supported hamas, bc so many people choose not to think about or consider the fact that israel has been committing atrocities for a long time. decades.",0.225,positive
351,rGVgjS98OsU,You won't see this on Fox News or CNN.,0.0,neutral
352,rGVgjS98OsU,As a Jewish person in America I'm so sad that I was never taught this history.,-0.25,negative
353,rGVgjS98OsU,"Its important to note that during the Nakba, Palestinian resistance was already weakened because of the revolt of 1936 where Palestinians revolted agaisnt the British colonizers and were squashed, essentially eliminating political and military strength of Palestine.",0.06000000000000001,positive
354,B12qniUwPMg,"„All land that was once inhabited by Germanic people must be added to Germany, no place for a Polish state.“ Now make an intelligent guess who said that.",0.8,positive
355,B12qniUwPMg,"The term ""Palestine"" first appeared in the 5th century BCE when the ancient Greek historian Herodotus wrote of a ""district of Syria, called Palaistinê"" between Phoenicia and Egypt in The Histories",0.125,positive
356,B12qniUwPMg,Can  you tell more indepth about the belfor declaration,0.5,positive
357,B12qniUwPMg,What books would you recommend for someone like me who wants a deeper understanding of the situation like you were able to do?,0.35,positive
358,B12qniUwPMg,I pray for peace from both sides. No innocent people should be hurt in this massacre. May peace prevail.,-0.25,negative
359,B12qniUwPMg,Where was that cartoon mocking the man who was killed in the terrorist attack published?  I can’t find it.,-0.2,negative
360,Il-Vz6X2ygg,"“If two fishes are fighting in a pond, a britisher must have passed by”",0.0,neutral
361,Il-Vz6X2ygg,"I pray for the innocents, those are the ones who suffer the most",0.5,positive
362,Il-Vz6X2ygg,"Hats off to you brother. 
You have predicted it's gonna happen 2 years later correctly.",0.0,neutral
363,Il-Vz6X2ygg,Great work Dhruv. Simple explanation of the most complicated global conflict,0.16,positive
364,Il-Vz6X2ygg,“There is no such thing as real peace! It’s impossible as long as we live in this accursed world!”,-0.05924242424242423,negative
365,Il-Vz6X2ygg,"History is interesting when you don't have to study for an exam.
Someone",0.5,positive
366,Il-Vz6X2ygg,"Vengeance brings justice but that justice breeds more vengeance 
         - pain",0.5,positive
367,Il-Vz6X2ygg,"Gandhi never said ""An eye for an eye makes the world blind"" This was a dialogue in the movie ""GANDHI"" and BEN KINGSLEY said this.",-0.5,negative
368,Il-Vz6X2ygg,"you are best neutral speaker on this matter Dhruv, lots of respect♥",1.0,positive
369,iiUIWnU-Ofk,Imagine how much hard work need to prepare this type of content. No word to describe sir's effort.,-0.2916666666666667,negative
370,iiUIWnU-Ofk,"I wish i could imprint all the information all at once in my brain and never forget them again.. As a Christian and as a student, I am really thankful for your work. Things have become clearer than before, not only for the ongoing debate on Israel-Palestine conflict, but also for my academics and my Bible knowledge. Thank you Sir.",0.06666666666666667,positive
371,iiUIWnU-Ofk,"I have watched countless of videos and documentaries from various sources but nothing like yours. This is clearly by far the best narration ever , very clear, crisp, succinct and straight to the point ! Thank you. I'm a huge fan of yours. I  really appreciate your hard work. God bless you and keep doing what you're doing.    🙏",0.2038333333333334,positive
372,iiUIWnU-Ofk,"Amazing video sir , those who say India was never a nation before their doubt will be cleared , I think my present generation takes our culture for granted and mocks it often  without knowing the fact that thundred of thousands of lives are sacrificed to keep this culture alive .
Proud to be part of this oldest civilization.
Jai Hind",0.375,positive
373,iiUIWnU-Ofk,"Geography, history, politics, religions, civics...this video is a 5-in-1educational bonanza. <3",1.0,positive
374,iiUIWnU-Ofk,This young man’s knowledge of history is unbelievable. I am beyond wow 🤩,-0.016666666666666663,negative
375,nufBpHmWhtQ,"UK created most of the territorial disputes around world in history, but incapable to solve any of them nowadays.",0.5,positive
376,nufBpHmWhtQ,When you divide a nation like it's an incomplete jigsaw puzzle this is what happens. I think much of the blame falls on the U.N. and the British empire. You can't promise a nation to a people where people are already building lives.,0.1,positive
377,nufBpHmWhtQ,"If there are two fish fighting, a Brit swam through",0.0,neutral
378,nufBpHmWhtQ,"The map after 6 days war that you used was inaccurate, Israel also took the Sinai and Golan Heights.",0.0,neutral
379,nufBpHmWhtQ,"I mean, they could at least have divided it in half, with both sides getting sea access... but no, they divided it by what seems like drunk people throwing darts at a map.",-0.3197916666666667,negative
380,nufBpHmWhtQ,Me in 2023 trying to understand the conflict,0.0,neutral
381,nufBpHmWhtQ,Why is America involved in everything?,0.0,neutral
382,nufBpHmWhtQ,Only the blind cannot see the cruel injustice,-0.5,negative
383,nufBpHmWhtQ,"Sykes-Picot Agreement, also called Asia Minor Agreement, (May 1916), secret convention made during World War I between Great Britain and France, with the assent of imperial Russia, for the dismemberment of the Ottoman Empire. The agreement led to the division of Turkish-held Syria, Iraq, Lebanon, and Palestine into various French- and British-administered areas. Negotiations were begun in November 1915, and the final agreement took its name from the chief negotiators from Britain and France, Sir Mark Sykes and François Georges-Picot. Sergey Dimitriyevich Sazonov was also present to represent Russia, the third member of the Triple Entente.",0.043750000000000004,positive
384,nufBpHmWhtQ,"The PLO was founded in 1964, before the 6-day war, not after it.",0.0,neutral
385,W5hBL94EFMQ,Never ask the UN to ever draw borders again.,0.0,neutral
386,W5hBL94EFMQ,And when Palestinians fight back they cry out in anger but when Israelis murder Palestinian civilians they say “It’s war what do you expect”,-0.35,negative
387,W5hBL94EFMQ,When the oppressed becomes the oppressor,0.0,neutral
388,W5hBL94EFMQ,Who needs history when you can make your own reality,0.6,positive
389,W5hBL94EFMQ,Cant believe vox went into this narrative without presenting all the facts.,0.0,neutral
390,W5hBL94EFMQ,Y'all decided not to tell 99% of the story,0.0,neutral
391,W5hBL94EFMQ,Tell me half the story without telling me you're telling half the story.,-0.16666666666666666,negative
392,W5hBL94EFMQ,Free Palestine 🇵🇸,0.4,positive
