,video_id,comment,polarity,sentiment
710,mITaDOAUAQE,This is the British legacy creating immense suffering across the globe,0.0,neutral
711,mITaDOAUAQE,Britain helped the zionists do to Palestine what the British did to us Irish ☘️ Palestine will always have the support of Ireland 🇮🇪,0.0,neutral
712,mITaDOAUAQE,"""Divide and rule"". That's how British maintains its power.",0.0,neutral
713,mITaDOAUAQE,Thanks TRT for truthfulness,0.2,positive
714,mITaDOAUAQE,This is like giving a car you stole from a random guy as a gift to your wife.,-0.5,negative
715,mITaDOAUAQE,British promoted colonialism and is the root cause of most of the disturbing problems in this world,0.0,neutral
716,bzdQ770lt-g,Excellent explanation.  Hope firstpost remains neutral and covers both sides of the story. We need neutral non political journalism.,0.5,positive
717,bzdQ770lt-g,Where has this woman been all my life. She breaks things down so well and in a non-biased format.,-0.15555555555555559,negative
718,bzdQ770lt-g,So far the only good thing that has come out of  the Israel-hamas war has been the discovery of your channel and your outstanding and top tier journalism. Thank you for showing me that journalistic integrity is still possible. 🇺🇸 🇮🇳,0.3,positive
719,bzdQ770lt-g,"I have been watching the new and have no idea what was going on. She is great, now I am clearer and have much better understanding of the whole situation. Thank you.",0.4090909090909091,positive
720,bzdQ770lt-g,She is one of the best Journalist in the world. Well researched news and presented eloquently. I am not Indian but like watching her news reports.,1.0,positive
721,bzdQ770lt-g,Palki: You presented a clear review of the long conflict between the two factions involved.  Thanks for answering some of my questions.,0.08333333333333333,positive
722,bzdQ770lt-g,I am from Pakistan and I must say Palki Sharma is one of the best news presenters in the world. Listening to her always gives you new information with a nuanced approach. Outstanding.,0.5454545454545454,positive
723,TGvifbr6sBg,May the lord have mercy and compassion for all innocent people caught up in this situation,0.5,positive
724,TGvifbr6sBg,Thanks you for your true conclusion,0.275,positive
725,TGvifbr6sBg,She so pretty 😍. ...ok back to news,0.125,positive
726,TGvifbr6sBg,Watching from the Philippines we ask God to protect Israel against any unprovoked assault from Hamas,0.0,neutral
727,TGvifbr6sBg,News click,0.0,neutral
728,TGvifbr6sBg,Who create the israel,0.0,neutral
729,TGvifbr6sBg,a,0.0,neutral
730,TGvifbr6sBg,Peace would be attained if Hamas was ended.,0.0,neutral
731,TGvifbr6sBg,And thats why Hamas Attacked israel yesterday 8/10/23,0.0,neutral
732,cGZE6Yh0X6M,I never realized how bad the Palestine people have it. This was a real eye opener,-0.24999999999999992,negative
733,cGZE6Yh0X6M,This is the kind of stuff we need. Empowerment through knowledge,0.6,positive
734,cGZE6Yh0X6M,Came across you on George Galloway's show (as I did with many other great people before). Thank you for everything you do Mohammed!,0.4583333333333333,positive
735,cGZE6Yh0X6M,As a Ugandan muslim I am greatfull that they didn't settle in Uganda . I am also sad to have  come to that realization after the the killings of many innocent Palestinians mostly children 😢😢😢😢,0.25,positive
736,cGZE6Yh0X6M,"Mohamed Hijab is one of the few lions, in the Muslim ummah! Salam from NJ, USA.",-0.25,negative
737,cGZE6Yh0X6M,This video is highly needed and welcomed. History is very important yet overlooked.,0.34,positive
738,cGZE6Yh0X6M,Brother Hijab cooked hard with this one. Thank you bro 🔥🔥,-0.2916666666666667,negative
739,cGZE6Yh0X6M,This is by far the best youtube video content I have ever watched since the beginning of time! Thank you both for such a comprehensive accumulation of events in its true format with no toxic biases. May Allah reward both of you for the great work you bring the community and the world.,0.45,positive
740,0vwkfJb7FEc,"The arab and jews: preparing for war against each other*

UK: Adios",-0.125,negative
741,0vwkfJb7FEc,"Being British, I cannot agree more with this old Iraqi saying : if two fish fight in the Tigris, the British are behind it.",0.039999999999999994,positive
742,0vwkfJb7FEc,"politics aside, I like seeing the borders move over time in all these vids; it really helps.",0.2,positive
743,0vwkfJb7FEc,"4:50 - Israel did not withdraw from Sinai due to pressure of the Oil Embargo. It was the Egyptian President Anwar Al-Sadat who decided to announce a peace initiative and visited Israel. The following negotiations under the hospices of US President Jimmy Carter led to a peace agreement between Egypt and Israel. As a result Israel withdrew from Sinai and returned it to Egypt which paved the way to normalization and diplomatic ties between the two countries. This was the first peace agreement in the Israeli-Arab conflict and has since been in effect until this day. The peace makers, Mr. Anwar Al-Sadat and the Israeli P.M. Menachem Begin received in 1978 the Nobel Peace Prize.",0.041666666666666664,positive
744,0vwkfJb7FEc,Everyone is a goddamn history professor in the comments.,0.0,neutral
745,0vwkfJb7FEc,He is summing up one of the most complex situations of the previous century in less than 9 minutes. Of course things are going to be left out,-0.02666666666666666,negative
746,0vwkfJb7FEc,I haven’t read the comments yet but I’m sure everyone has an open mind and is accepting of everyone no matter their differences 😁😁😁,0.25,positive
747,0vwkfJb7FEc,Awesome map/year/narration combo. I never knew this progression on the history of the world. Thanks so much🙏,0.6,positive
748,2CVoPLea5_Q,"As a Westerner, this is why in addition to western media outlets, it is important to tune in to non-western reporting like Al Jazeera to get an accurate summary of both sides of the story. That way, you will be best-informed when drawing your own conclusions.",0.35,positive
749,2CVoPLea5_Q,"The families and children of Gaza bear the heavy burden of unrelenting pain as they endure the harsh realities of conflict. They suffer the anguish of losing loved ones to violence, their homes reduced to rubble, and their dreams shattered by the relentless cycle of strife. The echoes of explosions reverberate through their lives, leaving scars that run deeper than physical wounds. Amidst this turmoil, they grapple with fear, insecurity, and the trauma of an uncertain future. Their innocence is stolen by the harshness of the world they inhabit, and yet, they persevere with remarkable strength, seeking a glimmer of hope in the midst of the darkness that surrounds them",0.17499999999999996,positive
750,2CVoPLea5_Q,"Hammas knew what they are doing, including consequences. Israel also knows what they are doing and consequences. Anyone else talking about this,possibly can’t influence their choices.",0.0,neutral
751,2CVoPLea5_Q,"Nothing is right with any of this... however- murder, rape and kidnapping is not the answer to any problem. You cant not kill people and say its justified.",0.34285714285714286,positive
752,2CVoPLea5_Q,They always seem to forget there's an Egyptians border for Gazan citizens too... but even Egypt blockades gaza because of hamas,0.0,neutral
753,2CVoPLea5_Q,Israel should remember history will repeat itself,0.0,neutral
754,2CVoPLea5_Q,"If you treat people like animals, you don't get to decide what kind of animals they become, lions for lambs.",0.6,positive
755,2CVoPLea5_Q,it would be very hard for them to get international support after they filmed their atrocities and uploaded them for the whole world to see,-0.05972222222222223,negative
756,2CVoPLea5_Q,Im an outsider to all this but the hatred between these 2 countries is sad both are guilty,-0.5,negative
757,Y7a5Yww8mMc,"Correction - you said Palestinians ‘left’ their homes in 1948-
They were hunted down, killed, thrown out of their homes and  forcibly exiled.

Before 1946, Palestinians made up 96 % of the population.

Persecution, marginalisation, forced evictions, expulsions, - has lead to Palestinians being a minority in their own country.",0.07407407407407406,positive
758,Y7a5Yww8mMc,"Palestinians have a right to life🙏
Living in an open air prison for 16 years and being slowly suffocated to death slowly is evil. 
The religion that talks of being a mensch lives like the devil, I wouldn’t want that type in my country - maybe the world is waking up to what these people are really like…",-0.16285714285714287,negative
759,Y7a5Yww8mMc,I believe Buckingham palace is my home. . . Think I will move in.,0.0,neutral
760,Y7a5Yww8mMc,"From may 14 1948 to 2023 is over 5k year of history, you learn something new every day 🎉",0.13636363636363635,positive
761,Y7a5Yww8mMc,"ITV clearly getting money from ""someone""... smh... You guys have barely covered the pain of Palestinians but quickly created all this propaganda in favour of Israel with sad music and all...",-0.023333333333333338,negative
762,Y7a5Yww8mMc,I hope that the deceased will please restrain themselves 🙏,0.0,neutral
763,Y7a5Yww8mMc,Such a biased report 😮,0.0,neutral
764,Y7a5Yww8mMc,Originated by British,0.0,neutral
765,Y7a5Yww8mMc,Please see Papal Bull of 1430 !,0.0,neutral
766,Y7a5Yww8mMc,Origin !? Don't you mean ORANGES ?,-0.3125,negative
767,O454c_qs5kI,"If you take the time to learn the history behind all this, in my opinion, the reason why there’s conflict between Israel & Palestine , it’s because of the British back during pre world war 1 to world war 2. The British made a lot of bad deals between the 2-nations which led to a big mess where it is today. Now England is just hiding in the shadow hoping no one brings up their old history presence in the Middle East.",-0.13055555555555554,negative
768,O454c_qs5kI,"I never thought Fox News would be the best source of information on a topic, but here I am",1.0,positive
769,O454c_qs5kI,"This is OK for a quick crash course, but it kind of conveniently left out a few things. Nothing on settlers? Nothing on the blockade of Gaza? It makes it seem like a two-sided territorial dispute without much characterization of what each territory is like other than ""densely populated.""",0.18690476190476188,positive
770,O454c_qs5kI,Why are all these companies telling me to stand with Israel? No,0.0,neutral
771,O454c_qs5kI,I am not a Fox fan but I see somewhat balanced news and comments. Great job gentleman,0.8,positive
772,O454c_qs5kI,So you focused on “Jewish being persecuted and fleeing Europe” but not “Palestinian forced out of their home en masse.” Let’s be objective here shall we?,-0.10000000000000002,negative
773,O454c_qs5kI,"A nice attempt to explain what's going on ??
But some of the real important questions need to be answered?
Why did England want to create a State of Israel ??",0.6000000000000001,positive
774,O454c_qs5kI,"Good presentation and generally historically correct. What is missing in the conversation is the current apartheid mindset. For some 20 years Israel has segregated the Palestinians in two reservations (Gaza and the West Bank). In an effort to quell hatred of Israel and attacks - the Palestinians in these reservations face embargos and live in hopeless poverty.  Uprisings (intifada) happen regularly due the poor conditions in these reservations. These current acts of inexcusable terrorism by Hamas will bring even more oppression and misery to the Palestinians. That said, there will be no peace until both sides are willing to talk and compromise. As long as both sides see war as the only solution there will be only war.",0.0624125874125874,positive
775,O454c_qs5kI,This might be the most comprehensive and intelligent explanation of anything I’ve ever seen on Fox News.,0.65,positive
776,Hzntl-YJe04,"I'm a bit disappointed that the technologies of desalination were not mentioned, and how much the countries of the Middle East are turning to desalinating water from their seas and more water-saving technologies and practices than relying on the hydrologic cycle (rainwater, snowmelt, and groundwater) for human consumption.",-0.010000000000000009,negative
777,Hzntl-YJe04,This series is so great! I wish I'd known back in high school that geography could be so interesting,0.415,positive
778,Hzntl-YJe04,"I'm always very proud of Crash Course for approaching difficult subjects with nuance and kindness. It's difficult to talk about issues that are contentious politically and it is impossible to be without bias, but I think that it *is* possible to talk about such things with kindness and consideration. While it is a tall order, I would encourage commenters to remember DFTBA.",-0.08333333333333333,negative
779,Hzntl-YJe04,One of the facets of the conflict unknown to many.,0.2,positive
780,Hzntl-YJe04,"6:09 - I know this is a heavy topic but I found the mention of snow kinda funny - this area gets an average of about 1 snow day a year, and even that only happens in the most mountainous parts.",0.08,positive
781,Hzntl-YJe04,"A great video, thanks for the info.",0.5,positive
782,Hzntl-YJe04,"This comment section might be this show's first flamewar! Yay! 🎉🎉🎉 Truly, this is the moment when Geography joined the Crash Course family 😌",0.390625,positive
783,Hzntl-YJe04,Thank you for bringing this to light,0.4,positive
784,btVFgqkgkzw,"One point that didn't come up in this video is that when Israel made peace with Egypt, the Egyptians insisted on getting beck every last square inch of the Sinai peninsula, yet they were quite adamant not to take the Gaza strip back to their control.",0.03333333333333333,positive
785,btVFgqkgkzw,"What I’m very surprised to see left out of this discussion regarding the importance of context is the fact that it leaves out the 4/5 of British Mandate Palestine that included ALL of Jordan and a small part of Syria, Lebanon and Egypt.  And that doesn’t include the French Mandate.",-0.024,negative
786,btVFgqkgkzw,Why start in 1947 and not 2000bc - what’s the importance of 1947?,0.0,neutral
787,btVFgqkgkzw,"The main thing that this shows is that all of the peace loving, decent people all over the world have been stood upon by corrupt governments who don’t care about them or their welfare. It is extremely sad this world we are living in 🥺",-0.013333333333333353,negative
788,btVFgqkgkzw,It would be helpful if you showed an accurate first map that shows where no people lived.,0.32500000000000007,positive
789,btVFgqkgkzw,"Seems like the point laid is, might makes right ( literally what Netanyahu said) and the lack of ‘official’ ownership meant it was open for the taking. Obfuscation on display.",0.14285714285714285,positive
790,wv8F4NLr4E0,"What a revelation, a young man who actually want to know some facts about what’s going on!!! Brilliant interview Coleman 👌",0.3333333333333333,positive
791,wv8F4NLr4E0,"excellent information, and exploration of Israel.  I’m the daughter of a holocaust survivor, who has been trying to understand as much about Israel as I can, and this is one of the best discussion I’ve seen.  Thank you.",0.7333333333333334,positive
792,wv8F4NLr4E0,Thank you so much for this enlightening interview Coleman! You're fast becoming my favourite YouTuber!,0.334375,positive
793,wv8F4NLr4E0,"This was fascinating, and I learned a lot. I was very impressed with your skill and fairness in interviewing. Well done!",0.85,positive
794,wv8F4NLr4E0,This was an excellent history lesson!!! Great questions and the most fair and honest discussion that I have ever heard on this complex topic. Thank you both,0.55,positive
795,wv8F4NLr4E0,"Thank you for this interview.
It's precious. Unfortunately, I agree with Dr Morris. I don't expect any good outcome.
There's too much evil.
People do not have sound minds.",0.019999999999999997,positive
796,wv8F4NLr4E0,"This was made 8 months ago? Great timing, Coleman. We were gonna need this soon and we didn't even know it.",0.8,positive
797,wv8F4NLr4E0,"Thank for the historical perspective and the spiritual aspects of both the Israeli and Palestinian. The truth is always hard to accept, this truth gives understanding thanks",-0.02291666666666667,negative
798,x8UokctMePM,"Hamas had been a designated terrorist group for ten years when Palestinians democratically elected them to represent them and their values. They weren't misled, this is what they voted for",0.0,neutral
799,x8UokctMePM,Imagine losing every war of genocide you waged and then crying victim. Palestinian's greatest (and only) invention,0.18125,positive
800,x8UokctMePM,We support Israel.  From United States of America,0.0,neutral
801,x8UokctMePM,"Good synopsis, but people should still watch the full video if they haven’t already and are interested",0.4333333333333333,positive
802,x8UokctMePM,"Like always, good presentation bro",0.7,positive
803,x8UokctMePM,Free PlayStation!,0.5,positive
804,x8UokctMePM,Jordan didn’t concord Israel. The British did in 1917 and theygave Jewish land to a Muslim man that help them in another war and made him a king. Jordan is part of the promised land.,0.0,neutral
805,x8UokctMePM,You skipped 1948 to 1967. What happened?,0.0,neutral
806,x8UokctMePM,You can lie but none believe you.,0.0,neutral
807,x8UokctMePM,"From the river to the sea, Palestine will be free !!",0.625,positive
808,aEdGcej-6D0,"This is for those who thinks it started on oct 7th, especially piers….",0.0,neutral
809,aEdGcej-6D0,This is legit like a horror movie; imagine living through it everyday.,-0.2,negative
810,aEdGcej-6D0,"It was heartbreaking hearing Salwa's father telling her to be strong, while she, A CHILD, was being arrested for existing as a Palestinian",0.4333333333333333,positive
811,2Qs6kdvprt0,"People forget ""free Palestine"" was a saying before October 7th",0.4,positive
812,2Qs6kdvprt0,Free Palestine has been a thing for 75 years. Hamas didn't exist until the 80's.,0.4,positive
813,2Qs6kdvprt0,You put your boot on someone's neck for 75 years and expect him to just be cool with you?,0.35,positive
814,2Qs6kdvprt0,Palestinians have a right to defend their land.,0.2857142857142857,positive
815,2Qs6kdvprt0,"He just mentioned the actions of Hamas since October 7th, israel killed 27k civilans, since the october 7th and way more civilians since 1948. The Palestinians have the right to resist and defend they're land. Israel has no right to steal the palestinian houses.",0.1107142857142857,positive
816,2Qs6kdvprt0,Palestine have the right to fight to fight back,0.14285714285714285,positive
817,2Qs6kdvprt0,Palestinians have the right to resist and fight back against israel.,0.14285714285714285,positive
818,2Qs6kdvprt0,Imagine you get bullied by a rich guy for you're whole school life and on day you slap that guy and the whole school calls you violent kid,-0.006250000000000033,negative
819,2Qs6kdvprt0,Never again for anyone and free PALESTINE,0.4,positive
820,2Qs6kdvprt0,"If Hamas is  terrorist, what would you call Israel? Angel?",0.0,neutral
821,kbPnF8Hvj0I,I had no idea Israeli settlers were Americans. Says a lot about how they treat Palestinians there.,0.0,neutral
822,kbPnF8Hvj0I,"Is it just me or is watching those smug racists smiling while mistreating that family really, really frustrating? It makes the world seem so depressing. I've seen that type of smile before and every time that I do it's because someone is being bullied.",-0.2333333333333333,negative
823,kbPnF8Hvj0I,The nerve of a foreign people flying half way across the world to kick out indigenous people from their homes for another foreign people. This is crazy,-0.25416666666666665,negative
824,kbPnF8Hvj0I,"So sad, I’m so sorry for all the Palestinians who are suffering under Israel’s harsh regime. Everyone deserves peace dignity and respect.",-0.39999999999999997,negative
825,kbPnF8Hvj0I,Imagine being an American Tourist and kicking people out of their homeland that you are just visiting lol,0.4,positive
826,kbPnF8Hvj0I,I am quickly losing respect for certain groups of people. Never thought I would feel like this 😢,0.2738095238095238,positive
827,kbPnF8Hvj0I,Brazil supports Palestine! Free Palestine!,0.5,positive
828,kbPnF8Hvj0I,Thank you for exposing the utter arrogance of  American Jews and Israeli settlers to audiences like myself who once were ignorant to the plight of Palestinans. The Truth is knowledge and knowledge is power.  Keep up the good work.,0.2333333333333333,positive
829,kbPnF8Hvj0I,"After years of being brainwashed, thank you Aj+ for showing me and most people like me in the rest of the world who is the real trouble makers and who we stand with and support moving forward.",0.09999999999999998,positive
830,kbPnF8Hvj0I,It’s time to revoke them as American citizens!!!!,0.0,neutral
831,9scGFj7zp5w,I just hate what the innocent are going through on both sides. Specially the children. Breaks my heart.,0.019047619047619035,positive
832,9scGFj7zp5w,It's horrible what all these civilians are going through on both sides. It's truly heartbreaking.,-1.0,negative
833,9scGFj7zp5w,"These two guys give every impression of knowing what they're talking about. I appreciated their calm, measured tones. Badly needed right now in the midst of the hysteria.",0.021428571428571463,positive
834,9scGFj7zp5w,My heart breaks for the innocent children and anyone caught up in this dreadful war .,-0.25,negative
835,9scGFj7zp5w,Probably the most nuanced and unbiased take on the conflict so far,0.3,positive
836,9scGFj7zp5w,"Ignorance gets worse when mixed with lies, denial, and arrogance.",-0.2,negative
837,9scGFj7zp5w,"I'm glad the reporter asked the 1 question we've all been thinking & that is how is a peaceful outcome possible between hamas/isreal. The answer was the correct & absolute truth & that's ""not possible"". Well said",0.19,positive
838,9scGFj7zp5w,"Strange. 
"" We have to cover terrorist action but not call terrorists terrorists because it might sound judgey""
Like,  what?",0.15,positive
839,9scGFj7zp5w,Pray and hope for a divine intervention.,0.0,neutral
840,aBswCrpLSao,"This is complete human rights violation, totally disgusting, no one can stand this kind of oppression",-0.07500000000000001,negative
841,aBswCrpLSao,"This is insane, inhumane and terrifying. And what's even more insane is how the whole world slept on this all these years.",-0.5333333333333333,negative
842,aBswCrpLSao,"How the hell can those soldiers invade the house of the Arab family, without being invited. Prisoners in their own home. Those settlers have to be removed!!!!! What happened to the rights of the Palestinians. They let the settlements grow and grow, they were supposed to be stopped from the beginning. This is so unjust!",1.0,positive
843,aBswCrpLSao,"We express our gratitude to 60 Minute for organizing and presenting this program, which sheds light on the hardships endured by Palestinians. This platform provides an opportunity for people to gain insight into the challenges faced by this community. It is important to address the mistreatment they endure, as well as the complex issues surrounding terrorism.",0.16666666666666666,positive
844,aBswCrpLSao,Shame on all our leaders for leading us here.,0.0,neutral
845,aBswCrpLSao,I hope more people clueless about what been going on for years watches this. This is the reality.,0.5,positive
846,aBswCrpLSao,Thanks 60 minutes for re-airing these stories. One of the only media who report it like it is.,0.1,positive
847,aBswCrpLSao,Those soldiers who keep coming inside the house without permission is such an insane violation of privacy. I always remember learning about the third amendment of the constitution forbidding the quartering of soldiers in private homes but thought it was just an old colonial British thing,-0.15,negative
848,1oUZlWmMQU4,This was the best video regarding Israel hamas conflict as it cleared the basics,1.0,positive
849,1oUZlWmMQU4,Informative v,0.0,neutral
850,1oUZlWmMQU4,AWESOME work 👍,1.0,positive
851,1oUZlWmMQU4,Thank you sir🙏,0.0,neutral
852,1oUZlWmMQU4,Thank you sir ❤,0.0,neutral
853,1oUZlWmMQU4,Awesome work sir❤❤,1.0,positive
854,1oUZlWmMQU4,Thanku sir 😊,0.0,neutral
855,1oUZlWmMQU4,Thanks sir 😊,0.2,positive
856,1oUZlWmMQU4,Thank you sir 😊,0.0,neutral
857,1oUZlWmMQU4,Nicely explained❤.,0.6,positive
858,KSAdNFhWFdE,"Dovahhatti: *decides to discontinue the Rome series because he can't insult Muslims and Arabs*
Dovahhatti: *makes this*",0.0,neutral
859,KSAdNFhWFdE,When the world needed him most he did not return but we did rewatch his content,0.5,positive
860,KSAdNFhWFdE,"''Egypt exists , and it is ruled by idiots''
damn that was painful and true",-0.3833333333333333,negative
861,KSAdNFhWFdE,"8:48 ""Despite Israel's best efforts, a palestinean state still doesn't exist.""
Legendary",1.0,positive
862,KSAdNFhWFdE,This video's so good we're living the sequel.,0.7,positive
863,KSAdNFhWFdE,This video aged like fine wine,0.15833333333333333,positive
864,KSAdNFhWFdE,"Wow, zero dislikes! Truly an unbiased history where everyone is happy!",0.5625,positive
865,KSAdNFhWFdE,"If you made the unbiased history of Balkans, it would be great.",0.8,positive
866,KSAdNFhWFdE,"5:06 ""Egypt Exists, and it's ruled by idiots."" My Egyptian friends just wanted to say this is the truest statement you've ever made.",-0.8,negative
867,H7FML0wzJ6A,"Imagine that you are living in your land in peace...and someone comes and takes your land, demolishes your house, and steals what your ancestors earned in the past just because his religion tells him that this is your land...which religion accepts this crime?",-0.25,negative
