,video_id,comment,polarity,sentiment
1174,6x1kiySrklU,"Thank you so much sir ,for good explanation of world history and regional dispute.",0.44999999999999996,positive
1175,6x1kiySrklU,"Excellent explanation , very well researched . 
Good luck for more such videos",0.48,positive
1176,6x1kiySrklU,"History depends on how much year we go back,",0.1,positive
1177,6x1kiySrklU,Wonderful explanation ❤❤❤,1.0,positive
1178,6x1kiySrklU,Thank you. ❤,0.0,neutral
1179,G-06Z_9SBBI,What's your opinion on religion?,0.0,neutral
1180,G-06Z_9SBBI,Those who think that human beings are important before religion,0.2,positive
1181,G-06Z_9SBBI,இது இரு மதத்திர்கான சண்டை இல்லை சொந்த இடத்தை காப்பாற்றுவதர்கான போராட்டம்,0.0,neutral
1182,G-06Z_9SBBI,Our Palestine Our Lord will protect the people of Palestine,0.0,neutral
1183,G-06Z_9SBBI,"Attacking and hurting women, children, and the elderly is never justified, regardless of the cause. Such actions are always in the wrong. 😢",-0.2333333333333333,negative
1184,G-06Z_9SBBI,"சமூக கருத்துக்களை எப்படி நடுநிலையான முறையில் கையாள்வது என்று மற்ற ஊடகவியலாளர்கள் மதன் அண்ணாவை பார்த்து கற்றுக் கொள்ள வேண்டும்...
Big respect for you ❣️",0.0,neutral
1185,G-06Z_9SBBI,"Says our life. Life Sava is the next person in the hand 
  Where is a peaceful life 😢😢💔",0.125,positive
1186,G-06Z_9SBBI,அருமையான விளக்கம். பல கேள்விகளுக்கு விடை கிடைத்தது. பலஸ்தீனிய மக்கள் இலங்கைத் தமிழர்களைப் போல் துன்பப்படுவதை பார்த்திருக்கிறேன். மிகவும் நேர்மையான மக்கள். விரைவில் இருதரப்பு பொதுமக்களுக்கும் சமாதானம் கிடைக்க இறைவனை வேண்டுகிறேன்.,0.0,neutral
1187,G-06Z_9SBBI,History was so wonderfully explained. You earned my respect.,1.0,positive
1188,RYj9JAKiP1o,No way the Israeli intelligence apparatus was taken by surprise to this extent. Benjamin Netanyahu must have allowed this in order to bolster his power when there is so much pushback against his legal system changes.,0.2,positive
1189,RYj9JAKiP1o,"If you increase the pressure in a pressure cooker, it is bound to explode.",0.0,neutral
1190,RYj9JAKiP1o,"Nobody should interfere in this War, let them get on with it. The Hate in the Middle East is so Intense, let them resolve their own issues without dragging the world into the conflict.",-2.7755575615628914e-17,negative
1191,RYj9JAKiP1o,Thanks for good reporting and interviews on the topic,0.44999999999999996,positive
1192,RYj9JAKiP1o,gentlemen...you can't fight in the holy land,0.0,neutral
1193,RYj9JAKiP1o,"I love you Netanyahu!! God Bless You and  God Bless Israel,  God Bless the Peace of Jerusalem,, In Jesus name , Amen",0.78125,positive
1194,RYj9JAKiP1o,Israeli government needs a massive game changing and they need to change some policy!,-0.25,negative
1195,RYj9JAKiP1o,Israel has been in violation of international law under UN Resolution in reference to settlement activities. It is about time for the US to focus on this violation and not favor Israel. There won't be peace if they don't cease settlement issues.,0.0,neutral
1196,RYj9JAKiP1o,"Russia: Sanctions
Israel:",0.0,neutral
1197,JAT9NQ4WkE0,"It’s not about Joe Biden only. If the president was Trump, it’s the same thing. Who is controlling American’s capital, who is controlling the government is the question.",0.0,neutral
1198,JAT9NQ4WkE0,The action  of Aaron Bushnell   can make you  imagine what the feeling of the people sharing the same concern than him.,0.05,positive
1199,JAT9NQ4WkE0,Its just so blatant at this stage... no shame... pride in fact. The cruelty is unfathomable. An entire nation brainwashed to hate 'the other'.,-0.35625,negative
1200,JAT9NQ4WkE0,This is what the devil looks like when he takes over humans souls,0.0,neutral
1201,JAT9NQ4WkE0,It is a burden on the soul to witness these things and be unable to do anything about it.,-0.5,negative
1202,JAT9NQ4WkE0,I can’t believe that the world is allowing this,0.0,neutral
1203,JAT9NQ4WkE0,How horrible can supposed human beings become when they lack love and become monsters 😢😢😢,-0.16666666666666666,negative
1204,JAT9NQ4WkE0,Anyone who says he is neutral regarding this massacre against the Palestinians is despicable and evil at the same time,-0.5,negative
1205,KYhx6K9BYY0,Biblical prophecy should be put to attention for every believer . This is the beginning of trouble days,-0.2,negative
1206,KYhx6K9BYY0,Praying for peace and protection of Israel and Jerusalem,0.0,neutral
1207,KYhx6K9BYY0,"Amen, stay in prayer for Israel",0.0,neutral
1208,KYhx6K9BYY0,Praying for Jerusalem and Israel. Amen,0.0,neutral
1209,KYhx6K9BYY0,"I am an 87 year old believer. It is because of God's infinite mercy and love and forgiveness of all my sins that I am alive today.
. My prayer is that before I am called to be with the Lord I will have the joy of seeing ALL the members of my family - my two sons and four grandchildren and their partners accept Jesus as their Lord and Saviour, Thank you brothers in Christ for your prayer.",0.375,positive
1210,KYhx6K9BYY0,Amen...Praying for the peace of Jerusalem and Israel...,0.0,neutral
1211,KYhx6K9BYY0,"I pray for Israel and Jerusalem and all the civilians that are hurting and the world peace, amen",0.0,neutral
1212,NgVXIBj905w,"Concise and impartial, exactly what you needed in order to do the job as you did! Thank you.",0.20625,positive
1213,NgVXIBj905w,One huge fact people leave out is that mosque was build 60 years after Muhammad death. It’s not the actual mosque in the Quran.,0.20000000000000004,positive
1214,NgVXIBj905w,WOW! In a short few minutes you went through some major history. I salute you well done!,0.0007812499999999972,positive
1215,NgVXIBj905w,I find it very strange that the Muslims holy book doesn't even mention the word city of Israel.,-0.065,negative
1216,NgVXIBj905w,Well done Sir! Well Done!,0.0,neutral
1217,NgVXIBj905w,thank you for this amazing concise presentation..especially from someone who has seen part of it,0.35000000000000003,positive
1218,uRmSZuvdwBs,"Some great person said ""half knowledge is dangerous than no knowledge """,0.011111111111111146,positive
1219,uRmSZuvdwBs,Someone tell them that the episode started from 1948 they started watching from this season 😂 Bro was educated from Mcdonald's university,0.0,neutral
1220,uRmSZuvdwBs,Bro thinks War is a Netflix season.,0.0,neutral
1221,uRmSZuvdwBs,"History started from 1948, not 7 October.",0.0,neutral
1222,uRmSZuvdwBs,"This is exactly how EVERY conversation works ""So lets start at the 7 of October""",0.25,positive
1223,uRmSZuvdwBs,"Bro educated 
from McDonald's toilet 😂😂",-0.03333333333333333,negative
1224,uRmSZuvdwBs,"As an Indian hindu, I'll support humanity, I'll support Palestine
Free PALESTINE......",0.4,positive
1225,uRmSZuvdwBs,from the river to the sea palestine will be free🇵🇸🇵🇸,0.0,neutral
1226,uRmSZuvdwBs,Bro Educated from whatsapp news 😂😂😂,0.0,neutral
1227,sPY92HDQwM0,"It doesn't matter what happened, its matter what will happen. We should all live in peace without wars.",0.13636363636363635,positive
1228,sPY92HDQwM0,Now that's communication skills ! 71 yrs it took to realization dawnin on the ancient heritage burdened carriers ones !!!,0.0,neutral
1229,sPY92HDQwM0,The content is very good. But a different font and colour could be used,0.45499999999999996,positive
1230,sPY92HDQwM0,Only The Hindu news Network provides unbiased  news .genuine quality content . keep watching it for more news updates . recently I ditched times of India because it supported cronny capitalist. Though The Hindu news paper is costly but has great content.,0.325,positive
1231,sPY92HDQwM0,Nice Video 👍🏻. Thanks for information 🙏🏻,0.4,positive
1232,sPY92HDQwM0,"As far as Documentaries go, the one made by “The Economist” on the same topic points at the Arabs who did not agree to the UN Resolution. The Jews were happy with Any Resolution as long as they were able to get some land they could call their own.",0.325,positive
1233,sPY92HDQwM0,Thanks for making such a short informative video,0.06666666666666667,positive
1234,sPY92HDQwM0,Very helpful thank you,0.2,positive
1235,sPY92HDQwM0,Selective news.,0.0,neutral
1236,sPY92HDQwM0,"Now this is sth, I would like to see more.!",0.625,positive
1237,km-ciyqmAus,"Mainstream media should be cancelled. All these years they fed us propaganda. I feel like a fool and so betrayed!
Thanks to social media particularly YouTube with all the podcasts and video clips like these. I have learnt a lot since October 7th. Keep up the good work. Really appreciated.
Peace & love, South Africa. 🙏🏾❤️",0.2392857142857143,positive
1238,km-ciyqmAus,"There is no such thing as an Israeli ""settler"". When you take land that belongs to someone else, that's not ""settling"". It's stealing.",0.0,neutral
1239,km-ciyqmAus,"When you are told to leave because you are asking too many questions, you know all you need to know about the validity of what they are doing.",0.5,positive
1240,km-ciyqmAus,I saw some videos of treatment these settlers inflict and it was horrific. They were bullying and assaulting people who will be murdered if they defend themseles. I couldnt imagine living in such conditions.,-0.5,negative
1241,km-ciyqmAus,"This is what the mainstream media should show us, This is reality and it is shameful that so many people are being mislead in this conflict. Thank you for showing us this.",0.5,positive
1242,km-ciyqmAus,"if I was living somewhere and someone came n was like, ""Yeah, god gave me a message saying this is my home now"" I'd turn into a ""terrorist"" too",0.0,neutral
1243,km-ciyqmAus,I’m Israeli and I’m embarrassed by the existence of Ben Gvir. Actually that’s an understatement. I’m ashamed. Everyone I know here feels the same way as me.,0.0,neutral
1244,O7ByJb7QQ9U,"Cant believe that this video is from 13 years ago, and tons of people still simply refuse to study history.",0.0,neutral
1245,O7ByJb7QQ9U,People will still be watching this video in a 100 years except the situation will be a little more confusing than now.,0.00416666666666667,positive
1246,O7ByJb7QQ9U,"A correction...It says ""in April 1920 Palestinians poured into the old city""...but these Arabs refused to be called ""Palestinians,"" in fact at the time and throughout the first half of the 20th century it was considered an insult to Arabs, like calling them ""dirty Jews"" since the Jews were the ones known as ""Palestinians."" They insisted on being called simply ""Arabs."" But yes, these are the people who perpetrated regular massacres of Jews in the 1920s and 1930s.",-0.05952380952380952,negative
1247,O7ByJb7QQ9U,I am 17 years old girl with a learning disability. this is so hard for me to understand but I'm trying every day to be more informed......,0.10277777777777779,positive
1248,O7ByJb7QQ9U,"The fact that this was done 12 years ago, is amazing.",0.6000000000000001,positive
1249,O7ByJb7QQ9U,Starting wars @ losing them doesn't make you the victiim,0.0,neutral
1250,O7ByJb7QQ9U,I guess you can't have a 2-state solution when the Palestinians will only accept one state as the solution.,0.0,neutral
1251,O7ByJb7QQ9U,This is why i get triggerd of people that choose sides without knowing any history. The fact that this shows just how important history and knowledge is,0.4,positive
1252,O7ByJb7QQ9U,"It would be nice to have an updated slide to include the more recent two presidents, and how the UN and others are behaving towards these groups today.",0.3666666666666667,positive
1253,O7ByJb7QQ9U,Sad that 12 years later there's actually even more people deluded about the truth. Especially the truths of history and it seems this particular conflict. More young dingbats than there ever used to be. Teaching the next gen is so important!!!,0.15479166666666666,positive
1254,W43Rgzge4Po,«God as a land agent» What a phrase Dr. Shlaim😊Thank you so much.,0.2,positive
1255,W43Rgzge4Po,Another fantastic interview....Avi Shlaim was beautifully interviewed by you Karan....thank you so much for continuing with your interviews on this terrible war,0.11249999999999999,positive
1256,W43Rgzge4Po,"I’ll definitely rewatch this interview; it’s one the most informative ones so far, in what is going with Palestine and Israel today. Thank you.",0.19999999999999998,positive
1257,W43Rgzge4Po,"Extraordinary interview...👌👌👌
Avi Shlaim is simply brilliant...👏👏👏",0.16666666666666666,positive
1258,W43Rgzge4Po,Mr Avi Shlaim ...THANKYOU for educating us the truth in history.,0.0,neutral
1259,IQcmfxO-to0,"UK: This map is based on this line I drew
France: Sounds legit",0.0,neutral
1260,IQcmfxO-to0,"Oh yes, the holy land, land of controversy all over the world",0.0,neutral
1261,IQcmfxO-to0,"As an Israeli who has studied extended history, I have to say that this is the most objective video I have seen about the conflict, telling the honest facts in a neutral way without taking sides and mixing narratives",0.3666666666666667,positive
1262,IQcmfxO-to0,"Virgin Jews: *Palestine bad*
Virgin Arab: *Israel bad*
Chad Middleasterner: *England and France bad*",-0.6999999999999998,negative
1263,IQcmfxO-to0,"You know when I saw the Hebrew writing I thought this was going to be incredibly biased, but you actually tell the events of which that unfolded and do it from a neutral standpoint with jokes. Great job",0.5666666666666668,positive
1264,IQcmfxO-to0,"so what did we learn in this video?
all the situation is Brittan's fault",0.0,neutral
1265,IQcmfxO-to0,"Nobody: 
United Arab Emirates : Hey guys you wanna make peace?",0.0,neutral
1266,IQcmfxO-to0,"Story telling and editing are all really good! Most importantly, it states just facts without prejudice.",0.5916666666666667,positive
1267,IQcmfxO-to0,I’m from the UAE and this video is well made and unbiased. Also that ending. Lol.,0.8,positive
1268,IQcmfxO-to0,"Nobody: 
Britain: hey, you know what you need? Raid shadow legends",0.0,neutral
1269,wb6IiSUxpgw,This was one of the most unbiased and fact based explanations of the origins of the Israeli-Palestinian conflict.,0.5,positive
1270,wb6IiSUxpgw,"This video is like a wine🍷. The more it ages, the more valuable it becomes. It provides us the historical background, hence the useful information to better understand the current conflict.",0.3,positive
1271,wb6IiSUxpgw,Perhaps the best video I have seen on this issue. Well done.,1.0,positive
1272,wb6IiSUxpgw,"I am SHOCKED!! What a wonderful, accurate and informative video!! Keep up the great work!",0.40625,positive
1273,wb6IiSUxpgw,I surely didn't expected this face... I been following this channel for 2 yrs but surely was not imagining this face,0.225,positive
1274,wb6IiSUxpgw,"This is the best summary I saw so far. Kudos! You are very intelligent and your videos very objective. Bravo!
I wish you great future!",0.4875,positive
1275,wb6IiSUxpgw,"Thanks for sharing your knowledge. I've learned more from your 10 minute video than 30 years of media coverage in my country did.

Greetings from the Netherlands.",0.35,positive
1276,wb6IiSUxpgw,"Lots of great info, with no fluff and to the point.",0.42500000000000004,positive
1277,wb6IiSUxpgw,"It's like rocket science. 
But you explained it well.",0.0,neutral
1278,Cj_Pr38vj8k,"Wion ,study iq, world affairs 

These 3 made me addicted to current affairs",-0.2,negative
1279,Cj_Pr38vj8k,"I’m from Algeria 🇩🇿 and I find this channel very informing, I think she does an excellent job as true reporter with plenty knowledge of history and culture, highly recommended 💯",0.42749999999999994,positive
1280,Cj_Pr38vj8k,"Palki you have a wonderful  voice , regards from 🇦🇱. Albania.",1.0,positive
1281,Cj_Pr38vj8k,"Her voice tone has such a fine reproach when she said that “the Brits washed their hands of all responsibility, when they left Israel (1948) in a mess,  just as they left India and Pakistan after partition”",0.04833333333333334,positive
1282,Cj_Pr38vj8k,Palki Sharma Upadhyay is the best journalist of our times. Greetings from the Philippines.,1.0,positive
1283,Cj_Pr38vj8k,This is the closest factual explanation about Jerusalem that I have ever come across.,0.0,neutral
1284,Cj_Pr38vj8k,"""it's symbolism lost in reality"". Facts well said and understood.
Great woman.",0.8,positive
1285,EhFbVjntcvg,Since when does the man holding the weapon do the investigation? Thank goodness our courts don't allow that.,0.0,neutral
1286,EhFbVjntcvg,"We can never tell a lie! ""The Intercept showed how the Israeli operators of a Hermes 450 were responsible for killing four Palestinian children, cousins aged 10-11, playing on a beach during the 2014 Operation Protective Edge. They killed one child with the first missile fired, and then fired a second missile which killed the remaining three.""",-0.008333333333333337,negative
1287,EhFbVjntcvg,Can we have  our 14 billion dollars back ?,0.0,neutral
1288,EhFbVjntcvg,"If you said it, it’s 100% the truth🤣",0.0,neutral
1289,EhFbVjntcvg,There's nothing humanitarian about what's happening... but I'm African..I stay in humanitarian crisis with No War...thank you Everybody,0.0,neutral
1290,EhFbVjntcvg,Saying netanyahu is not a war criminal is like saying biden can run up the stairs without stumbling.,-0.4,negative
1291,EhFbVjntcvg,"It’s a new low, even on top of all the attrocities they have comitted. This is disgusting and depraved. To do this to starving human beings. If anybody else did it, make no mistake, it would not go unpunished.",-0.07272727272727272,negative
1292,EhFbVjntcvg,"FOX NEWS, WHAT WAS CENSORED BETWEEN 1:45 and 1:58 ???

13 seconds of SILENCE",0.0,neutral
1293,EhFbVjntcvg,Tbh we need an independent investigation,0.0,neutral
1294,EhFbVjntcvg,"They've changed their story 10 times...

Why should America support this?",0.0,neutral
1295,jG8NpxLwU5k,"For academic purposes, watch more detailed analysis of Israel-Palestine Conflict..",0.3,positive
1296,jG8NpxLwU5k,Do you know the problem with the problem,0.0,neutral
1297,jG8NpxLwU5k,Those who know the thing is good to hear when they say something .. I wanted I wanted to know. Well given it. Thanks.,0.44999999999999996,positive
1298,jG8NpxLwU5k,"18 minutes to explain 108 years of violent history. Hats off,  Alex.",-0.8,negative
1299,jG8NpxLwU5k,Ippo 2023 October in Kaanunna Var Undo ... AFTER ISRAEL PALESTINE WAR ...,0.0,neutral
1300,jG8NpxLwU5k,Given the exactly introduction of things without communal red tinges unlike other channels ....,0.041666666666666664,positive
1301,jG8NpxLwU5k,"If history is checked, you can see the nail stone's stone as British",0.0,neutral
1302,jG8NpxLwU5k,.... Thank you brother,0.0,neutral
1303,jG8NpxLwU5k,This channel is in the course of the time. Learn about Social Science,0.03333333333333333,positive
1304,jG8NpxLwU5k,Do not kill the innocent babies ..,0.5,positive
1305,exyQ724_2nk,"World peace to everyone. No more war, no more hurts and no more pain but love.",-0.0625,negative
1306,exyQ724_2nk,The General is a very composed and resilient. You need this kind of leadership,0.2833333333333333,positive
1307,exyQ724_2nk,emotional for sure. i am not jewish and i am crying. both sides are crying. peace. we all need peace,0.019999999999999997,positive
1308,exyQ724_2nk,"What was important to hear first and foremost was that the ""home"" was recognized as a place of peace, family, and all that represents. It does not matter who the home belongs to - it is other people occupying it without invitation. HOW indignant other people from other countries would feel if this happened to them - yet Palestinian people have to accept it as part of the norm - their homes destroyed as part of the expansion and just because others ""CAN"".  It is not so long ago 75 years or so that Jewish homes were appropriated, their property either seized, confiscated, or destroyed. It makes no difference.  The feeling is exactly the same - helpless, traumatized, and violated. I do not condone any action of violence. ALL peoples deserve peace all over the world no matter who they are no matter what. Everyone deserves to be accorded dignity and respect.",0.05750000000000001,positive
1309,exyQ724_2nk,"Neighbors are like extended family. There is a border, but you are neighbors.
Help each other, don't hurt each other. Conflict will never solve anything.",-0.125,negative
1310,exyQ724_2nk,It is sad to see this happen to the civilians but they are not being attacked they are being moved to another fully built home recompensed and transported there with respect... Which is way more than how the Palestinian families were being treated by these people,0.0,neutral
1311,exyQ724_2nk,"What the outside world doesn't know is that those settlers came from all over the world, had Palestinian natives evicted from their own homes, and took those Palestinian homes and started living happily in them.",0.4666666666666666,positive
1312,exyQ724_2nk,"One of the most strangest and bizarre things ever…
they are acting like this on another peoples land, that’s not even theirs. Where did they even come from anyway??",0.3,positive
1313,sUE8N74opz0,The genocide of Bengali Hindus in East Bengal now Bangladesh is very much under stated and not discussed,0.26,positive
1314,sUE8N74opz0,The irony is that those who are condemning the (extremely saddening) death of hundreds of children didn't even comment on the October 7 massacre.,-0.125,negative
1315,sUE8N74opz0,"This guy took the words out of my mouth. This is actually my stand out of this whole situation. It's sad, because other people won't understand this and will instead condemn you for standing in the middle.",-0.08499999999999999,negative
1316,sUE8N74opz0,Explained impeccably! Every minute of the 52 minutes was worth it especially for someone who is here to genuinely understand the situation between Israel and Palestine.,0.40937500000000004,positive
1317,sUE8N74opz0,People who are supporting and Protesting for Palestine I have never seen same people protesting and Standing with Kashmiri Pandits who are living Refugees life in their own country.....,0.2833333333333333,positive
1318,sUE8N74opz0,Cannot be more happy for bringing Abhijit back on the podcast 💝,0.43333333333333335,positive
1319,sUE8N74opz0,Every Indian needs to watch this. Awareness is the biggest strength!,0.0,neutral
1320,1Q575bziwXQ,Lesson learned: don't let British people draw borders,0.0,neutral
1321,1Q575bziwXQ,"Basically, never let the British draw borders",0.0,neutral
1322,1Q575bziwXQ,"Team not wanting civilians dying
👇",0.0,neutral
1323,1Q575bziwXQ,Raise your hand if you support humanity,0.0,neutral
1324,1Q575bziwXQ,"Team peace ❤
👇",0.0,neutral
1325,1Q575bziwXQ,"Peace No War #stopwar 🇮🇱❤️🇵🇸
👇",0.0,neutral
1326,1Q575bziwXQ,"Israel team
👇",0.0,neutral
1327,1Q575bziwXQ,You forgot to mention that the Arabs also received Jordan from the previous British mandate.,-0.08333333333333333,negative
1328,1Q575bziwXQ,"Team Peace 
👇🏻",0.0,neutral
1329,1Q575bziwXQ,Raise Your Hands ✋️ If You Support Palestine 👇,0.0,neutral
1330,aoCf0yEO6U4,Isn't the most valuable human lifestyle to miss anyone or to feel ..,0.25,positive
1331,aoCf0yEO6U4,"* Prior to the end of God, we should end up and end the religion and caste",0.0,neutral
1332,aoCf0yEO6U4,"""അത്തരം കാര്യങ്ങൾ നമ്മുടെ നാട്ടിലേക്ക് വലിച്ചിഴച്ചു കൊണ്ട് വന്ന്, നമ്മൾ പരസ്പരം തർക്കിച്ചുകൊണ്ട്, നമ്മുടെ നാട്ടിൽ ആ പ്രശ്നം വ്യാപിപ്പിക്കാതെ ഇരിക്കാം.... നമുക്ക് ആ കാര്യങ്ങൾ പഠിക്കാൻ വേണ്ടി എടുക്കാം. ഭാവിയിൽ അത് നടക്കാതെ ഇരിക്കാൻ നമുക്ക് അത് ഉപയോഗിക്കാം "" ❤☮️😇",0.0,neutral
1333,aoCf0yEO6U4,I have been to both Israel and Palestinian in April. How you explained the situation is correct and clear 👍,0.10000000000000002,positive
1334,aoCf0yEO6U4,There should be no life and a lives. There are only. We do not live by one hundred years. Live comfortably in the days. Everyone is human.,0.09363636363636364,positive
1335,aoCf0yEO6U4,* Britain himself in front of the fishing of the Map in the world. Example India Pakistan Bangladesh.,0.0,neutral
1336,aoCf0yEO6U4,All the children are the same pain. Nay in any country ....,0.0,neutral
1337,aoCf0yEO6U4,This was what you have to do with a lot of channel. The presentation is crying.,-0.2,negative
1338,4vsEM90JSGI,Finally someone has the balls to tell more truth .,0.25,positive
1339,4vsEM90JSGI,"Wow. Unbiased report from Global?

My heart is broken for the families and children facing these atrocities 💔",-0.10000000000000002,negative
1340,4vsEM90JSGI,I'm shocked this is being shown on mainstream media.,-0.7,negative
1341,4vsEM90JSGI,Thoughts and prayers are for the innocent lives.,0.5,positive
1342,4vsEM90JSGI,Respect to global news,0.0,neutral
1343,4vsEM90JSGI,blessings for all 👏,0.0,neutral
1344,4vsEM90JSGI,Thank you @global for having the courage to report the truth!,0.0,neutral
