,video_id,comment,polarity,sentiment
0,R0ftmf_Uv9A,No matter how many times these information gets thrown to our eyes. The ignorant will remain put a blind eye to the oppressed which is sad.,-0.16666666666666666,negative
1,R0ftmf_Uv9A,Let peace prevail.,0.0,neutral
2,R0ftmf_Uv9A,Why start at 1946?,0.0,neutral
3,R0ftmf_Uv9A,What happened the video was removed and put again!!,0.0,neutral
4,R0ftmf_Uv9A,"This is not a  conflict, this is occupation.",0.0,neutral
5,R0ftmf_Uv9A,"*To learn who RULES over you, simply find out who you are NOT allowed to CRITICIZE.*",0.0,neutral
6,R0ftmf_Uv9A,So sad. They were living in peace and now suffering for 7 decades 😢,-0.5,negative
7,R0ftmf_Uv9A,Thanks for the video. True history but youtube make it age restricted?,0.275,positive
8,R0ftmf_Uv9A,"Very interesting thing is that ,if you will look the map carefully, Israel very smartly captured the areas 1st which are bordering to jordan  to block any type of access through Jordan! So,that it will be easier for Israel to capture whole Palestinian land!!",0.30267857142857146,positive
9,Bno1m1zhIWs,Who else is here trying to understand what’s going on right now,0.2857142857142857,positive
10,Bno1m1zhIWs,This is the first video which has actually explained things thoroughly! Best way to understand a problem is go back to the original roots of the situation. Thank you for the insight.,0.325,positive
11,Bno1m1zhIWs,The best and most concise clip on explaining this conflict I have ever seen.  And in only six minutes.,0.4,positive
12,Bno1m1zhIWs,Thank you for this excellent breakdown of the history. So many have never heard the total story. Your summation of the multigenerational conflict was well presented.,0.5,positive
13,Bno1m1zhIWs,Great Britain has caused so many problems throughout history,0.65,positive
14,Bno1m1zhIWs,"Not that one will ever put perspective to a child losing their life, but this has helped breakdown of the history summarising of the multigenerational conflict that has led up to date. Thank you for your unbiased insight!",0.0,neutral
15,0anQIEeLonA,"From someone who's a history buff, thank you for this unbiased reporting of history.",0.0,neutral
16,0anQIEeLonA,"Cool finally someone telling both sides of the story , the true history and in unbiased way. Nice video worth sharing",0.31999999999999995,positive
17,0anQIEeLonA,"I've done some basic research on this subject over the years, but so much of what was presented in this video is new to me...I applaud the creators for giving such a concise and focused account, sharing each side's POV, giving us a much clearer view on the past and present situation 👏🏾👍🏾",0.024410774410774414,positive
18,0anQIEeLonA,"As a Palestinian, I have always felt some bias from Indian media against us. But I have to be fair, you have done a good job summarizing the history of the conflict. Thanks",0.5333333333333333,positive
19,0anQIEeLonA,"Amazing synopsis, pertinent timelines, and balanced & unbiased presentation…all done in approx 14 minutes!😂❤ My decree:  This MUST be shared with the multiples!😂",0.6000000000000001,positive
20,0anQIEeLonA,I like this episode because it's really a history that would understand to those who can't understand the history before. Good luck!,0.5375,positive
21,0anQIEeLonA,"The most concise , informative explanation of this crisis done in under 14 minutes. I’ll pass this on and hope others do too.",0.3,positive
22,0anQIEeLonA,This informative video brings a lot of clarity about the ongoing crises in West Asia. Thumbs Up!,0.0,neutral
23,0anQIEeLonA,Thank you for explaining the reasons for this war from both sides so clearly and factual. I appreciate the history lesson.,0.10000000000000002,positive
24,iRYZjOuUnlU,"UK : Prepare for trouble
US : And make it double",-0.1,negative
25,iRYZjOuUnlU,"""Unless something dramatic changes, whatever comes next will be much worse.""

That sent chills down my spine.",-0.2472222222222222,negative
26,iRYZjOuUnlU,Would I be wrong in saying that England kind of botched this entire thing and kind of gets let off the hook for creating a lot of this conflict?,0.175,positive
27,iRYZjOuUnlU,*”Unless something drastic happens - whatever comes next will be much worst”* famous last words and oh boy were you right 🥺🥺,-0.04285714285714286,negative
28,iRYZjOuUnlU,What a great video. A lot of people my age blindly support one side or the other without actually knowing anything about the history at all,0.04375000000000001,positive
29,iRYZjOuUnlU,Thank you for this video. It really cleared things up because I was misinformed by one of my acquaintances regarding the history of Palestine-Israel. I'd like to be educated more about this conflict.,0.35,positive
30,iRYZjOuUnlU,"Britain and France be like: ""Hobbies include drawing straight lines on maps""",0.2,positive
31,iRYZjOuUnlU,"""If you're not careful, the newspapers will have you hating the people who are being oppressed, and loving the people who are doing the oppressing"". 
- Malcolm X



edit: In order to not ruin anyone's day, I want to clarify that both  the Israeli military and Hamas are in the wrong here. What I was trying to say with that quote was that Israel had no right to do what they did in Gaza and the West bank",-0.01857142857142856,negative
32,E4iygQ--7dk,"Another thing, when britain received he mandate over the region, it divided palestina into two part, the eastern part was given to the Hashemite family from Saudi arabia in exchange for their support in the first world war. This is how the state of jordan was created, which is actually part of palestina. Most of the Jordanians are palastinian.",0.25,positive
33,E4iygQ--7dk,"A Brief History of the name Palestine and its derivative Adjective Palestinian:

 1.	Palestine is Judea, the Roman name for ‘Land of the Jews’ when the Roman Emperor Hadrian re-named this land as Palestina in 135 CE. Since then, it was never an Islamic State. [‘In the 2nd century CE, the Romans crushed the Jewish revolt and Judea was renamed Syria Palestina’ – Jewish Virtual Libr.]

2.	The Pre-Islamic Arabs were in the Roman armies and witnessed both Jerusalem’s destruction and the name change of Judea. [Flavius Josephus Wars, Book V, Ch 13, 4]. As well, the Quran mentions Israel as the land of the Jews. Thereby, the Muslim people would be fully aware Palestine referred to the Jews for 2,000 years.

3.	The historical archives of the Persians, Greeks, Romans, British, French and Americans refer to Palestine as the ‘historical homeland of the Jews’, not of the Muslim peoples. America’s early Presidents initiated Israel’s return prior to Britain and Herzl: “Restoring the Jews to their national home in Palestine is a noble dream. My emancipated hope is the restoring of the Jews to their nation home in Palestine” - President Abraham Lincoln to Canadian Zionist Wentworth Monk; 1863. 

4.	The term Palestine was introduced in the Hebrew Bible from the term Plishtim [‘Invaders’]. The Muslims disdained the name Palestine, as they do the term ‘Zionists’ today. In 1947, the Arabs virtually begged of Britain not to use this name for the land. Thereby, the usurping of this name in the 1960’s is not credible as a mark of land ownership, because it was not one of historical usage by the Arabs. 

5.	 A host of Islamic scholars and historians decried and rejected Muslims as Palestinians.: “Allah Gave the Land of Israel to the Jews. The al-Aqsa Mosque was built on top of Solomon’s Temple.” - Eleventh century historian Muhammad Ibn Ahmad al-Maqdisi and fourteenth century Iranian religious scholar Hamdallah al-Mustawfi // “There is no such thing as ‘Palestine’ in history, absolutely not.” - Arab-American historian and Princeton University Professor, Philip Hitti, testifying before the Anglo-American Committee in 1946] 

6.	A host of Jewish organizations and Institutions were called by the prefix of Palestine or Palestinian in the 20th century, including ‘The Jewish Palestine Brigade’ in Britain’s WW2 Military Forces; The [Jewish] Palestine Symphony Orchestra; Today’s Jerusalem Post media was called “The Palestine Post”. 

7.	 There are no Arab Muslim Palestinians on record prior to the 20th century; the land was referred only as the homeland of the Jews. It is validated by a host of archives by many nations, and some one million Archaeological relics. Thereby, the nativity claim can only apply to Jews. In fact, there was never a time of no Jews in Palestine the past 2,000 years, as evidenced by the Crusaders, Islamic invasions and the previous Ottomans. 

8.	Generally, real natives do not usurp the name of other natives, especially one they disdained. [“There is a propaganda war going on now with regard to the term ‘Palestine.’ It is specifically employed to avoid the use of the name Israel, and must be considered an anti-Israel term.” - Dr. Thomas McCall, the Senior Theologian of Levitt Ministry, quoting Zola Levitt.] 

9.	 The previous Islamic Ottoman rulers of Arabia declared Palestine as the homeland of the Jews. - “Who can challenge the rights of the Jews in Palestine? Good Lord, historically it is really your country” - Ottoman Mayor and scholar Yusuf Diya al-Khalidi; Jerusalem, 1899. 

10.	 Judea’s original, previous name was Israel in 1002 BCE, established under King David; and again in 1947 when this country was re-established by the UN. ‘Israel’ is mentioned in the Quran as one belonging to the Jews. [Joshua J. Mark , Ancient History Encyl.) 

11.	 All Religious Scriptures acknowledge Palestine as the ‘Land of Israel’; ‘Land of Judea’; and ‘Land of the Jews’ – including the Hebrew Bible [1 Samuel 13:19]; The New Testaments [ ‘And he arose, and took the young child and his mother, and came into the land of Israel.’ - Matt. 2:21]; The Quran - [Surah Al-Ma'idah 5:20-21.]; and the Dead Sea Scrolls. 

12.	 The Original Philistines converted to the Hebrew Belief and became Israelites. The term Palestine is derived from the Philistines, a Greek Island people who invaded Canaan some 4,000 years ago. The Philistines converted to the Hebrew belief under a peace offer by King David, and held prominent positions in David’s army. [“They (the Philistines) met with a severe defeat, however, early in the reign of David (2 Samuel 5:20), he succeeded in reducing them to a state of vassalage (2 Samuel 8:1). In the year of the fall of Samaria (721 B.C.) they became vassals of Sargon. After the time of the Assyrians the Philistines cease to be mentioned by this name. In the ebb and flow of warring nations over this land it is more than probable that they were gradually absorbed and lost their identity. - [The Catholic Encyl.). / The Philistine cities lost their independence to Assyria, and revolts in following years were all crushed. [Myers 1997, p. 313.] / The theory of the “Lost Ten Tribes” calls for (1) all inhabitants of the Northern Kingdom of Hoshea to be deported by Shalmaneser and Sargon, 722-718 B.C [Hearyhim, Weebly, Armstrongism] / They (the Canaanites) were indeed assimilated into the Israelite nation. When the Assyrians overran the Kingdom of Israel, they did not leave any Canaanite aside, as they had all become Israelites by that time. Therefore, the only people that can trace back a lineage to the ancient Canaanites are the Jews. The Canaanites did not exist any longer after the 8th century b.c.e. and they were not annihilated but assimilated into the Jewish people. - [The True Identity of the So-called Palestinians, imninalu] / The Bible describes the Philistines as remaining “subdued” during David’s reign [Philistine; New World Enycl.]/ Josephus, Antiquities, Book 11, Ch.1] & [Esdras 13:39] Q. How then did the Muslims become Palestinians, an adjective of Palestine, in the 1960’s, and have been using this name as the antithesis of Judea and Israel¬¬¬? A. The Palestinian Name Deception: Those in the West who manoeuvred this name upon Muslims did so to mock, if not desecrate, the history, belief and culture of the Muslim people. Thereby it should be overturned by honourable Muslims.",0.06912878787878787,positive
34,E4iygQ--7dk,Your 1967 Map is wrong this was not occupied land.,-0.5,negative
35,E4iygQ--7dk,Well it seems that the creator of this video skipped a few HISTORY lessons.,-0.2,negative
36,E4iygQ--7dk,History starts from canaan period not 1946,0.0,neutral
37,E4iygQ--7dk,Wonderful explanation..,1.0,positive
38,E4iygQ--7dk,Looks like a rat nibbling cheese,0.0,neutral
39,E4iygQ--7dk,"🤣THAT IS NOT a map of Palestine In 1946 LOL ""Palestine"" the country or well ""the state of palestine"" didnt even exist yet. In fact in 46 Israel didnt even exist lol. It was founded in 2 years later, and the state of palestine over 40 years later. That ENTIRE area was British Mandate Palestine, which wasnt even a country first of all and then named it after the roman name of Syria Palestine, which the romans had renamed from ""Roman Province of Judea"", after beating the jewish revolt and expelling jews from their land, they renamed it after the jews historical enemies, The philistines (which have NOTHING to do with Palestine or modern day Palestenians) SO NO, that is NOT a map of ""Palestine in 46.. I mean if within the first 3 seconds you cant be unbiased, and historically accurate why even bother tackling this incredibly complex subject?",0.12805555555555556,positive
40,E4iygQ--7dk,🎉,0.0,neutral
41,ZQUtT3pnw5Q,What do you think of the conflict going on right now?,0.2857142857142857,positive
42,ZQUtT3pnw5Q,the history of the two seem very different depending on who’s telling the story.,0.0,neutral
43,ZQUtT3pnw5Q,As someone who has some Jewish ancestry my best friend living there and having cousins all throughout Israel and knowing some good honest Palestinian Americans it’s just sad,0.36,positive
44,ZQUtT3pnw5Q,We want peace! No more war,-0.25,negative
45,ZQUtT3pnw5Q,"I think ti is time to find a proper solution - understanding, peace, respect , and acception of each other",-0.0625,negative
46,ZQUtT3pnw5Q,"""When a foreigner resides with you in your land, you must not oppress him. You must treat the foreigner living among you as native-born and love him as yourself, for you were foreigners in the land of Egypt. I am the LORD your God."" Leviticus 19:34",0.5,positive
47,ZQUtT3pnw5Q,"Some reading for people interested in knowing more about the issue:

Enemies and Neighbours: Arabs and Jews in Palestine and Israel, 1917-2017 by Ian Black;
Anonymous Soldiers: The Struggle for Israel, 1917-1947 by Bruce Hoffman;
1948: A History of the First Arab–Israeli War by Benny Morris.",0.20833333333333334,positive
48,ZQUtT3pnw5Q,Good conclusive video,0.7,positive
49,6foH3Zc82ZQ,it's unbelievable that nobody mentions or blames the British for setting up the region for failure.,-0.18888888888888888,negative
50,6foH3Zc82ZQ,I'm blown away by the Jewish solder laughing when he was asked how many Palestinians he had killed. No loss of life should ever be met by laughter.  This has truly troubled me,-0.05,negative
51,6foH3Zc82ZQ,"As I say, you don't have to be a Muslim to feel the pain, you just have to be a human",0.0,neutral
52,6foH3Zc82ZQ,never let a british guy near a map and ask him to draw borders,0.05,positive
53,6foH3Zc82ZQ,"Watching a documentary that presents the formation of modern Israel in such a grim light is personally jarring for me. I had long held the view of Israel as a sanctuary for a people who had suffered immeasurable atrocities. To suddenly be confronted with the idea that its foundation is marred by acts of violence, terrorism, and potentially even genocide against Palestinians shakes the core of what I thought I knew. It's like experiencing a form of betrayal, where a narrative I held to be virtuous is revealed to have dark undertones. It's not just an intellectual exercise in reassessing history; it's a gut punch that makes me question the stories we're told and the stories we choose to believe. It's a painful reckoning with complexity in a world that's easier to navigate in black and white.",-0.08333333333333334,negative
54,6foH3Zc82ZQ,"What blows my mind is that after experiencing all the atrocities and persecution in Europe, Jewish people went and did pretty much the same thing to Palestinians.",0.1125,positive
55,6foH3Zc82ZQ,A lot of people are not informed about this history especially the younger generation. Knowledge is of great importance.,0.26666666666666666,positive
56,6foH3Zc82ZQ,"This sounds similar to how British split India, Pakistan, and Bangladesh. Once they understood they couldn't trouble anymore actively,  they left a passive trouble as a separation gift. The entire Indian Subcontinent is still enjoying that gift!",0.01145833333333332,positive
57,6foH3Zc82ZQ,"I think the more you try to isolate yourself as ‘the chosen people’ based on your religious believes, the more you will always want to fight to stay separated from other nations. As long as that’s the belief, the war will never end. No one is too special or more equal than another, we are all mere human beings just passing by, just live in harmony with others.",0.11986422668240851,positive
58,6foH3Zc82ZQ,Most of the misery in the world is created by the UK and US,0.5,positive
59,RW105kjNtho,"""If you aren’t careful, the newspapers will have you hating the people who are being oppressed and loving the people who are doing the oppressing.”
― Malcom X",0.25,positive
60,RW105kjNtho,"The world would bend toward justice if discussion and criticism of Israel didn't automatically get deemed ""antisemitic."" It's entirely possible to question Israel and not hate Jewish people.",0.13333333333333333,positive
61,RW105kjNtho,This series came out a long long time ago. What’s really sad is that people are just now watching this. It’s not perfect but it definitely a start,-0.22000000000000003,negative
62,RW105kjNtho,"This is also why Africa is and been in the state it's in, because of the English, French and Belgium.",0.0,neutral
63,RW105kjNtho,Dang Timeline quick wit it,0.3333333333333333,positive
64,RW105kjNtho,Thank you for having this treasure trove of interviews and perspectives to release at such a confusing and disheartening point in our time.,-0.15,negative
65,RW105kjNtho,I am ashamed that I served in the Middle East and had no idea of the full history of rationale of it all. Thank you for the insight on what caused the tension.,0.175,positive
66,RW105kjNtho,"The part about the Arab communities having a strong case but no good advocates, and the Jews having a weaker case but excellent advocates is a perfect summary of how this panned out.",0.5208333333333333,positive
67,hdYZtRQ_eeo,"You're doing a public service with these deep dives - well-researched, with strenuous efforts to represent fraught issues in ways the participants might recognize, and just enough humor (but no more) to make the medicine go down. Thank you.",-0.0811111111111111,negative
68,hdYZtRQ_eeo,"I have done tremendous amounts of research on this subject, and I found your content to be incredibly accurate and unbiased. That is not an easy feat! I have recommended this to my friends who, like myself, are neither Jewish nor Muslim. Knowledge is POWER. Thank you for your hard work! Keep it up. ☮️",0.12395833333333334,positive
69,hdYZtRQ_eeo,As an educator Simon is invaluable! Hopefully this will help keep the messages of critical thinking and science  based decision making loud and clear.,0.06666666666666667,positive
70,hdYZtRQ_eeo,"I always enjoy Simon's videos across a number of his channels, but this video elevates the quality to a whole new level.",0.24545454545454548,positive
71,hdYZtRQ_eeo,"2:55 - Chapter 1 - Ottomans & zionists
27:45 - Chapter 2 - During the war; after the war
36:20 - Chapter 3 - Civil war
43:35 - Chapter 4 - Suez & 6 day
54:35 - Chapter 5 - Interlude & consolidation
1:02:55 - Chapter 6 - The yom kippur war
1:07:25 - Chapter 7 - Normalization & palestinian isolation
1:13:20 - Chapter 8 - Intifada 
1:18:50 - Chapter 9 - The rise of hamas
1:27:00 - Chapter 10 - Intifada ; redux
1:34:45 - Chapter 11 - Elections & internal warfare
1:42:20 - Chapter 12 - 2 state solution ; 2 palestine situation  
1:47:55 - Chapter 13 - Recent developments",0.0,neutral
72,hdYZtRQ_eeo,"Don't ever feel guilty about asking your community for support, you provide knowledge and perspective that cant be valued. Appreciate you.",-0.5,negative
73,fGH94HoSJ2s,This is by far the best coverage of the conflict I have seen so far. Excellent!,0.55,positive
74,fGH94HoSJ2s,Amazing! I'm looking forward to the second part!,0.37500000000000006,positive
75,fGH94HoSJ2s,PART 2 please.  amazing clarity,0.6000000000000001,positive
76,fGH94HoSJ2s,I love your videos. You have helped me learn about history way faster than ever,0.5,positive
77,fGH94HoSJ2s,"Well at the current situation it can be an explosive topic, but very informative to form one's own opinion..",0.26666666666666666,positive
78,fGH94HoSJ2s,A clear informational video that shows the history of the region. Looking forward to part two.,0.10000000000000002,positive
79,fGH94HoSJ2s,"Wonderful video, as always. Thank you. Note: the bottom part of Africa is not the Horn of Africa.",1.0,positive
80,fGH94HoSJ2s,Is there an IWM video about TE Lawrence? I’d be interested in that.,0.25,positive
81,fGH94HoSJ2s,Thanks for creating vids relating to modern day events. Truly educational and entertaining!,0.31875,positive
82,kI_spMxp6t8,As a uk citizen I agree with you. We have done so much damage over the decades.,0.2,positive
83,kI_spMxp6t8,"Think of a scenario: someone came into your house as a guest and you let them stay. But within a few days he said that he's also the owner of the house, and after a few more days he kicked you out of YOUR OWN HOUSE.

The same thing happened with the people of Palestine, they were the house owner and now Israel forcefully trying to kick them out of their own lands.",0.21666666666666665,positive
84,kI_spMxp6t8,"I don't know... the whole ""We're God's chosen people"" thing doesn't sound that much different than Hitler declaring the Germans to be the master race to me.",0.20000000000000004,positive
85,kI_spMxp6t8,What right did America and Britain have to sign off another man's land to another people? This is the root cause of the conflict in the Middle East.,0.14285714285714285,positive
86,kI_spMxp6t8,I want to see more information on this topic but it does seem to be a major issue. I must admit that I agree with the people of Palestine. Israel seems to be more evil in their actions to steal the land of Palestine. I think this situation should have been treated differently and all of this violence will not happen.,0.0125,positive
87,kI_spMxp6t8,"Similarly in India, British left in a rush and left India and Pakistan fighting against each other.",-0.025,negative
88,kI_spMxp6t8,"Compared to western reworks on this topic, this video is qualitative and truthful. Thank you, you are doing indispensable work against hypocritical reporting.",0.3,positive
89,ZXfuqUhzESg,Britain as well as many European nations on history have started many conflicts around the world that people are still suffering from in those respective countries.,0.25,positive
90,ZXfuqUhzESg,I wish this could be part of school teaching so our children will learn.,0.0,neutral
91,ZXfuqUhzESg,"It is very good to see a piece which gives such a clear history of the deals, both secret and open, which have led to the conflict which continues.  It is important for everybody to understand how this has come about.",0.16833333333333333,positive
92,ZXfuqUhzESg,"I appreciate the work that went into making this documentary. Whoever you are, thank you.",0.0,neutral
93,ZXfuqUhzESg,"It's funny how we get the rawness of history through the windows of documentaries and such a like, but never taught in the educational system.",0.16666666666666666,positive
94,ZXfuqUhzESg,"By far this is the very best documentary on The Israeli-Palestinian Conflict that I have ever seen!
Beautifully created and laid out!",0.525,positive
95,zE8GCX1w3ys,I’ve been trying to figure this conflict out. The problem is every video has a different narrative.,0.0,neutral
96,zE8GCX1w3ys,You left out the part where 2/3 of the area was given to create Jordan.,0.0,neutral
97,zE8GCX1w3ys,"Historical fact; The Romans changed the name of Judea to Syria Palaestinia in 135 AD after the Bar Kokhva Revolt, which is sometimes called the Third Jewish-Roman War. At the same time, the Romans expelled most Jews from the province. The purpose was to destroy the cultural identity of the province, and spread the Jews throughout the empire in order to prevent another revolt.",0.06666666666666667,positive
98,zE8GCX1w3ys,The way he emphasizes the 27% when speaking about the Jewish population rising really says it all.,0.1,positive
99,zE8GCX1w3ys,What about the 3000 years before the first world war? And you failed to mention the Balfour agreement.,-0.125,negative
100,zE8GCX1w3ys,Lol “Let’s go back to the beginning 1916” 😂😂 oh yea that’s totally the beginning,0.26666666666666666,positive
101,zE8GCX1w3ys,"Up until 4:00 , his complaint would be with the British and the UN.
Immediately after that, there is no mention of Arab nations attacking Israel.
So are all of the other historical sources wrong, or is he merely choosing to omit any facts that might support Israel?",-0.23750000000000002,negative
102,zE8GCX1w3ys,Bro graduated from Wendy's kitchen 💀,0.0,neutral
