,video_id,comment
441,Jb2YMvfvm_M,"My mother told me "" Never take drugs from convicted felons with legal indemnity . """
442,Jb2YMvfvm_M,"""For the first time in history the ineffectiveness of a medicine is being blamed on those who refuse to take it."" ~ Dr. Robert Malone"
443,Jb2YMvfvm_M,My best piece of advice I ever got from an elderly person was to stay away from mainstream healthcare for as long as your body allows. Do everything in your power to stay fit and healthy to ensure you don't need any medical interventions. I only now truly understand what he meant.
444,Jb2YMvfvm_M,"I have family and friend passed away days and weeks after.
I am 66.  No vaccuies or pills. No flu shots full of Virus.  I feel good.   Thank you God."
445,Jb2YMvfvm_M,"Chuck Norris took his dad to the doctor at age 96.  The doctor said he was in stellar health, for his age, and asked what was his secret.  
He said, ""I stayed away from you guys as long as I could"".  True story"
446,Jb2YMvfvm_M,"My best friend died a few months ago from a blood clot.. he was laid in his chair for two days until a neighbour alerted the Police to kick down his door to find him.

He laughed at me when I tried to tell him not to take this poison, I told him that his immune system would fight the virus off.. but he didn’t listen. He had every shot and every booster shot.. now he is gone."
447,Jb2YMvfvm_M,We're witness to the greatest crime against humanity ever seen.
448,Jb2YMvfvm_M,"Years ago, one of my pre-med professors told my entire class to never take a drug within it's first 5 yrs of development unless your life depends on it because researchers never really know the extent of what a drug can do until it's administered to a massive population of people. It takes years for that data to trickle in... I never forgot that. 😥"
449,Jb2YMvfvm_M,"The longer this has gone on, the more relieved I am that I never got the jab."
450,Jb2YMvfvm_M,"Some people would never accept this as they were brainwashed into taking it,  really sad."
451,AQhiMirOODY,Always do the opposite of what Matt Damon tells you to do.
452,AQhiMirOODY,"Well, I'm convinced. Matt knows how to say what he is told to say."
453,AQhiMirOODY,"I'm not sure I could put into perspective how little I care about Matt Damon's opinion on anything, really."
454,AQhiMirOODY,"I'm so glad we have Hollywood ""health experts"" telling us what to do with our bodies! We regular people are just too dumb to think for ourselves!"
455,AQhiMirOODY,I'm only getting the jab when I hear Shrek's professional opinion on this.
456,AQhiMirOODY,"Hey Matt, maybe you can explain why your friends are more important than the thousands upon thousands of victims who have had their lives and health snatched away from these vaccines."
457,AQhiMirOODY,What does Ja Rule think about this though
458,AQhiMirOODY,"Will listen to my MD certified Pathologist wife who warns against vaccine dangers before considering professional actor Mr Damon's ""science""."
459,AQhiMirOODY,I honestly need to hear Mr. Beans input on this issue!!
460,AQhiMirOODY,*I just got my first shot and I'll be getting my 2nd shot as soon as the bartender comes back.*
461,1m_iclAMXLo,The Governor trusted the CDC just like 70%. Only politician to admit he was wrong. Right on Ron
462,1m_iclAMXLo,"O my God, he changed his mind  when more information became available as time went on!!Sounds like a smart person"
463,1m_iclAMXLo,He changed his mind when 30 year olds suddenly starting dying having heart attacks on an alarming rate. Fair play on him for speaking out.
464,1m_iclAMXLo,Being sold a lemon and then realizing later it was a lemon isn’t flip flopping.
465,1m_iclAMXLo,Making vaccines available and making it mandatory are completely different.
466,1m_iclAMXLo,Changing your stance when you find valid information that government officials have been deceptive throughout this entire pandemic process is the sign of a strong leader
467,1m_iclAMXLo,"Honestly, people that spread misinformation should be held accountable for the deaths they caused."
468,1m_iclAMXLo,"“The vaccine should be tested on politicians first.  If they survive, the vaccine is safe.  
If they don’t, then the country is safe.”
—  Monika Wisniewska
…….."
469,1m_iclAMXLo,All states need to investigate Covid
470,1m_iclAMXLo,A wise man will change his mind a fool won't.
471,Kd-E95tXfsY,This didn't age well.
472,Kd-E95tXfsY,MRNA turns your body into a spike protein factory and doesn't let up.
473,Kd-E95tXfsY,"Great explanation. Except new data shows spike proteins from mrna can enter cell nuclei, so  there are questions about whether spike proteins really are as harmless as was first thought."
474,Kd-E95tXfsY,Years ago I used to laugh at my friend for prepping for the zombie apocalypse. Guess who's laughing now. 🙁
475,Kd-E95tXfsY,Your own immune system is better without interruption.
476,Kd-E95tXfsY,"I'll take a pass until the long-term human safety trials are complete, which is what's happening now..."
477,Kd-E95tXfsY,"but if it really works, why is that pharma companies producing that COVID 19 evade legal sanctions and no liability if it fails, since they said it is effective (theoritically)..."
478,Kd-E95tXfsY,I love this channel because it doesn't have any creepy background music
479,Kd-E95tXfsY,“Faith is like a radar that sees through the fog of the reality of things at a distance that the human eye cannot see.”
480,Kd-E95tXfsY,GOD GUNNA HAVE TO WIPE THE GENE POOL AGAIN!
481,-92HQA0GcI8,"This video tells a part of the vaccine story few people get to see. Vaccines aren't miracles. They are the products of research, curiosity, and the hard work of scientists. 
Follow me on Instagram and Twitter and let me know what you thought of this video! @DrJoeHanson @okaytobesmart"
482,-92HQA0GcI8,Gosh that PhD student really hit the jackpot of PhDs
483,-92HQA0GcI8,"3 things I still can't get today:
1. covid vaccine
2. PS5
3. RTX 3090"
484,-92HQA0GcI8,"Dude, amazing explanation video. I really wish they would show more of that on TV instead of all those depressing news about covid and political debates about every single decision."
485,-92HQA0GcI8,"7:57 ""Can you play Doom on this thing?"" Responds with: ""Some of our computers, you are able to play at max settings"""
486,-92HQA0GcI8,"Such a fantastic video, thank you! I get really emotional thinking about how much we are capable of solving huge problems if we really put our minds to it. Very grateful to all the scientists, researchers, health workers, and so many more people, who have put in such a tremendous amount of hard work into developing and distributing vaccines in record time."
487,-92HQA0GcI8,Can we please share this with the broader public? This video was so well designed and easy to digest. It answers so many questions.
488,-92HQA0GcI8,Imagine writing your phd and get to study a pandemic first hand...
489,-92HQA0GcI8,"Lots of love and respect to the science community. The media focuses a lot on crappy influencers, royals, actors and actresses , sports people but they forget about the people working anonymously to save and protect lives."
490,-92HQA0GcI8,Your last statement is extremely important. Supporting basic research is so important.
491,RaLxhFiOBYk,What she didn't realize was that the FDA was in on the crime too.
492,RaLxhFiOBYk,"Your not a whistle blower, your a human being with love and compassion for humanity. Thank you for your bravery and for the sacrifices you have made to bring awareness to what’s really going on the world. We need more people like you and I hope others see this and are encouraged to do the same because our lives and future generations depend on it."
493,RaLxhFiOBYk,"Thank you for speaking out. As a frontline medical worker who lost their job to these mandates to force “vaccines” on people, I truly appreciate any time the truth is told. I am not anti vax, I have willingly had plenty of vaccines introduced to my body. I just want people to have choice and want for big pharma to be open that things are in a trial phase and not fully proven. No one should be an unwilling lab experiment."
494,RaLxhFiOBYk,Prison for these pharmaceutical employers.
495,RaLxhFiOBYk,Nothing but respect and admiration for this woman for speaking out. Thank you 🙏
496,RaLxhFiOBYk,"This lady is so brave and smart! Lucky world to have someone with great morals. Out of so many employees at Pfizer and Ventavia, she is the only one who noticed weird things, realized what was happening, and spoke up."
497,RaLxhFiOBYk,"When exposing a crime is treated as committing a crime, you're being ruled by criminals."
498,RaLxhFiOBYk,"With so little intergrity and morals in the world it's somewhat heartening to see people like this putting they're life and career on the line to tell the truth, thank you."
499,RaLxhFiOBYk,"Thank you, Covid-19 Researcher for your integrity ❤️

May God protect you from these criminals🙏"
500,RaLxhFiOBYk,"My doctor knew about some people having adverse reactions. The medical officials knew, and their silence speaks volumes"
501,sv0dQfRRrEQ,"I was curious how some other countries were able to achieve extremely high vaccination rates and came across Portugal, where 91% of the population has completed their vaccinations, compared to 64% in the US. (Note: the definition of “fully vaccinated” is shifting as the evolving virus makes boosters increasingly important!) 

Portugal’s strategy was, in part, to give the vaccine effort a non-political face: a military officer named Henrique Gouveia e Melo. He’s very tall, wears a combat uniform everywhere he goes, and enforced a strictly non-political communications strategy. He approached the vaccine effort like a military mission and by all accounts, gained the trust of the nation. It certainly wasn’t the only factor in Portugal’s success, but it made me wonder whether a military-led approach could have helped reduce polarization in the US. 

Let me know what you think in the comments below. 
-Joss"
502,sv0dQfRRrEQ,Its really disturbing that facts and medicine have been somehow integrated into political beliefs
503,sv0dQfRRrEQ,"if we hadn't treated covid as a political issue instead of the health issue it really is, we really would've gotten a lot more done by now"
504,sv0dQfRRrEQ,"I feel like this is just one example of the main reason why I despise modern politics. It has become an Us vs Them thing. It no longer matters what your qualifications are, your experience, your plans or even what kind of person you are. Now all you have to do is say the other side is bad and “they” want to keep you down and you’ll get a significant amount of the vote which can turn the tides for you. Now, everything becomes politicized and that makes people on both sides dumber because they think with emotions rather than their brain."
505,sv0dQfRRrEQ,"I lost my dad to Covid and I’m just 18. I told him many times to get the vaccine, but he was skewed by political views. It hurts a lot to see him gone. Im sorry if you rely on your news station to tell you what’s best for you. It is your decision. Don’t come to a decision and never look back. Stay open minded. Think about those around you. Life is precious"
506,sv0dQfRRrEQ,“There are two diametrically opposed views of what America should be like in in the world.” Wow. This is it.
507,sv0dQfRRrEQ,"My parents (who are very right leaning) got the vaccine before it was required by either of their jobs. They started being ""anti Vax"" once they realised the vaccine wouldn't be the end of masks, social distancing, online schooling, etc."
508,sv0dQfRRrEQ,"Aside from the great content, I am floored by the creative direction on this video. 
It is extremely difficult to create something captivating without using lots of graphics. The use of projector transparency film is genius and the framing of the video calls is amazing too. This video has so much depth of information and clear visual information. Bravo. Really. Great work!"
509,sv0dQfRRrEQ,Joss Fong is an American hero whose hard work in journalism is saving lives through dispelling misinformation. I look up to her so much because of these videos.
510,sv0dQfRRrEQ,"This is really interesting data, and it aligns with my experience. Most of the people I've spoken to who are either vaccine hesitant, or even are vaccinated but lean conservative poltically, have at some point said to me that they thought the severity and/or death counts of the virus were overblown."
511,aOInguXymGc,I'm still not voting for Biden.  Robert will always be the better option.
512,aOInguXymGc,Kennedy is the best option in my lifetime that we have had for president. There was no peer reviewed scientific evidence to refute any of the things Kennedy says. Jest “he is a conspiracy theorist”
513,aOInguXymGc,Kennedy2024! It’s happening!
514,aOInguXymGc,"To anyone buying the spin of this video, try watching any one of rfk's long form interviews and see how this drek holds up"
515,aOInguXymGc,This video is the lie of the year. Well done 👍
516,aOInguXymGc,"The machine is so scared now, they’re totally desperate with their lies about RFK!"
517,aOInguXymGc,The difference between some conspiracy theories and the truth is time. RFK all the way!
518,aOInguXymGc,"I've spent hours listening to RFK JR. All you people do is lie about him. 
Kennedy 2024"
519,aOInguXymGc,You don't need a formal conspiracy when interests align.
520,aOInguXymGc,Kennedy 2024
521,lEFYYpE_hds,"I’m not anti vax but when I’m not allowed to ask questions, I ask more questions. Why so defensive? Why so unwilling to have a conversation about it? It’s a red flag to me when questioning something or asking questions gets a strong negative response."
522,lEFYYpE_hds,"""You're willing to lose your job over this?""
""Yes""
""Tell me why.""
""Because I am not going to take that vaccine...""
*Immediately gets cut off by the reporter and we can't hear why she won't get it*

Well done. Amazing reporting."
523,lEFYYpE_hds,"My roommate who's a 21 year old male contracted myocarditis from the COVID vaccine. He started convulsing in the floor one night and we had to rush him to the hospital. He's been to multiple specialists since then. It's a much bigger deal than people think, one of the risks of myocarditis is sudden death."
524,lEFYYpE_hds,"Reporter - ""So you're willing to lose your job instead of getting the vaccine, tell me why.""
Woman - Begins to explain 
Today show - *immediately cuts her off 😐"
525,lEFYYpE_hds,"It's linked to heart issues in all age groups in my opinion.  As a nurse, I'm seeing a lot of heart issues about 3-4 months after receiving covid shots in people that don't have prior heart issues."
526,lEFYYpE_hds,My friends cousin (female) who is 19 went into cardiac arrest 3 days after 2nd vaccine. She just had a heart transplant and has a long road ahead of her. It’s more common than they are letting people believe.
527,lEFYYpE_hds,"They really need to report numbers and percentages so we can have even a clue as to what an ""increased rate"" is. News channels are so bad at reporting useful information and ambiguous information only increased emotional reactions and conjecture."
528,lEFYYpE_hds,Imagine posting such a story and not stating how many have had these reactions out of how many observed. I guess that's why you don't need a degree to be a news anchor...
529,lEFYYpE_hds,I'm so sorry for all the individuals here that were convinced or cohersed into taking this vaccine. People really need to band together and push back against this.
530,lEFYYpE_hds,A friend of mine went completely 100% paralyzed in response to the COVID vaccine and has been in rehab for over 2 months and can just now sit up on her own.  This is not the only case of this I've heard of either.
531,v-NEr3KCug8,the animation is hard not to praise
532,v-NEr3KCug8,"""And yet ignorance is an enemy, even to its owner"""
533,v-NEr3KCug8,I watch Ted Ed vids not just for the knowledge but for the animation. Kudos to the people behinds their vids
534,v-NEr3KCug8,I am a Japanese high school student and I want to be a public health nurse in the future.To realize my dream I am working hard to pass the university.This video gave me motivation to study as well as medical knowledge.
535,v-NEr3KCug8,There's something about this narrator's voice; a gravity that makes the video and its message all the more compelling. I always enjoy hearing it 💖
536,v-NEr3KCug8,Can't stop praising TED-Ed animators and the whole team to make such an easy explanation of a deep and complex concept. Thank you
537,v-NEr3KCug8,Imagine if kurzgesagt and ted ed joined together to make an one big channel it would be the hub for all knowledge.
538,v-NEr3KCug8,"“If I have seen further it is by standing on the shoulders of Giants.”
― Isaac Newton"
539,v-NEr3KCug8,"Mitochondria is the powerhouse of the cell. Thank you, junior high Biology class!"
540,v-NEr3KCug8,The animation makes everything easier to understand.
541,IxCHv7T_mao,I forgot where they put the title on YouTube videos...which is wild because I don't think it's been on top since like 2012.
542,IxCHv7T_mao,"I am terrified of needles. Normally when I hear people talking about vaccines I get super light headed and sometimes actually pass out. I'm slowly exposing myself to images and videos of vaccines and needles so that, when it comes time,  the process is easier for me. Getting the vaccine was never in question. I will not be responsible for someone's death if I can help it."
543,IxCHv7T_mao,"Hank, you realise the people will demand you recreate your 15 hours in Target video?"
544,IxCHv7T_mao,"i knew the ""yes"" was coming even before i clicked"
545,IxCHv7T_mao,Thanks for clarifying that the vaccine testing regulations haven’t changed. That wasn’t clear to me
546,IxCHv7T_mao,"As a healthcare worker, this is the first time I’ve heard anyone say they would get a vaccine to help me and it made me feel more things than I though it would. Thank you Hank."
547,IxCHv7T_mao,"A little over a month ago I went to the ER and got diagnosed with appendicitis, the cases in my state weren’t super bad at the time and I was able to get care and a same day surgery. Which was good because when they took it out the surgeon said it was close to rupturing. The cases in my state have skyrocketed since and I can only imagine what people are dealing with in hospital. I am so incredibly thankful for them and all the people helping to end this pandemic and when it’s my turn I’ll get a vaccine"
548,IxCHv7T_mao,The old vlogbrothers references made me tear up....idk why or if I’m just emotional but gosh I love this community. Thank you nerdfighteria for changing my life.
549,IxCHv7T_mao,"Oh boy, I'd let Ruby Rod be my roommate for the low low cost of I'd pay his half of the rent."
550,IxCHv7T_mao,Thanks for this. I’m doing a vaccine trial starting Monday.
551,qVcP3cI64ow,I’m unvaccinated and will continue to thoroughly research and remain unvaccinated.
552,qVcP3cI64ow,My heart said no; my head said no. I said yes to my instinct and said no to the 'vaccine'. Happy and healthy.
553,qVcP3cI64ow,Shame on everyone who coerced or pressured people to take that shot.
554,qVcP3cI64ow,These side effects are not rare. They are underreported.
555,qVcP3cI64ow,"100% safe from side effects, 99.98% safe from COVID death. I think I’ll stay unvaccinated. Let’s Go Brandon!"
556,qVcP3cI64ow,"My 34 yr old step daughter in Critical Condition Hospitalised for 2 Months a Heart Attack and needed Open Heart Surgery.
She was a Nurse…she is no longer ABLE to be a Nurse.

We have now seen 22 of our loved ones suffer…all who were Co£rc£d into being £xp£rim£nt£d on. Thankfully 16 of them are still here and recovering well now…and I have looked after many of them …luckily for them I know how to look after them! 
6 died after Co£rc£d I only 2 years…we have never seen anything like this in our entire lives.

It’s Disgusting.

They are nothing but Criminals and this Man is completely brainwashed !"
557,qVcP3cI64ow,Not a single one of us regrets not getting the jab…NOT ONE.
558,qVcP3cI64ow,"People should go to jail for the rest of their lives for this. I’ve never seen a clearer instance of corruption, greed, and flat out evil than this"
559,qVcP3cI64ow,So rare yet EVERYONE knows someone that's had problems with the jab. The fact that they aren't being documented and the truth is being hidden just further supports my decision
560,qVcP3cI64ow,"The pressure I endured from friends and some family members was unrelenting. But I knew deep down this was dangerous! I was prepared to walk away from every relationship and determined to stand my ground.
  Two of my friends developed aggressive cancers who were otherwise very healthy.
  One family member is suffering from heart issues. I fully expect to be at a lot of funerals in the near future.  But the best thing about Covid is it taught me  just how evil our own government is.  I will NEVER trust our government or the pharmaceutical industry, again! Rest assured I’m not the only one."
561,iyo2UNQcdpQ,"Australia 🇦🇺 lost 34k deaths in WW2  servicemen, 30k excess deaths in 2022, yet no one is talking about it. At my sports club, common mention of funerals to go to, but no one connects the dots."
562,iyo2UNQcdpQ,"My Father (74), had taken 5 jabs, he had been complaining for the last 2 years about chest and back pain, last week he collapsed and passed out, I called the paramedics, they told him he was just having a panic attack, later in the day I took him to the ER because he started to cough up blood. At the hospital they took an X-ray of his heart, gave him a sleeping pill and an injection of some muscle relaxant, they didn’t take blood or look for clots. We got him around 4:30 AM, I woke up to him in pain, I immediately started the truck to take him to the hospital and when I came back in to help him to the truck he collapsed and died in my arms. The ME wasn’t going to do an autopsy, but I pushed them to do one. They found myocarditis, several blockages in the arteries around the heart and hemorrhaging in the lungs. The worst part about all of this tragedy is that he trusted our State Funded Media here in Canada and the Government over his own loving family. 

Please don’t stop dissecting data in a fair and honest way. 6:47"
563,iyo2UNQcdpQ,"This is all sadly unbelievable, as I sat with my wife and watched this fiasco unfold.  I wouldn’t allow my wife, or my children to receive any of the shots.  My entire extended family of very well educated people with Doctorates, Masters, and Bachelors, all questioned beyond belief our misunderstanding of the “opportunity” we were missing to save our own lives by receiving a 6 month old “Wonder of Science”, and how could we DARE question “Science”.  I can promise you, they’re not lining up any more for their shots, and it’s strange how silent they are about their shots now!  It’s amazing to me in our modern age how folks can be led to slaughter, and the saddest part is, the most educated are the dumbest."
564,iyo2UNQcdpQ,"The abuse I received from friends and family for refusing to take these vaccines.. The relationships broken forever.. Family members injured..
And I will still never regret my decision"
565,iyo2UNQcdpQ,"My 23 y/o grand niece died in her sleep the night after getting the jab. It was required by the company she had just been hired by, which she was to start the following day. So sad and such a crime to humanity. At 71, I refuse the jab. Blessings to all"
566,iyo2UNQcdpQ,"I lost my  only child at 49 three days ago. He was born with heart disease but after several surgeries, was healthy. He did not want the vaccine, but his steel mill employer told him he could lose his job. Tuesday evening he had sudden chest pain and was unable to breathe, and fell dead. Probably a blood clot caused by the vaccine. His wife and I did not want him to undergo an autopsy. I blame this wretched government for my son’s death. They took my everything away from me. May God pour his mighty vengeance upon them."
567,iyo2UNQcdpQ,"Too many ""peer-reviewed"" journals only require a Conflict of Interest statement from the authors, not the reviewers, editors, or publishers.  Because of this, my faith in getting the truth from these journals has been seriously compromised.  I'm SO glad that you're covering this paper!"
568,iyo2UNQcdpQ,My mother was a vivid high functioning person who ran an antique store and was an accomplished artists. When Covid hit my mother and father immediately got in line for the shot and every booster they could get! About two months after my father called me and said that they were having health problems. My mother was having a hard time with her memory and him with his general health. My mother is now in hospice and my father is not too far behind. It happened so fast! I know this can happen without a shot but it all seemed to start as soon as they got it.
569,iyo2UNQcdpQ,"Slam dunk indeed! Thank you John, I have followed you from the beginning and am very happy to see where you are now! Justice must come to those who perpetrated these evil crimes against humanity"
570,iyo2UNQcdpQ,Many heart attacks gone up 8 fold in young people I'm glad I never let them jab me with that rubbish.The question people should ask themselves is do you 1000% trust our government if the answer is no then you should never let them put anything in your body.great work Dr keep up the good work
571,fdGj6p2qDdk,"Congratulations on your true endeavors. I'm old enough to remember at a very early age the polio sugar cube to help fight the disease. At that time..we had no fear of an attempt in eradicating the polio virus, no politics involved."
