,video_id,comment
1180,z5lJeTjvFHU,"At first it felt like a regular shot but later in the day, my arm felt like it was going to fall off 😂

It hurt so badly lol"
1181,z5lJeTjvFHU,"I got my second shot today, it feels like someone punched me in the arm 50 times with a big ass hand! I can barely move my right arm, it really does hurt."
1182,z5lJeTjvFHU,I think “a little sore” is an understatement
1183,z5lJeTjvFHU,yo I thought I was the only one feeling this way lmao I literally can't lift my arm
1184,z5lJeTjvFHU,My shoulder feels like a restraining order was made against moving.
1185,z5lJeTjvFHU,"For me, I got my vaccine today, early morning. My arm did NOT hurt after. But 5-6 hours later on in the afternoon, my arm is then sore and I can't lift it up!! :'( :'("
1186,z5lJeTjvFHU,Yeah... got my first dose of Moderna today. The injection site was sore right after which is to be expected from getting a shot but now hours later my whole arm hurts lol. If this is the worst of my symptoms I’ll count myself lucky. I’m more worried about the second shot though.
1187,z5lJeTjvFHU,"I got mine today in the morning, I was fine for about 7-8 hours. I thought my arm wouldn’t hurt but nope. 7-8 hours, it started really hurting. My arm looked a bit swollen too. I had to take Tylenol. Now it’s a bit better but I can still feel it. I hope this goes away by tmw."
1188,z5lJeTjvFHU,I got the Pfizer shot then right after my dumbass went to bench press my arm feels like it's dead 💀
1189,zL8tCKEHJ6o,I can't believe they're still trying to push this 😂
1190,zL8tCKEHJ6o,They don’t seem to talk about how natural immunity has kept people out of the hospitals…
1191,zL8tCKEHJ6o,More propaganda
1192,zL8tCKEHJ6o,Anyone who still falls for this has just self selected. Nothing more can be done for them.
1193,zL8tCKEHJ6o,The public hasn't seen or heard from Jamie Foxx in over two months.
1194,zL8tCKEHJ6o,"The reason why there is such a huge movement toward organic foods and ""going green"" - is because many people, including experts, know that it is really important for us to keep all types of chemicals and toxins and pharmaceuticals out of our foods and out of our bodies and out of our environment. In fact, the health and future of humanity depends on us completing this positive shift. I wish EVERYONE could realize and respect this truth."
1195,zL8tCKEHJ6o,She really makes sense when you watch her hands as she talks. I’m sold!
1196,zL8tCKEHJ6o,Crimes against humanity!
1197,zL8tCKEHJ6o,I've been fine without any of your experimental treatments.
1198,zL8tCKEHJ6o,Hello and Good day. Does this mean it will requires 2 doses and 2 booster to be safe and effective like all good mRNA vaccines. And given the 4 year AIDS are parents recommending it for their children ?
1199,8dM8b8bqz3Y,Watching that ad almost made it hard for me to breath
1200,8dM8b8bqz3Y,"if the “people who survived” would talk about what they went through, the public will think they were paid…"
1201,8dM8b8bqz3Y,"“Just have people share their stories, and it would have been effective.”

Um maam no people HAVE been sharing their stories. It would just feel cliched"
1202,8dM8b8bqz3Y,"As someone who's treated patients who have COVID, this is excellent.  People need to see the reality of those who suffer from the worse of the symptoms."
1203,8dM8b8bqz3Y,"Sometimes the truth is hard to listen to, but the truth is the truth. People need to stop being offended by everything and acknowledge the reality of everything."
1204,8dM8b8bqz3Y,"“Fear isn’t always the best motivator, but it is a hell of a good one”
- My history teacher"
1205,8dM8b8bqz3Y,Did everyone forget about the ad America had about school shootings? That one was…BRUTAL
1206,8dM8b8bqz3Y,The ad isn't any worse than the anti smoking ads we watched growing up. Sometimes it's best to show people what they're really risking
1207,8dM8b8bqz3Y,It gives you horrible memories that I would like to forget
1208,8dM8b8bqz3Y,"I love inside edition for some of the more silly things

Gotta admit... I am real tired of the hyper sensitivity of the media."
1209,-gq51K9fi_s,Imagine a robber just stole everything from your house… Now imagine it’s that same robber who’s investigating the robbery… that’s how ridiculous this sounds.
1210,-gq51K9fi_s,I love how we are supposed to report side effects and yet often are told there is no correlation between a side effect and the vaccine.
1211,-gq51K9fi_s,"RIP Doctor Michael.
The drug companies will not ever report these things accurately."
1212,-gq51K9fi_s,"You will never hear about this ""investigation"" again, Very very sad."
1213,-gq51K9fi_s,My heart goes out to his wife and family.
1214,-gq51K9fi_s,No liability NO TRUST!
1215,-gq51K9fi_s,"Give to the politicians first, we need the doctors!"
1216,-gq51K9fi_s,I’m so sorry about that doctor’s passing. He looked like such a nice man.
1217,-gq51K9fi_s,So sad. God bless his wife and children.
1218,-gq51K9fi_s,"The Government is investigating the Government, LOL.  In this case big Harma will investigate big Harma which the Government is beholden to."
1219,2AaTvrFlhMo,The fact that Fauci still has a leg to stand on is what baffles me.
1220,2AaTvrFlhMo,Data has always baffled Fauci.
1221,2AaTvrFlhMo,I'm so thankful that people are finally waking up 😀👏👏
1222,2AaTvrFlhMo,"Hmmmm, let me think.  Maybe it's because there are rational people that would rather experience cold and flu symptoms than myocarditis, blood clots, and neurological damage."
1223,2AaTvrFlhMo,He is baffled people aren't going for 3 after the two that were supposed to be sufficient failed. I am shocked that he is shocked lol
1224,2AaTvrFlhMo,Nuremberg Code states that all government medical experiments on the public must be consensual and under no duress when deciding to participate.
1225,2AaTvrFlhMo,I’m baffled why anyone trust this charlatan.😳
1226,2AaTvrFlhMo,"It's not complicated. First, people are seeing that breakthrough cases are now quite common. And second, even people positively receptive to being vaccinated aren't keen about getting a jab every 4-6 months in what increasingly seems like an endless cycle with no end in sight."
1227,2AaTvrFlhMo,"Simple, people got it because they thought shit was going to go back to normal then suddenly the goal post was moved"
1228,2AaTvrFlhMo,"“54% of patients over the age 65 are unvaccinated, despite 12% of those patients are unvaccinated”????🤔 what???"
1229,YhMlZczq4Ns,"The Pfizer shots and booster all nearly killed me. I lose 2 days of my life per shot, laying in bed with 101 fever and rapid shallow breathing, chills and odd stabbing pains in my abdomen and thighs. I get the massive swollen glands in my armpit and can’t raise my arm for days."
1230,YhMlZczq4Ns,"When I got the first 2 doses of the pzifer vaccine, I had minor aches and pains, headache, and chills which went away within a few hours of getting the vaccine. However when I got the pzifer booster and flu shot, I was miserable, all of those side effects were so strong. Aches and pains, and headache was horrible and lasted for a couple of days for me. Never want to go through that again. Was horrible."
1231,YhMlZczq4Ns,You may very well have the only doctors handwriting that is understandable in the entire world. Thank you for all you do.
1232,YhMlZczq4Ns,"I had Moderna shots. My booster was a half dose. I had very mild reactions to all three shots. However I felt the booster the most. I spent a day resting on the couch, drinking tea and napping. Mostly fatigue, some aches and chills. Felt 100% better the next day."
1233,YhMlZczq4Ns,"Thank you, Meccram !!!  
   **** Could you Please make a video on the myocarditis & related risks with Moderna, and how 3 Nordic countries ( Sweden, Norway, and Finland)  have suspended Moderna  for people under 30 ( in Sweden for men AND women that age.)****
     How safe is Moderna for women in their 40's and 50's? ( Concerned re: myocarditis, blood clots, etc.)....but I'd LIKE to get a Moderna booster, if safe enough ( I got J& J initially.)  THANKS SO MUCH !!!"
1234,YhMlZczq4Ns,Thanks for another great video Doctor. Amazed at the clarity and level of detail and presented in a way that folks with not too much scientific knowledge can understand.
1235,YhMlZczq4Ns,Amazing how you take a complicated subject and make it sooo easy to understand ... wish you were my chem. Bio .anatomy prof in college ...
1236,YhMlZczq4Ns,"Please explain the myocarditis risk for young men, specifically regarding boosters... if you can.  With many thanks."
1237,YhMlZczq4Ns,How would you extrapolate Moderna boost as a half dose?
1238,YhMlZczq4Ns,For my healthy tripple vaxxed BF the first one was the last one: he passed away from a sudden heart attack a month after the  booster.
1239,RyT3veZRMcg,"“The vaccine should be tested on politicians first.  If they survive, the vaccine is safe.  
If they don’t, then the country is safe.”
—  Monika Wisniewska
………"
1240,RyT3veZRMcg,"No matter how many millions, you can't undo it."
1241,RyT3veZRMcg,Gonna need more than 15 mil. Better get all those billions back from ukraine.
1242,RyT3veZRMcg,Much respect to you guys for doing ACTUAL journalism. Including myself I know thousands of people who have been injured. If I alone have come across that many that I guarantee there are millions and these aren't just effects that happen right away. Mine started 3 days after and now I have breast cancer as a result 2 years to the month later. It will likely be 50 years or so before the truth comes out but I'm telling you this is going to affect generations to come. One of the worst mass humanitarian crimes ever committed. And if still keeps going. Thank you for standing up for us
1243,RyT3veZRMcg,We tried to tell them and they wouldn't listen
1244,RyT3veZRMcg,NO ONE regrets not getting it.
1245,RyT3veZRMcg,"They knew, many scientists and medical professionals spoke out at public meetings and wrote countless letters to politicians advising against the shots."
1246,RyT3veZRMcg,The local news reporting on c19 v a x injuries?? Noooo way!!!
1247,RyT3veZRMcg,"As a person who is dealing with injuries from it, CICP only covers medical bills, loss of employment, or death. Not a life altering issues resulting from it. I was told the VA will cover it when I retire from the military. My prescription to keep my platelets from bottoming out costs $3-4000 a bottle. If I wasn’t in the military there’s no way I could pay that every month."
1248,RyT3veZRMcg,"And guess who's going to foot the bill..  
Yup, taxpayers!  
But those responsible for the injuries should pay!  
How many 100billions of dollars did big pharma and the governments make off the tax payer funded 💉? 
And they are only Asking $15 million?  
That's pennies ... 

Big pharma needs to pay!"
1249,J9KROxs4uKc,"“If you have to be persuaded, reminded, pressured, lied to, incentivized, coerced, bullied, socially shamed, guilt-tripped, threatened, punished and criminalized .... If all of this is considered necessary to gain your compliance -- you can be absolutely certain that what is being promoted is not in your best interest.” - Ian Watson"
1250,J9KROxs4uKc,"What about private flights?
Are they also mandated to the same testrictions that commercial flights are doing?"
1251,J9KROxs4uKc,"NO problem for me, i don't fly."
1252,J9KROxs4uKc,"Also take into account how much that COVID test will cost you in an international country! I knew someone traveling back from Spain that paid close to $150 for a test. Whether it was available for free or not, I don’t know, but she searched and couldn’t find it for free. Price varies per country."
1253,J9KROxs4uKc,"""Show me your papers"".....just like Hitler."
1254,J9KROxs4uKc,So do we need to take the vaccine to travel or just a negative covid test a day before traveling?
1255,J9KROxs4uKc,"The guy just said the exception for children still requires them to get a covid test 24 hours before flying...that's the same rule for  adults, so I don't understand why he said there was an exception for children?"
1256,J9KROxs4uKc,"700 likes, 60 dislikes, and not a single comment seems to approve of this video. Hmmm... 🤔"
1257,J9KROxs4uKc,They said two weeks ago that starting in the beginning of next year all airports and other countries will have to show your vaccine book in order to travel the world.
1258,J9KROxs4uKc,"But the people at the border aren't being tested and flown into different states through private charter planes. Just obey, don't question."
1259,LXDH-xKIk0A,The only shocking part of this is seeing it on mainstream media.
1260,LXDH-xKIk0A,"If you are an MD or biochemist, and surprised by this, then you have officially prioritized your political leanings over “the science”. Lets see how many MDs in 5 years can say that repeatedly vaccinating and boosting everyone (not just those with major health concerns) was a good idea…..especially 5-11 year olds."
1261,LXDH-xKIk0A,"This occurrence is not only not new, it was predicted as a strong possibility and cautioned about with regards the mRNA transfection inoculations by many prominent virologists and immunologist right from the start. Doctors were shadowbanned if they tried to talk about it. The two hosts do look a little unsettled. I would love to know what was said in Amy Roach's ear piece as they quickly went to commercial. ""That's very important information. We appreciated it. Thank you very much."""
1262,LXDH-xKIk0A,Hold the line Pureblood's 🤝
1263,LXDH-xKIk0A,The truth will always emerge no matter how much the truth was suppressed from day one.
1264,LXDH-xKIk0A,They are telling you they don't know the outcome of the shot .
1265,LXDH-xKIk0A,Why do we expect any dose to be any different it’s the same thing lol.
1266,LXDH-xKIk0A,"""Antibody levels, which are associated with protection against infection and disease, fell within weeks of getting the shots and were much lower than the level of antibodies specific to the original and delta coronavirus variants, the researchers said."" 

But that fourth one. That'll change everything! 🙄"
1267,LXDH-xKIk0A,I can't wait until the 100th dose.
1268,LXDH-xKIk0A,If we comply with this our compliance means we never get out of this mess
1269,d3yk1FKFeqI,The truth is finally starting to surface.
1270,d3yk1FKFeqI,"So, glad I didnt get any of the vackses! And, I wish no one had, as well! Something comes up every year(multiple negative developments) as to why this was such a nightmarishly bad idea! It's just been 2 years and symptoms began to show after the first victims took it! But, these things may be the least of their worries!  I also hope that it was only medicul and not spiritual(Rev 13 and 14)! I surely hope so!"
1271,d3yk1FKFeqI,Does anyone remember when they struck people off the transplant list for not getting the jab?
1272,d3yk1FKFeqI,"we tried to warn you.
you called us ""conspiracy theorist."""
1273,d3yk1FKFeqI,We was trying to tell y’all….
1274,d3yk1FKFeqI,Never got that toxic dangerous shot and I never will!
1275,d3yk1FKFeqI,That means it's doing it's job.
1276,d3yk1FKFeqI,Never got the shot…. This unfortunate for lots of people
1277,d3yk1FKFeqI,"And to think, some patients are denied a transplant unless they take the shot. Make it make sense please!!!!"
1278,d3yk1FKFeqI,I took myself off the organ donor list last year.......I refuse to give anything that would go to a vaxxed
1279,CjzZOM6kGZg,This aged like a choc ice after a thousand years in a blast furnace.
1280,CjzZOM6kGZg,Elton needs to watch UK Column News!
1281,CjzZOM6kGZg,The B.S. never stops.  At least with these ads we know who is who.
1282,CjzZOM6kGZg,What a great doctor!
1283,CjzZOM6kGZg,This is a side effect of the Astra Zeneka vaccine that gives people the urge to do TV interviews
1284,CjzZOM6kGZg,"Public Health Act 2016 (WA)
– Instrument of Authorisation – Authorisation to Supply or Administer a Poison
[SARS-COV-2 (COVID-19) VACCINE – Australian Defence Force] (No.2) 2021 Guidance
An authorisation by the Chief Health Office under the s. 197 and s.198 Public
Health Act 2016 (WA) to authorise relevant Australian Defence Force employees
to supply and administer the COVID-19 Vaccine"
1285,CjzZOM6kGZg,perfeito
1286,CjzZOM6kGZg,"0:47 What was that, Elton?
""That was me, acting."" lol 😆"
1287,CjzZOM6kGZg,This just proves that they used every weapon they could on the public to push this jab.
1288,CjzZOM6kGZg,there might of been a time celebrity had some influence but that world is gone
1289,GtYNX69Abv0,It almost sounds like it's safe enough and tested enough that the manufacturers can start accepting liability for it 😮
1290,GtYNX69Abv0,If the vaccine companies are so confident the vaccines are so safe then lift the waiver forms and have them liable for any major side effects when they occur that impacts the  longer term of quality of life for those who take it!
1291,GtYNX69Abv0,"The safest thing you can do in this pandemic is whatever the mainstream media tells you to do ,  flip it 180° and do that. . ."
1292,GtYNX69Abv0,Reported for spam/misleading.
1293,GtYNX69Abv0,"""there has been a 300% increase in DMED codes registered for miscarriages in the military in 2021 over the five-year average. The five-year average was 1,499 codes for miscarriages per year. During the first 10 months of 2021, it was 4,182"""
1294,GtYNX69Abv0,"Anyone want to explain why corporations have zero liability no matter what with their ""vaccines""?"
1295,GtYNX69Abv0,I personally know a woman who got the vaccine while she was pregnant and the baby developed myocarditis  in the womb.
1296,GtYNX69Abv0,"Well, I've had the call I was expecting,  but hoping wouldn't come.  My friend's 24 year old jabbed daughter has just been for a scan and has been told her 24 week old baby has died. She's now going to have to give birth.  I have given them all the information I could over the last 3 years about the dangers of what Government and NHS has been pushing, but I'm the one brain washed. I even spoke about the spike in still births since March/April 2021. Sooo frustrating."
1297,GtYNX69Abv0,"How to be a good citizen:

1. Obey without questioning.
2. Comply without thinking.
3. Worship authority.
4. Have blind faith in government.
5. Have absolute trust in mainstream media.
6. Never question official narratives."
1298,GtYNX69Abv0,"Why there are so many cases in australia, us, uk with over 80% of vaccinated???"
1299,iiWCZDEjjKw,"Mom always told me "" Just because everyone else is doing something, doesn't mean you have to""....... words of wisdom."
1300,iiWCZDEjjKw,If you’re young and healthy it just isn’t worth the risk. Period.
1301,iiWCZDEjjKw,I’ve never heard anyone talk so casually about side effects and people still line up to get the jab... unbelievable
1302,iiWCZDEjjKw,"""If you or someone you know has received the Covid 19 vaccine you may be entitled to compensation."""
1303,iiWCZDEjjKw,I just had my first shot and felt fine. I'll get my second shot when the bartender gets back.
1304,iiWCZDEjjKw,I’m sure that random mom will shed light on what’s going on here.
1305,iiWCZDEjjKw,its crazy how people still listen to the news
1306,iiWCZDEjjKw,"News segment did not mention the health conditions of the 18 affected prior to receiving the vaccine.  Lumped the number 18 together with teens and young adults.  Could be 1 teen and 17 YA or 17 teens and 1 YA.  Did not classify what is considered a young adult.  Did not mention the amount of vaccines administered to this age group.  While my sympathies go to the affected no matter how big or small the number, this segment is too vague for me to form an understanding opinion on the matter."
1307,iiWCZDEjjKw,"I would consider this ""news"" to be a public health announcement and legal disclaimer made on behalf of the pharmaceutical companies: ""hey we told you so, cant say you didnt know"""
1308,iiWCZDEjjKw,The fact that they are being forced to report this shows that its much worse out there than we think
1309,0dbapFRDN0I,The funny thing is these parents and children think that things are ever going back to pre Covid. It’s never going back.
1310,0dbapFRDN0I,"The fact that this is the quickest approval in FDA history, makes me even more hesitant"
1311,0dbapFRDN0I,"“If you have to be persuaded, reminded, pressured, lied to, incentivized, coerced, bullied, socially shamed, guilt-tripped, threatened, punished and criminalized .... If all of this is considered necessary to gain your compliance -- you can be absolutely certain that what is being promoted is not in your best interest.” - Ian Watson"
1312,0dbapFRDN0I,This is a dark time in our history
1313,0dbapFRDN0I,"The last time I was pressured this hard, I had to listen to a 3 hr. Seminar on time shares. I didn't buy that either."
1314,0dbapFRDN0I,I wonder when they're going to start hiding dislikes again 🤔🤔🤔
1315,0dbapFRDN0I,*HEY HERES AN IDEA: STOP BLOCKING OUR ABILITY TO SEARCH FOR STORIES OPPOSING YOUR NARRATIVE AND LET US DECIDE FOR OURSELVES!!*
1316,0dbapFRDN0I,"This has only been approved for emergency use. Yet, they continue to deceptively state ""It's approved."" Pure Unadulterated Evil"
1317,0dbapFRDN0I,It must be scary knowing that the public isn't playing in your games anymore.
1318,0dbapFRDN0I,"""So we can go back to normal"" and yet they still have the mask on. What a joke."
1319,tYJkhp8lGho,looks like they accidentally found a vaccine for Kardashians
1320,tYJkhp8lGho,Wait everyone being critical of cosmetic procedures. A lot of people have heart valve replacement with either a synthetic valve or that of a pig which to the immune system would be considered foreign. Some people have joint replacement which is also synthetic. A very important question is how is this going to affect those millions of Americans?
1321,tYJkhp8lGho,This is actually the best news I've heard all year. I'm tired of most celebrities.
1322,tYJkhp8lGho,"The Kardashian's / Jenner's watching this like.  
👁👄👁"
1323,tYJkhp8lGho,"THANK YOU.
PRESCREENING LIMITS
LIABILITY WITH A DETAILED
QUESTIONNAIRE.ATTACHED.
NOT A NASCAR PIT STOP."
1324,tYJkhp8lGho,That's half of LA!
1325,tYJkhp8lGho,me with a neutral face: *guess being ugly ain't that bad!*
1326,tYJkhp8lGho,See this is why nobody believed them when they came out and said it's perfectly safe because it takes time for these things to be revealed.
1327,tYJkhp8lGho,I wonder how long before we start seeing advertisements by lawyers telling people they are entitled to compensation.
1328,tYJkhp8lGho,All Hollywood needs to be made aware of this.
1329,lNYnIc94kdM,I’ll happily wait a yr or so & see how she fares with her long term  outcomes!
1330,lNYnIc94kdM,"It is more important that all countries are allowed their different approach, because if there ever is a future problem we have a diverse set of test studies and solutions from which to measure, this is far more practical and credible to the scientific community, we should not put extra pressure on different governments with different solutions they may end up having bigger peices of the puzzle and we should have compassion for all suffering not pointing fingers at others - peace, I prey you have a good week all"
1331,lNYnIc94kdM,We better hope she doesn’t become a Titan
1332,lNYnIc94kdM,Fauci looks young to be the age he is!
1333,lNYnIc94kdM,What about the military ? i NEVER HEAR ABOUT THEM.
1334,lNYnIc94kdM,"Goodluck to all ... I hope it won't be mandatory, don't know the long term side effects till about 3 or more years."
1335,lNYnIc94kdM,"“You are an incredible virus, you gave your best and for that I admire you. You went through various mutations, you were so contagious that we all hated you.

I hope you are reborn as an antibody, I will be hoping you are healthy. I will also get vaccinated and take good care of myself to become stronger.

Goodbye, Covid19. """
1336,lNYnIc94kdM,Remember when we were excited for 2020.
1337,lNYnIc94kdM,We might kiss Covid good bye but then just like it’s selfish to not wear a mask it will be selfish to have more than one child.
1338,lNYnIc94kdM,this aged well
1339,H7716weqCIs,Can we ALL take a moment to agree that this is/was the BIGGEST fear we have/had
1340,H7716weqCIs,"The story ""More polio cases now caused by v than by wild virus"" was by you guys, The Associated Press. Maybe you should read it."
1341,H7716weqCIs,"Pure evil. For respiratory infection that was highly survivable, the elderly and vulnerable more suseptable and only hastened death by a few months."
1342,H7716weqCIs,Line up and do what the experts say... they are never wrong. 🤪
1343,H7716weqCIs,leave the Kids alone!!!! Monsters!!!! stop that
1344,H7716weqCIs,Wow this makes me sick . These parents have no clue what they're doing
1345,H7716weqCIs,if i had kids i wouldn't make them take that
1346,H7716weqCIs,Noooooooooooooooo😞😞😞😞😞 I pray not but somebody is going to be more than sorry for this
1347,H7716weqCIs,Maddie Garray
1348,H7716weqCIs,Insane parent's
1349,OjbSWebA3Ko,She is one of THEM
1350,OjbSWebA3Ko,I wonder how many people Dolly is indirectly responsible for their deaths.   What a traitor.
1351,OjbSWebA3Ko,"That hasn’t aged well and nobody (nobody…) will ever be able to forget her singing her jingle.  Oh, boy…"
1352,OjbSWebA3Ko,She called antivaxxers cowards??!!
1353,OjbSWebA3Ko,"Dolly: ""so how are the long term studies and any current issues with the shots?""  

Doctor: ""oh were still writing up the script for the long term studies and nope.... no issues at all, everyone is fine taking this!"""
1354,OjbSWebA3Ko,Never forget what these people did.  Never.
1355,OjbSWebA3Ko,"What Dolly got was 🎶Saline, Saline, Saline, Sayyy-leeee-eeeen. I'm beggin you to please open yer eyes🎶"
