,video_id,comment
572,qVcP3cI64ow,Not a single one of us regrets not getting the jab…NOT ONE.
573,qVcP3cI64ow,Shame on everyone who coerced or pressured people to take that shot.
574,qVcP3cI64ow,My heart said no; my head said no. I said yes to my instinct and said no to the 'vaccine'. Happy and healthy.
575,qVcP3cI64ow,I’m unvaccinated and will continue to thoroughly research and remain unvaccinated.
576,qVcP3cI64ow,"100% safe from side effects, 99.98% safe from COVID death. I think I’ll stay unvaccinated. Let’s Go Brandon!"
577,qVcP3cI64ow,This is Disgusting... cognitive dissonance in its highest form.
578,qVcP3cI64ow,"When the truth comes out, you can’t unvaccinate yourself."
579,qVcP3cI64ow,"People should go to jail for the rest of their lives for this. I’ve never seen a clearer instance of corruption, greed, and flat out evil than this"
580,qVcP3cI64ow,One of the best life decisions I made for me and my family was NOT to take any shots of any covid vaccines regardless the great panic and great social pressure against the unvaccinated
581,qVcP3cI64ow,These side effects are not rare. They are underreported.
582,lEFYYpE_hds,"I’m not anti vax but when I’m not allowed to ask questions, I ask more questions. Why so defensive? Why so unwilling to have a conversation about it? It’s a red flag to me when questioning something or asking questions gets a strong negative response."
583,lEFYYpE_hds,"My roommate who's a 21 year old male contracted myocarditis from the COVID vaccine. He started convulsing in the floor one night and we had to rush him to the hospital. He's been to multiple specialists since then. It's a much bigger deal than people think, one of the risks of myocarditis is sudden death."
584,lEFYYpE_hds,"""You're willing to lose your job over this?""
""Yes""
""Tell me why.""
""Because I am not going to take that vaccine...""
*Immediately gets cut off by the reporter and we can't hear why she won't get it*

Well done. Amazing reporting."
585,lEFYYpE_hds,"Reporter - ""So you're willing to lose your job instead of getting the vaccine, tell me why.""
Woman - Begins to explain 
Today show - *immediately cuts her off 😐"
586,lEFYYpE_hds,"It's linked to heart issues in all age groups in my opinion.  As a nurse, I'm seeing a lot of heart issues about 3-4 months after receiving covid shots in people that don't have prior heart issues."
587,lEFYYpE_hds,My friends cousin (female) who is 19 went into cardiac arrest 3 days after 2nd vaccine. She just had a heart transplant and has a long road ahead of her. It’s more common than they are letting people believe.
588,lEFYYpE_hds,"They really need to report numbers and percentages so we can have even a clue as to what an ""increased rate"" is. News channels are so bad at reporting useful information and ambiguous information only increased emotional reactions and conjecture."
589,lEFYYpE_hds,Imagine posting such a story and not stating how many have had these reactions out of how many observed. I guess that's why you don't need a degree to be a news anchor...
590,lEFYYpE_hds,I'm so sorry for all the individuals here that were convinced or cohersed into taking this vaccine. People really need to band together and push back against this.
591,lEFYYpE_hds,"Proudly unvaccinated. Y’all were flat out brainwashed. Me? I stayed strong. Had my money saved. When my job laid me off for not taking that jab, I was ready. I had over 3 years of rent saved up. I was living good for the past 2 in half years. Get ya priorities straight."
592,P3nXJB5PoBM,My Aunt died three days after having the v. She was an athlete who’s heart just stopped in her sleep. I know a guy who can no longer walk after complications from the v.
593,P3nXJB5PoBM,"Hey David, you seem like a really smart guy. May I give you a little unsolicited advice? Forget about politics for a moment. Forget about political parties for a day and go out into the world and try to find the truth about this. Do research online. Talk to doctors. Talk to families of healthy young people who just suddenly drop dead. Do some digging and follow the truth wherever it takes you. If you are able to take politics out of your research you will find some semblance of the truth. And the truth is scary."
594,P3nXJB5PoBM,My university professor died right after his 3rd dose. He said he would take the week off for that and that was the last time we saw him. Also my ex-girlfriend is now battling with Von Willebrand disease and has severe heart issues. She had none of that before getting vaccinated.
595,P3nXJB5PoBM,Why does David ask for comments if he doesn’t read them?
596,P3nXJB5PoBM,"Anecdotally I personally know 7 people who were hospitalized with pericarditis,myocarditis or embolisms within 2 weeks of vaccination. 3 others “only “ had temporary Bells Palsy within a week of getting the first booster. No one died. I know of 3 deaths from COVID pneumonia and 3 or 4 serious illnesses. The overwhelming majority of the people I know who have had COVID were barely ill. Most were unvaccinated."
597,P3nXJB5PoBM,"A friend had to be hospitalised after the jab. Had serious blood clots. Once he got over that he became paralysed on one side. 
A couple of other people became very lethargic, tired all the time and had to stop working. Blacked out while driving. 
Thing is, we don't really know the longterm effects. If you were to get cancer or heart disease years down the line how do you know if it was from the vax or how much it contributed to your illness?? 
I know many people who still contracted Covid, some very seriously, after receiving multiple jabs."
598,P3nXJB5PoBM,My friend is dead..35 years old .a roofer..said he got the shot to protect his daughter .died of heart attack...so suck it
599,P3nXJB5PoBM,My Dad died of myocardial infarction about 2 weeks after getting the vaccine. He was in his early 60s and quite overweight which definitely contributed (if not the sole cause) but the timing of him dying so soon after the vaccine has left us all with a few question marks
600,P3nXJB5PoBM,"Yet those responsible are walking around free , evading justice and not being held to account ."
601,P3nXJB5PoBM,My cousin had a heart attack after the jab at 33
602,p42FmUNULWg,The fact a doctor does not want vaccine speaks volumes. 😮
603,p42FmUNULWg,"“The vaccine should be tested on politicians first.  If they survive, the vaccine is safe.  
If they don’t, then the country is safe.”
—  Monika Wisniewska
………"
604,p42FmUNULWg,This man deserves a nobel prize.
605,p42FmUNULWg,"I’ll still never forgive those who demonized people for not having the ‘Jab.’

— ThomasKing"
606,p42FmUNULWg,The smartest among us refused.
607,p42FmUNULWg,"So many doctors didn’t want this 😢
Our medical system needs to be renamed more accurately to ‘our pharmaceutical system’."
608,p42FmUNULWg,This Dr needs a massive raise.
609,p42FmUNULWg,"Medication so dangerous, doctors sacrifice their entire career to avoid it."
610,p42FmUNULWg,"They should not be able to force anyone to inject anything into their bodies.  If a doctor feels that going to these lengths to keep his job, and doesn't feel the vaccine he is being told he must take is safe why force him?  Why not give him the choice,  and respect his decision, especially when he is a doctor? 
Stripping him of his ability to carry on treating his patients, comes across as more sinister than if he doesnt take it he is a public health risk."
611,p42FmUNULWg,This why I didn’t take it and never will I knew I was right
612,uOxppT3gPpE,It amazes me how people are still in denial simply because their egos can't tolerate how wrong they have been this whole time. And on top of that they feel like they're the intelligent ones.
613,uOxppT3gPpE,Even mentioning this used to get you banned or fired. Was madness
614,uOxppT3gPpE,"It’s amazing how some people are still so trusting and naive, even after they’ve been lied to. And after they KNOW they’ve been lied to"
615,uOxppT3gPpE,The way this  whole thing was handled has turned me complete anti vaxx. I hope everyone effected gets justice.
616,uOxppT3gPpE,My heart breaks for all the people who felt pressure to take the jab.
617,uOxppT3gPpE,"I'm a simple man. When the Dr. who created the MRNA technology said it wasnt safe, that is all i needed to hear."
618,uOxppT3gPpE,I'm still 17 and took vaccine at 15 yrs age... After vaccine my health got downhill and developed high Bp and heart issues and I'm still young😢😢
619,uOxppT3gPpE,This is like when the police investigate the police to find that there was no misconduct by the police.
620,uOxppT3gPpE,"During covid vaccinations: ""Safe, tested, proven, effective!""
After covid vaccinations: ""There is no such a thing as vaccination without side effects""
I sucked it in. This one myself as well! 😅 Never again! No matter what new pandemic gonna come!"
621,uOxppT3gPpE,"One of my relatives developed pericarditis three days after taking 2nd dose of Moderna vaccine. He was absolutely healthy previously and he is in his early twenties. Kaiser doctors at the beginning were trying to deny any connection to vaccine. He was several times in and out of the hospital now and finally they admitted that it's related to vaccine. Also, my mother-in -law developed bone cancer after the ""shot"". My sister in law's mother just passed away after her cervical cancer returned after long remission after the ""shot"". My other's sister-in-law father developed severe heart issue also right after the shot, to the point that he is dying now. Of course, they are all older people, but what is striking is the timing of this.  I have not taken the shot, neither my child and nor my husband because 10 years ago when we took swine flu vaccine we all got severe side effects, and that is why we did not take any covid shots. My husband developed stroke then ( absolutely healthy 36 year old), I almost died from Guillain-Barre syndrome , my child developed severe neuropathy, and my husbands uncle had a heart attack. Again coincidence? I was very healthy before the flu shot, and now I am almost disabled. I did regain some of my health after the Guillain Barre  , but I am still have severe residual symptoms. I am a microbiologist and have also medical background and I would never take another vax even if threatened. It is a poison, you might not believe me and think it is just all some kind of conspiracy nonsense , but I hope you will heed the warning! Lot of smart people, scientists and doctors spoke against it, but the censorship is very live and strong on YT"
622,r_eFcUpVtqE,"So many of my friends were loudly touting the ""vaccine"" 2 years ago and shaming those who didn't get it. Now they're strangely quiet......"
623,r_eFcUpVtqE,"I remember when India asked to do a independent study of Pfizer's vaccines first before deploying it in India, and they refused. They would rather sacrifice over a billion customer base, than have their product independently examined. That should tell you what the shots have."
624,r_eFcUpVtqE,The damages it has done to people who had received the vaccines is unimaginable!
625,r_eFcUpVtqE,It is criminal what they have done to humanity 😡😡😡
626,r_eFcUpVtqE,It made you more susceptible to it by weakening or destroying your immune system.
627,r_eFcUpVtqE,I'm not Vaccinated...Thanks God
628,r_eFcUpVtqE,"My father, my neighbours, my friends parents... strokes, heart attacks, thrombosis, brain inflammation."
629,r_eFcUpVtqE,I’m retired and presently work as an independent contractor teaching safety related courses. I said if they want to give me this crap they’d have to dart me like a wildebeest from a helicopter. Many people thought I was crazy then……. No so many now.
630,r_eFcUpVtqE,It blows my mind to see a real news program ask questions about the jabs. Well done India.
631,r_eFcUpVtqE,I refused the vaccine and so did my daughter.
632,pxKMrcxxjfM,Do you think this requirement will be overturned ? And when do you think this would happen? Because this vaccine is basically not requirement for nothing else except for immigration it's very unconstitutional :(
633,pxKMrcxxjfM,"My friend has a heart problem like palpitation, pvcs, and arrythmia, he has the copy of the result from the hospital, and he did a research and found out that covid 19 vaccine has an ingredient that increases the palpitation, so it may make his  health issue worse. he can't have the vaccine. My question is, the civil surgeon can write a letter to the immigration that he can't take the vaccine, providing the heart result?"
634,pxKMrcxxjfM,If i already take 3 doses covid do i have to take the last update covid??
635,pxKMrcxxjfM,Hello good day. Do we have to be fully vaccinated(covid vaxx) if getting our medical examination at st. Lukes medical center and at USEM? My husband applied me IR1 visa and IR2 for my son(8 yrs old)
636,pxKMrcxxjfM,"We petition my son frm the Philippines he don’t have schedule yet for interview and medical, but he doesn’t want to get the covid vaccine, what other option he can have? Or he needs to show and submit religious exemption?"
637,pxKMrcxxjfM,What if the vaccine is no longer available in my country?
638,pxKMrcxxjfM,Does my spouse need a green card to be able to come to America
639,pxKMrcxxjfM,please tell me the approximate price of a lawyer for the Supreme Court to cancel the vaccine for a green card?
640,pxKMrcxxjfM,What about if you been here for more than 20 yrs +..  Never travel outside..
641,pxKMrcxxjfM,Is it still a requirement for the foreign National for a green card?
642,aOInguXymGc,I'm still not voting for Biden.  Robert will always be the better option.
643,aOInguXymGc,Kennedy is the best option in my lifetime that we have had for president. There was no peer reviewed scientific evidence to refute any of the things Kennedy says. Jest “he is a conspiracy theorist”
644,aOInguXymGc,"I've spent hours listening to RFK JR. All you people do is lie about him. 
Kennedy 2024"
645,aOInguXymGc,"To anyone buying the spin of this video, try watching any one of rfk's long form interviews and see how this drek holds up"
646,aOInguXymGc,Politifact and CBS calling RFK lier of the year is TOO rich.
647,aOInguXymGc,"I'll be voting for RFK Jr. Kennedy has many solutions to a lot of other issues that affect all Americans. And he wants to rebuild the middle class, make housing affordable again and wants to use some of our military budget to fix these issues, including the decaying infrastructure of America. Kennedy is the best choice for America."
648,aOInguXymGc,"The machine is so scared now, they’re totally desperate with their lies about RFK!"
649,aOInguXymGc,Kennedy2024! It’s happening!
650,aOInguXymGc,The difference between some conspiracy theories and the truth is time. RFK all the way!
651,aOInguXymGc,Kennedy 2024!
652,RaLxhFiOBYk,What she didn't realize was that the FDA was in on the crime too.
653,RaLxhFiOBYk,"Your not a whistle blower, your a human being with love and compassion for humanity. Thank you for your bravery and for the sacrifices you have made to bring awareness to what’s really going on the world. We need more people like you and I hope others see this and are encouraged to do the same because our lives and future generations depend on it."
654,RaLxhFiOBYk,"Thank you for speaking out. As a frontline medical worker who lost their job to these mandates to force “vaccines” on people, I truly appreciate any time the truth is told. I am not anti vax, I have willingly had plenty of vaccines introduced to my body. I just want people to have choice and want for big pharma to be open that things are in a trial phase and not fully proven. No one should be an unwilling lab experiment."
655,RaLxhFiOBYk,Prison for these pharmaceutical employers.
656,RaLxhFiOBYk,Nothing but respect and admiration for this woman for speaking out. Thank you 🙏
657,RaLxhFiOBYk,"This lady is so brave and smart! Lucky world to have someone with great morals. Out of so many employees at Pfizer and Ventavia, she is the only one who noticed weird things, realized what was happening, and spoke up."
658,RaLxhFiOBYk,"When exposing a crime is treated as committing a crime, you're being ruled by criminals."
659,RaLxhFiOBYk,"Thank you to Brook Jackson for her integrity and courage to report this. 
Also, thank you BMJ for your courage in breaking the story and producing this video. 
As an American, our medical industrial complex is so completely owned by corrupted pharmaceutical companies that the situation sometimes feels hopeless. It's refreshing to see people with integrity still exist in this industry!"
660,RaLxhFiOBYk,"With so little intergrity and morals in the world it's somewhat heartening to see people like this putting they're life and career on the line to tell the truth, thank you."
661,RaLxhFiOBYk,"Thank you, Covid-19 Researcher for your integrity ❤️

May God protect you from these criminals🙏"
662,Kd-E95tXfsY,Your own immune system is better without interruption.
663,Kd-E95tXfsY,"Great explanation. Except new data shows spike proteins from mrna can enter cell nuclei, so  there are questions about whether spike proteins really are as harmless as was first thought."
664,Kd-E95tXfsY,MRNA turns your body into a spike protein factory and doesn't let up.
665,Kd-E95tXfsY,Years ago I used to laugh at my friend for prepping for the zombie apocalypse. Guess who's laughing now. 🙁
666,Kd-E95tXfsY,I love this channel because it doesn't have any creepy background music
667,Kd-E95tXfsY,This didn't age well.
668,Kd-E95tXfsY,"but if it really works, why is that pharma companies producing that COVID 19 evade legal sanctions and no liability if it fails, since they said it is effective (theoritically)..."
669,Kd-E95tXfsY,"Can someone please explain to me, if I have already had covid and recovered from it, then my immune system would have made the antibodies, correct? What is the difference between antibodies from natural immunity versus anitbodies from mRNA? Wouldn't natural immunity be stronger than synthetic immunity?"
670,Kd-E95tXfsY,So what happens when the M spike goes through structural changes such as in the case of the new variants?  I assume vaxxed and unvaxxed will be in the same position after a few months.  Simply put we cannot keep chasing these variants by vaccinating every few months. It’s not practical or good for our overall health.
671,Kd-E95tXfsY,"I'll take a pass until the long-term human safety trials are complete, which is what's happening now..."
672,6z4oAgRCySc,"Instead of the old and fragile dying of a disease, the young and healthy are dropping suddenly of the cure. Africa dodged a bullet."
673,6z4oAgRCySc,"When a person has a over 99% chance of surviving a pathogen, how would you be able to work out what the intervention  actually did?  I didn't have any jabs and still managed not to die!"
674,6z4oAgRCySc,"The biggest tell is that the people in charge kept having parties. They weren't afraid to get together without masks, they only wanted us to be."
675,6z4oAgRCySc,"I am so grateful to these rare individuals in the medical community who are courageous enough to stand against the lies and tell us the truth, especially when they pay for it with their career and reputation"
676,6z4oAgRCySc,"I've been trying to tell people, HAITI had the best Covid outcomes in the western hemisphere according to the WHO data, NO Vax, No Mandates! What does this tell us people?"
677,6z4oAgRCySc,"We had a great time in several East African countries during “that time.” Tanzania rejected all COV-ID measures - vaccines, masks, shut-downs, all rejected. It was such a great liberating space to be at that time. Spent time in a couple other countries that did the testing but had limited vaccine utilization. We’ve moved to Kenya since. This disease has been more of a political matter than anything else. One trip back to the US and we caught the thing. Arrrrgh! Africa has been way safer for us concerning this context."
678,6z4oAgRCySc,The virus was so deadly that you have to test yourself to know if you were infected
679,6z4oAgRCySc,"Hi Dr. , thank you for your presentations. I am a seventy year old South African and I would like to share with you what happened here.The black peoples of Africa have a culture which is highly family orientated. They all have a deep respect for elders and tribal leaders. There was a massive campaign to force vaccination here, co-ordinated by our corrupt government in co-operation with big Pharma and the large private sector retail and hospital outlets. The staff at most of these were given no option ...take the vaccine or lose your job. Guess what? They opted to lose their jobs, because their tribal leaders ordered them not to take the vaccine. Millions of doses were destroyed and heavy financial losses suffered by  the big deals because they ignored the influence of tribal customs. I know this because I am a pharmacist who works in the retail industry here."
680,6z4oAgRCySc,"RIP president of Tanzania, a true hero who loved his nation and people. His bravery in speaking truth will be cherished forever."
681,6z4oAgRCySc,"Everyone should look at how Sweden managed the pandemic.
I still question why healthy people were quarintined."
682,EETuOY3JjfM,"This video is a collaboration between Nucleus Medical Media and our friends at the What If Channel. To watch interesting hypothetical scenarios on the human body, humanity, the planet and the cosmos, please visit the What If Channel at https://www.youtube.com/WhatIfScience."
683,EETuOY3JjfM,He said you have a greater chance of being struck by lightning than having an allergic reaction. I already have bad allergic reactions to many things...and I’ve actually been zapped by lightning! I’d be doomed! 😬
684,EETuOY3JjfM,"I am an athlete. I got my second dose of the covid vaccine 3 days ago. The next day after the vaccine, I couldn't sleep. I had the worst fever ever. Today is my 3rd day after the second shot, I feel normal but my stamina when I workout is not the same. I feel like I get fatigued much faster than before and I run out of breath much faster than I used to. I swear I am not lying."
685,EETuOY3JjfM,I would love for this to have been real microscope footage of the vaccine interacting with cells.
686,EETuOY3JjfM,The inside of the body is nothing less than an action movie 😬😎
687,EETuOY3JjfM,"Even if you make it sound cool and easy, to me it is quite terrifying"
688,EETuOY3JjfM,"My friend, who is 39, fit and healthy, was hospitalized with stroke-like symptoms yesterday. He received his second vaccine dose 3-4 weeks ago, his wife said he woke up in the morning and complained of his heart racing and difficulty breathing. While they were waiting for the ambulance she checked his heart rate with their blood oxygen finger monitor, his heart rate was at 155BPM. Can someone explain why a guy with no health issues had a reaction like this after getting the covid vaccination? I'm not anti-vax but this scares the hell out of me. I've heard reports of death and heart inflammation after getting the Covid vaccine, I feel like the vaccine will weaken the heart and cause health problems down the line for healthy adults 18-44."
689,EETuOY3JjfM,the human body is amazing the way it fights for your health
690,EETuOY3JjfM,I had my first jab yesterday but I've been nauseous and weak ever since plus got a running stomach. As someone that hasn't fallen sick on a decade this sucks.
691,EETuOY3JjfM,"Imagine these vaccines don't work on incoming variants, and WHO has to make another vaccine and all those fully vaccinated still need another dose lmao the business keeps going"
692,wosyaWiDR2U,"Doctor Mike Hansen's Programs ⏩ 
FULL Course for MORE ENERGY:
https://learn.doctormikehansen.com/products/increase-energy-course/
FREE Course for MORE ENERGY:
https://doctormikehansen.com/6-days-to-more-energy/"
693,wosyaWiDR2U,Why am I not surprised that he tried to point the blame in another direction
694,wosyaWiDR2U,I had a bad reaction to my first Moderna vaccine .   Doctors were not only unhelpful but could care less.  I went through 6 weeks of physical therapy due to intense dizzy spells.  Then said I should go ahead and get the second shot . No thanks.
695,wosyaWiDR2U,"Of course we can’t blame the “vaccine” but it’s ok to  blame the dead victim. 
RIP Kassidi."
696,wosyaWiDR2U,She was a surgical assistant.  I'm sure she knew how much Tylenol to take!
697,wosyaWiDR2U,The moment they said the manufacturers would have no liability was the moment my decision was .......
698,wosyaWiDR2U,"2 people passed in my family one after 2 dose , 1 after 15 days of first shot, both were healthy prior vaccination"
699,wosyaWiDR2U,"Unfortunately, there are more stories like this but they just aren't being reported on the news."
700,wosyaWiDR2U,"Thalidomide was prescribed for years to help pregnant women with morning sickness ... and then, the monstrosities started appearing in the THOUSANDS.  Yet, it was years before Thalidomide was taken off the shelves."
701,wosyaWiDR2U,Natural immunity is still the best
702,_o2C_KujcB4,I wont take any meds from someone who talked about depopulation a few years ago..hell no 😂
703,_o2C_KujcB4,Love how he just describes an invisible ink injection like it's an everyday thing...think I'll risk the supposed deadly virus instead.
704,_o2C_KujcB4,It’s not a “microchip” it’s nanoparticles like Graphine Oxide and hydrogel!
705,_o2C_KujcB4,So far conspiracy theories are coming true
706,_o2C_KujcB4,Wow. They literally just layed it out. Stay strong with the Lord
707,_o2C_KujcB4,This video brought to you by the Bill and Melinda Gates Foundation.
708,_o2C_KujcB4,what's the difference between a conspiracy theory and the truth? Answer: about 9 months!
