,video_id,comment
0,im3otpqYAiQ,"Remember when FJB said “If you get the shot, you WONT get Covid” ? 🤣😂🤣…how is that ‘revelation’ aging ?🥴"
1,im3otpqYAiQ,"""knew it all along"" Jason GALE, Bloomberg News.

Family must be so proud.

We need to start arresting these criminals for their lies."
2,im3otpqYAiQ,Not like Bloomberg to show this😊 the truths coming out
3,im3otpqYAiQ,"""...linked to SMALL increases in neurological, blood, and heart-related conditions""  ""knew it all along""  sounds like the Overton window is shifting 🙄"
4,im3otpqYAiQ,We knew from the beginning…..that explains “safe and effective “…….
5,im3otpqYAiQ,"If one wears a face mask, they can almost always not get sick from respiratory illnesses including the seasonal flu. From airplanes to vaccines, accelerated approval always begs questions: Is there an alternative solution? Does it minimize disruption or prevent an extinction level event? Who will benefit economically?"
6,im3otpqYAiQ,"""normal"", ""not surprising"", yes normal and not surprising for gross negligence"
7,im3otpqYAiQ,Such misinformation … “nothing to see here as we knew all about these side effects from the beginning
8,im3otpqYAiQ,Anyone else or company would be fined and imprisoned. Where’s our justice? Had pericarditis same night I took moderna and it’s never went away completely.
9,im3otpqYAiQ,Ohhh its reassuring lol this guy says this with a straight face……
10,uiwjAj0zfKQ,"""Why be immune, when you can be invincible""
Sounds like a Thanos quote."
11,uiwjAj0zfKQ,"“He has superpowers but he surely has to have a weakness.”

*Dies of heart failure*"
12,uiwjAj0zfKQ,"Haha ""but sir you only need 2"" that line aged well"
13,uiwjAj0zfKQ,See why cant we have commercials like this
14,uiwjAj0zfKQ,"""Arthritis, pericarditis, Bell Palsy, Dementia, and Nausea."" All 5 pieces of Exodia."
15,uiwjAj0zfKQ,"""Why be immune when you can be... ahhhck""

*died suddenly*"
16,uiwjAj0zfKQ,"Why be immune... when you can be invincible?

Perfect villain quote"
17,uiwjAj0zfKQ,I love the guard giving commands in Spanish.
18,uiwjAj0zfKQ,Hearts attack: incoming
19,uiwjAj0zfKQ,"""Some sketchy off brand company"""
20,LfmhYVCCGhc,"""I'm just some idiot who tells jokes for a living. Nobody should listen to me."" -Joe Rogan"
21,LfmhYVCCGhc,Dr Campbell here in the UK started off being in favour of blanket vaccination.  He changed.  Study from Australia - myocarditis and pericarditis went up by 65% after vaccination.      This was before covid actually entered Australia.    I'm super happy if you think the vaccine is great and suggest you keep on taking them.
22,LfmhYVCCGhc,"If you completely ignore VAERS and every other database worldwide and live in an alternative reality, then yeah, these covid injections are the best and safest vaccinations ever."
23,LfmhYVCCGhc,How much are you getting paid to toe the state line?
24,LfmhYVCCGhc,"I did the moderna vaccine twice and had chest pain and breathing symptoms for almost a year. My mom was working, very active and independent, had a stroke several months after the vaccine. The research evidence is overwhelming that there are risks to vaccines, and the historical record is undeniable that the risks were underplayed or dismissed."
25,LfmhYVCCGhc,Do you know why Rogan said this? Because a lot of vaccinated people died suddenly after they had a covid vaccine.
26,LfmhYVCCGhc,I’m 72 and have every vaccine available.  I’m FINE
27,LfmhYVCCGhc,"Some young people did actually die from the Astra Zeneca vaccine. It caused blood clotting that led to heart and brain issues. In Australia, young people had to sign a waiver before choosing to take that particular brand."
28,LfmhYVCCGhc,It's crazy how many people drank coffee and then died suddenly
29,LfmhYVCCGhc,No recourse with vaxx companies should tell us something
30,SU_SSfiYtfM,"i love the phrase ""fall arsenal,"" like it's a seasonal fashion collection of vaccinations"
31,SU_SSfiYtfM,The only place i get my news bc it doesn’t make me sad :)
32,SU_SSfiYtfM,"I love how the flu vaccine was standard here.

We have come so far as a species."
33,SU_SSfiYtfM,You will be held accountable for crimes against humanity
34,SU_SSfiYtfM,Cried with relief that an RSV vaccine is approved! It's no joke. Staying in a crowded ICU with a brand new newborn is awful. But now that doesn't have to happen! 🙌
35,SU_SSfiYtfM,I still haven’t gotten any Covid Vaccines
36,SU_SSfiYtfM,Lol!  Safe and effective!
37,SU_SSfiYtfM,"God can’t wait for my 2,376th booster shot 😃"
38,SU_SSfiYtfM,"“Omg the new Myocarditis 3.0 is here!  Better get my 8th booster

*strokes out and dies*"
39,SU_SSfiYtfM,Brought to You by Pfizer!
40,7MAlEYqWUTk,"I wanna see this guy make 
""Bad news you have a rare disease""
""How rare?""
""You get to name it."""
41,7MAlEYqWUTk,Been over a year since this was made and people are still malding
42,7MAlEYqWUTk,I had the omicron variant after I didn’t get my booster and ended up in hospital. I had “super covid” where it lingered after the 2 week period and it actually made my asthma escalate so now I have to have 2 inhalers
43,7MAlEYqWUTk,"That last line though... ""You're looking for random facts to support the conclusion you've already drawn, rather than drawing a conclusion from the available facts."""
44,7MAlEYqWUTk,"Just remember folks we don't have a healthcare system, we have a pharmaceutical industry."
45,7MAlEYqWUTk,You would need at least 4 boosters a year that’s been shown to have a multiplicative risk for life long consequences that’s the part that gets me concerned
46,7MAlEYqWUTk,"Until they drop a battle pass for Covid, I’m not dealing with this seasonal new variant BS. Worst game of Plague inc ever"
47,7MAlEYqWUTk,Why did they request the side effect report be held for 50 years? That’s weird
48,7MAlEYqWUTk,"“The hepatitis vaccine requires 2 boosters” NOT EVERY SIX MONTHS, DUDE 😂😂"
49,7MAlEYqWUTk,"Man: Well my chance of dying is like 0.0003%
Dr: I wouldnt be sure about that. *pulls out gun*"
50,8oHP5tmCUZU,20 years in the army and 14 of those in SF and my refusal to get the jab is what took me out of the military. Smdh.
51,8oHP5tmCUZU,Contractor on the east coast here- what he said about corralling sailors and harassing them about the shot is absolutely TRUE. They relieved officers of command and told pregnant sailors they don’t actually know what it does to the baby. Utterly disgusting how the OICs rolled over on their sailors with legit concerns.
52,8oHP5tmCUZU,Never forget or forgive what they did to us .
53,8oHP5tmCUZU,When the Navy Seals realize they've been serving under Nazis.
54,8oHP5tmCUZU,"This has been the case for awhile. In 2002 we were forced to start anthrax and small pox vaccines. We didn't feel good about it but had to have atleast 3 shots before deployment and the remainder overseas. The guys that refused it not only seperated under dishonorable but were sent to the brig. Not sure of the specifics, but i heard of a few officers at lejuene refused and given the shaft  quick. Guess they didnt wanna let marines see officers reject it and follow as we were getting prepped for war. What makes me mad is i had 5 shots before we left, while doing a predeployment medical screening a week out. Corpsman came back anf told a handful of us we only recieved 3 shots. Crazy because we all went as a platoon and did it together. My Gunny argued with them, but because we didn't have it in the record, we ended up getting 1 more that day and 1 a few weeks later. Then the second small pox dose and malaria pills overseas also"
55,8oHP5tmCUZU,"I respect this man for actually standing for his beliefs. I know a lot of my coworkers said they wouldn't take it, but when it came to time, they bent their knees so fast I was shocked. I didn't take it and one other coworker on my shift. It taught me a valuable lesson on who I could trust and depend on"
56,8oHP5tmCUZU,My father fought in WWII.  I served in the Army from 88-94.  My son is now 16 and yesterday I told him I don’t want him to join the military.  The current military is not the one my father and i served.  My son will not fight for a group of people that don’t care about its soldiers/sailors.  He asked me what a draft.  I told him we would cross that bridge if/when we get to it.  I don’t want my son to be in the service and then have to face American citizens if ordered to treat them as the enemy.
57,8oHP5tmCUZU,They better never question why people don’t want to join! NEVER
58,8oHP5tmCUZU,Imagine starting wars while simultaneously alienating a whole generation of GWOT vets
59,8oHP5tmCUZU,The biggest injustice ever in our country’s history. Thank you for your service 🇺🇸
60,t1fboB1YdEQ,ARE YOU GOING TO REPORT THAT THE US IS STILL PAYING AND SUPPORTING THE CHINEESE RESEARCH?
61,t1fboB1YdEQ,"Call it what you like. It’s a bio weapon, just like the first one. Period."
62,t1fboB1YdEQ,If you ever doubted that the original strain was created in a lab then this is your wake up call.
63,t1fboB1YdEQ,"We followed the science and it simply wasn't there, we then followed the money and found the science."
64,t1fboB1YdEQ,Guess RFK was right about warning us about bio weapons all along.
65,t1fboB1YdEQ,This is crimes against humanity!!! What can we do???
66,t1fboB1YdEQ,"It should be illegal in every country to do this types of ""research"""
67,t1fboB1YdEQ,Insane that this isn't being stopped and in fact has arguably been accelerated since the start of the pandemic. People continuing this gain of function research around the world are playing with all of our lives.
68,t1fboB1YdEQ,"Let's get to the bottom of this!  Quick Robby, get the facts from Dr. Fauci again!
No shame."
69,t1fboB1YdEQ,This is crimes against humanity!! Charges should be brought !!
70,mkZ1MabMEZw,This must have taken forever to grow that beard and film.
71,mkZ1MabMEZw,"Pfizer before covid: $60 billion in profit
Pfizer after covid: $122 billion in profit"
72,mkZ1MabMEZw,"Sure wish doctors were this passionate about getting people off junk food, alcohol, and cigarettes."
73,mkZ1MabMEZw,Favorite VAERS factoid is how one entry says a vaccine turned the recipient into the incredible hulk.
74,mkZ1MabMEZw,Would love to hear your take in a Nuremberg trial setting.
75,mkZ1MabMEZw,My friend died the day after she had the HPV vaccine and there was nothing wrong before
76,mkZ1MabMEZw,"My dad had a bad reaction and then collapsed 48 hours after receiving the booster. 
Cluster of skull fractures, bleeding in the brain, seizure upon arrival at the hospital, flown by helicopter to different hospital where he remained for 1 1/2 months. 
He’s now using a walker, trying to get back on his feet. His memory and general mental condition is coming back well, but he’s still messed up.. He’s 67 years old, had no serious health issues his entire life, was on no medications, a runner that was doing 6+ mile runs 2-3 times a week. Ran the NY marathon when he was younger."
77,mkZ1MabMEZw,"Since most VAERS entries are entered by doctors or pharmacists, we can conclude the entries are accurate.  Since it takes nearly an hour to complete a VAERS report, we can also conclude the VAERS data is a small proportion of the actual events since most doctors will not spend the time to report."
78,mkZ1MabMEZw,You should also say that most doctors didn’t even KNOW about this site and are being bullied/fired for bringing up red flags about this.
79,mkZ1MabMEZw,"""So you're saying popsicles kill people?""
""Can I have one?""

Mood"
80,sNUpmYtEWtI,"Rather than a home isolation analogy, what about the seatbelt analogy?  Seatbelts don't guarantee that you'll never get in a car accident, but they do drastically reduce your chance of getting injured.  Hence why we all wear one, and why it's also not an excuse to go driving like a maniac.  We still check our blindspots and use turn signals when wearing a seatbelt, like wearing a mask even while vaccinated."
81,sNUpmYtEWtI,Oh no look what the Florida surgeon general is saying now and hes not the only one
82,sNUpmYtEWtI,"2 years on, I wonder if you are starting to feel like a piece of Schmidt"
83,sNUpmYtEWtI,Y'know I'm glad there are doctors taking the time to educate people about the vaccine
84,sNUpmYtEWtI,"Give it up bud, ain’t getting it and never will."
85,sNUpmYtEWtI,"The clot shot does slow the spread,  you can't transmit when you're dead!"
86,sNUpmYtEWtI,When you realise non of this worked
87,sNUpmYtEWtI,"This turned out to be complete bs, good job!"
88,sNUpmYtEWtI,So where is your apology video for spreading misinformation???
89,sNUpmYtEWtI,I love how you make this information so accessible and easily understandable for lay people.  This is so much easier to understand than all the charts and stats. You’re doing great work. Science!
90,ukwmdCJ8VAw,The paradox.
91,ukwmdCJ8VAw,Booster Botox 😂
92,ukwmdCJ8VAw,Funny asf idk why anti vaxxers r so mad just ignore them this is clearly a joke😂
93,ukwmdCJ8VAw,Blood clots and strokes and heart issues are such a laughing matter 😂😂
94,ukwmdCJ8VAw,All of the anti vaxxer conservatives in this comment section are MAD 💀 and it’s very funny.
95,ukwmdCJ8VAw,Just to give background- this video is from when Covid was on the rise and we were just wrapping up the lockdown.  A lot of medical offices made vaccines required for employees or they couldn’t work.  In our office we highly encouraged it (didn’t make mandate) and all our patient facing staff got it by their own will. This was one of our back office staff member and dr ibrahimi was only teasing her.
96,ukwmdCJ8VAw,My dentist tells me i need botox in my jaw for teeth grinding
97,ukwmdCJ8VAw,Lawsuit!!
98,ukwmdCJ8VAw,"Bro these comments are lame asf, what happened to humor"
99,ukwmdCJ8VAw,Remember to get your booster this fall!!! ❤️
100,81Pk08ixkp0,The needle wasnt the issue.  But anything to make the shareholders happy! Youve taken an oath!
101,81Pk08ixkp0,Stop the madness
102,-Ea3UwYZnrA,"You're brave to discuss possible side effects from the 'Jab', John. I'm downloading this video just in case is dissappears. Thank you, Dr. John."
103,-Ea3UwYZnrA,"I’m a retired veterinarian. 

I could see from the start that mRNA had the potential to cause constant antigen production. 

Reverse transcription was taught when I went to vet school, 40 years ago."
104,-Ea3UwYZnrA,"My sister (a nurse) had 4 jabs now. She had blood clot in lung and pneumonia last year. She’s developed asthma too. She’s always having to take time off with sickness. Her health has steadily declined over past two years. Prior to that she had a healthy immune system and often said herself, just how robust she was. Sadly she thinks I’m a conspiracy theorist and won’t listen to anything I try and put in front of her. I’ve had to just step back and let her find out the hard way. The thing is, the hard way could very well cost her her life. She’s only 57"
105,-Ea3UwYZnrA,"Prof. Robert Clancy is an international treasure. Humility, humor, compassion, curiosity and of course great knowledge and skill. In a time of confusion, ignorance and pettiness it is a relief to hear him talk, giving hope to many people suffering with debilitating illness. Long may he live."
106,-Ea3UwYZnrA,"The end... "" You don't vaccinate people with chronic fatigue syndrome, you are just putting petrol on the fire""   THANK-YOU !!  This was me in April 21. I'd been ill since Mar 20 and In April 21 had Chronic Fatigue. My vax invite came in April 21, I had 11 invites actually. Didn't do it. I'd been ill for over a year, no answers from Drs or Consultants and well my gut instinct was telling me if spike protein does this to me already, didn't seem like the best idea to ask my body to make more. I don't even want to think what may have happened. And I had to put up with people telling me ""Just get the jab""  ""Don;t be silly""  etc. The look of disgust from some people when I said I wasn't vaccinated and one was a male nurse at my local hospital , gave me a proper lecture. I wasn't;t well and didn't;t want to get into an argument as his made was well and truly made up.  Thanks you John and Robert."
107,-Ea3UwYZnrA,"I'd suffered with CFS for 15yrs at the time of the onset of the pandemic. My gut feeling told me not to get the vaccination, but I was given a really hard time about it. Thank goodness I listened to my gut! So thankful for this information 🙏"
108,-Ea3UwYZnrA,Thank you Dr John and Prof Clancy for a very informative discussion.  I live in Australia and took the only jab available to me which was Astra-zen due to the severe mandates in the state I live in.  A few weeks after my 1st jab in late 2021 I lost my ability to walk unaided and have remained with worsening paralysis of my right leg with no definit diagnosis.  I have never had a covid infection and the fact that Astra-zen is now banned in most countries including Australia speaks for itself.  Forcing untested vaccines on people that have the potential to do so much harm is a crime against humanity
109,-Ea3UwYZnrA,I've struggled with chronic fatigue for 29 years. This is the first time I now understand what is happening in my body.
110,-Ea3UwYZnrA,"i'll never forget how people treated me when i told them to avoid the vaccine.. i was already disollusioned with the world before 2020, and what followed just confirmed my disdain. glad theres still some people out there taking it seriously and talking about it"
111,-Ea3UwYZnrA,"This is by far the best double act, not only on YouTube, but currently around. Great moderation again  by Doctor John , and Prof Clancy always delivers his information in such an enthusiastic and accessible way. Thank you very much  to both of you gentlemen, for this and the previous videos and long may you continue."
112,gPHgRp70H8o,"When he said ""You, Mike, in Baltimore. Get the vaccine"", I took that personally. I already got it, John. Go bother Steve in Annapolis. He's being hard headed about getting the vaccine."
113,gPHgRp70H8o,“that is the worst thing to come out of a kennedy’s mouth since the back of a kennedy’s head” holy SHIT lmao
114,gPHgRp70H8o,"""My mom is experiencing some side effects from the vaccine. What was it you said you were experiencing, mom?""
""Bein' a boss ass bitch""
Lmao 🤣"
115,gPHgRp70H8o,"I wonder if John discussed the egg bit with his wife beforehand, or just let her discover it organically. 

I've seen enough episodes of this show to know is definitely the second one. I can imagine the text messages from her friends about eggs, shes confused at first but then remembers who she married, accepting her future and the inevitable egg jokes."
116,gPHgRp70H8o,"That egg bit. Something about it screams ""this is a joke,"" but I'm genuinely worried that he actually wants to be egg. It was way too convincing."
117,gPHgRp70H8o,How did John keep a straight face during the vaccine cicada bit? A true professional. I couldn't stop laughing.
118,gPHgRp70H8o,"Spring of 2020: ""Why the hell is it taking so long for these scientists to make a covid vaccine!?!""
Spring of 2021: ""Why the hell did those scientists make that vaccine so fast?!?"""
119,gPHgRp70H8o,This contained way more of Tucker Carlson than I ever wanted to actually directly experience.
120,gPHgRp70H8o,"It's great that you're asking questions, Tucker. I'd recommend asking a doctor rather than a camera, though. Cameras are not medical experts, Tucker."
121,gPHgRp70H8o,"""Bein' a boss ass bitch"" made me laugh so hard 😭"
122,85ZicYaZsbQ,"This is gaslighting. Trying to tell her that her friend’s injury was random and there was no causal relationship to the kool-aide, gaslighting."
123,85ZicYaZsbQ,Someone who was perfectly healthy then had 3 heart attacks and other symptoms . It is perfectly reasonable to assume it might be a vaccine injury.
124,85ZicYaZsbQ,"By not taking the jab, I'm 100% safe from side effects and 99% safe from covid."
125,85ZicYaZsbQ,I am unvaccinated and don't have any regrets.
126,85ZicYaZsbQ,"The amount of relief I feel that I didn't get vaccinated, even though I was pressured by almost every member of my family, is absolutely indescribable! I feel sorry for those who got it though. Best of luck, they're definitely gonna need it."
127,85ZicYaZsbQ,THANK GOD I DID NOT GET THE VACCINE
128,85ZicYaZsbQ,"My mother told me "" Never take drugs from convicted felons with legal indemnity . """
129,85ZicYaZsbQ,Nazarin says that they edited this to make her look bad and even swapped her reactions. This would not surprise me at all.
130,85ZicYaZsbQ,This documentary sickened me to my core. And further convinced me that I would never take it. Well done to Nazarin for standing up for herself.
131,85ZicYaZsbQ,"The only question I'd ask the reporter and anyone else:
*""How can you be suuuure, the vaccine is safe?""*"
132,1m_iclAMXLo,The Governor trusted the CDC just like 70%. Only politician to admit he was wrong. Right on Ron
133,1m_iclAMXLo,"O my God, he changed his mind  when more information became available as time went on!!Sounds like a smart person"
134,1m_iclAMXLo,He changed his mind when 30 year olds suddenly starting dying having heart attacks on an alarming rate. Fair play on him for speaking out.
135,1m_iclAMXLo,Being sold a lemon and then realizing later it was a lemon isn’t flip flopping.
136,1m_iclAMXLo,"It’s really simple.  He made it available to those who wanted it but made sure no one was FORCED to get it.  He is loved in Florida,…even in Democrat run Dade County.  Best Governor EVER!"
137,1m_iclAMXLo,Making vaccines available and making it mandatory are completely different.
138,1m_iclAMXLo,"Honestly, people that spread misinformation should be held accountable for the deaths they caused."
139,1m_iclAMXLo,The left wing and the right wing belong to the same bird
140,1m_iclAMXLo,Changing your stance when you find valid information that government officials have been deceptive throughout this entire pandemic process is the sign of a strong leader
141,1m_iclAMXLo,A wise man will change his mind a fool won't.
142,YAl7jHHuG9E,The conclusion is: the vaccines are more effective at preventing traffic accidents than they are at preventing infection of Covid. 😂
143,YAl7jHHuG9E,"""For the first time in history the ineffectiveness of a medicine is being blamed on those who refuse to take it."" ~ Dr. Robert Malone"
144,YAl7jHHuG9E,How you managed to keep a straight face throughout the majority of this is remarkable. Thank you again DJC! 🙏
145,YAl7jHHuG9E,"With studies like these, I can't believe distrust in medicine is at an all-time high!"
146,YAl7jHHuG9E,"There should be legislation to force these institutions to disclose their sponsors and funding right down to the major investors of holding companies that would benefit from such pieces in any way. 
Thanks Dr Campbell."
147,YAl7jHHuG9E,"I was recently run off the road by a truck and ended up hitting a sign and damaging my vehicle. The truck driver did not stop, not even sure if he knew he ran me off the road. Wonder if he was vaccinated. The officer who investigated the accident did not ask me about my vaccination status! He asked if I had been injured. This paper is the most bizarre thing I’ve heard in a very long time!!!😂😂😂"
148,YAl7jHHuG9E,Strange how they get vaccination status of people but not when it comes to the sudden deaths
149,YAl7jHHuG9E,Two of my “treated” colleagues avoided the perils of driving for a while at least. Their shingles and kidney failure kept them safely and effectively off the roads.
150,YAl7jHHuG9E,"Thanks for this, Dr. John! I'm going to use this (and perhaps you're subsequent video) in my class to explain why critical thinking is necessary even with articles published in reputable sources. Very helpful!"
151,YAl7jHHuG9E,"And the virus is so smart, it knows not to attack you when you’re eating!  This is why we had to wear masks when entering or exiting a restaurant during the pandemic, but could safely take it off to eat! 🙄  The numbers of people who actually went along with this nonsense is embarrassing. 🤦‍♀️"
152,-rqGp6vVxnk,This is the cutest way to explain a vaccine
153,-rqGp6vVxnk,Bro when he started slapping his ass I fucking lost it 💀💀💀💀💀💀💀
154,-rqGp6vVxnk,"Nobody:
""Him moving his head the whole time"""
155,-rqGp6vVxnk,I want cat doctors in real life
156,-rqGp6vVxnk,This is good analogy of how vaccines used to work. The Covid Vaccine is actually a mRNA vaccine and works very differently.
157,-rqGp6vVxnk,actually it doesn't use antigen technology- it uses gene therapy to change the coding of your cells
158,-rqGp6vVxnk,I've never felt so sorry for an antigen before.
159,-rqGp6vVxnk,When I got the shot I got Covid a month later
160,-rqGp6vVxnk,"“Please get the shot everyone!”😁
“Please get shot everyone!”💀"
161,-rqGp6vVxnk,This was the most adorable explanation of the human immune system ever.
162,-O8ItNje4yc,Crime against humanity.
163,-O8ItNje4yc,That is absolutely evil to give a child a Covid shot when we know we are having adverse reactions
164,-O8ItNje4yc,Don't put your children through  the fire.... Many were deceived by sorcery -(pharmakeia) Revelation 13:
165,-O8ItNje4yc,"I’ll still never forgive those who demonized people for not having the ‘Jab.’

— ThomasKing"
166,-O8ItNje4yc,Child abuse
167,-O8ItNje4yc,Mark of the beast
168,-O8ItNje4yc,Video reported for child abuse
169,-O8ItNje4yc,"So who willingly let's their child be experimented on to provide this ""data""?"
170,-O8ItNje4yc,Assault on a child with deadly weapon
171,-O8ItNje4yc,I would never hold my kid down to give him some bull that's hasn't been tested enough.  I could never forgive my self if my child would die  :/ NEGATIVE
172,FPeg508YTvA,Thank goodness there are still doctors with honesty and integrety!
