,video_id,comment
884,sL6OTbMnsMo,"It was the politicians that kept people from speaking out though. It was the politicians that squelched free speech. It was the politicians who policy forced it on people.
There were not mandates, if there was not a propaganda campaign, if people were able to share their experience, I would give the politicians a pass. 
But they did not do that therefore, they are guilty"
885,sL6OTbMnsMo,Sunak is a liar and covering up
886,OJJbm8JuRvs,"""You dont want to be the only kid in class without myocarditis, do you?"""
887,OJJbm8JuRvs,"If I was calm near my friend, it was because I didn’t wanna cry in front of them lol"
888,OJJbm8JuRvs,I hope and pray these babies don't develop major health issues later in life.
889,OJJbm8JuRvs,I'd be scared getting something that can cause bloodclots and heart attacks too
890,OJJbm8JuRvs,My goodness I hope nobody is vaccinating their kids anymore. I hope everyone is aware and awake. It is not for your benefit. Believe in your gut instinct. If somebody Hass to talk you into something it’s not good.
891,OJJbm8JuRvs,These parents have to feel so bad for what they’ve done to kids
892,OJJbm8JuRvs,How about an update now. How many parents will continue to get their children vaxed against covid?
893,OJJbm8JuRvs,"im 19, turning 20 and i still have the phobia of needles, i never grew out of it haha. looking away tends to help a ton."
894,OJJbm8JuRvs,"I remember getting a shot when I was like 8 and the lady was like “it’s gonna feel like I’m pinching you, like this” and I felt a pinch on my arm and I was like “oh that’s not bad.” She had already given me the shot."
895,OJJbm8JuRvs,How many of these kids died or ended up with health issues 🤔
896,0UHCFPDhrEI,"“The vaccine should be tested on politicians first.  If they survive, the vaccine is safe.  
If they don’t, then the country is safe.”
—Monika Wisniewska
.....……"
897,0UHCFPDhrEI,I swear our world has gone through a wormhole where wrong is right and right is wrong. God help us all. ✝️
898,0UHCFPDhrEI,They should do a documentary on severely injured patients from the vaccine and the percentage then
899,0UHCFPDhrEI,The more they try to convince me to get it the more my gut tells me not too
900,0UHCFPDhrEI,"The longer I have worked in the health field as an RN the more skeptical I am with ""Experts""."
901,0UHCFPDhrEI,You women are my heroes!  Stay strong!!
902,0UHCFPDhrEI,"Vaccine or no vaccine, everyone is taking a risk. People should just mind their own business."
903,0UHCFPDhrEI,Thank God there are still people out there who can  think for themselves and not let mainstream media do it for them.
904,0UHCFPDhrEI,This aged beautifully…
905,0UHCFPDhrEI,"I highly respect these women. Imagine having most of the world against you, having ALOT of people despise you, and you still decide to stand by what you believe is right.
Nothing but respect"
906,h6potmDg0ek,"WAIT....SOOOO serious heart condition, gets the shots THEN catches cOvId, THEN didn't get circulation to her legs and needs to have them amputated???? HOW is this NOT a story about VaXxInE injury??????🤯🤯🤯"
907,h6potmDg0ek,"""sAfe aNd EfFeCtIvE""

Prayers for this young lady."
908,h6potmDg0ek,"""Healthy 20 year old"" and ""born with a heart condition"" are two completely different things."
909,h6potmDg0ek,Wait wait wait…. You didn’t say it loud enough….SHE HAD THIS HAPPEN AFTER BEING VACCINATED
910,h6potmDg0ek,"I have a coworker who was born with a congenital heart condition and had to have multiple heart surgeries as a child… she was afraid to get the vaccine due to the cardiac side effects, so never got vaccinated but ended up getting Covid… Thankfully she recovered without any lasting effects."
911,h6potmDg0ek,"Doctors tried to amputate my friend’s leg from the hip due to clotting.. she didn’t allow it, neither from the knee or the ankle or the toes each time those “butchers” tried to convince her it was life and death. Years later she sill has her legs thanks to not complying."
912,h6potmDg0ek,"If she was born with a serious heart condition, how is she a “healthy individual”? I think she is the definition of an individual with serious health conditions"
913,h6potmDg0ek,I can't imagine being a 20 year and losing  legs. God bless her and her family.
914,h6potmDg0ek,"I absolutely feel for her.  Sounds like she is a very strong woman.  I wish her the best.  I encourage people to think outside the box.  Outside the MSM.

I had a close friend that died recently.  She was a fitness competitor.  In her prime and incredibly healthy.  She had no prior health concerns.  Fast forward to post ""covid prevention method"" She began experiencing extreme leg pain.  Her legs began to rapidly swell up.  She went into the hospital, where the clotting continued to get worse.  The doctors had no answers.  The only option was to amputate her legs from the hip down.  After the procedure, she died of a heart attack soon after.  In no way, shape or form was she sick with covid.  

This isn't the only story."
915,h6potmDg0ek,"Yea my mom had a very serious blood clot almost killed her, it did take away her vision but she survived. That paired with elevated heart rate high blood pressure and enlarged heart. All happened shortly after being vaccinated"
916,yhECkm16AGU,A good thing about being called a conspiracy theorist is not having myocarditis 🤷‍♂️
917,yhECkm16AGU,Refusing the covid vaccine was one of my best decisions ever.
918,yhECkm16AGU,Bri gets awfully quiet once she realizes this narrative isn't going her way.
919,yhECkm16AGU,The whole thing has been a crime against humanity.
920,yhECkm16AGU,"The CDC didn't Fail, they accomplished exactly what they wanted."
921,yhECkm16AGU,What’s the difference between the truth and a conspiracy theory? About six months.
922,yhECkm16AGU,Bri is so deep in her vaccine defense stance she just can’t stand to hear truth
923,yhECkm16AGU,"This information is almost 3 years old for us ""conspiracy theorists"". How did we know? We just followed the doctors and scientists they were censoring; it wasn't that profound or prophetic. Anyway... I guess it's better late that never."
924,yhECkm16AGU,Briahna blinking as she sees her talking points fall apart is priceless. Especially when he discussed the nature of myocarditis in COVID patients vs vaccinated.
925,yhECkm16AGU,Bri looked devastated by the news.   She may have to come to terms with spreading MISinformation.
926,RQwcX-B6luw,"A 120k for severe disability, life totally ruined. That is no justice."
927,RQwcX-B6luw,The fact these pharma companies were given complete indemnity by our government tells you all you need to know
928,RQwcX-B6luw,"The GP had assured us, in a patronising way, that the AZ jab was completely safe and that we were being silly worrying about it, and that Mum needed the jab because of her age (86). 

Two days after her AZ jab in Feb 2021, my mother developed 'flu' symptoms. 5 days later she was in hospital with a suspected pulmonary embolism (according to the consultant). She died the next morning. The only consolation was that I was ""permitted"" to sit with her for her last hour of life. 

I will never forgive the Govt (and GP) for ignoring science and allowing such emotional and physical damage to innocent citizens."
929,RQwcX-B6luw,I am so happy I resisted all social pressure and did not take a jab. Even at the high social costs.
930,RQwcX-B6luw,I wonder how many people who on here are going to tell us about their injuries are the same people who shamed and abused the people who refused it ?
931,RQwcX-B6luw,And those of us who did not listen to our governments were seen as stupid 🤦🏻
932,RQwcX-B6luw,"It is not about compensation, which is paid by the taxpayer and not astra zeneca.  Its about holding those who lied to us to account for thier crimes."
933,RQwcX-B6luw,"When tens of thousands of NHS nurses refused to take the vaccines even under severe threats of being sacked other people should have taken notice, the whole thing stunk at the time"
934,RQwcX-B6luw,Covid will be talked about for decades to come. The greatest social and science experiment.
935,RQwcX-B6luw,Big Pharma need to foot the bill and be held accountable for what they have done.
936,ButW2kNe564,How come someone's religious belief can be questioned but someone's gender can't. Please make it make sense.
937,ButW2kNe564,You shouldn’t even have to do this kind of run around with exemptions as a free citizen you should have the right to just say no.
938,ButW2kNe564,"By law, they have to accept the exemption.  If they don't, you can sue them.  Do not let these bullies scare you"
939,ButW2kNe564,"Has nothing to do with health, all to do with power and control!"
940,ButW2kNe564,"The vaccine theory of “Well you’ve had vaccines in the past why not this one?

 Most vaccines are given as children with consent of parents without choice. 
People grow into Adults and are perfectly  entitled to change their opinion & their Religious belief if they choose to do so ."
941,ButW2kNe564,You don’t get to decide my religious beliefs. I hope all those denied sue and win.
942,ButW2kNe564,"You shouldn't have to hide behind religion. All that should be required is someone simply saying ""No""."
943,ButW2kNe564,"AT 1:17 ""The nature of their objection isn't truly religious."" The woman is basically calling those who would seek a religious exemptions liars and she does it with a smirk on her face. The lady's a snake."
944,ButW2kNe564,"i love how the ""lawyer"" lady just makes her unfounded assumptions..."
945,ButW2kNe564,People have to stand up and say No
946,OjbSWebA3Ko,She is one of THEM
947,OjbSWebA3Ko,"That hasn’t aged well and nobody (nobody…) will ever be able to forget her singing her jingle.  Oh, boy…"
948,OjbSWebA3Ko,I wonder how many people Dolly is indirectly responsible for their deaths.   What a traitor.
949,OjbSWebA3Ko,Never forget what these people did.  Never.
950,OjbSWebA3Ko,"I was a huge enthusiastic listener for decades. With this performance, it's over forever! I'm not buying any more records from her!"
951,OjbSWebA3Ko,Shameful. Every single one who helped push this should be held accountable..
952,OjbSWebA3Ko,"What Dolly got was 🎶Saline, Saline, Saline, Sayyy-leeee-eeeen. I'm beggin you to please open yer eyes🎶"
953,OjbSWebA3Ko,It’s called “towing the line”... The one thing worse than getting duped is not accepting that you have been duped.
954,OjbSWebA3Ko,"Dolly: ""so how are the long term studies and any current issues with the shots?""  

Doctor: ""oh were still writing up the script for the long term studies and nope.... no issues at all, everyone is fine taking this!"""
955,OjbSWebA3Ko,"How dare she call people cowards !! 
Lost  my respect that’s for sure !!"
956,7n6Eagn5d78,Love how a high profile married couple can disagree and stay civil.
957,7n6Eagn5d78,Well that was weirdly refreshing. Can anyone actually imagine a fully autonomous and articulate First Lady that has her own views and positions?
958,7n6Eagn5d78,"My god she exudes class, intelligence, beauty, calmness, sharpness, and articulate. Hard to find someone like her in the modern age woman."
959,7n6Eagn5d78,"Such an intelligent, dedicated and classy lady. Vivek isn't just blessed for his many positive traits he is deeply blessed by having this amazing woman walk by his side through life. Irregardless of whether or not he is or isn't elected as our next president and this lovely lady our first lady, I am inspired by their marriage and family. I wish them only the best throughout thier lives. May God bless them and keep them, may they continue to do good works for  those around them who are lucky enough to cross paths with them. These are good people doing good works and should be set as an example of how to live life."
960,7n6Eagn5d78,What a beautiful and educated woman. Vivek is a very lucky man to have her.
961,7n6Eagn5d78,I LOVE that she can think for herself and has her own opinions.  My husband and I are the same way!  That shows HONESTY to me!!
962,7n6Eagn5d78,"She's very intelligent and well spoken, and she respects the AUTONOMY of the individual - very important!"
963,7n6Eagn5d78,"Vivek's a lucky guy. She's beautiful. intelligent, supportive and has a great sense of humor ."
964,7n6Eagn5d78,"For someone who has not been trained in political speech techniques formally by the nature of their profession, Apoorva is extremely articulate and lightfooted around questions intended to procure concrete answers. Not only is she excellent during this interview and demonstrating the profoundness of her mind, but I cannot help but also notice that she is stunningly physically attractive. The total package!"
965,7n6Eagn5d78,This is what an actual First Lady doctor looks like.
966,IS3kQYcKSeY,"India has broken record of fastest vaccine production thanks to our pharmacy workers, scientists and QUAD who gave soft loans to Indian companies.❤️"
967,IS3kQYcKSeY,"To maintain international relations , such acts are very much appreciated and have optimal importance.
Mere 1lac doses never quench the requirement of thousand of millions.."
968,IS3kQYcKSeY,Meanwhile Indians and Taiwanese: Something is burning.😂
969,IS3kQYcKSeY,Amazing 🔥🇮🇳🇹🇼
970,IS3kQYcKSeY,"Taiwan is a peaceful country and  India and taiwan good Friend's
It is a friend's duty to help a friend🙏"
971,IS3kQYcKSeY,"India doing what it always does, help those in need. It is a cultural value and I am glad we have not lost it"
972,IS3kQYcKSeY,Once a legend said action speak louder than words ❤️.
973,IS3kQYcKSeY,Wowwwww!!!!Good job INDIA...Love from the PHILIPPINES.❤️❤️❤️🙏🙏🙏😊😊😊
974,IS3kQYcKSeY,"Everyone should praise India for doing the right thing like China, 👍👍"
975,IS3kQYcKSeY,🇮🇳❤️🇹🇼
976,qWI0YiSmTKs,"If keys are sticking to you, you might want to shower more often."
977,qWI0YiSmTKs,This explains why I’m always being attracted to my fridge.
978,qWI0YiSmTKs,"The part that cracks me up the most is that keys are almost always made of brass,  or chrome-plated brass.  They won't stick to a magnet.  Try it!  They are NOT magnetic."
979,qWI0YiSmTKs,I was having a bad day and came back to view the key sticking lady. I’m feeling a lot better now thank you 😊
980,qWI0YiSmTKs,Ahhh I see.. That's why I kept getting drawn back to my fridge. I thought I was just hungry.
981,qWI0YiSmTKs,The J and J has ruined my life. Now 2 years later I still have severe tinnitus and neurological problems. I am scared
982,qWI0YiSmTKs,Maybe that woman needs to take a shower
983,qWI0YiSmTKs,"""I just found out something interesting over lunch""....and thus being the expert that now makes me, I'd like to share it with this state committee"
984,qWI0YiSmTKs,Sticking stuff to yourself is a gag I've been doing since high school. It isn't magnetism but sweat.
985,qWI0YiSmTKs,"""Think of how stupid the average person is, and realize half of them are stupider than that."" George Carlin (1937-2008)"
986,Yd1P-NnvkOA,"Just remember I'm using your card, if you lost it?"
987,Yd1P-NnvkOA,Just forge one.  Is not worth it getting it
988,Yd1P-NnvkOA,"*I was finding difficulties getting a vaccine card until I came across scott, the above mentioned social media account that got me my vaccine card in a very short period of time.*"
989,Yd1P-NnvkOA,🔝is the best we ordered some cards yesterday and we got them today❤️❤️
990,Yd1P-NnvkOA,👆👆👆👆I really appreciate you for your kindness and good work i just received my vaccination card in less than 30 minutes I'm grateful 🙏
991,Yd1P-NnvkOA,☝️make sure you contact the above mentioned account incase you have similar issue of lost vaccine card your Hope's of getting another is 100%
992,Yd1P-NnvkOA,Reporter has an unnecessary loud mouth!
993,Yd1P-NnvkOA,👆👆👆👆I really appreciate you for your kindness and good work i just received my vaccination card in less than 30 minutes I'm grateful 🙏
994,It7VNzhAqOs,"I have a friend who developed a pulmonary embolism after his second vaccination shot. He was told by his doctor, the hospital and CDC it was not related to the vaccine, but he'd never had that type of an issue before.  And they wonder why people are hesitant to get vaccinated."
995,It7VNzhAqOs,"Notice they never promote natural immunity or antibody treatment, it’s all about the shots. Glad this doctor is getting the word out."
996,It7VNzhAqOs,"When I had my vac at a pharmacy I asked if they could aspirate and the person said they were not trained to do that, I would have to go to a nurse for vaccination. I find that appalling, a layman trained to give a vaccine but not trained in safety techniques. This is in Australia."
997,It7VNzhAqOs,"Still blows my mind that for a 99.7 recovery rate people are flocking to get this exper i ment. 
I'm equally shocked that this very informative, great video has survived 3 days on this platform."
998,It7VNzhAqOs,"We have a moral duty not to comply. No to discriminatory vaccine passports and mandates, it is an utter disgrace. This must not happen England. Say no to this disgraceful dystopian tyranny."
999,It7VNzhAqOs,Aunt had a heart attack a week after her second shot. They said she had a damaged artery. Three months prior she had a full medical and was in perfect health.
1000,It7VNzhAqOs,"Thank you Doctor Moran, Please may I use a short clip from this video in one of my videos."
1001,It7VNzhAqOs,"My doctor in the UK laughed at me when I asked him to aspirate the injection, telling me there’s no major blood vessel he could go into, basically I was been silly, it’s disgusting they won’t do it!"
1002,It7VNzhAqOs,"im starting to have my doubts about the whole covid thing , here in NZ anyone who doesnt get a vaccine can be fired with 4 weeks pay which is the same as forcing people to get it , additionally i had a reaction to the vaccine (pzier) that did not get better after 2 months  ,i went to my GP who said there was no mechanism to report long term effects due to covid vax , im now very concerned"
1003,oz4FCtHEH5M,"COVID 19 Second Wave - How dangerous it is? When to get hospitalized? Treatment protocol  ( Hindi )
👇👇👇👇 👇👇👇👇𝘄𝗮𝘁𝗰𝗵 𝗮𝗻𝗱 𝘀𝗵𝗮𝗿𝗲👇👇👇👇👇👇👇👇 
https://www.youtube.com/watch?v=RAfAR1FLCfU"
1004,oz4FCtHEH5M,Dr Nadeem jager explain very good way about covid19. Thank you sir.
1005,oz4FCtHEH5M,Your teaching style is outstanding. Thank you so much for giving this information. I am from Nepal
1006,oz4FCtHEH5M,"प्रणाम सर
आपने सारी जानकारी बहुत ही सुंदर तरीके से दी हैं जिससे लोगों का भ्रम पूरी तरह से दूर हो गया💐
इसके लिए आपको बहुत बहुत
धन्यवाद"
1007,oz4FCtHEH5M,Very detailed information 👍 thank you 🙏🏼
1008,oz4FCtHEH5M,Best video available on Youtube till date. Please make Part-2 with latest vaccination data available and to answer more questions. Thanks
1009,oz4FCtHEH5M,Sir sinus patent and asthama patient kya vaccine lee shkte.... mujhe Subha subha sardi lg jata hai aur mujhe asthama ho jata kv kv to kya mai covaxin lee shkta hu kya???
1010,oz4FCtHEH5M,"इस से अच्छा वीडीओ पूरे यूट्यूब पर नहीं मिलेगा 

आप का बहोट धन्यवाद डॉक्टर साहब 
फैन हो गया में तो आप का 🙏"
1011,oz4FCtHEH5M,Thank you so much Dr. Sir 💐🙏
1012,oz4FCtHEH5M,Thank you so much sir for this wonderful information
1013,2Ruq3o7iZho,"Incidentally enough, the first two times in YEARS I've ovulated (I have PCOS), were directly after shots one and two. Second time, I got pregnant ;) Currently percolating twins!"
1014,2Ruq3o7iZho,"I’ve decided to try for medical school again, after 2 failed attempts and nearly 10 years since my undergraduate studies! You inspired me. Also a momma, hopefully soon to be doctor. ❤️❤️❤️

Edit: Wow I am so touched at this response, thank you for the support. MCAT number 3 scheduled for April 2022, if I get in I will start in the fall of 2023! 🙏🏼🙏🏼🙏🏼🙏🏼"
1015,2Ruq3o7iZho,"LOVE seeing you discuss actual epidemiological data, I'm learning about this in my first semester of veterinary school, I face similar challenges when I discuss vaccine risk with my clients! Thank you for spreading evidence-based medical knowledge with a sympathetic and digestible message!"
1016,2Ruq3o7iZho,Never thought I would see a science experience on pregnant women.
1017,2Ruq3o7iZho,"Just had the weirdest realization when she was talking about the placenta. My body has the ability to not only create new human life,  but a whole new organ outside the fetus as well. Never thought about it. And I've given birth twice!  🤯"
1018,2Ruq3o7iZho,"When I got my first shot I had a sore arm, of course, and a bit of a headache, and I was EXHAUSTED. The rest of it cleared up, but the exhaustion only lessened a bit. Which is when I realized I was about five weeks pregnant. LOL! Turns out baby was more to blame for the exhaustion than the vaccine was."
1019,2Ruq3o7iZho,"I’m happy to see this I got both of my Covid shots back in I believe March and I recently found out I’m pregnant with my 5th child even though my 4 children are grown up and I’m a grandmother,  this little one came very unexpectedly and honestly if I didn’t watch your shows and decide to take a pregnancy test I probably would’ve been on the show I didn’t know I was pregnant!!  because I’m 26 weeks and I had no clue once I got my Covid shot I never recovered I was constantly throwing up thinking well I ever recover from getting the shot, and I also have crazy periods so i didn’t think absolutely anything of pregnancy ,  the only thing I noticed was I was overly emotional constantly crying to the point my eyes have psoriasis, so I said I should take a test and call the doctors sure enough we have a blessing on the way 🤰🏻 even though I have to learn all over again what to buy what the baby needs because it’s been so long 😊 like I said my kids are all grown up graduated . so my fear was when I received the Covid shot did I harm my baby , I won’t know till next week till I receive my first ultrasound , it’s been a fear of mine i was thinking did I cause harm birth defects and all of this has helped me . so just wanted to say thank you so much for all your videos and knowledge you have made me feel so much better and also helped me not be on the show I didn’t know I was pregnant!!! LOL again thank you"
1020,2Ruq3o7iZho,"Much of my decision to be vaccinated back in May was because of information you shared here and on Instagram regarding COVID in pregnancy. Thank you for the update. Our little one is now a month old and she is thriving; our community had very few cases during my pregnancy but now that cases are spiking again, my hope is that my vaccination will be enough to protect her if necessary."
1021,2Ruq3o7iZho,"Thank you so much for not attacking the misinformed. Since I'm not high risk and I had almost no symptoms when I got covid in 2020 I decided to wait until the vaccine was 100% fda approved, although I was still pretty nervous about getting it. Your video has given me more peace about getting vaccinated this Friday and I'm excited to share your information with friends who are concerned about the fertility aspect of things. Thank you so much for not attacking me for having concerns, but for educating me and reassuring me instead!"
1022,2Ruq3o7iZho,I just want to say before I even start watching the video. Thank you for covering this topic. I was just fully vaccinated on the 1st of September and am currently 6 months pregnant. I've been nervous because of all the misinformation.
1023,sidjKoHS6NE,"96% it’s disgusting! 
I quit my masters of public health at the University of Melbourne because they revealed that a subject was funded by a large pharmaceutical company and the part of the subject I experienced was simply trying to work out how to change policy to allow more people access to said company’s products. I withdrew in disgust! 
Anyone in Australia involved in ‘Health’ promotion and public health in Australia should be very, very ashamed!"
1024,sidjKoHS6NE,"I am 68 years old,  not vaccinated, never had Covid and perfectly healthy.  In my county we were put under house arrest, discriminated and pressured worse than in any authoritarian regime but we stood our ground and I a  so happy we did."
1025,sidjKoHS6NE,Watching Dr Campbells journey of realizing he's living in a corrupt system of lies and oppression has been magnificent.
1026,sidjKoHS6NE,"This whole 3 years of ""covid"" has been nothing short of criminal. Thank you Mr. Campbell...."
1027,sidjKoHS6NE,absolutely criminal. thank you so much Dr. Campbell for your continued bravery in bringing all these important issues to light.
1028,sidjKoHS6NE,Your utter contempt for our criminal authorities is beautifully expressed at 3.35. God bless you sir!
1029,sidjKoHS6NE,"My Dad was 58, never smoked, never drank alcohol, had a physical job and a great diet. On the 3rd of January I found him dead in his bed. Cause of Death has been put down to heart failure which doesn’t make any sense to me at all. If I could go back in time and stop him from getting those Vaccines + Boosters then I would. I feel so much guilt."
1030,sidjKoHS6NE,In your videos you’ve become incredibly good at saying exactly what you want to say without saying anything. Thank you!
