,video_id,comment
0,jPs4_MeuX7U,"I love being a conspiracy theorist.  Maligned, slandered, hated....but still right 😎"
1,jPs4_MeuX7U,Politicians who pushed these injections should and must be held to account
2,jPs4_MeuX7U,"My husband nearly died of a massive heart attack after his second shot,  both our moms and my aunt had strokes, our best friend died from a heart attack,  my brother in law developed AFIB, I developed severe neuropathy and people in our neighborhood have also suffered adverse affects like these...everywhere we go, or random people we meet, or aquaintences all say the same things.  This is no joke!  Shame on them for crimes to humanity!!!"
3,jPs4_MeuX7U,"Just disregard the word ""rare"" because all of my vaxxed patients are injured and suffering."
4,jPs4_MeuX7U,"Dr John Campbell has constantly pushed for the truth, hopefully other nations news stations will follow 🤙"
5,jPs4_MeuX7U,They forced you to choose between heart failure or Lose your job.
6,jPs4_MeuX7U,I guess all they so called conspiracy theorist before were right after all
7,jPs4_MeuX7U,What can go wrong when Dr BILL GATES ( by the way who has no medical degree at all ) makes himself the top Epidemiologist in the world ?
8,jPs4_MeuX7U,"This study is seemingly minimising the the number of those affected. I've heard, and it has been stated in the UK parliament by Andrew Bridgen MP, that studies showed that adverse events were 1 in 800!"
9,jPs4_MeuX7U,"Can you imagine how many would not have taken the jab if they knew this, the government cannot be allowed to do this again."
10,-Ea3UwYZnrA,"You're brave to discuss possible side effects from the 'Jab', John. I'm downloading this video just in case is dissappears. Thank you, Dr. John."
11,-Ea3UwYZnrA,"I'm in tears here after listening to Dr John Campbell.He is the first person to explain what has happened to me after having the COVID vaccine. I spent all my savings trying to find answers for severe burning and pins and needles and muscle weakness straight after my 2 nd vaccine. (No NHS drs available at that time) Diagnosed small fibre neuropathy. Not one doctor admitted what I was saying all along, that the vaccine had caused this!!"
12,-Ea3UwYZnrA,"i'll never forget how people treated me when i told them to avoid the vaccine.. i was already disollusioned with the world before 2020, and what followed just confirmed my disdain. glad theres still some people out there taking it seriously and talking about it"
13,-Ea3UwYZnrA,"Prof. Robert Clancy is an international treasure. Humility, humor, compassion, curiosity and of course great knowledge and skill. In a time of confusion, ignorance and pettiness it is a relief to hear him talk, giving hope to many people suffering with debilitating illness. Long may he live."
14,-Ea3UwYZnrA,Dr Campbell is a man of honor. He did not sell out to big pharma like so many other doctors and politicians. I wish you the best of everything. Thank you.
15,-Ea3UwYZnrA,Finally a brilliant review by Professor Clancy based on REAL research! All Doctors need to hear this to help their patients!
16,-Ea3UwYZnrA,Biggest psyops ever perpetrated on human mankind. Great work john.
17,-Ea3UwYZnrA,"I'd suffered with CFS for 15yrs at the time of the onset of the pandemic. My gut feeling told me not to get the vaccination, but I was given a really hard time about it. Thank goodness I listened to my gut! So thankful for this information 🙏"
18,-Ea3UwYZnrA,"I’m a retired veterinarian. 

I could see from the start that mRNA had the potential to cause constant antigen production. 

Reverse transcription was taught when I went to vet school, 40 years ago."
19,-Ea3UwYZnrA,"Prof Clancy is a legend with his discussion relating the jabs and also alternative treatments for C-19, however he was widely censored and silenced in Australia for the last few years. He did a fabulous interview in 2021 on our national broadcaster in Australia discussing the “horse” medicine and the interview was wiped from the internet. So glad to see him on your channel uncensored."
20,2IXl4qJGrRk,He got more vaccines than all Texans together!
21,2IXl4qJGrRk,It seems reckless that they would even allow him to get that many shots
22,2IXl4qJGrRk,That is one Guiness Book of records that will never fall.
23,2IXl4qJGrRk,"Wow, this dude’s 5g signal must be off the charts!"
24,2IXl4qJGrRk,A young Italian woman was accidently given a Covid-19 vaccine batch by a nurse that should have been divided (into 6 shots?).  She became critically ill and it took her many months to recover. I think that she still has side-effects from the overdose.
25,2IXl4qJGrRk,He took all those shots so you don't have to😂😂😂
26,2IXl4qJGrRk,The fact that you can get that many that frequently is disgusting
27,2IXl4qJGrRk,"The researchers analyzed his blood chemistries, which showed no abnormalities linked to his hypervaccination. They also looked at various markers to evaluate how his adaptive immune system was functioning, according to the study.

The adaptive immune system is the subsection of the immune system that learns to recognize and respond to specific pathogens when you encounter them throughout your life, Miller said. There are two main cell types in the adaptive immune system, T cells and B cells.

In chronic diseases, such as HIV and hepatitis B, immune cells can become fatigued from frequent exposure to the pathogen and lose the ability to combat it effectively, Schober said. Hypervaccination, in theory, could have a similar effect.

However, that’s not what the researchers found. Hypervaccination in this case increased the quantity (the number of T cells and B cell products) but did not affect the quality of the adaptive immune system, according to the study.

In total, the man got eight vaccine formulations, including mRNA vaccines from Pfizer/BioNTech and Moderna, a vector-based vaccine from Johnson & Johnson and a recombinant-protein vaccine from Sanofi.

While very interesting from a scientific perspective, individual case studies like this must always be taken with a grain of salt, Miller said. Public health recommendations, which are based on very large, randomized control trials, are what people should look to for guidance, she added.

The US Centers for Disease Control and Prevention recommends Covid vaccination for everyone ages 6 months or older in the United States, following the vaccination schedules outlined on its website. Last week, the CDC updated its guidance to recommend an additional dose of the current Covid vaccine for people 65 and older.

Less than a quarter of adults and only 13% of children in the US have gotten the most recently recommended Covid vaccine, according to CDC data.

Covid hasn’t disappeared, and neither have vaccination conspiracy theories.

CDC drops 5-day isolation guidance for Covid-19, moving away from key strategy to quell infections"
28,2IXl4qJGrRk,"Doctors here in Australia would not allow someone to get vaccinations within the appropriate time frame. You definitely wouldn't be getting two, one in each arm at the same appointment. So my question is, how did he access this many vaccinations and why did the doctors allow it?"
29,2IXl4qJGrRk,Question is who let him get all this?  You mean he don't have records of getting this.
30,geXKovieb1E,It’s crazy how the majority of the population don’t have an inner monologue and don’t question anything.
31,geXKovieb1E,A good friend of mine aged 39 died last March. He hadn't had Covid but he had three jabs to stay employed despite my warnings. He thought I had jumped on some QNON bandwagon and asked me if i was an antivaxxer. I said NO I'd had all my vaccines but wasn't going to take this one as it was untested. March 4th last year he sat down in a chair to read and died. His wife went to talk to him but he had just gone without even a sign or noise! It was heartbreaking but an autopsy showed massive blood clots to his heart and brain. His funeral was horrible and people who had once shunned me are now wondering if they have made a huge mistake. I don't feel superior or even say see I knew it because it was terrible the way they put people through mandates and put pressure on them to 'save grandma!'
32,geXKovieb1E,The risks are NOT small. Bloody lies.
33,geXKovieb1E,The adverse events aren't rare. I know 3 vaxed injured people.
34,geXKovieb1E,"i did not take vaccine,.. i'm still alive,....!!"
35,geXKovieb1E,I never took the Jab. Nor did my 85 year old mother. We are both healthier than most people that took the Jab. I guess you can say we are PURE BLOODS.
36,geXKovieb1E,"If you have to be persuaded, reminded, pressured, lied to, incentivized, coerced, bullied, socially shamed, guilt-tripped, threatened, punished and criminalized … If all of this is considered necessary to gain your compliance — you can be absolutely certain that what is being promoted is not in your best interest.” – Ian Watson"
37,geXKovieb1E,This doesn't even talk about the turbo cancers and the psychosis.
38,geXKovieb1E,When will media outlets like this grow a conscience ?
39,geXKovieb1E,"Too late, harm has been done."
40,im3otpqYAiQ,The dude makes it sound like Myocarditis and pericarditis are just minor health conditions. What a joke
41,im3otpqYAiQ,Glad I made it through the gaslighting.
42,im3otpqYAiQ,“They didn’t find anything else that was alarming….” This is actually comical. Aren’t these enough??
43,im3otpqYAiQ,Didn't they destroy doctors careers who said this 2yr ago .. ?
44,im3otpqYAiQ,"If you have to be persuaded, reminded, pressured, lied to, incentivized, coerced, bullied, socially shamed, guilt-tripped, threatened, punished and criminalized … If all of this is considered necessary to gain your compliance — you can be absolutely certain that what is being promoted is not in your best interest.” – Ian Watson"
45,im3otpqYAiQ,No one regrets not getting it
46,im3otpqYAiQ,Its a          B I O W E A P O N
47,im3otpqYAiQ,The Truth must be revealed……. Or we’re doomed to repeat it 😔
48,im3otpqYAiQ,Take the number of instances. Multiply by 75000
49,im3otpqYAiQ,Duh we said this on day one and the mainstream news called us conspiracy theorists lol such a joke
50,IMRTSwb3hCs,"I didn't get the shots but this whole experience permanently ruined my trust in the system. I don't care how many studies they do, I'll never ""trust the expert"" ever in my life."
51,IMRTSwb3hCs,What about those giant rubbery clots found in cadavers?  Could you please do a report on that?  They've never been seen by embalmers before 2021.
52,IMRTSwb3hCs,17 mill around the world rare ..... 🙄 Thats not called rare thats called crimes against humanity
53,IMRTSwb3hCs,Chris it’s not extremely rare. And you pushed that shot to no end!
54,IMRTSwb3hCs,But they said people were just conspiracy theorist remember lol
55,IMRTSwb3hCs,I’ve met so many jab injured here in Australia. I don’t think it’s “rare” at all. Many years on they are still suffering.
56,IMRTSwb3hCs,"How long until it goes from extremely rare, to rare, to common?"
57,IMRTSwb3hCs,"Just watch Dr.John Campbell , he’s ahead of it all"
58,IMRTSwb3hCs,My favorite part about being a conspiracy theorist is not getting myocarditis.
59,IMRTSwb3hCs,IT'S NOT RARE
60,YVFAvoeFahI,Those who questioned and didn't get jabbed will never get an apology. But they have peace of mind knowing that they haven't got poison locked within their system.
61,YVFAvoeFahI,I agree with him😎People should be the only ones Who Control their own BODY 💯
62,YVFAvoeFahI,APOLOGY??? I want criminal charges filed.
63,YVFAvoeFahI,"The fact that the drugs quite obviously were not subject to an adequate peer reviewed clinical trial process along with that billions of people were denied informed consent is all kinds of illegal.

The definition of ""conspiracy"" simply means two or more people secretly agreed to carry out an illegal act.

Therefore, the entire thing was absolutely a ""conspiracy""... less the theory part."
64,YVFAvoeFahI,I don't take apologies. You are all an enemy to me. You tried to murder me
65,YVFAvoeFahI,I remember when “natural immunity” wasn’t a thing and if you told anyone they looked at you so strange. I’m glad of my decision now seeing the massive amount of injuries. And as I expected..the injured don’t have a voice. 🤷🏼‍♂️
66,YVFAvoeFahI,"Stuff your apologies, and save it for the people who died!!!! The next life is not going to be bought or anything else that is what you are doing to get through this world 😉"
67,YVFAvoeFahI,"don't feel sorry for us,we didn't take it lol"
68,YVFAvoeFahI,"It's not rare. We were threatened. Lost jobs, family, alienated, denied, ostracized from society. We were treated like 'terrorists'/criminals. We deserve compensation. The injured deserve 'reparations'."
69,YVFAvoeFahI,Not rare. Quit saying rare.
70,LfmhYVCCGhc,If you dont see theres a problem at this point you never will
71,LfmhYVCCGhc,"Joe Rogan is right ! 
Imagine defending Phizer in 2024…"
72,LfmhYVCCGhc,The fact that Joe Rogan is correct.  The ignorance of people that don’t do their own research 🤦‍♂️
73,LfmhYVCCGhc,The only thing painful to watch is this show.
74,LfmhYVCCGhc,But we have increased death rates and loads of people have some new kind of blood clots that can be as long as a calamari. There’s something going on and obviously no one wants to take the blame so things are being silenced as long as they can.
75,LfmhYVCCGhc,Unfortunately the people that have died can't comment in this section
76,LfmhYVCCGhc,"""I'm just some idiot who tells jokes for a living. Nobody should listen to me."" -Joe Rogan"
77,LfmhYVCCGhc,"If you completely ignore VAERS and every other database worldwide and live in an alternative reality, then yeah, these covid injections are the best and safest vaccinations ever."
78,LfmhYVCCGhc,Dr Campbell here in the UK started off being in favour of blanket vaccination.  He changed.  Study from Australia - myocarditis and pericarditis went up by 65% after vaccination.      This was before covid actually entered Australia.    I'm super happy if you think the vaccine is great and suggest you keep on taking them.
79,LfmhYVCCGhc,How much are you getting paid to toe the state line?
80,mkZ1MabMEZw,This must have taken forever to grow that beard and film.
81,mkZ1MabMEZw,"Pfizer before covid: $60 billion in profit
Pfizer after covid: $122 billion in profit"
82,mkZ1MabMEZw,"Since most VAERS entries are entered by doctors or pharmacists, we can conclude the entries are accurate.  Since it takes nearly an hour to complete a VAERS report, we can also conclude the VAERS data is a small proportion of the actual events since most doctors will not spend the time to report."
83,mkZ1MabMEZw,Favorite VAERS factoid is how one entry says a vaccine turned the recipient into the incredible hulk.
84,mkZ1MabMEZw,"Sure wish doctors were this passionate about getting people off junk food, alcohol, and cigarettes."
85,mkZ1MabMEZw,Would love to hear your take in a Nuremberg trial setting.
86,mkZ1MabMEZw,I'M NOT READY FOR THE NEW WIGS😭😭
87,mkZ1MabMEZw,Thank you for informing us that VAERS is severely under reporting.
88,mkZ1MabMEZw,You should also say that most doctors didn’t even KNOW about this site and are being bullied/fired for bringing up red flags about this.
89,mkZ1MabMEZw,"My dad had a bad reaction and then collapsed 48 hours after receiving the booster. 
Cluster of skull fractures, bleeding in the brain, seizure upon arrival at the hospital, flown by helicopter to different hospital where he remained for 1 1/2 months. 
He’s now using a walker, trying to get back on his feet. His memory and general mental condition is coming back well, but he’s still messed up.. He’s 67 years old, had no serious health issues his entire life, was on no medications, a runner that was doing 6+ mile runs 2-3 times a week. Ran the NY marathon when he was younger."
90,u9sfVoHhIfM,I remember the fear on the faces of the grocery store staff who were working at the time when all of us were ordered to be home. The vaccine changed everything - for the better.
91,u9sfVoHhIfM,Being a Boomer means never having to admit you are wrong and dying before the disastrous consequences of your hubris are fully realized.
92,u9sfVoHhIfM,Agree: the public pushback on public health measures has made things worse for future pandemics.
93,u9sfVoHhIfM,"I admire Dr. Offit and agree with him, in principle, that the availability of vaccines in record time was lifesaving. I lost one relative to covid and nearly lost a friend who spent 36 days in the hospital because he hadn't yet decided whether to get vaccinated and ended up being severely ill. Many of their friends did get vaccinated after that ordeal. HOWEVER, I'm disappointed this podcast didn't mention a legitimate reason why some would have bristled at the mandate --- that by then, many people (Kyrie Irving among them, I think?) had been infected already. Also, was there irrefutable evidence that getting vaccinated would ensure you weren't contagious to others? I don't believe there was, so to portray it that way could have been more harmful than helpful to those at highest risk of death. This is why people are skeptical of public health now, myself included, and I would never have said that pre-pandemic. Some things were amazing and some things were handled very poorly, but at least Pfizer has raked in billions, right?"
94,u9sfVoHhIfM,"Where there is risk, there must be choice"
95,u9sfVoHhIfM,"Thank you for this thoughtful discussion, it’s good to reflect on some of what we went through (though we may wish to forget).  I’m grateful for much of what we learned and accomplished, still heartbroken about the loss of life before, and especially after the vaccines.  

I recently watched a great lecture by Johannes Krause from the Max Plank Institute on historical infectious diseases and human evolution.  He focused on recent research into plagues caused by Yersinia pestis, such as the Plague of Justinian, and the Black Death which killed 40-60% of Europe.  

It gives one pause to contemplate the possibility of civilization facing another infectious pathogen evolving with a mortality rate of Y. pestis, given how our recent pandemic revealed the power of fear and denial to drive human behavior."
96,u9sfVoHhIfM,"I am grateful for the vaccine.  I pushed hard to bet vaccinated as early as I could qualify and I succeeded in completing the  double vaccination three months before I got Covid.  I was pretty darned sick, but I did not die.  I was a 79 year old diabetic with asthma and high blood pressure.  Despite all that I survived.  I probably should have been hospitalized but not many people were leaving the hospitals once admitted.  Instead I doubled my asthma inhalers and rested as much as possible.  It took three weeks to be able to change the sheets on my bed by myself.  But I survived at home.  I attribute that to the vaccine."
97,u9sfVoHhIfM,"This is utter nonsense, and Paul Offit, who for a time actually flirted with reality, has apparently started getting worried about his paycheck. Congratulations to you all for destroying people's trust in public health, and this discussion seems to imply that you don't have any idea why."
98,u9sfVoHhIfM,The CDC messaging was abysmal and WHO was worse.
99,u9sfVoHhIfM,3:50 “we had to flatten the curve”
100,KBvys-kcJi0,I would like to thank the D.A.R.E. Program for teaching me to resist peer pressure and not experiment with drugs.
101,KBvys-kcJi0,I like how they ignore literally allllllll of the other evidence in young people. And only relate it to the latest booster. This is strictly damage control
102,KBvys-kcJi0,"Some of us have been screaming this for 3 years now....and we were mocked, ridiculed, and silenced on social media. So nice of the MSM to catch up."
103,KBvys-kcJi0,Pretty sad that everyone waits till the tv box says it’s dangerous.
104,KBvys-kcJi0,I don’t know anyone who regrets NOT getting that poison cocktail.
105,KBvys-kcJi0,"Still unvaccinated, and couldn’t be happier. ❤🙏"
106,KBvys-kcJi0,Still unvaccinated and healthy as ever thank you Jesus ❤️
107,KBvys-kcJi0,The truth is slowly trickling out
108,KBvys-kcJi0,One thing about being a so called conspiracy theorist is that I will not have to worry about any of the side effects
109,KBvys-kcJi0,So glad I was able to resist the pressure to get injected with that garbage.
110,H0Y7sUfLFEA,"Being jealous of the US, especially for something healthcare-related, is a weird new feeling."
111,H0Y7sUfLFEA,"As someone who lives in Brazil (with a comorbidity), the fact that you have to beg people to get vaccines in the US is mind blowing to me. I have no idea when I'll be able to leave the house to walk my dog once a day without having a panic attack."
112,H0Y7sUfLFEA,"To all the young adults with anxiety: it is okay if you need moral support for your vaccine appointment. My mom came with me for my first dose, and since she was already vaccinated, they even let her stay with me through the whole process. But even just having a trusted friend or family member in the car with you can be a huge help."
113,H0Y7sUfLFEA,"Hang on, you guys are getting donuts?"
114,H0Y7sUfLFEA,"As someone who had covid last year and just got vaccinated, trust me, the vaccine side effects are WAY less painful than actually having it."
115,H0Y7sUfLFEA,"As a 27-year-old musician, I got my appointment within an hour of them going up this week, because I. WANT. TO. PLAY. SHOWS. AGAIN!!!"
116,H0Y7sUfLFEA,"Sent this video to an ""I'll do it later"" friend, now his first appointment is tomorrow at 10 :)"
117,H0Y7sUfLFEA,I'm 24 I work in Health Care and I got my first vaccine in December and the 2nd in January. Getting the vaccine and see everyone of of my coworkers get the vaccine had been incredibly helpful with my anxiety
118,H0Y7sUfLFEA,"I had a ""mild"" case back in October, I no longer get winded going upstairs as of last month but my sense of taste/smell is still... Off. Foods just randomly taste rotten some days. Covid sucks, y'all."
119,H0Y7sUfLFEA,"Thank you, 
Signed an exhausted ICU nurse."
120,the81FQoAUI,"Are you planning on getting the vaccine when it's available to you? Hopefully this video helps with your decision :)
Also, don't forget to check out our Podcast Channel: https://www.youtube.com/sidenotepodcast"
121,the81FQoAUI,"Nothing says 'Trust The Science"" quite like ""You can't sue us if something goes wrong"" and ""We need 55 years to release the data to the public"""
122,the81FQoAUI,"If a person or government is forcing you to do or take something, you don't have to do any research or prove anything, just refuse it by default, because they want to hurt you."
123,the81FQoAUI,Gives you a permanent and irreversible heart condition like a boss
124,the81FQoAUI,Still waiting on part 2 How the Vaccine Side Effects Work
125,the81FQoAUI,Just the fact that you can't sue drug companys makes me not want to take the jab.
126,the81FQoAUI,How about a video about how they didn’t work out too well for the some that are no longer with us?
127,the81FQoAUI,"Perhaps you guys can take the vaccine yourselves, and do a daily vlog showing your results. Cheers."
128,the81FQoAUI,This aged well.
129,the81FQoAUI,You forgot to mention the heart attacks people are getting... Good job at not being biased!!
130,FZd3asOuwEw,"I think it's fascinating how just talking about the vax induces such disproportionately strong feelings in certain people. I mentioned it on another thread and I had people telling me I was gonna die and basically raging at the fact I was still alive.

These are the same people who claim to be pro-life. Just a reminder."
131,FZd3asOuwEw,"My very elderly stepmother announced one day, after reading some bullshit on her phone, that three, just THREE covid shots would completely destroy a person's immune system! Upon hearing this, my father (also very elderly but not quite so susceptible to bullshit) pulled his vaccination record card from his wallet and announced, ""We've had four shots already."" I presume that the expression on my stepmother's face was one of disappointed embarrassment."
132,FZd3asOuwEw,Sounds like serious mental health issues no matter how healthy he is.
133,FZd3asOuwEw,"I honestly doubt this. Medical see his vaccine status and see he’s already been vaccinated, they wouldn’t waste resources like this."
134,FZd3asOuwEw,"According to the right-wing misinformation, that man shouldn’t even be alive, but reality shows that he is."
135,FZd3asOuwEw,I've had 3 boosters since the initial 2 shots and I've not even had so much as a sore arm from any of them.  I forgot to add that I turned 72 this past September 3rd.
136,FZd3asOuwEw,"Absolutely fascinating, that guy has now so many microchips in his body, he probably works now as a G5 Cell tower 😉"
137,FZd3asOuwEw,Lol.  There was that one dude in the UK who got ninety shots so he could sell the COVID shot cards to people who refused to get jabbed.
138,FZd3asOuwEw,"Pierce, you've had two hundred covid shots!

I'll be a LIVING GOD!"
139,FZd3asOuwEw,"I'm kinda disappointed. Considering what the Antivaxxers love to claim about the Vaccine, I was kinda hoping he turned into a real life Magneto."
140,uOxppT3gPpE,It amazes me how people are still in denial simply because their egos can't tolerate how wrong they have been this whole time. And on top of that they feel like they're the intelligent ones.
141,uOxppT3gPpE,Even mentioning this used to get you banned or fired. Was madness
142,uOxppT3gPpE,My heart breaks for all the people who felt pressure to take the jab.
143,uOxppT3gPpE,The way this  whole thing was handled has turned me complete anti vaxx. I hope everyone effected gets justice.
