,video_id,comment
2132,xz-Q5RxUgOw,Don’t be fooled those animals are living in captivity for human use and consumption. 💔
2133,xz-Q5RxUgOw,i think only Russia save the humanity
2134,xz-Q5RxUgOw,Nope. Not getting my very sensitive cat near that vac
2135,xz-Q5RxUgOw,When i hear amongus....I'm always know that there's a ''sus''
2136,xz-Q5RxUgOw,Excellent 🌹🥰👌
2137,xz-Q5RxUgOw,MORE VARIANTS TO COME
2138,xz-Q5RxUgOw,Am0nG uS!
2139,xz-Q5RxUgOw,"0:07

Among us"
2140,xz-Q5RxUgOw,Among us?
2141,xz-Q5RxUgOw,"When the vaccine is sus‼‼‼

0:07"
2142,ACwutOXamrw,"In India, situation is so grim that Everyone personally knows Someone who died of Covid."
2143,ACwutOXamrw,My aunt 65 died in front of us due to lack of oxygen. I literally felt like we were murdering her when she could have easily been saved if there was oxygen availability.
2144,ACwutOXamrw,"""And no place is in worse shape right now.... than India.""
I almost cried here. Every day someone I know is dying, and it's scary to think this thing would hit someone I care about someday."
2145,ACwutOXamrw,"""The difference between animals and humans is that the animals will never let the dumbest one in the group to lead the path"""
2146,ACwutOXamrw,You did explain the situation better than most Indian media and politicians
2147,ACwutOXamrw,"I stay in Delhi ( India), the situation here is very critical. Every 10 minutes you hear an Ambulance passing by. Please pray for India."
2148,ACwutOXamrw,"The virus is getting smarter, governments getting dumber. Goodluck to humanity 🙏"
2149,ACwutOXamrw,"My brother lives in Argentina and they are just beginning to vaccinate those under 70years old. Additionally, they are basically getting the “reject” vaccines and they are happy to get whatever they can get their hands on! And us here in the US complaining..."
2150,ACwutOXamrw,"I lost my father on 28th April. I miss him a lot, Papa loved us all didn't cared about him much always provided us with everything we needed. I love him, I'll miss him always. 
Papa, I love you. I never said this but I do❤️"
2151,ACwutOXamrw,Seeing this in 2022 make me laugh as indian because india ended up being only  country in world who not only being able to successfully vaccinate its people but also send vaccines to 70 other countries
2152,ju3FCA0LBM4,Je faisait partis des soignants qui ont alerté.  En réponse nous avons été exclus de nos fonctions !
2153,ju3FCA0LBM4,"A tout ceux qui ne ce sont pas laisser vacciner, qui on préserver leur principes moraux , ainsi que nos soignants qui ont tout perdu. Chapeau vous êtes de vrai guerrier."
2154,ju3FCA0LBM4,Je suis Québécois et je fais parti d'un groupe de résistance et je n'abandonnerai JAMAIS la lutte pour que justice soit faite
2155,ju3FCA0LBM4,"Ni oubli, ni pardon !!!"
2156,ju3FCA0LBM4,"Les commanditaires ,eux se portent à merveille et ont les poches pleines !"
2157,ju3FCA0LBM4,"Pompier volontaire suspendu je vais seulement pouvoir réintégrer dans quelques mois, être libre ça coûte cher"
2158,ju3FCA0LBM4,"""Ne leur pardonnez pas car ils savent ce qu'ils font"" claire séverac"
2159,ju3FCA0LBM4,"Pas vacciné et j'en suis contente, je ne regrette pas du tout. Et pourtant beaucoup on essayé de me faire changer d'avis même des disputes dans le couple, pour ne pas priver nos enfants de profiter, sauf qu'on peut profiter autrement et simplement sans aller dans un lieu public. 3 ans après le début, on n'entend plus rien"
2160,ju3FCA0LBM4,Bravo pour ton courage.  DOMMAGE d avoir cru aussi belles paroles de la médecine ??? Aujourd'hui je refuse les vaccins  même la grippe  malgré mes 81 ans
2161,ju3FCA0LBM4,"Résister, c'était aussi remettre en question un produit dont on ne savait rien de la compositon."
2162,zAZspZ6PQiI,Hi madam.. How to get recover to the revoked certificate. I'm fully vaccinated 3 doses are completed but i will but wrongly revoke options madam.. How to recover my old certificate... Pls tell 🙏🙏
2163,zAZspZ6PQiI,OMG stop showing needles going into arms for Christ's sake! Its repulsive.
2164,zAZspZ6PQiI,"Maine I'd no update Kiya tha kyuki hospital ne reg wrong I'd no se kar diya tha, but abhi tak mera I'd   adhaar no update nahi hua hai
Kya karu?"
2165,zAZspZ6PQiI,What if i scan a certificate and then it shows as verified but the batch number is same for both doses. Can it be fake or real ?
2166,zAZspZ6PQiI,Ye website work nahi kar rahi hai koi aur bataea website
2167,zAZspZ6PQiI,Ashru Happy Diwali !!! Have a great and prosperous diwali to you and your family 😊
2168,zAZspZ6PQiI,Hm kesa check korega mere certificate original ha na Doublicate
2169,zAZspZ6PQiI,Thank you for your kind information
2170,zAZspZ6PQiI,Scan kro to stop ho jata details show ni ho rhe
2171,zAZspZ6PQiI,"Hello mam, I m olrdy now out of india, I take vaccine in India, now I need vaccine certificate but hre my mobil number not working how to I get vaccine certificate in her"
2172,Ozk594EtwcE,"Instead of being prepared for a reaction, how about we just have the right to say “no thanks”"
2173,Ozk594EtwcE,"My first allergic reaction to a vaccine was for the BCG at 13 years old. 5 mins after, I felt sick, turned pale, and dropped onto the couch. Being a kid, they took care of me. 2 years later I had a tetnus, and the same thing happened. I avoided vaccines for 20 years, until I was told to take another tetnus. I told the nurse what happened in the past. She had never heard of problems like this, and told me not to leave after the tetnus. 5 mins, and that recognisable feeling started. Wanting to vomit, shaking, and unable to stand up. The nurse called a Dr, who said ""ah, you are afraid of needles!"". He wouldn't accept anything else. I asked him, ""why does it not happen when I had blood taken?"" He said ""uh, uh..."". I'm not trying to put anyone off, if you want the vaccine, take it, but if you experience what I do, go to a Dr you trust, and one that recognises problems for what they are, rather than trying to talk crap about ""even 6 '5 soldiers getting scared of needles"" (yes, the Dr said that).... My experiences make me sceptical."
2174,Ozk594EtwcE,I had an allergic reaction to Pfizer today in front of Walgreens outside by myself. Couldn’t stand at all. Tried to go in and get help and I kept fainting. Praise God women came and found me outside and praise GOD for saving me!!! I had a full blown allergic reaction outside on the ground and I prayed and was healed! Normally I need Epi-pens or Benadryl but God!!! He is a healer! Believe in him! I cannot get the next vaccine but I have God!!
2175,Ozk594EtwcE,"“Ooops, this one kills too many, try this one, no wait, this one, no wait, this one”   is what I heard"
2176,Ozk594EtwcE,"Imagine assuming that government agencies, media, and powerful corporations have your best interests in mind. Being suspicious of the fact that they are demanding unlimited access to your veins in exchange for the ability to live a normal life does not make you a ""science denier""."
2177,Ozk594EtwcE,"*10 years later on some random commercial* ""have you or a loved one suffered from the effects of the Pfizer Vaccine then you are entitled to compensation"""
2178,Ozk594EtwcE,My left ear is allergic to this video.
2179,Ozk594EtwcE,"My son passed away to Anaphylaxis.  I have been telling people exactly what is said in this video.  I thank you very much for the direct honesty and PLEASE make sure to stay on this message because it is true.  I have been telling all to make sure if you have a history of Anaphylaxis to please make sure to take the precaution of the correct setting, make sure you are observed, and that you communicate clearly with the administrator of your history.  I believe the role of Allergists ( Doctors) should be proactively reaching out to those that might fit this.  Many are confused about what an allergic reaction vs. Anaphylaxis ( life taking - fast-acting EPI and ER sometimes intubation needed)  and in that the awareness the media PR must be.   I would never want to put a person, not even the healthcare worker who has to live with helping in those moments if they are not prepared with the proper equipment, staff, and knowledge of what to do.  Anaphylaxis is The difference between an allergic reaction and anaphylaxis is the latter involves the respiratory and/or cardiovascular system.  My son had been placed on his Asthma meds before receiving his Epi and was driven to the hospital and 911 was not called, I was not with him at the time.  He was only 7.  These all things I knew if I was there, this I now try into teaching and helping everyone.  It happens so quickly and can happen again in 24hrs.  He went into cardiac arrest by the time he got into the ER and the right doctors had been made available upon transfer, that poor doctor came up to me the day of his funeral services and I held him so tight because his life too was forever changed, he wept to me how he did everything possible and I held him and told him I knew and I only wished that he had been prepared before he got to him... Thank you Dr. Fauci and I am not sure if you will ever read this, but I want you to know I am a voice of this, and I will keep to it and please keep to your message, it is so very important to have this as I advocate this truth... Now to make sure everyone has the proper setting equipment and not cause a shortage of epi... and awareness.  I thank all the heroes out there... all of you... Joseph Denicola's Mom Julianne   https://twitter.com/MemoryofJoseph/status/1338569552330969090?s=20

For those of you who need to understand signs, this is a great article that discusses Anaphylaxis  ( as Dr. Fauci is describing) My son was so prone to Anaphylaxis shock even the smallest kiss to his forehead by someone that had coffee early in the morning hours we would be off to the hospital, this meant he would stop breathing..blood pressure drops very quickly... so much that is happening on the inside.  This is not the mere rash... you can read his story too on JosephDenicola.com  Here is a quick article that describes the difference .. Everyone should not be in fear the vaccine can be safe if given in the correct setting and if you do not know if you are one that needs to take precaution call your allergist, if you do not have an allergist and are walking around daily with just an itch here and there, you do not have Anaphylaxis and you would most definitely be seeing an allergist annually for blood works etc. and prescription epi.  

https://www.abc.net.au/news/2017-07-17/anaphylaxis-and-allergies-explained/8715284#:~:text=%22So%20a%20person%20has%20an,respiratory%20and%2For%20cardiovascular%20system"
2180,Ozk594EtwcE,"Another point of concern was ""none of the vaccine testing"" included those who had previously been exposed to the virus. We know people infected a second time with covid had a negative cascade effect  immuno-response. This is very important given the number of people who are are asymptomatic and do not know that they have contracted the virus. And here we are a year later and there is still no national testing. In my state, I have to be over 65, symptomatic, or have come in contact with somebody who had covid in order to get tested and I need a Rx. So basically nobody knows if they have been infected. 
So what happens if you have antibodies for the virus already for my previous, unknown exposure and then your immune system starts doing somersaults reacting to the viral proteins in the vaccine? 
The fact that they did not test for this in the trials makes me leery given what we know about this virus and the number of people that are going to need to be vaccinated in order for us to get somewhere to normalcy by next year. How likely are people going to take the vaccine if two in ten start having a adverse reaction that includes organ failure or a anaphylactic response?
Again, zero forethought. This is why even if you rush something you do it right. And you never rush something for a political reason."
2181,Ozk594EtwcE,"Why won't they mention about Ivermetin and it's finding on how it prevents getting COVID... Dr. Kory was pleading for NIH, CDC, and FDA to look at their data"
2182,ihRCuTdUQdI,Biden should run for president of Ukraine. 😊
2183,ihRCuTdUQdI,End cancer? Joey went far and beyond the crazy stuff he normally babbles 😁
2184,ihRCuTdUQdI,Laughable. Why cant he stop illegal immigaration first--its more realistic goal.
2185,ihRCuTdUQdI,Captain Joey: I will end cancer and go where no man has gone before… he was watching Star trek before he started babbling 😁
2186,ihRCuTdUQdI,He is the cancer though….
2187,ihRCuTdUQdI,"Don’t make promises you won’t keep, Mr. President!!"
2188,ihRCuTdUQdI,He will say anything for votes.  Trump doesn't pander. Trump has literally been saying the same stuff for many many years cause he means it.
2189,ihRCuTdUQdI,That's because they've had the cure for cancer and kept it from us. 🙄
2190,ihRCuTdUQdI,Congrats. Formaldebrain stuck to the teleprompter and made it through without falling over.
2191,ihRCuTdUQdI,"Make America Normal Again!!
Trump 2024 !!"
2192,b3hWEC553sU,"She was removed, demoted from her position, lost grants and yet she continued and today the world depends on that research. The sheer belief in what she was doing would be unimaginable! Thank you for your sacrifices 👏"
2193,b3hWEC553sU,"""I failed the first 200 times i tried"" 
that hit me differently"
2194,b3hWEC553sU,"When he said ""I Failed the first 200 times when i did it""   that really gave me courage to not be afraid of failure."
2195,b3hWEC553sU,If she is not deserving a Nobel prize for this than I don't know who and for what.
2196,b3hWEC553sU,Amazing what we can do when we work together. I hope that lady gets a Nobel prize
2197,b3hWEC553sU,Why are these innovative thinkers suppressed? Thinking out of the box is necessary for progress going forward.
2198,b3hWEC553sU,"Katalin Kariko has my utmost respect. Especially that she's doing a job she loves to help people and not for the money. And for the money that she made, she deserves it."
2199,b3hWEC553sU,Drew Weissman and Katalin Karikó made a great team. Both of them probably deserve a lot of credit for the work they had done. I love it when scientists get recognition they deserve.
2200,b3hWEC553sU,I love when scientists become Billonaires. I think its well deserved because of the importance of their  contribution.
2201,b3hWEC553sU,"These two people are the true heroes.
Rejected countless times but never gave up.

(I wonder how the guys who refused to give Einstein a job at their University in Switzerland felt later on.)"
2202,emuTXyu_ei8,Trying not to be racist is actually meaning of racism...
2203,emuTXyu_ei8,"The whole point of the emphasis on race here is that historically, science has often attached less value to people of color. Pay attention to the story that has a long line of trauma attached to it, and you will understand how extraordinary Dr. Corbett's presence on developing a vaccine is. Please, everyone, do your part and know your (American) history!"
2204,emuTXyu_ei8,"CBS, I love what this scientist is doing.  Please explain why her gender and race are important?"
2205,emuTXyu_ei8,"Why didn’t you just say...”Meet the scientist who...”. CBS, look at yourself. Your industry is the problem."
2206,emuTXyu_ei8,"Lighten up Francis! I think the video summed it up perfectly, ""she cannot be a hidden figure... little girls need to see her, of all races!"" SHE IS A ROLE MODEL PEOPLE; be positive and celebrate that."
2207,emuTXyu_ei8,We can tell from the thumbnail that she’s black and female lol. That’s very redundant and unnecessary.
2208,emuTXyu_ei8,everytime i see race in the title of something like this they are basically saying black people arent usually smart enough for this but wow here is a black person in this role AMAZIN! If people truly want racial equality you should request to be treated like everyone else because the moment you are treated special there is no equality.
2209,emuTXyu_ei8,I'm black woman ❤I'm so proud of you 🌹 thank you for all you do and the people you save ❤❤
2210,emuTXyu_ei8,"When we help others, we are lending to, putting seeds in the ground! 💕🙏🏽"
2211,emuTXyu_ei8,What does her skin color have to do with it?
2212,NejZH2GB-sI,"You are beautiful, ma. Ageing so gracefully and sharing your advice . God bless.Namasivaya."
2213,NejZH2GB-sI,It feels like my grandmother is talking to me. Thanks a lot for spreading knowledge. Lots of love ❤️
2214,NejZH2GB-sI,No mask.   No vax.  Never felt better.
2215,NejZH2GB-sI,Thank you doctor!! Your advice is so inspiring!!!
2216,NejZH2GB-sI,"Yes, Thanks!  I knew l was right l kept myself busy. Feel good plus will take a nap went l was tired. 
Due 4 my 2 shot. My friend said ,drink a lot of 💧 water!
Plus l praying 4 God Protection 🙏 ❤!"
2217,NejZH2GB-sI,Thank you Ma.. I am feeling very tired and feel lack of energy. Last 3 days I am only lying down. Your video has motivated me. My daughter and son are just recovering from mild covid attack.
2218,NejZH2GB-sI,I am already feeling fully fit & inspired by your calm and energetic voice maaji❤️❤️🙏🙏
2219,NejZH2GB-sI,"Thank you so much ma, you are a god's gift to every human being, will definitely follow your advice 🙏❤️"
2220,NejZH2GB-sI,"Your advice is appreciated as it is amazing and homily, while listening to you,I have digested your information 💯👌👍🙏"
2221,NejZH2GB-sI,"Namasté , You  are  such an Angel , Thank You  , much Love .....  ;)  Thanks !"
2222,RA6aBke219o,"And now with 23 grand slam titles, he became the greatest tennis player of all time without forgoing his integrity. Legend."
2223,RA6aBke219o,Love how they make it sound like he is being irrational when it is a perfectly rational decision
2224,RA6aBke219o,"""Why Novak?""
Because he has common sense."
2225,RA6aBke219o,"When the interviewer said, ""why Novak... why??"" I cringed so hard. Like it's  unbelievable that someone doesn't want this jab. Bruh... Novak has conviction and I applaud him."
2226,RA6aBke219o,He's a true hero.
2227,RA6aBke219o,I SUPPORT THIS MAN 100000%
2228,RA6aBke219o,Germany says: we are proud of this man👍🇩🇪
2229,RA6aBke219o,this man knows whats going on
2230,RA6aBke219o,"Maybe...just maybe he observed whats happening to soccer players randomly collapsing on the field with heart issues, and opted not to take the damn jab."
2231,RA6aBke219o,Character is more important than achievements.
2232,F8aueQXQ2H4,She's got a lot of guts to do that. Wishing her the best of luck and good health!
2233,F8aueQXQ2H4,I pray to every one who is helping and suffering their life's for the world and may your the good Lord be with u
2234,F8aueQXQ2H4,"God bless this brave woman, humanity at it's finest."
2235,F8aueQXQ2H4,Why haven’t we heard updates from these volunteers? 🤨
2236,F8aueQXQ2H4,"I'm not American.... I feel proud there are people like her out there, she's a hero 
Whether the vaccine work outs or not..."
2237,F8aueQXQ2H4,"Everyone who will is willing to risk their life’s during this time, are heroes! Pretty courageous, I commend her for her bravery and for risking her life to potentially save life’s."
2238,F8aueQXQ2H4,Jennifer Haller you are a hero to many of us... Sending Light and Love
2239,F8aueQXQ2H4,"She's not just ""this woman."" she's a brave woman. Otherwise addressing her as ""this lady"" would be a polite word to use, Doctor!"
2240,F8aueQXQ2H4,"These are real heroes, no matter how crazy you think they are and no matter how crazy they actually are. Heroes!"
2241,F8aueQXQ2H4,Anyone wonder how come there’s a vaccine testing so quick?
2242,swlndIVQOdg,"📍Nursing Short Videos Easy Way To Learn Nursing Terms For all Nursing Exams Playlist👇
▶https://www.youtube.com/playlist?list=PLpIz0Dy1wvDyMbReN_oPan0Yki5p1DZL_
🛑 Join us on our Utkarsh Nursing Telegram Channel to get PDF, Class Notifications, Quiz, etc.:- 
👉 https://t.me/UtkarshNursingClasses
✅ उत्कर्ष एप डाउनलोड करने के लिए लिंक पर क्लिक करें ।
utkarsh.onelink.me/Lc5j/2b6f5416
✅ ऑनलाइन कोर्स अथवा ऑफ़लाइन बैच की पूछताछ के लिए: 9829213213  पर सम्पर्क करें।
✅ आधिकारिक वेबसाइट: https://utkarsh.com/in"
2243,swlndIVQOdg,THANK U SO MUCH SIR 🙏🙏🙏 SHORT VIDEO SE TOPIC JALDI CLEAR HO JAATA H 🙏🙏🙏🙏
2244,swlndIVQOdg,You are the best teacher in the world 🙏🙏👍👍
2245,swlndIVQOdg,Sar Maine padhna chhod diya tha per aapki classes dekar ab mujhmein mein ummid jagi hai ki main Bhi kuchh kar sakti hun thank you sir
2246,swlndIVQOdg,Thanks a million sir for this important session 💫💫💫💫💫💫💫💫💫💫💫💫
2247,swlndIVQOdg,Sir aap sbse best teacher hai sbse best🙏🙏🙏
2248,swlndIVQOdg,World is the best teacher Siddharth sir 🙏🙏🙏🙏
2249,swlndIVQOdg,Such a amazing sir really you are a best and best teacher
2250,swlndIVQOdg,Sir bahu bhut dhnybad apke jaisa teacher world me nhi hai ap hamare liye itna mehnat kr rhe slute hai apke knowdedge ke liye
2251,swlndIVQOdg,Very nice class.Thank you so much sir for giving such good content. 🙏🏻🙏🏻
2252,PgLmrprP9KI,"My son had Covid and you would have never even known. He wasn’t only tested because I had it. He’s also immune deficient. My son had also been doing everything he loves for over a year now. If someone gets their child vaccinated due to this video and gets injury or worse, are you responsible for it?Because the pharmaceutical have ZERO liability."
2253,PgLmrprP9KI,"American Academy of Pediatrics. 
This is what industrial capture looks like"
2254,PgLmrprP9KI,Claiming natural immunity being a good thing isn’t good for the business model
2255,PgLmrprP9KI,Why are comments turned off on your mRNA vaccine for kids video?
2256,PgLmrprP9KI,HAHAHAHAHAHAH way to push the poison guys
2257,PgLmrprP9KI,what a big pharma schill
2258,PgLmrprP9KI,Use my Comment as a Dislike Counter.
2259,PgLmrprP9KI,Evil literally evil
2260,PgLmrprP9KI,MASS FORMATION PSYCHOSIS. I HOPE YOU BREAK FREE.
2261,PgLmrprP9KI,"Propaganda at its finest, no answer to the question in the thumbnail and contradicting with every word, this should not be on YouTube and this page is a joke"
2262,k_YrHglsKho,This influencer is a hero.
2263,k_YrHglsKho,It's Great to see people rebelling against the Tyrants!
2264,k_YrHglsKho,If that’s the case all of these clown politicians should be in jail too
2265,k_YrHglsKho,A true social media influencer...
2266,k_YrHglsKho,These people don’t know how to move
2267,k_YrHglsKho,"Never thought I'd see a day where ""show me your papers"" was a part of american life."
2268,k_YrHglsKho,Lmao fact that they thought they could get away with it in this age is mind boggling!!!
2269,k_YrHglsKho,"Well, at least we finally found some crime they're taking seriously."
2270,k_YrHglsKho,Not all heroes wear capes
2271,k_YrHglsKho,"Well, she does need the money to correct that horrific plastic surgery."
2272,Uv3REjrZDio,"Doctor Mike Hansen's Programs ⏩ 
FULL Course for MORE ENERGY:
https://learn.doctormikehansen.com/products/increase-energy-course/
FREE Course for MORE ENERGY:
https://doctormikehansen.com/6-days-to-more-energy/"
2273,Uv3REjrZDio,"Thank you for providing this information!  I've heard and read the same information via the media, but glad that people who don't listen to certain news outlets have received this information through your channel."
2274,Uv3REjrZDio,thank you so much for plain straight facts so that we can make up our own minds. truly appreciate your valuable time reporting to the public BUT  I really feel you need to get some rest yourself! please take care.
2275,Uv3REjrZDio,"Thank you, Dr. Mike for keeping us informed. Please take care of yourself. ❤️"
2276,Uv3REjrZDio,Thank Dr. Hansen! You are a blessing! Nothing but the best for you and yours!
2277,Uv3REjrZDio,You are a great explainer as a good doctor should be. You inspire confidence and I have friends who have become addicted to your videos. - Great bedside manner.
2278,Uv3REjrZDio,"As always, informative, easy to understand, and much appreciated. Take care🙏Namaste"
2279,Uv3REjrZDio,Thank you for these videos and for explaining everything Dr. Mike.
2280,Uv3REjrZDio,Excellent breakdown of the Clinical Study Report and the Adverse Event Data!
2281,Uv3REjrZDio,"Dear dr. Hansen, please rest and take care of yourself. You look very tired. Thank you for the update. Love from Minnesota"
2282,Uw5Lwak8gXY,When is the mandate against cigarettes coming out if the government is so worried about our health?
2283,Uw5Lwak8gXY,You media sure do love the chaos you’re creating. Good for you.
2284,Uw5Lwak8gXY,Why do the protected need to be protected from the unprotected by forcing the unprotected to use the protection that did not protect the protected in the first place?
2285,Uw5Lwak8gXY,“Compliance” will be the death of this country
2286,Uw5Lwak8gXY,"“If you have to be persuaded, reminded, pressured, lied to, incentivized, coerced, bullied, socially shamed, guilt-tripped, threatened, punished and criminalized .... If all of this is considered necessary to gain your compliance -- you can be absolutely certain that what is being promoted is not in your best interest.” - Ian Watson"
2287,Uw5Lwak8gXY,"""This report is sponsored by Phizer."""
2288,Uw5Lwak8gXY,Gov should NEVER have this much involvement in our lives…
2289,Uw5Lwak8gXY,This is complete insanity!!! Stand together!
2290,Uw5Lwak8gXY,Why doesn't the vaccine companies wave their immunity from prosecution should anyone have an adverse reaction from getting the jab? If it's so safe there would barely be any lawsuits.
