,video_id,comment
1033,YhMlZczq4Ns,You may very well have the only doctors handwriting that is understandable in the entire world. Thank you for all you do.
1034,YhMlZczq4Ns,"Question - if the J&J is an adenovirus vaccine and Pfizer, Moderna are mRNA vaccines, is there any benefit, such as, for example, a different type of immune response, that if mixed would theoretically give you broader immunity? Is this something that is measurable?"
1035,YhMlZczq4Ns,Amazing how you take a complicated subject and make it sooo easy to understand ... wish you were my chem. Bio .anatomy prof in college ...
1036,YhMlZczq4Ns,Thanks for another great video Doctor. Amazed at the clarity and level of detail and presented in a way that folks with not too much scientific knowledge can understand.
1037,YhMlZczq4Ns,"Thank you, Meccram !!!  
   **** Could you Please make a video on the myocarditis & related risks with Moderna, and how 3 Nordic countries ( Sweden, Norway, and Finland)  have suspended Moderna  for people under 30 ( in Sweden for men AND women that age.)****
     How safe is Moderna for women in their 40's and 50's? ( Concerned re: myocarditis, blood clots, etc.)....but I'd LIKE to get a Moderna booster, if safe enough ( I got J& J initially.)  THANKS SO MUCH !!!"
1038,YhMlZczq4Ns,"I had Moderna shots. My booster was a half dose. I had very mild reactions to all three shots. However I felt the booster the most. I spent a day resting on the couch, drinking tea and napping. Mostly fatigue, some aches and chills. Felt 100% better the next day."
1039,YhMlZczq4Ns,"Please explain the myocarditis risk for young men, specifically regarding boosters... if you can.  With many thanks."
1040,YhMlZczq4Ns,"The fact that the moderna boost is full dose (100ug) in this study versus a half dose(50ug) which is the acutual dose people will receive. This almost invalidates the moderna boost graph results in this video, it is concerning because It is difficult to make a decision based on something that may be inaccuarate."
1041,YhMlZczq4Ns,For my healthy tripple vaxxed BF the first one was the last one: he passed away from a sudden heart attack a month after the  booster.
1042,z5lJeTjvFHU,Bro my arm is literally in a state of paralysis
1043,z5lJeTjvFHU,"At first it felt like a regular shot but later in the day, my arm felt like it was going to fall off 😂

It hurt so badly lol"
1044,z5lJeTjvFHU,"I got my second shot today, it feels like someone punched me in the arm 50 times with a big ass hand! I can barely move my right arm, it really does hurt."
1045,z5lJeTjvFHU,I think “a little sore” is an understatement
1046,z5lJeTjvFHU,yo I thought I was the only one feeling this way lmao I literally can't lift my arm
1047,z5lJeTjvFHU,"For me, I got my vaccine today, early morning. My arm did NOT hurt after. But 5-6 hours later on in the afternoon, my arm is then sore and I can't lift it up!! :'( :'("
1048,z5lJeTjvFHU,My shoulder feels like a restraining order was made against moving.
1049,z5lJeTjvFHU,Yeah... got my first dose of Moderna today. The injection site was sore right after which is to be expected from getting a shot but now hours later my whole arm hurts lol. If this is the worst of my symptoms I’ll count myself lucky. I’m more worried about the second shot though.
1050,z5lJeTjvFHU,"I got mine today in the morning, I was fine for about 7-8 hours. I thought my arm wouldn’t hurt but nope. 7-8 hours, it started really hurting. My arm looked a bit swollen too. I had to take Tylenol. Now it’s a bit better but I can still feel it. I hope this goes away by tmw."
1051,z5lJeTjvFHU,I got the Pfizer shot then right after my dumbass went to bench press my arm feels like it's dead 💀
1052,ety8YR7fR1Y,We hope you have been blessed by this video. Please take a moment to subscribe and share it with a friend! For more encouragement and daily devotions visit https://www.harvest.org/
1053,ety8YR7fR1Y,"Brothers and Sisters in Christ, Do Not look for answers from pastors or from anyone else, they are just human like us.  But seek the Lord Our God with all your heart, and he'll give you the answer that you'll need. God bless you!"
1054,ety8YR7fR1Y,This vacation might not be the mark of the best “BUT” when you can’t buy/sell/travel/enter into certain places without it we are dangerously close to something evil. Please don’t down play it. Praying for you and your family!!
1055,ety8YR7fR1Y,"We're headed in that direction.  Soon we can't enter any baseball game, basketball, mall, airport, without the vaccine card.. we're just moving closer and closer.  Jesus Loves You All"
1056,ety8YR7fR1Y,"Remember what the SERPENT said to Eve ..""You won't surely die"" and it turned out to be the Opposite !"
1057,ety8YR7fR1Y,"By the way, celebrities, school districts, doctors nurses, etc... even our facebook friends have ""encouraging"" memes on their pages. So yes, it's all there to influence to take the jab."
1058,ety8YR7fR1Y,"Remember folks the bible says there are many wolves in sheep clothing, are you willing to risk your eternity because somebody says it is safe."
1059,ety8YR7fR1Y,Jesus loves whoever reads this
1060,ety8YR7fR1Y,Why do I instinctively feel so bad for people when they tell me they got it? Not judging anyone for any choice it's just a feeling I get when I hear it. Trust in God and fear Him only.
1061,ety8YR7fR1Y,"It may NOT be the mark if the beast, but it sure is a good exercise and preparation for when it comes around."
1062,LXDH-xKIk0A,The only shocking part of this is seeing it on mainstream media.
1063,LXDH-xKIk0A,"This occurrence is not only not new, it was predicted as a strong possibility and cautioned about with regards the mRNA transfection inoculations by many prominent virologists and immunologist right from the start. Doctors were shadowbanned if they tried to talk about it. The two hosts do look a little unsettled. I would love to know what was said in Amy Roach's ear piece as they quickly went to commercial. ""That's very important information. We appreciated it. Thank you very much."""
1064,LXDH-xKIk0A,"If you are an MD or biochemist, and surprised by this, then you have officially prioritized your political leanings over “the science”. Lets see how many MDs in 5 years can say that repeatedly vaccinating and boosting everyone (not just those with major health concerns) was a good idea…..especially 5-11 year olds."
1065,LXDH-xKIk0A,They are telling you they don't know the outcome of the shot .
1066,LXDH-xKIk0A,The truth will always emerge no matter how much the truth was suppressed from day one.
1067,LXDH-xKIk0A,If we comply with this our compliance means we never get out of this mess
1068,LXDH-xKIk0A,Hold the line Pureblood's 🤝
1069,LXDH-xKIk0A,"""Antibody levels, which are associated with protection against infection and disease, fell within weeks of getting the shots and were much lower than the level of antibodies specific to the original and delta coronavirus variants, the researchers said."" 

But that fourth one. That'll change everything! 🙄"
1070,LXDH-xKIk0A,"Everyone who went along with this and continues to be controlled should be ashamed of what they have let happen.
Disgraceful."
1071,LXDH-xKIk0A,This would be labeled misinformation and scrubbed from the internet just 6 months ago.
1072,xong5K4om2U,My local crack dealer doesn't push this hard......
1073,xong5K4om2U,"*From the vaccine consent form:* "" I understand that the long-term side effects or complications of this vaccine are not known at this time."""
1074,xong5K4om2U,Yes. Brilliant. So glad to see so many people are standing up for themselves. You are not selfish for refusing a medical procedure which has zero benefit to you and may even have irreversible harmful effects.
1075,xong5K4om2U,Why has this video not been taken down for misinformation!
1076,xong5K4om2U,"“So I’m immune now?

“No, you can still get it.”

“Oh, ok. But I can take my mask off, right?”

“No, you still need to wear it.”

“Ok, but will the manufacturer at least be held accountable if something happens to me?”

“No, they’re not responsible for any side effects.”

“So why am I getting this shot?”"
1077,xong5K4om2U,This is 100% misinformation but it's ok and won't get removed
1078,xong5K4om2U,Wow they're getting desperate. Keep standing strong guys.
1079,xong5K4om2U,That's gaslighting at its finest
1080,xong5K4om2U,“The only thing necessary for the triumph of evil is that good men to do nothing” — Some Dead Guy
1081,xong5K4om2U,"My body my choice, I have a perfectly healthy immune system thanks."
1082,YtIRJNrRm4M,হুজুরদের কথায় লাস্ট পর্যন্ত সত্য হয়.....
1083,YtIRJNrRm4M,"সুস্থ্য আছি আলহামদুলিল্লাহ্‌ ❤
আল্লাহ্‌ চাইলে কিছুই হবেনা, আল্লাহ্ ভরসা ❤❤"
1084,YtIRJNrRm4M,আমরা সাধারণ মানুষ এতটাই  নিরুপায় যে করোনার টিকা ইচ্ছা না থাকা সর্তেও নিতে হয়েছে আর এতদিন পরে জানতে পারছি তার পার্শ্ব প্রতিক্রিয়া তবে হ্যাঁ আমরা মুসলমান আল্লাহর ওপর ভরসা সবসময় রাখি ইনশাআল্লাহ কিছু হবে না।
1085,YtIRJNrRm4M,"ফাইজার টীকা দিয়ে টানা দুই বছর অসুস্থ ছিলাম।  মৃত্যু আর আমার মাঝে যেন আর একটা সিড়িই বাকি ছিল😢
আলহামদুলিল্লাহ!  আল্লাহ আমায় নতুন জীবন দিয়েছেন।"
1086,YtIRJNrRm4M,আলহামদুলিল্লাহ ঠিকা ছাড়াই মহান আল্লাহ তায়ালা অনেক সুস্থ ও সুন্দর রেখেছেন।
1087,YtIRJNrRm4M,"আলহামদুলিল্লাহ দুইটা নিয়েছিলাম, আল্লাহ এখনো সুস্থ রাখছে।"
1088,YtIRJNrRm4M,"আলহামদুলিল্লাহ তিনটা নেওয়ার পরেও এখনো সুস্থ আচি।
ভালো রাখার মালিক আল্লাহ।"
1089,YtIRJNrRm4M,"না নিলে ও সমস্যা ছিলো নিয়ে ও সমস্যা, আল্লাহ এখনো সুস্থ রাখছেন আলহামদুলিল্লাহ।"
1090,YtIRJNrRm4M,আলহামদুলিল্লাহ টিকা ছাড়াই আল্লাহ ভালো রেখেছে
1091,YtIRJNrRm4M,"আমিই মনে হয় একমাত্র ব্যাক্তি কোভিডের ১ টি টিকাও নেয়নি। আলহামদুলিল্লাহ, আল্লাহ তায়ালা আমাকে তবুও সুস্থ রেখেছেন।"
1092,IGqDGeDssmY,"Thank you for covering this. It’s really scary when such an important issue is dismissed, so hearing people talk about it is really calming. Thank you."
1093,IGqDGeDssmY,"I am absolutely disgusted by the way our ""healthcare"" industry has dealt with this issue and the stories I am reading in this comment section are absolutely horrifying. I pray that all you ladies suffering from this injection find help and are able to heal. I'm very sorry this is happening to you 😔"
1094,IGqDGeDssmY,Kudos to Vice for reporting on this issue without making it political.
1095,IGqDGeDssmY,It's happening all over the world. Problem is media isn't covering it in any country. Agree with the comments.
1096,IGqDGeDssmY,My sister is bipolar and she experienced a rough period and went manic after her second shot. I would love to see a study done on the effects of the shot on the the mentally ill.
1097,IGqDGeDssmY,Imagine if this video wasn’t posted..where could women openly have this dialogue and be heard??
1098,IGqDGeDssmY,"The fact that around half the population has periods, and yet it was not properly studied is kinda fucked up..."
1099,IGqDGeDssmY,This is happening and more all over the world. It’s criminal. My heart goes out to all who are going through this. Don’t give up. Report and share your stories wherever you can. I send you hugs and strength.
1100,IGqDGeDssmY,"I just spent 4 hours reading the comment section. It is amazing and inspiring to see so many women share, discuss, correlate & analyse the situation going on with these vaccines at the moment. As a person with Endo, whose painful period symptoms were never taken seriously by doctors, it was incredible to hear so many women speak their truth loud and proud.  We deserve a healthcare system that doesn't exploit us !

Please remember that: 
1. Menstrual/fertility issues are SERIOUS - they could have long term effects, or cause death, not just disrupted periods
2. Most want to dismiss us because they are conditioned to think these side effects are super rare, when they are not
3. If this report by Vice is not taken seriously, if they continue to dismiss all these cases as anecdotal, the only solution would be for all of us to unite together as women of all races and religions and fight Big Pharma to its death. For our men too, they will thank us later.

Stay strong, stay healthy ! Support good, caring local doctors, you know who they are !"
1101,IGqDGeDssmY,"I'm glad this subject is becoming more popular to talk about, we should all be talking about stuff like this if they're making it mandatory 🤔 👏"
1102,d3yk1FKFeqI,The truth is finally starting to surface.
1103,d3yk1FKFeqI,"So, glad I didnt get any of the vackses! And, I wish no one had, as well! Something comes up every year(multiple negative developments) as to why this was such a nightmarishly bad idea! It's just been 2 years and symptoms began to show after the first victims took it! But, these things may be the least of their worries!  I also hope that it was only medicul and not spiritual(Rev 13 and 14)! I surely hope so!"
1104,d3yk1FKFeqI,Does anyone remember when they struck people off the transplant list for not getting the jab?
1105,d3yk1FKFeqI,"we tried to warn you.
you called us ""conspiracy theorist."""
1106,d3yk1FKFeqI,That means it's doing it's job.
1107,d3yk1FKFeqI,We was trying to tell y’all….
1108,d3yk1FKFeqI,Never got that toxic dangerous shot and I never will!
1109,d3yk1FKFeqI,"And to think, some patients are denied a transplant unless they take the shot. Make it make sense please!!!!"
1110,d3yk1FKFeqI,Never got the shot…. This unfortunate for lots of people
1111,d3yk1FKFeqI,I took myself off the organ donor list last year.......I refuse to give anything that would go to a vaxxed
1112,GtYNX69Abv0,If the vaccine companies are so confident the vaccines are so safe then lift the waiver forms and have them liable for any major side effects when they occur that impacts the  longer term of quality of life for those who take it!
1113,GtYNX69Abv0,It almost sounds like it's safe enough and tested enough that the manufacturers can start accepting liability for it 😮
1114,GtYNX69Abv0,"The safest thing you can do in this pandemic is whatever the mainstream media tells you to do ,  flip it 180° and do that. . ."
1115,GtYNX69Abv0,"Anyone want to explain why corporations have zero liability no matter what with their ""vaccines""?"
1116,GtYNX69Abv0,"""there has been a 300% increase in DMED codes registered for miscarriages in the military in 2021 over the five-year average. The five-year average was 1,499 codes for miscarriages per year. During the first 10 months of 2021, it was 4,182"""
1117,GtYNX69Abv0,Reported for spam/misleading.
1118,GtYNX69Abv0,"IF ITS SO SAFE 
WHY ARE THE VACCINATED NOT ALLOWED TO DONATE BLOOD OR ORGANS ??"
1119,GtYNX69Abv0,"Well, I've had the call I was expecting,  but hoping wouldn't come.  My friend's 24 year old jabbed daughter has just been for a scan and has been told her 24 week old baby has died. She's now going to have to give birth.  I have given them all the information I could over the last 3 years about the dangers of what Government and NHS has been pushing, but I'm the one brain washed. I even spoke about the spike in still births since March/April 2021. Sooo frustrating."
1120,GtYNX69Abv0,"How to be a good citizen:

1. Obey without questioning.
2. Comply without thinking.
3. Worship authority.
4. Have blind faith in government.
5. Have absolute trust in mainstream media.
6. Never question official narratives."
1121,GtYNX69Abv0,I personally know a woman who got the vaccine while she was pregnant and the baby developed myocarditis  in the womb.
1122,-ZW4T0L38J8,“Mandatory” except for postal workers.  Mandatory except for Congress. Mandatory for you.. not them.  It’s a setup.
1123,-ZW4T0L38J8,Ironic how serious this is yet it’s only “required” for business with over 100 employees so if you’re at 99 you’re all good no worries but over 100 then you must follow these rules… why is congress exempt from this? You have to ask these questions on something as serious as what they’re claiming COVID is
1124,-ZW4T0L38J8,"I got my shots by choice, I'm 72, so long term problems don't affect me much...but being VACCINATED should be by choice and not mandatory...it's your body, you make the choice.."
1125,-ZW4T0L38J8,"The one thing they don't mandate is exercise, sunlight/Vit-D, and healthy eating. They don't mention it even once."
1126,-ZW4T0L38J8,"Can someone explain to me when, in all of history have bullies and liars ever been the good guys? Censoring negative side effects, banning alternative treatments, lying about cases and efficacy to encourage injections, penalizing people who make their own decisions... When has this ever been done by the good guys?"
1127,-ZW4T0L38J8,"These people are making so much money off of this, they don’t want it to end."
1128,-ZW4T0L38J8,"I read a story where a person had 113 employees, fired 14 to make it to 99. All 14 were vaccinated. This is how you do it folks"
1129,-ZW4T0L38J8,I was absolutely surprised that MSNBC actually aired this TRUTH about the public pushing back against mandates..
1130,-ZW4T0L38J8,"If your forced to accept information; not allowed to question it; restricted from seeing conflicting data, receive only pre-filtered (censored) information, that is actually propaganda. Science is questioned, open to examination, openly discussed, and continuously up for peer review. Which are YOU accepting?"
1131,-ZW4T0L38J8,"How about instead of treating each other like crap we act like a united nation. Vaxed or not. We are all human beings. And yes, it is about freedom joe and some of us are willing to die for that.."
1132,sPOMCrV3dG4,this should be studied further.  not just for covid but for other immono deficiencies or even auto immune issues
1133,sPOMCrV3dG4,Why would you keep getting shots if they're not working for you? Your risks with all those different shots will probably be worse then the benefit.
1134,sPOMCrV3dG4,Well I hope they use her as a case study for the original failed shots. Praying for her safety and health
1135,sPOMCrV3dG4,"the media is freaking people out. i feel bad for her, she shouldn't have to live  like this"
1136,sPOMCrV3dG4,"I cannot imagine what she's going through, no immune response. So scary"
1137,sPOMCrV3dG4,"Bless her heart, I pray she stays well."
1138,sPOMCrV3dG4,"I wonder if this was recommended by her physician. I worked in the medical field and from what we studied, antibodies may usually take about weeks upto months to develop. And I'm just wondering, what does she mean by ""no immesurable antibodies?"" Is it completely 0 and how long did she have the antibody test after getting the vaccine? This is not meant to judge her but as someone who studied serology/immunology this is rather a ""weird"" case. I get it that she's *immunocompromised* but all the more you cant just introduced antibodies like that esp multiple times in a short period of time. Based also from experience, my aunt didnt know she has breast cancer and started feeling sick after 2 weeks of her 1st shot. From there, her health declined tremendously and died after 1.5months. We consulted the physician regarding this but told us that it was almost impossible to prove that it was caused by the vaccine as no study yet can support our claim. Hoping that this woman would remain safe and healthy as Covid can really be a big blow to unvaxxed seniors, immunocompromised, overweight and those with comorbidites. Keep safe everyone. ❤"
1139,sPOMCrV3dG4,"No surprise, one person i know managed to get 4."
1140,sPOMCrV3dG4,"She's targeting the get 7 shots get free pizza or get 10, get a planner Lol. But i do hope she gets the anti bodies to better defend against covid19"
1141,sPOMCrV3dG4,She is going to be the last boss in Resident Evil 9.
1142,OjbSWebA3Ko,She is one of THEM
1143,OjbSWebA3Ko,I wonder how many people Dolly is indirectly responsible for their deaths.   What a traitor.
1144,OjbSWebA3Ko,"That hasn’t aged well and nobody (nobody…) will ever be able to forget her singing her jingle.  Oh, boy…"
1145,OjbSWebA3Ko,Never forget what these people did.  Never.
1146,OjbSWebA3Ko,"The best thing about being a ""coward"" is not worrying about dying suddenly from myocarditis"
1147,OjbSWebA3Ko,She called antivaxxers cowards??!!
1148,OjbSWebA3Ko,"What Dolly got was 🎶Saline, Saline, Saline, Sayyy-leeee-eeeen. I'm beggin you to please open yer eyes🎶"
1149,OjbSWebA3Ko,"Dolly: ""so how are the long term studies and any current issues with the shots?""  

Doctor: ""oh were still writing up the script for the long term studies and nope.... no issues at all, everyone is fine taking this!"""
1150,OjbSWebA3Ko,It’s called “towing the line”... The one thing worse than getting duped is not accepting that you have been duped.
1151,OjbSWebA3Ko,SO SAD how easily these people will SELL THEIR SOULS.
1152,7l1fRs-IwRs,"Right, that's confirmed it! Kate looks elegant in everything she does! Don't you agree?"
1153,7l1fRs-IwRs,Do you honestly think they would give any member of the royal family an experimental drug?! Obviously not.
1154,7l1fRs-IwRs,"We've seen syringes that the needle recedes back into the syringe and the person never pushing down on the syringe...and you just release stills as ""evidence""."
1155,7l1fRs-IwRs,Prince charles already told us he would be right down the list for any vaccine as hes in with the world economic forum and knows the plan
1156,7l1fRs-IwRs,Ah. So Kate isn’t having any more kids then. Righto.
1157,7l1fRs-IwRs,"With jeans and a pretty white top, Kate looks like ""the girl next door"" but truly is the shining ""gem"" in the BRF's Crown!  William's ""Pearl Of Great Value""!  This American Grandmother admires, respects, and simply adores this Duchess, Wife, and Mother!  🎶Isn't She Lovely!🎶"
1158,7l1fRs-IwRs,Notice when celebs or public figures get the V it's always done without gloves on 🕵️‍♂️
1159,7l1fRs-IwRs,And we didn’t actually see her get and what’s to prove it’s not a placebo if we did..
1160,7l1fRs-IwRs,"I love how she approaches everything! On our level! She never ever carries aires... 💖 bless you Duchess Kate! Be blessed and encouraged, stay safe and well! 💜🎚💜"
1161,7l1fRs-IwRs,She is absolutely stunning! I can't believe she's had THREE children! Gorgeous woman!
1162,z8cYMT3ds4o,"Why don't they mandate eating your vegetables, getting 9 hours of sleep, and exercise daily?"
1163,z8cYMT3ds4o,"If anyone ""forces"" anything on me, I will defend myself to my last dying breath."
1164,z8cYMT3ds4o,I’m glad I’m not alone. I think I’m the only person in my company who has refused the vaccine. I will not take it.
1165,z8cYMT3ds4o,"A year later, I still haven't been jabbed. Get over yourself, CNBC."
1166,z8cYMT3ds4o,"This whole thing sounds sick and disturbing, you're basically forcing people to take an experimental drug and no one is liable for any damages that this experimental drug causes... Is any of this sound right to anyone? 🤷🏾‍♂️"
1167,z8cYMT3ds4o,"The New York State Supreme Court reinstated all employees who were fired for not being vaccinated on Monday, ordering backpay and saying their rights had been violated.

The court found that ""being vaccinated does not prevent an individual from contracting or transmitting COVID-19."""
1168,z8cYMT3ds4o,"I will never, ever understand why people actually think the government EVER has your best interests at heart."
1169,z8cYMT3ds4o,"“If you have to be persuaded, reminded pressured, lied to, incentivized, coerced, bullied, socially shamed, guilt-tripped, threatened, punished and criminalized ... If all of this is considered necessary to gain your compliance -- you can be absolutely certain that what is being promoted is not in your best interest.” - Ian Watson"
1170,z8cYMT3ds4o,"When I was a 21 yr old young man, I asked a 101 yr old lady once, ""what's the key to living so long?"". She looked right at me with a serious face and said ""stay away from the Drs"". Lol. So true."
1171,z8cYMT3ds4o,I identify as a fully unvaccinated person. Sobriety is happiness.
1172,i46co3L5gPM,Well somebody’s worried about his voter base possibly not surviving till 2024
1173,i46co3L5gPM,Amazing how he worked for fox
1174,i46co3L5gPM,"Trump's audience love calling other people sheeple yet they're the most sheepish people you'll ever come across, curious."
1175,i46co3L5gPM,"Trump: get vaccinated
Literally everyone: ""Wait, that's illegal."""
1176,i46co3L5gPM,I feel sorry for the individual that's influenced this easily
